file_name,section,speaker_id,speaker_name,speaker_role,start,stop,text
1961.72,1,15089,hugo_l_black,scotus_justice,5923.668,5927.097,"Well, I don't quite get what a man would have the right to challenge."
1961.72,1,33645,j_r_wells,,5944.385,5945.734,"No sir, no sir."
1961.72,1,15089,hugo_l_black,scotus_justice,5947.034,5952.29,"But he doesn't have to admit he comes within the class that covers, does he, so far as his conduct is concerned?"
1961.72,1,33645,j_r_wells,,5952.29,5954.418,"I don't think he does, generally speaking, no."
1961.72,1,15089,hugo_l_black,scotus_justice,5955.252,5961.551,"Do you think he does under communist act but not generally, is that it?"
1961.72,1,33645,j_r_wells,,5961.551,5961.894,No sir.
1961.72,1,15050,felix_frankfurter,scotus_justice,5968.847,5977.59,"Mr. Wells, there is a difference, isn't there between a man coming in to court and say, “I'm asked to sign a document."
1961.72,1,33645,j_r_wells,,5998.38,5999.523,"Well, that was the --"
1961.72,1,15050,felix_frankfurter,scotus_justice,5999.523,6000.339,I'm not saying that this is a good situation --
1961.72,1,33645,j_r_wells,,6000.339,6001.512,-- the point I was trying to make Your Honor.
1961.72,1,15050,felix_frankfurter,scotus_justice,6001.512,6004.166,-- I don't think it is but there is a difference.
1961.72,1,15089,hugo_l_black,scotus_justice,6004.166,6011.276,"I -- I was just going to ask you if you don't think that's happened here, do you?"
1961.72,1,33645,j_r_wells,,6017.477,6032.994,"I think he has to in large measure Your Honor where he says, “I have not lent aid, support and so forth to the Communist Party."
1961.72,1,15050,felix_frankfurter,scotus_justice,6054.304,6074.01,"Mr. Wells, isn't the truth of the matter just as interpreting what this really means, I haven't -- I don't live inside of the mind or the threat or with the constraints but he's trying, quite understandably, he's trying to ride through horses which is a feat that's not too impossible."
1961.72,1,33645,j_r_wells,,6089.881,6094.026,"Well, to -- I think in large measure Your Honor that is right."
1961.72,1,15089,hugo_l_black,scotus_justice,6094.183,6109.248,"Suppose he has -- suppose he has, how does he know that the state must -- that he hasn't done would not be disapproved by a group of informers or group of other people, how could you know?"
1961.72,1,33645,j_r_wells,,6109.248,6110.857,"Well, of course that gets to --"
1961.72,1,15050,felix_frankfurter,scotus_justice,6110.857,6112.532,That's the vice of (Inaudible) --
1961.72,1,33645,j_r_wells,,6112.532,6134.771,That gets to the question of whether it is fatally indefinite and if the statute is fatally indefinite then I don't question that the statute is invalid but that gets back to the question as to whether it is fatally indefinite.
1961.72,1,15050,felix_frankfurter,scotus_justice,6134.771,6144.741,"When you say fatally indefinite, I think if I may say so you're conjoining two very different things."
1961.72,1,33645,j_r_wells,,6184.368,6191.49,I realize that there is that possibility Your Honor.
1961.72,1,15082,charles_e_whittaker,scotus_justice,6212.569,6213.303,Mr. Wells.
1961.72,1,33645,j_r_wells,,6213.303,6216.179,Yes sir.
1961.72,1,15082,charles_e_whittaker,scotus_justice,6216.179,6220.903,This is the heart of the case for me here.
1961.72,1,33645,j_r_wells,,6241.816,6243.183,I believe it is Your Honor.
1961.72,1,15082,charles_e_whittaker,scotus_justice,6250.629,6270.027,"Whether he could -- whether he is able by reason of his past conduct to make the affidavit or he is not able, is that ever a relevant averment in a complaint in the case like this?"
1961.72,1,33645,j_r_wells,,6297.308,6299.091,I don't know.
1961.72,1,15097,john_m_harlan2,scotus_justice,6302.941,6332.74,"I thought your position was that it might be relevant on the question of the state rule that says that you cannot come in and raise a constitutional claim if this appears in the face of your complaint, the -- if you don't claim here, that'd be personal injury -- personally injured by the claim if it's -- if by the statute if it's enforced against you and all you want is a general declaration of rights under the law."
1961.72,1,33645,j_r_wells,,6334.962,6337.992,I think that that is -- is what enforced.
1961.72,1,15082,charles_e_whittaker,scotus_justice,6337.992,6355.52,"Well, isn't that quite another thing even if these averments of the kind made by here by this petitioner in paragraph 6 on page 2 of this record are irrelevant and are not necessary."
1961.72,1,33645,j_r_wells,,6381.699,6381.91,I think that --
1961.72,1,15082,charles_e_whittaker,scotus_justice,6381.91,6386.681,That's a different question isn't it?
1961.72,1,33645,j_r_wells,,6386.681,6394.459,I would have thought it was at least to the clause and relief question Your Honor.
1961.72,1,15082,charles_e_whittaker,scotus_justice,6394.459,6429.95,"Well, even if such an averment could never be relevant yet one might voluntarily by allegations like those in paragraph 6 of this complaint, show that he could not be injured by them and say, “I can make” as he says he can make this very affidavit and therefore reduced his complaint to a mere request upon the Court to render to him an advisory opinion."
1961.72,1,33645,j_r_wells,,6429.95,6432.847,"Well, I -- I think that's -- I think that's correct Your Honor."
1961.72,1,15089,hugo_l_black,scotus_justice,6437.807,6453.785,"Suppose it is true that a person has no standing to sue in the Florida Court, do you think he's having a standing to raise this constitutional question in any way?"
1961.72,1,33645,j_r_wells,,6453.785,6453.815,I think the --
1961.72,1,15089,hugo_l_black,scotus_justice,6453.815,6456.179,And so where would it be but the federal courts.
1961.72,1,33645,j_r_wells,,6456.179,6488.215,I think the Florida rule on that is that has been referred to as a state rule is similar to a rule that this Court has announced as to the necessity of a person injured in -- a necessity of a person being injured in order to get a decision on the constitutional question.
1961.72,1,15089,hugo_l_black,scotus_justice,6488.215,6497.238,But that's -- that's arguing the merits of the rule not what I understood Justice Harlan to be talking about that this is a Florida rule.
1961.72,1,33645,j_r_wells,,6497.238,6502.205,"Well, if -- if that is --"
1961.72,1,15089,hugo_l_black,scotus_justice,6502.205,6506.444,What about Mooney and Holohan that Florida won't let him raise?
1961.72,1,33645,j_r_wells,,6506.444,6507.065,I beg your pardon.
1961.72,1,15089,hugo_l_black,scotus_justice,6507.065,6513.593,What about the rule in Mooney and Holohan that Florida will not let him raise this constitutional question?
1961.72,1,33645,j_r_wells,,6513.593,6515.272,You mean as to --
1961.72,1,15089,hugo_l_black,scotus_justice,6515.272,6517.628,The right to raise it in the federal court.
1961.72,1,33645,j_r_wells,,6517.628,6519.939,"Well, it's entirely possible that there might be the right."
1961.72,1,15089,hugo_l_black,scotus_justice,6520.671,6543.457,Is it your idea that your Florida rule is intended to be played that whether the federal rule required to be not -- this man shall not be allowed to raise this constitutional question in the Florida Court under the circumstances here?
1961.72,1,33645,j_r_wells,,6543.457,6568.497,I think so far as this case is concerned Your Honor that if the -- if the Florida Court has announced a rule which is a sufficient rule of state law to decide this case then as to whether there's any other redress I think would be a question for another case.
1961.72,1,15089,hugo_l_black,scotus_justice,6568.497,6581.848,"Well, are you arguing that it's still the Florida rule or that you're following the federal court to say it has no chance to -- suppose you're wrong on the federal rule --"
1961.72,1,33645,j_r_wells,,6581.848,6582.681,"Well, I'm saying --"
1961.72,1,15089,hugo_l_black,scotus_justice,6582.681,6586.738,-- do you still say that Florida will deny him relief?
1961.72,1,33645,j_r_wells,,6586.738,6596.816,I feel like Your Honor that the Florida rule is sufficient to deny him relief.
1961.72,1,15089,hugo_l_black,scotus_justice,6596.816,6597.636,In Florida.
1961.72,1,33645,j_r_wells,,6597.636,6598.429,In Florida.
1961.72,1,15089,hugo_l_black,scotus_justice,6607.57,6621.351,But that would result in -- meaning that the man can have his constitutional right violated with no possible remedy in the federal or state court.
1961.72,1,33645,j_r_wells,,6625.209,6626.39,"Well, I don't --"
1961.72,1,15089,hugo_l_black,scotus_justice,6626.39,6626.421,I thought --
1961.72,1,33645,j_r_wells,,6626.421,6629.13,I'm not familiar with those two decisions that the --
1961.72,1,15089,hugo_l_black,scotus_justice,6629.13,6647.947,Mooney versus Holohan where the question was whether California has failed to give a remedy where there was a charge that the man had been convicted on perjurious evidence knowing that the evidence was -- the state knowing it was fault.
1961.72,1,33645,j_r_wells,,6648.867,6651.203,I remember something out of the case now Your Honor.
1961.72,1,15089,hugo_l_black,scotus_justice,6652.933,6656.18,And this Court held that it would not have -- as I recall it.
1961.72,1,15050,felix_frankfurter,scotus_justice,6673.265,6673.912,Mr. Wells.
1961.72,1,33645,j_r_wells,,6673.912,6675.471,Yes sir.
1961.72,1,15050,felix_frankfurter,scotus_justice,6675.471,6681.006,The -- I think I've been talking a little bit at large as to what the complaint says and what the courts held.
1961.72,1,33645,j_r_wells,,6681.006,6684.668,Yes sir.
1961.72,1,15050,felix_frankfurter,scotus_justice,6684.668,6702.55,"To be sure, paragraph 7, the complaint says, the plaintiff is a loyal American and does not decline to execute (Inaudible) oath of fear of the penalty provided by law of false oath."
1961.72,1,33645,j_r_wells,,6859.357,6863.448,"Oh, did Your Honor read from the bottom of page 18 and top of page 19?"
1961.72,1,15050,felix_frankfurter,scotus_justice,6863.448,6865.293,That's what I've been reading from.
1961.72,1,33645,j_r_wells,,6865.293,6866.311,I didn't --
1961.72,1,15050,felix_frankfurter,scotus_justice,6866.311,6872.249,That's just what I've been reading from Mr. Wells and that's all I find.
1961.72,1,33645,j_r_wells,,6891.854,6903.877,"Well, I see that my time is nearly up and I'll just briefly refer to the clause of the oath."
1961.72,1,15099,earl_warren,scotus_justice,7052.708,7056.83,Mr. Simon.
1961.72,2,43291,tobias_simon,,7056.83,7078.549,"The Court will note from the brief that this action was brought in Orange County, Florida pursuant to the provisions of Florida statute 87.01 which under Florida law permits an individual who is in doubt as to his status and his rights under a Florida statute to bring an action for declaratory relief."
1961.72,2,15082,charles_e_whittaker,scotus_justice,7187.155,7188.97,May I ask you Mr. Simon.
1961.72,2,43291,tobias_simon,,7204.051,7212.775,It is not surplusage according to the Florida Supreme Court with regard to the questions of ex post facto and bill of attainder.
1961.72,2,15050,felix_frankfurter,scotus_justice,7293.945,7312.987,"Mr. Simon before you sit down, in view of the breadth of your argument remain, I would like to ask you namely that no belief can constitutionally be inquired as to anybody who seeks office under the United States or state government, is that right?"
1961.72,2,43291,tobias_simon,,7312.987,7317.099,"Mr. Justice Frankfurter, I do not feel that my argument has to reach that point."
1961.72,2,15050,felix_frankfurter,scotus_justice,7324.377,7329.769,Let me -- let me put a case that is in regard to the President.
1961.72,2,43291,tobias_simon,,7357.947,7361.65,I have not represented the TVA nor the (Voice Overlap) of the Act and I would --
1961.72,2,15050,felix_frankfurter,scotus_justice,7361.65,7366.419,I know but our argument either -- argument either have relevance or they don't have relevance.
1961.72,2,43291,tobias_simon,,7366.419,7366.612,And --
1961.72,2,15050,felix_frankfurter,scotus_justice,7366.612,7389.55,And the lawyer says that a government can't ask its appointees whether they have a belief in the Constitution of the United States and its entirety or a belief in an Act under which they're supposed to act or belief in the law and the members of the law faculty then I have a right to put you a concrete case in order to test your argument.
1961.72,2,43291,tobias_simon,,7389.55,7411.06,My answer to that sir is that that particular provision in my opinion and based upon what I understand to be the decisions of this Court is that the federal government nor the government of Florida can reach into a man's mind and require it to be divulged as the condition of any governmental favor or employment.
1961.72,2,15050,felix_frankfurter,scotus_justice,7411.06,7414.031,So that that's an unconstitutional provision in the TVA.
1961.72,2,43291,tobias_simon,,7414.031,7415.44,"It was so here sir, yes sir."
1961.72,2,15050,felix_frankfurter,scotus_justice,7415.44,7416.384,Alright.
1961.72,2,43291,tobias_simon,,7416.384,7441.687,Thank you Your Honor.
