file_name,section,speaker_id,speaker_name,speaker_role,start,stop,text
1961.72,1,33645,j_r_wells,,3729.123,3731.287,I don't recall exactly but I think it was in general terms.
1961.72,1,15140,william_j_brennan_jr,scotus_justice,3731.287,3734.482,The attack on the indictment alone or was it after a conviction?
1961.72,1,33645,j_r_wells,,3734.482,3736.264,It was attack on the indictment.
1961.72,1,15050,felix_frankfurter,scotus_justice,3745.381,3746.626,Mr. Wells.
1961.72,1,33645,j_r_wells,,3746.626,3746.913,Yes sir.
1961.72,1,15050,felix_frankfurter,scotus_justice,3746.913,3749.063,Forgive me for interrupting you.
1961.72,1,33645,j_r_wells,,3756.452,3756.691,That's --
1961.72,1,15050,felix_frankfurter,scotus_justice,3756.691,3767.307,You accept the state court's decision that scienter is to be read into the statute and therefore the statute comes here with that -- with that authoritative interpretation of your court.
1961.72,1,33645,j_r_wells,,3767.307,3775.222,That's my assumption because I don't read any of his -- either his jurisdictional statement or his brief as raising any question of scienter.
1961.72,1,15050,felix_frankfurter,scotus_justice,3775.222,3780.927,I just wonder whether your appeal must be taking your time to answer an argument that is --
1961.72,1,33645,j_r_wells,,3780.927,3781.911,It may be that I am Your Honor.
1961.72,1,15050,felix_frankfurter,scotus_justice,3781.911,3784.026,Not that it's been abandoned but he just accept (Voice Overlap) --
1961.72,1,33645,j_r_wells,,3784.026,3785.702,"And if so, I apologize."
1961.72,1,15099,earl_warren,scotus_justice,3795.542,3804.059,But can you apply that rule of scienter to beliefs?
1961.72,1,33645,j_r_wells,,3804.059,3813.606,I apply it Your Honor that he's -- it's got to be a willfully and knowingly false.
1961.72,1,15099,earl_warren,scotus_justice,3973.165,3973.75,Would it --
1961.72,1,15050,felix_frankfurter,scotus_justice,3973.75,3974.432,Are you --
1961.72,1,15099,earl_warren,scotus_justice,3974.432,3975.641,"Go ahead please, please."
1961.72,1,15050,felix_frankfurter,scotus_justice,3975.641,3986.227,Are you going to argue what you call a subsidiary point that in case he is in no position that the stand -- put the standing problem to one side?
1961.72,1,33645,j_r_wells,,3986.227,3986.971,Yes sir.
1961.72,1,15050,felix_frankfurter,scotus_justice,3986.971,4007.654,"And assume it weren't in this case, I understood you to say a minute ago that if that were so, you would also defend -- you would defend the power of Florida that as – (Inaudible) anybody else whom it appoint but assume a teacher, but I have not -- will not lend my aid and support, advice to the Communist Party."
1961.72,1,33645,j_r_wells,,4007.654,4018.766,I would Your Honor on the same theory on which the Hawker case was decided and the same theory on which --
1961.72,1,15050,felix_frankfurter,scotus_justice,4018.766,4019.487,In what case?
1961.72,1,33645,j_r_wells,,4019.487,4021.435,The Hawker -- the -- involved in --
1961.72,1,15050,felix_frankfurter,scotus_justice,4021.435,4022.461,New York?
1961.72,1,33645,j_r_wells,,4022.461,4026.902,"Yes sir, involving the -- not --"
1961.72,1,15050,felix_frankfurter,scotus_justice,4026.902,4028.87,You have to get a license to be a hawker.
1961.72,1,33645,j_r_wells,,4028.87,4065.378,"He practiced in Madison and he had committed an abortion 15 years before the Act was passed and yet it was held to be valid to prevent him from practicing medicine and on the same theory on which the DeVeau case I believe it was, was decided two or three years ago by this Court involving the union officers on the Waterfront in which ex-felons were precluded from being union officers notwithstanding the fact that they had been convicted many years before."
1961.72,1,15050,felix_frankfurter,scotus_justice,4117.715,4118.651,Let me ask you this question Mr. Wells.
1961.72,1,33645,j_r_wells,,4118.651,4119.894,Yes sir.
1961.72,1,15050,felix_frankfurter,scotus_justice,4119.894,4125.288,I suppose your state university is dependent on state funds for its activities.
1961.72,1,33645,j_r_wells,,4125.288,4127.395,"Largely so, yes sir."
1961.72,1,15050,felix_frankfurter,scotus_justice,4127.395,4134.35,"Well, suppose Mr. Simon said there never was a Communist Party on the electoral ticket in Florida."
1961.72,1,33645,j_r_wells,,4134.35,4138.188,I don't recall that definitely but I don't think there was.
1961.72,1,15050,felix_frankfurter,scotus_justice,4138.188,4158.866,"Well, suppose the Communist Party of United States in 1924 or 1925 found out that there was a campaign on to increase the appropriations for the University of Florida, to double the appropriations of the previous years, I don't know whether they did it one year or two years."
1961.72,1,33645,j_r_wells,,4160.082,4161.229,Two years Your Honor.
1961.72,1,15050,felix_frankfurter,scotus_justice,4161.229,4181.5,"Suppose there was up a referendum to issue bonds to double the appropriations to the University of Florida, and suppose the Communist Party had sent in its most vocal leaders to support such an amendment and made a lot of noise in support of it."
1961.72,1,33645,j_r_wells,,4216.507,4229.854,I felt that Your Honor that that would come within it for the reason that I don't think parallelism of action would -- I think it would --
1961.72,1,15050,felix_frankfurter,scotus_justice,4229.854,4230.407,Well it doesn't --
1961.72,1,33645,j_r_wells,,4230.407,4232.888,-- be an aid to the Communist Party.
1961.72,1,15050,felix_frankfurter,scotus_justice,4232.888,4242.213,"Well, when you say you doubted it, I -- am I -- is it fair to imply that it would raise a question and a conscientious lawyer could argue that's an aid?"
1961.72,1,33645,j_r_wells,,4242.213,4244.514,"Well, it's hard to --"
1961.72,1,15050,felix_frankfurter,scotus_justice,4244.514,4264.517,"At all events, it isn't like the Hawker case or the DeVeau case where the Court had before it the consequences that a state may be allowed to draw from a criminal conviction and the relation of such a criminal conviction to a subsequent position of responsibility."
1961.72,1,33645,j_r_wells,,4264.517,4269.044,You don't have the element of a conviction.
1961.72,1,15050,felix_frankfurter,scotus_justice,4270.557,4287.364,"But it only meant words like aid or support, for instance, support if a distinguished member of the University of Florida is on the same platform under the auspicious of the Communist Party sponsoring increased appropriations for the university."
1961.72,1,33645,j_r_wells,,4296.583,4305.433,"Well, of course it's -- it's hard to say what a -- a man would be left out of (Inaudible) on various things --"
1961.72,1,15050,felix_frankfurter,scotus_justice,4305.433,4306.322,But (Voice Overlap) --
1961.72,1,33645,j_r_wells,,4306.322,4309.43,-- but I don't believe that would be a reasonable (Inaudible) --
1961.72,1,15050,felix_frankfurter,scotus_justice,4309.43,4309.833,But if --
1961.72,1,15107,william_o_douglas,scotus_justice,4309.833,4319.622,"If you had -- if he had six of them or eight of them or ten of them of the same quality, you wouldn't hesitate to take your case on that -- on parallelism, would you?"
1961.72,1,33645,j_r_wells,,4319.622,4338.981,"I don't believe that unless there was a direct element of aiding and supporting in connection with a -- contributing toward the subversive aims, I don't believe that that could reasonably come within it."
1961.72,1,15050,felix_frankfurter,scotus_justice,4338.981,4341.237,But Mr. -- Mr. Wells.
1961.72,1,33645,j_r_wells,,4341.237,4341.589,Yes sir.
1961.72,1,15050,felix_frankfurter,scotus_justice,4341.589,4360.899,"The trouble is in your -- in your fair mind and conscientious way, you have a like to say you don't believe it, but the difficulties that I had and why, it has simply been -- what was it, Updegraff and Wieman or the other way around or was it a conscientious man taking an oath wouldn't know what he was taking an oath to."
1961.72,1,33645,j_r_wells,,4396.145,4414.718,"Well, of course it's possible Your Honor but there are many matters that come up in connection with laws and indefiniteness where arguments can be made one way or the other and yet the laws can be held to be of sufficient depth."
1961.72,1,15050,felix_frankfurter,scotus_justice,4414.718,4415.023,Yes.
1961.72,1,33645,j_r_wells,,4418.995,4421.122,But the element of scienter is in there Your Honor.
1961.72,1,15050,felix_frankfurter,scotus_justice,4421.122,4422.519,"Yes I know, with knowledge."
1961.72,1,33645,j_r_wells,,4424.235,4424.833,But does he -- and does --
1961.72,1,15050,felix_frankfurter,scotus_justice,4424.833,4426.465,Yes but I was on that platform (Voice Overlap) --
1961.72,1,33645,j_r_wells,,4426.465,4433.704,"Well, unless he intends to aid the Communist Party as such."
1961.72,1,15050,felix_frankfurter,scotus_justice,4435.849,4459.232,"Well, I think from personal experience, I was once a chairman at a meeting in Boston way back, and the purpose of the meeting was to urge the Government of United States to recognize the soviet country, the present regime in Russia long before we did."
1961.72,1,33645,j_r_wells,,4516.525,4551.643,"Well, I realize that a contention can be made that the -- that there's too much of an indebtedness in that Your Honor but I -- when you have the scienter as a factor in it, I don't believe that that is sufficient that the oath should be declared unconstitutional on the basis of indebtedness."
1961.72,1,15050,felix_frankfurter,scotus_justice,4551.643,4564.456,"It wasn't your -- it wouldn't -- doesn't it make a difference how -- how needed this is, how essential this is to protect the interest that you have a right to protect from my point of view."
1961.72,1,33645,j_r_wells,,4599.896,4611.21,"Well, in that case though, the knowledge was held not to be a factor under the Oklahoma statute by the -- by the Oklahoma Court."
1961.72,1,15107,william_o_douglas,scotus_justice,4616.634,4617.17,It had no --
1961.72,1,33645,j_r_wells,,4617.17,4618.333,-- differences in the statute.
1961.72,1,15107,william_o_douglas,scotus_justice,4618.333,4623.574,You haven't -- maybe you have but I have -- I haven't been able to follow.
1961.72,1,33645,j_r_wells,,4657.211,4666.769,I don't believe that those purposes could come within the purport of the activeness to Justice Douglas.
1961.72,1,15107,william_o_douglas,scotus_justice,4666.769,4669.43,Tell me again just why.
1961.72,1,33645,j_r_wells,,4669.43,4675.352,On account of the fact that the subversive character --
1961.72,1,15107,william_o_douglas,scotus_justice,4675.352,4679.971,"But the statute says by aid, support, advice, counsel or influence to the."
1961.72,1,33645,j_r_wells,,4679.971,4680.335,Well --
1961.72,1,15107,william_o_douglas,scotus_justice,4680.335,4681.824,-- Communist Party which may have --
1961.72,1,33645,j_r_wells,,4681.824,4689.467,That -- that is construed by the Court to have reference to the subversive character.
1961.72,1,15107,william_o_douglas,scotus_justice,4689.467,4692.331,Where is that precisely?
1961.72,1,33645,j_r_wells,,4692.331,4698.342,It is on page 13 of the record Your Honor.
1961.72,1,15089,hugo_l_black,scotus_justice,4698.342,4730.463,"Suppose they knew that the Communist Party intended to be subversive, had full knowledge of it, he attended a meeting such as Mr. Justice Frankfurter mentioned where they talked about various things where this man was the chairman of the meeting or made a speech like De Jonge in Oregon, would you say that the fact that he knew about it would take away from him the protection of the First Amendment of the freedom to be there?"
1961.72,1,15107,william_o_douglas,scotus_justice,4730.463,4740.763,Where -- where his advocacy or belief or what not promotes a wholly lawful phase of a subversive organizations' activities.
1961.72,1,33645,j_r_wells,,4740.763,4747.034,I think it would depend Your Honor on the motive.
1961.72,1,15107,william_o_douglas,scotus_justice,4763.23,4782.14,"Well, the De Jonge, the man, De Jonge undoubtedly knew about the full scope of the purpose of the party but he was held immune there because the purpose of the meeting it had -- which he attended was to aid strikers or to give relief to picket lines or something in that category that was wholly lawful."
1961.72,1,33645,j_r_wells,,4782.14,4785.579,"Well, I think that that would be that same distinction here Your Honor."
1961.72,1,15107,william_o_douglas,scotus_justice,4785.579,4789.625,But I don't find it in the case of the report that you -- record that you refer to --
1961.72,1,33645,j_r_wells,,4789.625,4789.809,Well it --
1961.72,1,15107,william_o_douglas,scotus_justice,4789.809,4798.947,-- because there it says whether he has been or is or has been innocently and knowingly aligned with a subversive.
1961.72,1,33645,j_r_wells,,4816.914,4831.085,I don't think he would unless his motive was to advance the cause of the party as distinguished from an advancing the cause that the party was also seeking to advance.
1961.72,1,15089,hugo_l_black,scotus_justice,4831.085,4837.416,Well suppose a speaker had preceded him who advocated the Communist Party in its aims.
1961.72,1,33645,j_r_wells,,4842.053,4864.016,"Well, I don't see how unless in other words, unless the -- what he did was done for the purpose of advancing the Communist Party as distinguished from advancing the cause there that the Communist Party was also seeking to advance at the time."
1961.72,1,15089,hugo_l_black,scotus_justice,4864.135,4880.387,"You mean if he had talked on something that was purposely lawful, advocated the cause that many people before (Inaudible) that the jury could convict him if they thought from the evidence of a speaker preceding him had advocated the Communist Party."
1961.72,1,33645,j_r_wells,,4880.387,4881.008,I don't think that that would be --
1961.72,1,15089,hugo_l_black,scotus_justice,4881.008,4886.857,He too wanted -- he too wanted to aid the Communist Party looking to his motives.
1961.72,1,33645,j_r_wells,,4886.857,4889.869,I don't think that that would be sufficient Your Honor.
1961.72,1,15089,hugo_l_black,scotus_justice,4889.869,4891.604,That -- then you wouldn't look to his motives.
1961.72,1,33645,j_r_wells,,4891.604,4896.738,I think you look to his motives but I think you'd have to have more than that to establish his motives.
1961.72,1,15050,felix_frankfurter,scotus_justice,4896.738,4913.55,"Mr. Wells, my narrow point is this that if you were defending this man in the hypothesis put, I'm confident if you let me say so that you get them all but you might not, you might not."
1961.72,1,33645,j_r_wells,,4952.826,4972.133,"Well, I can understand the point that Your Honor is putting and raising and realize that it's a point that has to be faced in the case, but I don't believe that it should be fatal to the -- to the statute."
1961.72,1,15050,felix_frankfurter,scotus_justice,4972.133,5006.738,"If you have -- it shouldn't be fatal to the statute if you can give a really strong weighty counter consideration why this is the way that a reasonable legislature must deal with the problem with which it has a right to deal with, namely, that puts no time limit, refuses voguish words which is susceptible of ambiguous construction etcetera, etcetera."
1961.72,1,33645,j_r_wells,,5006.738,5027.677,"Of course, I realize Your Honor that the alternatives are to be taken into account to a brief but I think also that the legislature is not bound to consider the best possible alternative."
1961.72,1,15050,felix_frankfurter,scotus_justice,5027.677,5029.251,I'm with you on that.
1961.72,1,33645,j_r_wells,,5029.251,5047.368,And that if this has a reasonable connection with a purpose which they have a right to achieve that it is something that they could have adopted.
1961.72,1,15050,felix_frankfurter,scotus_justice,5122.891,5125.782,"That's much more definite than this, isn't it Mr. Wells?"
1961.72,1,33645,j_r_wells,,5125.782,5126.038,"Well, it --"
1961.72,1,15050,felix_frankfurter,scotus_justice,5126.038,5134.404,Whether a man has been a member of a party -- there isn't much room for a debate about that.
1961.72,1,15099,earl_warren,scotus_justice,5142.41,5142.944,Counsel.
1961.72,1,15050,felix_frankfurter,scotus_justice,5142.944,5144.258,-- counsel.
1961.72,1,33645,j_r_wells,,5156.418,5180.573,"Well, they are words of breadth but I think the words like counsel and advice that they have had a long history of having been used in connection with accessories, words of that kind, accessory before it, in fact on crime and things of that kind and I think all that needs to be taken into account in determining in the meaning to be attached to it as to whether the --"
1961.72,1,15050,felix_frankfurter,scotus_justice,5180.573,5186.811,"They made an influence on ethnic -- aren't words of ours, are they, influence?"
1961.72,1,33645,j_r_wells,,5186.811,5196.932,"Well, influence is sometimes used in connection as influence in an act in connection with accessory before the fact but advice and counsel are more."
1961.72,1,15050,felix_frankfurter,scotus_justice,5196.932,5199.759,"Mr. Dale Carnegie uses them in a different sense, doesn't he?"
1961.72,1,33645,j_r_wells,,5199.759,5201.212,I believe it does Your Honor.
1961.72,1,15099,earl_warren,scotus_justice,5201.212,5202.456,"Mr. Wells, may I ask you this --"
1961.72,1,33645,j_r_wells,,5202.456,5202.592,Yes sir.
1961.72,1,15099,earl_warren,scotus_justice,5202.592,5204.141,-- this question?
1961.72,1,33645,j_r_wells,,5216.78,5218.139,Yes sir.
1961.72,1,15099,earl_warren,scotus_justice,5218.139,5234.167,Does that lead you to the conclusion that no redress can be given to an admittedly loyal American citizen just because he asserts his loyalty.
1961.72,1,33645,j_r_wells,,5242.702,5255.871,I don't know that the question can be answered strictly that we -- Your Honor.
1961.72,1,15099,earl_warren,scotus_justice,5255.871,5258.828,"Well, we've got the two extremes, two poles and --"
1961.72,1,33645,j_r_wells,,5258.828,5284.136,"Well, I take it for instance as applied specifically to the past, I think it's quite definite that the -- a party cannot raise a question for someone else on a constitutional question."
1961.72,1,15099,earl_warren,scotus_justice,5284.136,5285.796,That wasn't the question I asked you.
1961.72,1,33645,j_r_wells,,5308.492,5316.904,"If they are -- to a loyal American, if his rights -- if his constitutional rights have been invaded then there certainly is redress."
1961.72,1,15099,earl_warren,scotus_justice,5316.904,5320.947,Regardless of whether he claims to be loyal or not.
1961.72,1,33645,j_r_wells,,5320.947,5324.886,That's as to whether if his constitutional rights have been invaded.
1961.72,1,15099,earl_warren,scotus_justice,5324.886,5325.19,That's right.
1961.72,1,33645,j_r_wells,,5325.19,5331.541,But the -- I think the -- it does affect whether his constitutional rights has been invaded.
1961.72,1,15099,earl_warren,scotus_justice,5338.324,5338.557,In other words --
1961.72,1,33645,j_r_wells,,5338.557,5339.778,-- whether his constitutional rights have been invaded.
1961.72,1,15099,earl_warren,scotus_justice,5339.778,5340.934,"Well, I'll put it this way."
1961.72,1,33645,j_r_wells,,5369.528,5374.043,"Well, that would depend on whether there is an invasion of his constitutional rights."
1961.72,1,15099,earl_warren,scotus_justice,5378.146,5381.724,"Well, tell me this then."
1961.72,1,33645,j_r_wells,,5400.35,5434.149,"Well, a communist or a person who has lent aid or support to the Communist Party years ago and has reformed then he would be entitled to raise a question as to whether that was a bill of attainder or ex post facto law as to whether how that -- it would be answered, it would be a different question but he would be entitled to raise that question as to whether there was passed to him a bill of attainder or ex post facto law."
1961.72,1,15099,earl_warren,scotus_justice,5456.409,5467.565,"Yes, but suppose a man -- a man like Justice Frankfurter was talking about, a man who had supported certain causes that the Communist Party supports."
1961.72,1,33645,j_r_wells,,5539.47,5551.963,"Oh, I think he would -- he would have the right to raise the question as to whether his constitutional rights had been invaded by the unconstitutionally vague statute as -- but I don't believe --"
1961.72,1,15099,earl_warren,scotus_justice,5551.963,5553.813,Where could he -- when -- where could he raise it?
1961.72,1,33645,j_r_wells,,5555.953,5560.487,I think he could raise it in advance although I do think --
1961.72,1,15099,earl_warren,scotus_justice,5560.487,5563.479,Do you have procedure for that in Florida?
1961.72,1,33645,j_r_wells,,5563.479,5570.404,"Well, I think -- I think he could raise it in a type of procedures that is raised – that's invoked here."
1961.72,1,15099,earl_warren,scotus_justice,5617.537,5619.227,But suppose the man was in this position.
1961.72,1,33645,j_r_wells,,5655.551,5679.097,"Well, that gets to the question as to whether it is fatally indefinite and with the scienter in there, I don't think it is fatally in depth because you've got to show a lack of bona fides in connection with it and I don't think that there -- in order to show that it was false and I don't think that that could ever be shown."
1961.72,1,15099,earl_warren,scotus_justice,5679.097,5709.869,Was there anything in -- in -- in the statute or in the decisions of your Florida Supreme Court which hold that the -- that the cooperation and the -- and the counseling and assistance and so forth that is contemplated by this oath must be as to those facets of the Communist Party that have to do with overthrowing our government?
1961.72,1,33645,j_r_wells,,5709.869,5721.074,I don't -- I think that the statement by the Court in this decision substantially holds that Your Honor.
1961.72,1,15099,earl_warren,scotus_justice,5721.074,5723.371,Where?
1961.72,1,33645,j_r_wells,,5723.371,5724.633,In the statements.
1961.72,1,15099,earl_warren,scotus_justice,5724.633,5725.415,What does it say?
1961.72,1,33645,j_r_wells,,5727.047,5729.009,At the bottom of page 13 of the record.
1961.72,1,15099,earl_warren,scotus_justice,5729.009,5729.858,Of the record.
1961.72,1,33645,j_r_wells,,5729.858,5730.166,Yes.
1961.72,1,15099,earl_warren,scotus_justice,5730.166,5730.606,Yes.
1961.72,1,15089,hugo_l_black,scotus_justice,5730.606,5732.902,May I ask you to get there from my mind about this.
1961.72,1,33645,j_r_wells,,5732.902,5734.736,Yes sir.
1961.72,1,15089,hugo_l_black,scotus_justice,5734.736,5747.527,Is it your argument that no man can raise this who is not affected by it and no man can be affected by it unless he's been guilty of the things which it prohibits?
1961.72,1,33645,j_r_wells,,5747.527,5749.322,Not exactly Your Honor.
1961.72,1,15089,hugo_l_black,scotus_justice,5749.529,5761.105,"But it is your idea that in order to challenge it, he must show -- he comes within the class who have either been a communist, is a communist who has advised, aided and abetted communists."
1961.72,1,33645,j_r_wells,,5761.105,5769.543,It is my position that where he shows that he has not --
1961.72,1,15089,hugo_l_black,scotus_justice,5769.543,5771.969,Suppose he hadn't shown he has not?
1961.72,1,33645,j_r_wells,,5784.659,5790.322,"Well, I think that that would be a more questionable --"
1961.72,1,15089,hugo_l_black,scotus_justice,5790.322,5791.637,More questionable?
1961.72,1,33645,j_r_wells,,5812.881,5818.402,"Well, I think it's necessary that he show that he come within the class Your Honor."
1961.72,1,15089,hugo_l_black,scotus_justice,5818.402,5818.498,Suppose he (Voice Overlap) --
1961.72,1,33645,j_r_wells,,5818.498,5820.337,However -- but -- certainly if he (Voice Overlap) --
1961.72,1,15089,hugo_l_black,scotus_justice,5820.337,5820.553,Suppose he didn't come (Voice Overlap) --
1961.72,1,33645,j_r_wells,,5820.553,5821.967,-- he doesn't come within the class --
1961.72,1,15089,hugo_l_black,scotus_justice,5821.967,5824.625,"Suppose he just comes and says, “I'm not going to answer this."
1961.72,1,33645,j_r_wells,,5833.029,5833.599,Well --
1961.72,1,15089,hugo_l_black,scotus_justice,5833.599,5835.583,Would he have standing?
1961.72,1,33645,j_r_wells,,5835.583,5837.577,I doubt that he would but of this situation that he --
1961.72,1,15089,hugo_l_black,scotus_justice,5837.577,5854.987,"In other words, he decided to come in -- when he's got to come in and do as I -- your argument, as I understand it, is to come in first and either admit that he is a communist or has done these things under which -- under which circumstances, he would have standing to challenge."
1961.72,1,33645,j_r_wells,,5854.987,5859.371,I think it depends on which standing the question what it would be brought.
1961.72,1,15089,hugo_l_black,scotus_justice,5859.371,5861.12,Standing the question of this Act.
1961.72,1,33645,j_r_wells,,5861.12,5878.977,"Well, I think he has standing in the question of the act on certain basis of it without regard to that, but I don't think he's got standing to contend that it is an ex post facto law or bill of attainder."
1961.72,1,15089,hugo_l_black,scotus_justice,5878.977,5880.878,"Why not, what's the difference?"
1961.72,1,33645,j_r_wells,,5880.878,5887.834,On account of the fact that it cannot be an ex post facto or bill of attainder unless it adversely affects him.
1961.72,1,15089,hugo_l_black,scotus_justice,5887.834,5896.423,"Well, is that the only one you claim that he doesn't have standing to raise here?"
1961.72,1,33645,j_r_wells,,5896.423,5905.681,"Well, I think that it's affected seriously where he -- on the -- in the question of vagueness."
1961.72,1,15089,hugo_l_black,scotus_justice,5905.681,5908.404,Do you think he doesn't have the right to raise that?
1961.72,1,33645,j_r_wells,,5908.404,5923.668,"I doubt that he has the right to raise the question of vagueness where he comes in and swears to the facts that he says, the oath is too vague with regard to."
