file_name,section,speaker_id,speaker_name,speaker_role,start,stop,text
1968.30,0,15089,hugo_l_black,scotus_justice,2446.655,2461.717,Or might it not be relevant if they deliberately made the district that it was not a convenience in order to elect white men or colored men either one might have not make a difference.
1968.30,0,42637,thomas_j_downey,,2461.717,2470.975,"It would be relevant only in so far as to population disparity of a district would be involved, Your Honor."
1968.30,0,15099,earl_warren,scotus_justice,2474.557,2486.628,"Well this shape, form and size of eighth had been made for an incumbent congressman?"
1968.30,0,42637,thomas_j_downey,,2486.628,2489.782,"Well there again, there's nothing in the record in regard to that."
1968.30,0,15089,hugo_l_black,scotus_justice,2502.578,2503.504,What county?
1968.30,0,42637,thomas_j_downey,,2503.504,2505.949,"Texas County, Your Honor."
1968.30,0,15089,hugo_l_black,scotus_justice,2507.356,2509.575,What's the county's city?
1968.30,0,42637,thomas_j_downey,,2509.575,2516.308,Houston.
1968.30,0,15089,hugo_l_black,scotus_justice,2542.045,2545.686,Is that the -- in that district?
1968.30,0,42637,thomas_j_downey,,2545.686,2546.243,"No, Your Honor."
1968.30,0,15099,earl_warren,scotus_justice,2568.411,2569.798,Mr. Collins.
1968.30,1,20662,david_collins,,2569.798,2572.368,May it please the Court.
1968.30,1,15061,abe_fortas,scotus_justice,2776.911,2785.207,"But if you carry that kind of analysis to the state as a whole, nobody's been that is both diluted at all."
1968.30,1,20662,david_collins,,2785.207,2786.908,Well that would almost be correct.
1968.30,1,15099,earl_warren,scotus_justice,2814.074,2830.819,Would you mind pointing out to us the reasons that you rely on in this case for the legislature in departing from equality?
1968.30,1,20662,david_collins,,2832.633,2834.012,"Alright sir, I will."
1968.30,1,15099,earl_warren,scotus_justice,2846.782,2847.92,"Yes, I understand that."
1968.30,1,20662,david_collins,,2847.92,2850.993,"Right, now the reasons are these."
1968.30,1,15099,earl_warren,scotus_justice,2880.931,2886.743,"And therefore, you rely on it regardless of equality?"
1968.30,1,20662,david_collins,,2886.743,2887.784,That's right Your Honor.
1968.30,1,15099,earl_warren,scotus_justice,2906.871,2910.873,That's another question whether it could or not.
1968.30,1,20662,david_collins,,2924.851,2934.467,"Well, I think that's obviously true from the record, Your Honor absent compulsion from this Court or some other federal court, that's true."
1968.30,1,15099,earl_warren,scotus_justice,2934.467,2946.623,You mean absent following the rules that have been laid down by this Court for reapportionment?
1968.30,1,20662,david_collins,,2946.623,2949.569,"No, I think the rules have been followed."
1968.30,1,15099,earl_warren,scotus_justice,2956.891,2957.544,Yes.
1968.30,1,20662,david_collins,,2957.544,2957.664,And it --
1968.30,1,15099,earl_warren,scotus_justice,2957.664,2965.556,"But it has said that it could not be unequal for certain reasons, hasn't it?"
1968.30,1,20662,david_collins,,2965.556,2973.894,That's right and there's absolutely no indication in this record that there's been any reason quite was unequal.
1968.30,1,15099,earl_warren,scotus_justice,2973.894,2987.747,"But you're telling us that the reason that you can rely on that is because it's a legislative function and that's the only bill, they could pass therefore it is all right."
1968.30,1,20662,david_collins,,2987.747,3000.458,I don't think any legislature whether the map looks like this or whether it looks otherwise that you can hammer out and get the votes to pass a bill that's closer than 3% ideal.
1968.30,1,15099,earl_warren,scotus_justice,3006.634,3009.786,Well if it was 6%?
1968.30,1,20662,david_collins,,3009.786,3014.335,"Well if it were 6%, in my judgment it would still be good."
1968.30,1,15099,earl_warren,scotus_justice,3014.335,3015.411,12?
1968.30,1,20662,david_collins,,3015.411,3018.732,I think the cutoff point ought to be in the area of ten.
1968.30,1,15071,byron_r_white,scotus_justice,3099.408,3103.271,Would that be -- even then it would only be with respect to 1960.
1968.30,1,20662,david_collins,,3103.271,3104.137,That's true.
1968.30,1,15071,byron_r_white,scotus_justice,3104.137,3111.331,Then you have enormous changes I suppose in certain places in Missouri since 1960?
1968.30,1,20662,david_collins,,3111.331,3113.245,"That's true, that's true."
1968.30,1,15140,william_j_brennan_jr,scotus_justice,3113.245,3124.397,"I think Mr. Downey suggested, Mr. Collins that there are who -- wherein they vote going on population changes."
1968.30,1,20662,david_collins,,3130.897,3132.093,In the fourth that's true.
1968.30,1,15140,william_j_brennan_jr,scotus_justice,3136.62,3141.789,What you are suggesting was because of Kansas City in the fourth and its environs?
1968.30,1,20662,david_collins,,3141.789,3142.066,That's right.
1968.30,1,15140,william_j_brennan_jr,scotus_justice,3142.066,3147.416,There is a trend that's possible in any event in the way of increase there is if any in eight --
1968.30,1,20662,david_collins,,3147.416,3149.859,Oh I'm sure that's true.
1968.30,1,15140,william_j_brennan_jr,scotus_justice,3167.125,3169.618,"Now that is 15, 17,000 approximate --"
1968.30,1,20662,david_collins,,3169.618,3172.291,Well it was about seven -- 15 to 17 then.
1968.30,1,15099,earl_warren,scotus_justice,3241.796,3250.879,"I understood they take it under consideration in the City of St. Louis, for instance, the transitory population in a great city like that."
1968.30,1,20662,david_collins,,3253.29,3256.264,There's no evidence in the record Your Honor that they did.
1968.30,1,15099,earl_warren,scotus_justice,3256.264,3262.802,You don't think there is any transitory population in a great city like St. Louis?
1968.30,1,20662,david_collins,,3262.802,3267.221,"Well, talking about what I think and what's in the record are two different things."
1968.30,1,15099,earl_warren,scotus_justice,3274.518,3277.31,"This taking is after the fact too, isn't it?"
1968.30,1,20662,david_collins,,3282.64,3284.285,"The testimony did, yes sir."
1968.30,1,15099,earl_warren,scotus_justice,3284.285,3293.652,"Yes but in the legislature, was it argued that there was a university in the Eighth District and there was a --"
1968.30,1,20662,david_collins,,3293.652,3295.838,"Yes, sir, that was the testimony."
1968.30,1,15099,earl_warren,scotus_justice,3295.838,3296.29,Well --
1968.30,1,20662,david_collins,,3296.29,3297.595,The testimony by these legislative --
1968.30,1,15099,earl_warren,scotus_justice,3297.595,3299.739,-- well the testimony was that what they intended.
1968.30,1,20662,david_collins,,3304.497,3306.134,"Not other than the testimony, no sir."
1968.30,1,15089,hugo_l_black,scotus_justice,3348.081,3357.557,Could the Census Bureau indicate why it conceded a possible error as much as 3%?
1968.30,1,20662,david_collins,,3357.557,3360.002,I don't know the answer to that Your Honor.
1968.30,1,15089,hugo_l_black,scotus_justice,3362.297,3364.878,Was there a witness from the Census Bureau there?
1968.30,1,20662,david_collins,,3364.878,3365.148,"No, sir."
1968.30,1,15089,hugo_l_black,scotus_justice,3365.148,3367.769,How did this get into the record?
1968.30,1,20662,david_collins,,3367.769,3375.824,Simply a statement in the Attorney General's brief that I think this is a part of the documentary part of the -- those booklets.
1968.30,1,15089,hugo_l_black,scotus_justice,3377.818,3379.185,What is the stipulation?
1968.30,1,20662,david_collins,,3382.083,3387.364,"I don't know the page number of the appendixes, Your Honor."
1968.30,1,15089,hugo_l_black,scotus_justice,3388.472,3392.392,"If he knows, would you get him to tell you later so you can let us know?"
1968.30,1,20662,david_collins,,3392.392,3393.638,"Yes, sir."
1968.30,1,15099,earl_warren,scotus_justice,3427.769,3442.337,But did the courts agree that the difference is in the Mississippi were for the same reasons that you rely upon here?
1968.30,1,20662,david_collins,,3442.337,3445.381,"Well, there's no opinion of this Court in the Mississippi case."
1968.30,1,15099,earl_warren,scotus_justice,3445.381,3449.763,"No, the courts I said."
1968.30,1,20662,david_collins,,3449.763,3450.817,I'm sorry I don't understand you.
1968.30,1,15099,earl_warren,scotus_justice,3450.817,3454.088,Was there an opinion of any kind in that case?
1968.30,1,20662,david_collins,,3454.088,3454.977,In the lower court
1968.30,1,15099,earl_warren,scotus_justice,3454.977,3458.189,"Yes, well I asked in whatever court it was."
1968.30,1,20662,david_collins,,3466.185,3468.121,"No, I don't assert that Your Honor."
1968.30,1,15099,earl_warren,scotus_justice,3468.8,3477.308,"I thought you did, and I thought also that your colleague said that."
1968.30,1,20662,david_collins,,3477.308,3482.496,"Well, I don't say this is the only kind of a bill that you can get through the legislature."
1968.30,2,28475,irving_achtenberg,,3929.412,3932.964,"Mr. Chief Justice, and may it please the Court."
1968.30,2,15089,hugo_l_black,scotus_justice,4020.834,4024.07,What do you say is the test?
1968.30,2,28475,irving_achtenberg,,4027.605,4028.284,We think --
1968.30,2,15089,hugo_l_black,scotus_justice,4028.284,4028.621,The crucial?
1968.30,2,28475,irving_achtenberg,,4028.621,4035.991,-- the test in each case must be that the Court must examine the evidence before it.
1968.30,2,15089,hugo_l_black,scotus_justice,4083.085,4087.664,What do you suggest the legislature could've done?
1968.30,2,28475,irving_achtenberg,,4089.908,4104.286,"If the Court please I will -- if Mr. Justice Black please, I will refer to the map which is simply an enlargement of the map appearing on page 15 of appellees' brief, was also before the Court."
1968.30,2,15089,hugo_l_black,scotus_justice,4315.205,4319.526,What difference would that have made in the other districts?
1968.30,2,28475,irving_achtenberg,,4319.526,4321.474,This is true of every district.
1968.30,2,15089,hugo_l_black,scotus_justice,4370.02,4371.956,"You mean 5,000 people?"
1968.30,2,28475,irving_achtenberg,,4371.956,4372.525,"Yes, sir."
1968.30,2,15089,hugo_l_black,scotus_justice,4372.525,4374.878,Splitting up the counties?
1968.30,2,28475,irving_achtenberg,,4374.878,4390.259,"With -- you can take Scotland County from district nine into district six, which would bring district six up to 5,000 closer to equality."
1968.30,2,15089,hugo_l_black,scotus_justice,4394.188,4396.404,Would that split the county?
1968.30,2,28475,irving_achtenberg,,4396.404,4396.733,"No, sir."
1968.30,2,15089,hugo_l_black,scotus_justice,4397.232,4399.727,Keep it in the same district?
1968.30,2,28475,irving_achtenberg,,4399.727,4403.099,That would be shifting a full county from district to district.
1968.30,2,15089,hugo_l_black,scotus_justice,4403.099,4411.521,"Do you think it's advisable if possible, to keep the identity of the county boundaries on congressional district?"
1968.30,2,28475,irving_achtenberg,,4411.521,4416.501,I think that is a consideration which this Court has accepted.
1968.30,2,15089,hugo_l_black,scotus_justice,4435.083,4435.663,Well that's absolutely --
1968.30,2,28475,irving_achtenberg,,4435.663,4438.066,-- that we would follow their plan --
1968.30,2,15089,hugo_l_black,scotus_justice,4438.066,4441.33,"That's absolutely necessary, I mean in the big cities."
1968.30,2,28475,irving_achtenberg,,4441.33,4442.695,"I would think so, yes sir."
1968.30,2,15089,hugo_l_black,scotus_justice,4443.813,4446.318,"Yes, I see in some of the very large cities."
1968.30,2,28475,irving_achtenberg,,4446.318,4451.656,And we don't quarrel with the legislature's attempt to hold the county lines where they could.
1968.30,2,15089,hugo_l_black,scotus_justice,4451.656,4457.003,Do you make any complaint about the structure of that eight?
1968.30,2,28475,irving_achtenberg,,4462.087,4462.307,"Well, I --"
1968.30,2,15089,hugo_l_black,scotus_justice,4462.307,4465.139,With reference to the way it's built?
1968.30,2,28475,irving_achtenberg,,4465.139,4468.662,I think it is almost a two-headed gerrymander.
1968.30,2,15089,hugo_l_black,scotus_justice,4495.663,4499.214,"Well, I guess they will always do that, won't they?"
1968.30,2,28475,irving_achtenberg,,4499.214,4503.903,"They will do it to the extent that the rulings of this Court permit, but not --"
1968.30,2,15140,william_j_brennan_jr,scotus_justice,4503.903,4515.149,But did I understand you to say Mr. Achtenberg that you are not defending the District Court judgment on any ground that in any event aid as a gerrymander and an infamous one?
1968.30,2,28475,irving_achtenberg,,4515.149,4518.56,"Well, we think that the whole plan is a political error."
1968.30,2,15140,william_j_brennan_jr,scotus_justice,4518.56,4531.264,"No, no, no but are you -- are you defending the District Court judgment on the ground that eight constitutes an impermissible political gerrymandering?"
1968.30,2,28475,irving_achtenberg,,4533.009,4536.47,Now I think you're correct sir.
1968.30,2,15099,earl_warren,scotus_justice,4536.47,4551.47,"Well Mr. -- counsel I noticed that district eight is 13,542 above the normal."
1968.30,2,28475,irving_achtenberg,,4575.775,4576.082,I think the fourth --
1968.30,2,15099,earl_warren,scotus_justice,4576.082,4580.054,To which would equalize the two districts?
1968.30,2,28475,irving_achtenberg,,4580.054,4593.035,"I think not to arrive from the mathematical perfection, but to get within 2,000 you could shift either Howard County with 10,859 and it abuts for --"
1968.30,2,15099,earl_warren,scotus_justice,4593.035,4593.345,Yes.
1968.30,2,28475,irving_achtenberg,,4593.345,4613.689,"-- direct from district four, or you could reach almost the same result by shifting Morgan County, which again completely abuts the adjoining county with a population of 9,476 which would bring your variances in those two cases to a matter of a thousand or two, rather than the range of 26,000."
1968.30,2,15140,william_j_brennan_jr,scotus_justice,4613.689,4628.035,"Well are your clients concerned only of, I mean is there any practical foundation for political or something for your protest against this result?"
1968.30,2,28475,irving_achtenberg,,4638.655,4647.017,"Well, if the Court please, we're in this manner of political, we have -- one can never speak for why the individual parties are there."
1968.30,2,15140,william_j_brennan_jr,scotus_justice,4652.386,4659.263,"So your client's only interest in this is that it be done as the constitutional decisions require it to be, is that it?"
1968.30,2,28475,irving_achtenberg,,4659.263,4669.023,I think that statement is correct and I can certainly say that that their attorneys are only proposing -- are only appearing and we appear of course as appellees.
1968.30,2,15140,william_j_brennan_jr,scotus_justice,4669.023,4671.857,"Well, what narrowly you know in these cases?"
1968.30,2,28475,irving_achtenberg,,4678.969,4687.99,"To my knowledge, no sir. Again, this is my statement confirmed by Mr. Preisler who is one of the plaintiffs and is not in the record."
1968.30,2,15089,hugo_l_black,scotus_justice,4687.99,4700.274,Well is the dispute simply over that in fact that the courts have said they must be nearly like as possible in population?
1968.30,2,28475,irving_achtenberg,,4707.563,4712.074,I would agree with Mr. Justice's statement except that not a little closer.
1968.30,2,15089,hugo_l_black,scotus_justice,4719.016,4731.468,But there's no -- you have no argument of any kind based on the fact that somehow that voters are going to be heard of what is done?
1968.30,2,28475,irving_achtenberg,,4731.468,4736.304,Well we certainly have answers to their discussion on votings.
1968.30,2,15089,hugo_l_black,scotus_justice,4760.674,4761.311,Why?
1968.30,2,28475,irving_achtenberg,,4761.311,4774.071,"Well, let me take them one by one with regard to the position which is not specifically articulated by the appellants."
1968.30,2,15089,hugo_l_black,scotus_justice,4795.831,4801.868,So do you think -- do you think that's not worthy of any consideration whatever?
1968.30,2,28475,irving_achtenberg,,4801.868,4809.437,What we think that that argument sir could be used to justify any denial of equal representation.
1968.30,2,15089,hugo_l_black,scotus_justice,4809.437,4823.168,"I mean, do you think or maybe so but do you think it has no right to have any weight at all, practical pragmatic situation of what you can do in the legislative body?"
1968.30,2,28475,irving_achtenberg,,4823.168,4827.49,Well we think it is an element of the pragmatic problem to be weighed.
1968.30,2,15089,hugo_l_black,scotus_justice,4828.057,4832.227,You do then think it should be given some weight but you don't say how much.
1968.30,2,28475,irving_achtenberg,,4832.227,4835.498,Well I have to be specific.
1968.30,2,15089,hugo_l_black,scotus_justice,4863.37,4868.508,"But that is a pragmatic fact of life that has to be considered, doesn't it?"
1968.30,2,28475,irving_achtenberg,,4869.185,4874.842,"I would say no sir, because this legislature met three times on this vote."
1968.30,2,15089,hugo_l_black,scotus_justice,4890.138,4896.613,"Now if that's true, unless you can show something, it just shocks you someway."
1968.30,2,28475,irving_achtenberg,,4914.152,4914.252,"Well, I --"
1968.30,2,15089,hugo_l_black,scotus_justice,4914.252,4919.078,How do we know how much those -- they live in that district.
1968.30,2,28475,irving_achtenberg,,4939.065,4960.601,"Well, I think that the history of reapportionment is, Mr. Justice Black well knows, shows that what happened after Colegrove versus Green was that the legislatures of the several states structured congressional districts which ranged as far as 600,000 from the -- one range to the other."
1968.30,2,15089,hugo_l_black,scotus_justice,4960.601,4964.212,I know that very well and I said it isn't that case.
1968.30,2,28475,irving_achtenberg,,4964.212,4964.36,And after the --
1968.30,2,15089,hugo_l_black,scotus_justice,4964.36,4967.512,That's why they said it from what the court held.
1968.30,2,15099,earl_warren,scotus_justice,4982.701,4983.477,But we have --
1968.30,2,15089,hugo_l_black,scotus_justice,4983.477,4991.73,Without regard to the fact that the trade -- they are in the legislature and they're doing the best they can to bring them out any further.
1968.30,2,28475,irving_achtenberg,,4991.73,5009.721,I would still not accept the argument made of legislative practicability because this in effect says that in a state as in Missouri where one party has the majority in both Houses it may politically structure the district so as to be favorable to that party.
1968.30,2,15043,potter_stewart,scotus_justice,5020.323,5028.82,Is -- calling your attention to the table on page 55 of the appellant's brief on the merits.
1968.30,2,28475,irving_achtenberg,,5060.8,5064.042,"I believe so sir, yes sir."
1968.30,2,15043,potter_stewart,scotus_justice,5064.042,5074.812,And that shows Missouri to be the what? The eleventh best in the country from the point of view of size of deviation?
1968.30,2,28475,irving_achtenberg,,5074.812,5078.113,"I just count it, yes sir that is correct."
1968.30,2,15043,potter_stewart,scotus_justice,5078.113,5081.626,And I don't know that it appears here.
1968.30,2,28475,irving_achtenberg,,5092.062,5094.897,And I believe Florida which --
1968.30,2,15043,potter_stewart,scotus_justice,5094.897,5098.109,Florida is about twentieth.
1968.30,2,28475,irving_achtenberg,,5098.109,5099.724,If I might address myself to that?
1968.30,2,15043,potter_stewart,scotus_justice,5099.724,5106.808,"And Missouri -- well I was going to ask you, do you quarrel with the accuracy of this -- the factual accuracy of this table?"
1968.30,2,28475,irving_achtenberg,,5106.808,5111.447,I don't quarrel with the percentage variations.
1968.30,2,15043,potter_stewart,scotus_justice,5121.214,5122.929,"Well, I agree with you on that."
1968.30,2,15061,abe_fortas,scotus_justice,5133.624,5137.355,"May I ask you, sorry, may I ask you this question?"
1968.30,2,28475,irving_achtenberg,,5293.681,5303.074,"Well, Mr. Justice Fortas it seems to me that the burden does not shift when we get into this matter of the weight of the evidence."
1968.30,2,15061,abe_fortas,scotus_justice,5324.467,5327.239,There is certainly may be a more accurate way of stating it.
1968.30,2,28475,irving_achtenberg,,5327.239,5338.875,Of showing that that they have failed in that regard and that they have failed to justify what we consider substantial variances under the peculiar situation in Missouri.
1968.30,2,15061,abe_fortas,scotus_justice,5338.875,5354.103,"But if you assume that they have -- the state has before its burden by showing that these figures are within tolerable range, then the only thing you've been talking about thus far is that they could've done better?"
1968.30,2,28475,irving_achtenberg,,5354.103,5355.398,No sir.
1968.30,2,15099,earl_warren,scotus_justice,5358.442,5363.132,We'll recess now Mr. --
1968.30,2,28475,irving_achtenberg,,5363.132,5369.238,To continue with my answer to Mr. Justice Fortas's question.
1968.30,2,15043,potter_stewart,scotus_justice,5740.739,5749.414,"Mr. Achtenberg, fully understanding your position that percentage comparisons per se are not very meaningful."
1968.30,2,28475,irving_achtenberg,,5815.055,5819.556,"Well, I certainly can't speak of specific knowledge of each of those cases."
1968.30,2,15043,potter_stewart,scotus_justice,5828.165,5829.979,"Well it was in Florida, we agree."
1968.30,2,28475,irving_achtenberg,,5829.979,5832.684,For the Florida case yes.
1968.30,2,15043,potter_stewart,scotus_justice,5855.561,5861.273,"Yes, what my explicit question was when it says here that the data has been verified by court opinion."
1968.30,2,28475,irving_achtenberg,,5868.389,5869.218,"No, sir."
1968.30,2,15061,abe_fortas,scotus_justice,6029.151,6041.073,"Can you, without too much trouble, indicate what were the lines of the Eighth District before this redistricting?"
1968.30,2,28475,irving_achtenberg,,6045.335,6047.349,"Frankly, I can not sir."
1968.30,2,15061,abe_fortas,scotus_justice,6055.788,6063.991,"There's no map anywhere in these papers, is there that shows district lines before the redistricting?"
1968.30,2,28475,irving_achtenberg,,6063.991,6064.907,I think not.
1968.30,2,15140,william_j_brennan_jr,scotus_justice,6097.024,6104.996,Are there any improper counties you describe with the legislature?
1968.30,2,28475,irving_achtenberg,,6104.996,6111.716,"Well, I would certainly have to be bound by the record and by the statements of the appellants' counsel."
1968.30,2,15043,potter_stewart,scotus_justice,6171.673,6181.73,"What's the make up of the present congressional delegation from the State of Missouri, 10 members of the House of Representatives?"
1968.30,2,28475,irving_achtenberg,,6181.73,6184.163,Can somebody answer that?
1968.30,2,15043,potter_stewart,scotus_justice,6184.952,6187.058,Nine Democrats and one Republican.
1968.30,2,28475,irving_achtenberg,,6188.182,6189.457,Correct.
1968.30,2,15043,potter_stewart,scotus_justice,6189.457,6206.711,"Until last November, or rather until last week."
1968.30,2,28475,irving_achtenberg,,6206.711,6216.878,"If the Court please, it seems to the appellees' in this matter that in weighing this case there is a consideration that should be considered."
