file_name,section,speaker_id,speaker_name,speaker_role,start,stop,text
1968.30,0,15099,earl_warren,scotus_justice,0.0,16.643,"30, James C. Kirkpatrick, Secretary of State of Missouri, et al. appellants versus Paul W. Preisler, et al."
1968.30,0,42637,thomas_j_downey,,30.804,37.42,"May it please the Court, Mr. Chief Justice."
1968.30,0,15099,earl_warren,scotus_justice,381.07,399.966,"May I ask if you -- it's your position that under no circumstances could this deviation be legal, or is it because of the reasons that are assigned for it to the manner in which it is done constitute the illegality?"
1968.30,0,42637,thomas_j_downey,,399.966,406.264,It is our contention Mr. Chief Justice that this Act is legal.
1968.30,0,15099,earl_warren,scotus_justice,424.841,431.466,Regardless of the reasons for the deviations?
1968.30,0,42637,thomas_j_downey,,431.466,433.685,"Yes, Your Honor."
1968.30,0,15099,earl_warren,scotus_justice,442.809,444.254,Where do you stop on the deviation?
1968.30,0,42637,thomas_j_downey,,444.254,449.563,And that of course is the big question.
1968.30,0,15089,hugo_l_black,scotus_justice,478.739,481.002,What is largest difference?
1968.30,0,42637,thomas_j_downey,,481.002,485.763,"The largest difference Your Honor is slightly more than 25,000."
1968.30,0,15089,hugo_l_black,scotus_justice,485.763,487.937,Out of how many people?
1968.30,0,42637,thomas_j_downey,,487.937,501.417,"Out of approximately 304 no -- 4,320,000 population in the State of Missouri."
1968.30,0,15089,hugo_l_black,scotus_justice,501.417,502.794,I'm not talking about the whole state.
1968.30,0,42637,thomas_j_downey,,504.311,511.865,"And the largest district is 445,000 population."
1968.30,0,15089,hugo_l_black,scotus_justice,511.865,516.118,"Is that the one in which there's the 25,000 difference?"
1968.30,0,42637,thomas_j_downey,,516.118,528.157,"And that is 25,000 larger than the smallest district which is 419,000 population."
1968.30,0,15140,william_j_brennan_jr,scotus_justice,577.573,582.012,"Mr. Downey, I gather the larger of the two was eight is it?"
1968.30,0,42637,thomas_j_downey,,583.08,584.904,"The Eighth District, yes, Your Honor."
1968.30,0,15140,william_j_brennan_jr,scotus_justice,584.904,588.896,"And the smallest is district four with 419,000 is that it?"
1968.30,0,42637,thomas_j_downey,,588.896,589.575,"Yes, Your Honor."
1968.30,0,15140,william_j_brennan_jr,scotus_justice,589.575,591.71,"And they're contiguous districts, aren't they?"
1968.30,0,42637,thomas_j_downey,,591.71,594.822,They are contiguous districts.
1968.30,0,15140,william_j_brennan_jr,scotus_justice,594.822,600.758,Well what explains that difference between contiguous districts?
1968.30,0,42637,thomas_j_downey,,600.758,603.74,We have several factors.
1968.30,0,15140,william_j_brennan_jr,scotus_justice,614.178,616.943,"Well they're not included in the 419,000 are they?"
1968.30,0,42637,thomas_j_downey,,616.943,617.52,They are.
1968.30,0,15140,william_j_brennan_jr,scotus_justice,617.52,619.424,"Or rather 445, they are?"
1968.30,0,42637,thomas_j_downey,,619.424,621.111,They are included in the 445.
1968.30,0,15140,william_j_brennan_jr,scotus_justice,621.111,625.63,That is the military population plus the college population?
1968.30,0,42637,thomas_j_downey,,625.63,630.309,The military population and the college population are included in the census counts.
1968.30,0,15140,william_j_brennan_jr,scotus_justice,636.056,643.323,"And if you -- and if they were to be deducted from the 445, what would the figure then be for eight?"
1968.30,0,42637,thomas_j_downey,,643.323,658.332,"If they would -- if full weight was given to the population, if they were to be deducted in their entirety there would be in excess of 50,000 population taken out of the Eighth District."
1968.30,0,15071,byron_r_white,scotus_justice,658.871,663.641,"But that would be assuming that all of those people were nonresident, but not --"
1968.30,0,42637,thomas_j_downey,,663.641,669.437,"That would be assuming that all over nonresident, yes Your Honor, which of course would be an erroneous subject."
1968.30,0,15071,byron_r_white,scotus_justice,669.437,674.827,"But if half -- if you took half of them, why it would cut it down by about 25,000?"
1968.30,0,42637,thomas_j_downey,,674.827,675.732,"That's right, Your Honor."
1968.30,0,15043,potter_stewart,scotus_justice,675.732,678.117,But that would make it exactly equal to the other district.
1968.30,0,42637,thomas_j_downey,,678.117,680.313,That would equalize pretty well.
1968.30,0,15043,potter_stewart,scotus_justice,805.343,813.468,"I don't understand Mr. Attorney General these ratio figures, the 10% and the 40 to 50%."
1968.30,0,42637,thomas_j_downey,,815.551,830.839,"The ratio, Your Honor is the ratio of the total number of votes in the county cast in a particular election as related to the 1960 census population for that county."
1968.30,0,15043,potter_stewart,scotus_justice,830.839,835.079,You mean -- would you give us in illustrative figures?
1968.30,0,42637,thomas_j_downey,,835.079,840.466,"In other words, if the population of the county was a hundred thousand."
1968.30,0,15043,potter_stewart,scotus_justice,840.466,841.366,Yes.
1968.30,0,42637,thomas_j_downey,,841.366,849.609,"And there were 10,000 votes cast in a particular election, then 10% of the population voted in that election --"
1968.30,0,15043,potter_stewart,scotus_justice,849.609,850.946,Right.
1968.30,0,42637,thomas_j_downey,,850.946,863.598,"-- and as I say in Pulaski County where Fort Leonard Wood is located, in every election there has consistently been below 10% of the population voting."
1968.30,0,15043,potter_stewart,scotus_justice,874.717,879.083,Those counties all making up one district?
1968.30,0,42637,thomas_j_downey,,879.083,879.294,"Not necessarily, Your Honor."
1968.30,0,15043,potter_stewart,scotus_justice,879.294,880.332,Not necessarily?
1968.30,0,42637,thomas_j_downey,,881.021,886.278,We made this comparison simply to illustrate the fact that --
1968.30,0,15043,potter_stewart,scotus_justice,886.278,889.263,That Pulaski County contain a great many transients and nonvoters.
1968.30,0,42637,thomas_j_downey,,889.263,889.822,"Yes, Your Honor."
1968.30,0,15043,potter_stewart,scotus_justice,889.822,890.608,Right.
1968.30,0,42637,thomas_j_downey,,890.608,895.366,"And after all, we are talking here about voting rights."
1968.30,0,15099,earl_warren,scotus_justice,911.434,914.924,Well then may I ask you this question?
1968.30,0,42637,thomas_j_downey,,942.564,946.207,"Well, I'm saying Your Honor that you have to look at the entire picture."
1968.30,0,15099,earl_warren,scotus_justice,946.207,952.922,"Well I know but you got to take one or the other position or unless you want to take both, I don't know."
1968.30,0,42637,thomas_j_downey,,978.196,987.24,"We say first of all Your Honor, we say first of all that these are de minimis variations that they are of no consequence."
1968.30,0,15099,earl_warren,scotus_justice,987.24,987.999,Under any circumstances?
1968.30,0,42637,thomas_j_downey,,987.999,989.294,Under any circumstances.
1968.30,0,15099,earl_warren,scotus_justice,989.294,990.322,Very well.
1968.30,0,42637,thomas_j_downey,,990.322,998.401,That a ratio of 1.06 to 1 is not a significant debasement of a vote.
1968.30,0,15099,earl_warren,scotus_justice,1006.282,1025.374,"Even though 25,000 people have their votes lessened, and they could've been given an equal vote by having a more contiguous district than you have yourself lined out."
1968.30,0,42637,thomas_j_downey,,1025.374,1030.194,"We contend, Your Honor that that 25,000 is de minimis."
1968.30,0,15099,earl_warren,scotus_justice,1054.197,1056.661,"Well, isn't that then the ultimate question?"
1968.30,0,42637,thomas_j_downey,,1061.821,1068.562,"Well, I recognize Your Honor that you may not agree with that argument."
1968.30,0,15099,earl_warren,scotus_justice,1068.562,1069.61,"Yes, alright."
1968.30,0,42637,thomas_j_downey,,1069.61,1073.924,You may come to conclusion that this is an unconstitutional debasement of a vote.
1968.30,0,15099,earl_warren,scotus_justice,1073.924,1075.239,"Yes, yes."
1968.30,0,42637,thomas_j_downey,,1075.239,1084.021,"And in recognition of that, I say that this 25,000 difference is justified in the context of this particular case."
1968.30,0,15099,earl_warren,scotus_justice,1084.021,1088.315,"Yes, well that's what I wanted to get clear in my mind."
1968.30,0,42637,thomas_j_downey,,1104.264,1105.992,"That is my position, Your Honor."
1968.30,0,15061,abe_fortas,scotus_justice,1105.992,1109.675,In what congressional district is Pulaski County?
1968.30,0,42637,thomas_j_downey,,1109.675,1114.26,"Pulaski County is in the Eighth District, Your Honor, the largest district."
1968.30,0,15061,abe_fortas,scotus_justice,1114.26,1120.176,"But where you have an underage don't you, not an overage?"
1968.30,0,42637,thomas_j_downey,,1120.176,1122.529,We have -- it is the largest district.
1968.30,0,15099,earl_warren,scotus_justice,1146.208,1149.162,Well may I ask this?
1968.30,0,42637,thomas_j_downey,,1190.742,1192.539,The Eighth District of course --
1968.30,0,15099,earl_warren,scotus_justice,1192.539,1193.894,"Yes, yes."
1968.30,0,42637,thomas_j_downey,,1193.894,1196.16,-- Your Honor.
1968.30,0,15099,earl_warren,scotus_justice,1203.483,1203.806,Yes.
1968.30,0,42637,thomas_j_downey,,1203.806,1215.929,"And what would actually about 10 or 11,000 of that population being resident voting population."
1968.30,0,15099,earl_warren,scotus_justice,1217.385,1230.184,"Well, why do you have to go from one border of your state way over to the middle of the state in that circuitous way in order to carve out a district?"
1968.30,0,42637,thomas_j_downey,,1230.184,1236.902,"Well my only reply to that question, Your Honor, is that this is the legislature at work."
1968.30,0,15099,earl_warren,scotus_justice,1236.902,1237.03,Well --
1968.30,0,42637,thomas_j_downey,,1237.03,1248.235,Trying to agree upon districts will come within reasonable population variations and districts that will meet the requirements of the Constitution.
1968.30,0,15099,earl_warren,scotus_justice,1248.235,1253.622,Now for what reason? For what reasons you say they're dealing with the legislature?
1968.30,0,42637,thomas_j_downey,,1265.801,1269.474,"Well, I think Your Honor that it is contiguous."
1968.30,0,15099,earl_warren,scotus_justice,1271.268,1272.326,I beg your pardon?
1968.30,0,42637,thomas_j_downey,,1272.326,1272.925,I believe that --
1968.30,0,15099,earl_warren,scotus_justice,1272.925,1275.051,"If you configure the microphone, please."
1968.30,0,42637,thomas_j_downey,,1275.051,1277.57,"Yes, Your Honor I'm sorry."
1968.30,0,15099,earl_warren,scotus_justice,1293.15,1293.707,Yes.
1968.30,0,42637,thomas_j_downey,,1296.07,1306.857,"And you simply -- when you get into this business of drawing districts, you get into what has been called redistricting checkers and you --"
1968.30,0,15099,earl_warren,scotus_justice,1306.857,1308.055,What is that?
1968.30,0,42637,thomas_j_downey,,1309.081,1313.903,Redistricting checkers or dominoes as it is been referred to.
1968.30,0,15099,earl_warren,scotus_justice,1314.808,1316.582,Who refers to it in that sense?
1968.30,0,42637,thomas_j_downey,,1318.273,1326.365,"Yes, I believe the Judge of the Eighth Circuit who wrote the dissenting opinion referred to it in that matter."
1968.30,0,15099,earl_warren,scotus_justice,1326.365,1328.768,Not in a favorable way though.
1968.30,0,42637,thomas_j_downey,,1328.768,1333.0,"Not in a favorable way, no Your Honor."
1968.30,0,15099,earl_warren,scotus_justice,1343.071,1346.405,Just a question I'm trying to get at.
1968.30,0,42637,thomas_j_downey,,1360.873,1370.952,"I think the reason, Your Honor, I think the explanation is that this is the district which takes in the central part of the state."
1968.30,0,15099,earl_warren,scotus_justice,1381.837,1382.616,A lot of what?
1968.30,0,42637,thomas_j_downey,,1382.616,1384.939,A trading of counties.
1968.30,0,15099,earl_warren,scotus_justice,1388.233,1394.837,Well isn't that what -- isn't that what Reynolds versus Sims tried to avoid?
1968.30,0,42637,thomas_j_downey,,1407.372,1411.632,"I don't recall that factor in Reynolds, Your Honor."
1968.30,0,15099,earl_warren,scotus_justice,1426.38,1437.465,Could you have maintained the integrity of counties here by a change of this district that would've brought them more into conformity with equality?
1968.30,0,42637,thomas_j_downey,,1437.465,1442.453,"I think, Your Honor, had we done so we would've made this district look worse."
1968.30,0,15140,william_j_brennan_jr,scotus_justice,1461.101,1468.927,"Well suppose you would take one of those two counties along the line between the fourth and the eighth, as I look back here."
1968.30,0,42637,thomas_j_downey,,1478.326,1480.051,"Saline County, Your Honor."
1968.30,0,15140,william_j_brennan_jr,scotus_justice,1480.051,1481.406,No in the eighth.
1968.30,0,42637,thomas_j_downey,,1481.406,1483.392,"Oh in the eighth, Howard County."
1968.30,0,15140,william_j_brennan_jr,scotus_justice,1483.392,1484.71,And below that is what?
1968.30,0,42637,thomas_j_downey,,1484.71,1486.035,And that's Cooper County.
1968.30,0,15140,william_j_brennan_jr,scotus_justice,1486.035,1489.599,And what's the population of those two joint?
1968.30,0,42637,thomas_j_downey,,1489.599,1493.212,"Howard 10,859."
1968.30,0,15140,william_j_brennan_jr,scotus_justice,1493.212,1493.841,Next.
1968.30,0,42637,thomas_j_downey,,1493.841,1495.376,"Cooper 15,448."
1968.30,0,15140,william_j_brennan_jr,scotus_justice,1495.376,1498.248,"Alright, right there that's 25,000 isn't it?"
1968.30,0,42637,thomas_j_downey,,1498.248,1498.867,"Right, yes."
1968.30,0,15140,william_j_brennan_jr,scotus_justice,1498.867,1501.334,Suppose you put those two counties on the fourth?
1968.30,0,42637,thomas_j_downey,,1501.334,1504.387,That you put those two counties in the Fourth District --
1968.30,0,15140,william_j_brennan_jr,scotus_justice,1504.387,1505.573,Would that equalize it?
1968.30,0,42637,thomas_j_downey,,1505.573,1508.974,You would have equalized the population.
1968.30,0,15140,william_j_brennan_jr,scotus_justice,1514.287,1520.761,"If you done that, the eighth wouldn't have looked any worse that does now."
1968.30,0,42637,thomas_j_downey,,1520.761,1522.619,"Look pretty poor, Your Honor, in my opinion."
1968.30,0,15140,william_j_brennan_jr,scotus_justice,1522.619,1522.916,Maybe it wouldn't --
1968.30,0,42637,thomas_j_downey,,1522.916,1524.413,A matter of fact it's pretty bad.
1968.30,0,15140,william_j_brennan_jr,scotus_justice,1524.413,1526.315,-- be pretty poor now.
1968.30,0,42637,thomas_j_downey,,1526.315,1528.533,"It doesn't look good, I recognize that."
1968.30,0,15099,earl_warren,scotus_justice,1532.655,1535.631,But it would be equal.
1968.30,0,42637,thomas_j_downey,,1535.631,1541.227,It would've equalized pure raw census statistics figures.
1968.30,0,15099,earl_warren,scotus_justice,1576.657,1584.918,Do you have any other military installations in Missouri and other parts of the state than this eighth?
1968.30,0,42637,thomas_j_downey,,1584.918,1592.178,We have some other military installations but they are not of the size and significance of Fort Leonard Wood.
1968.30,0,15099,earl_warren,scotus_justice,1593.336,1604.658,"Have you taken consideration, in the consideration those installations in this reapportionment?"
1968.30,0,42637,thomas_j_downey,,1604.658,1612.34,"They were not taken into consideration Your Honor, because they were not of the size and significance of this Board."
1968.30,0,15061,abe_fortas,scotus_justice,1624.89,1653.008,"Well, Mr. Attorney General, the lower court was disturbed and I confess that I'm somewhat disturbed by the current fact that both the legislative committee and the legislature itself proceeded to draft, consider and enact a bill based upon, what shall I say, incorrect."
1968.30,0,42637,thomas_j_downey,,1712.373,1726.943,"Mr. Justice Fortas, many years ago Chief Justice Hughes in speaking before the American Bar Association made the remark that in this world of imperfections the faults of human clay are always manifested."
1968.30,0,15061,abe_fortas,scotus_justice,1726.943,1728.608,"No, that doesn't quite work here."
1968.30,0,42637,thomas_j_downey,,1760.778,1777.632,"Well, Your Honor the error about which we are speaking is a difference between the plan we have is a 25,000 population difference between the smallest and the largest district."
1968.30,0,15061,abe_fortas,scotus_justice,1784.868,1786.66,Well just take it very simply.
1968.30,0,42637,thomas_j_downey,,1792.481,1793.719,"Yes, Your Honor."
1968.30,0,15061,abe_fortas,scotus_justice,1793.719,1806.681,"If the -- if the -- on the basis of the correct figures, the overage there is what, 3.13% overage over the ideal."
1968.30,0,42637,thomas_j_downey,,1806.681,1807.497,"Yes, Your Honor."
1968.30,0,15061,abe_fortas,scotus_justice,1807.497,1813.921,"And the overage over the smallest district is in the neighborhood of 6%, is that right?"
1968.30,0,42637,thomas_j_downey,,1813.921,1816.647,Approximately 6% larger than the smallest district.
1968.30,0,15061,abe_fortas,scotus_justice,1816.647,1836.484,"Now if you take the figures that the legislature used, the incorrect figures that the legislature used, the percent of variation in district eight, Pulaski County etcetera, over the idea would've been only 1.85, isn't that what your --"
1968.30,0,42637,thomas_j_downey,,1836.484,1836.732,"That's right, Your Honor."
1968.30,0,15061,abe_fortas,scotus_justice,1836.732,1837.778,-- submission here says?
1968.30,0,42637,thomas_j_downey,,1837.778,1840.321,Just slightly less than 2%.
1968.30,0,15061,abe_fortas,scotus_justice,1840.321,1849.232,"And if you -- and I don't have -- now that's 1.85 over the ideal, isn't it?"
1968.30,0,42637,thomas_j_downey,,1849.232,1849.951,"Yes, Your Honor."
1968.30,0,15061,abe_fortas,scotus_justice,1849.951,1859.863,And the difference between the largest which is district eight and the smallest would've been what?
1968.30,0,42637,thomas_j_downey,,1859.863,1863.531,The smallest district under what the legislature thought --
1968.30,0,15061,abe_fortas,scotus_justice,1863.531,1867.621,What been around say 3% to 3.5%?
1968.30,0,42637,thomas_j_downey,,1867.621,1872.15,-- was the Tenth District with an under percentage of --
1968.30,0,15061,abe_fortas,scotus_justice,1872.15,1872.537,1.88.
1968.30,0,42637,thomas_j_downey,,1872.537,1874.242,--1.88%.
1968.30,0,15061,abe_fortas,scotus_justice,1874.242,1892.224,So that what you're doing is comparing a 6% in approximate which is just under 6% variation in terms of the true facts as against a somewhat around of 3 to 4% variation?
1968.30,0,42637,thomas_j_downey,,1892.224,1893.352,Just under 4%.
1968.30,0,15061,abe_fortas,scotus_justice,1893.352,1899.759,Just under 4% variation which is what the legislature thought it was doing.
1968.30,0,42637,thomas_j_downey,,1899.759,1900.569,"Yes, Your Honor."
1968.30,0,15061,abe_fortas,scotus_justice,1900.569,1932.033,"Now, taking into account the fact which I am for one accept that we should give a great deal of weight to what the legislature does, you have the curiosity here which seemed to have impressed the lower court and I must say it bothers me that the legislature proceeded on the basis of, what shall I say again using a colorless word, incorrect figures."
1968.30,0,42637,thomas_j_downey,,1938.09,1941.492,"That's right, Your Honor."
1968.30,0,15061,abe_fortas,scotus_justice,1979.686,1986.061,Is it a matter of calculation or don't you get from the census county by county figures?
1968.30,0,42637,thomas_j_downey,,1986.061,1987.299,"Yes, Your Honor, you do."
1968.30,0,15061,abe_fortas,scotus_justice,1987.606,2005.618,"So it's not a matter of having to make a recalculation in which errors of allocation or what not might occur, because they get their figures from the census county by county and then it's a matter of putting them together, is that right?"
1968.30,0,42637,thomas_j_downey,,2005.618,2012.182,"Well there's a very glaring error, Your Honor, right up here in the Sixth District which contains whole counties."
1968.30,0,15061,abe_fortas,scotus_justice,2051.703,2067.129,The lower court seems to have been so impressed by it and you would be really asked to do is to give the legislature the usual presumption of the correctness of its result.
1968.30,0,42637,thomas_j_downey,,2085.841,2094.844,Well I don't agree that the situation is as serious as the lower court has made it out to be.
1968.30,0,15061,abe_fortas,scotus_justice,2125.803,2127.677,It makes it five.
1968.30,0,42637,thomas_j_downey,,2129.713,2130.162,"Pardon me, Your Honor?"
1968.30,0,15061,abe_fortas,scotus_justice,2130.162,2132.278,Three and two make five.
1968.30,0,42637,thomas_j_downey,,2132.278,2133.833,"Yes, Your Honor, I realize that."
1968.30,0,15043,potter_stewart,scotus_justice,2133.833,2135.887,"Or it might make it one, three minus two make one."
1968.30,0,42637,thomas_j_downey,,2135.887,2138.769,And it could as well make it one.
1968.30,0,15043,potter_stewart,scotus_justice,2157.522,2158.772,Where was that?
1968.30,0,42637,thomas_j_downey,,2158.772,2161.302,In the State of Florida in Gong versus Kirk.
1968.30,0,15043,potter_stewart,scotus_justice,2161.302,2163.069,"Oh, yes."
1968.30,0,42637,thomas_j_downey,,2163.069,2169.175,And that was brought to the attention of this Court and this Court found nothing wrong with it.
1968.30,0,15089,hugo_l_black,scotus_justice,2179.931,2210.566,"Is there any furious argument made here supported by strong areas part of those either who support or reject the reapportionment that there's really difference in order to change the results of the district of having a Republican congressman instead of a Democratic congressman, or a Democratic congressman instead of a Republican congressman?"
1968.30,0,42637,thomas_j_downey,,2210.566,2215.967,There's nothing in the record Your Honor to indicate this political factor.
1968.30,0,15089,hugo_l_black,scotus_justice,2217.003,2219.947,Is that the argument it's made.
1968.30,0,42637,thomas_j_downey,,2221.911,2223.229,"No, Your Honor."
1968.30,0,15089,hugo_l_black,scotus_justice,2223.229,2225.592,That argument is not presented to us?
1968.30,0,42637,thomas_j_downey,,2225.592,2227.409,That is not presented to the Court.
1968.30,0,15089,hugo_l_black,scotus_justice,2227.409,2246.309,"So we can take the case as though there's no question raised in it which requires our attention, might involve a deliberate effort to shift parties in congressional districts."
1968.30,0,42637,thomas_j_downey,,2246.309,2248.957,"That's right, Your Honor."
1968.30,0,15089,hugo_l_black,scotus_justice,2267.624,2269.904,You mean the said Republicans?
1968.30,0,42637,thomas_j_downey,,2269.904,2271.754,The leaders of the Republican Party that --
1968.30,0,15089,hugo_l_black,scotus_justice,2271.754,2272.81,Who's the leader?
1968.30,0,42637,thomas_j_downey,,2272.81,2279.235,The minority leader of the House and the minority leader of the Senate.
1968.30,0,15099,earl_warren,scotus_justice,2279.235,2286.19,"But you did tell us the legislature itself, it went strictly on party lines?"
1968.30,0,42637,thomas_j_downey,,2286.19,2290.497,"Yes, Your Honor."
1968.30,0,15099,earl_warren,scotus_justice,2298.736,2299.423,Was what?
1968.30,0,42637,thomas_j_downey,,2299.423,2303.263,Was absolutely guaranteed to put a Republican in Congress and --
1968.30,0,15089,hugo_l_black,scotus_justice,2303.263,2304.481,Well which one is that?
1968.30,0,42637,thomas_j_downey,,2304.481,2315.304,That was the Second District to the City of St. Louis that -- or the County of St. Louis that had been strongly Republican for years and years and years.
1968.30,0,15089,hugo_l_black,scotus_justice,2317.542,2318.987,That didn't change?
1968.30,0,42637,thomas_j_downey,,2318.987,2324.108,But the people didn't follow the legislature in doing that.
1968.30,0,15089,hugo_l_black,scotus_justice,2329.924,2331.381,That showed this doesn't always work.
1968.30,0,42637,thomas_j_downey,,2331.381,2332.699,It doesn't always work.
1968.30,0,15071,byron_r_white,scotus_justice,2356.545,2358.936,Is there record about that?
1968.30,0,42637,thomas_j_downey,,2361.313,2366.649,The census data would sustain it would be the only thing Your Honor that's --
1968.30,0,15071,byron_r_white,scotus_justice,2366.649,2367.498,But there was no testimony to legislate --
1968.30,0,42637,thomas_j_downey,,2367.498,2369.921,"There was no testimony on that point, no."
1968.30,0,15071,byron_r_white,scotus_justice,2369.921,2371.248,-- attempted to do this?
1968.30,0,42637,thomas_j_downey,,2371.248,2371.797,No.
1968.30,0,15071,byron_r_white,scotus_justice,2371.797,2375.34,Or there wasn't any testimony about the other matter you referred to?
1968.30,0,42637,thomas_j_downey,,2375.34,2376.846,"That's right, no Your Honor."
1968.30,0,15071,byron_r_white,scotus_justice,2376.846,2384.748,Is there any testimony that there was some effort in forming these districts to permit incumbents to run from their home district?
1968.30,0,42637,thomas_j_downey,,2384.748,2388.552,There's no testimony to that effect.
1968.30,0,15071,byron_r_white,scotus_justice,2391.582,2394.794,"The lower court thought that was a consideration, didn't it?"
1968.30,0,42637,thomas_j_downey,,2394.794,2395.95,That's right.
1968.30,0,15071,byron_r_white,scotus_justice,2407.861,2431.85,Well now in making the statement you made about the so-called sure Republican district and about the so-called Negro district are you representing that these are actually the facts that really did influence the legislature?
1968.30,0,42637,thomas_j_downey,,2431.85,2437.018,These were very definitely facts that influenced the legislature Your Honor.
1968.30,0,15089,hugo_l_black,scotus_justice,2437.018,2438.952,Were there any findings to that effect?
1968.30,0,42637,thomas_j_downey,,2438.952,2439.91,There are not.
