file_name,section,speaker_id,speaker_name,speaker_role,start,stop,text
1969.412,0,15073,warren_e_burger,scotus_justice,0.0,7.435,"Number 412, Woodward against the Commissioner of Internal Revenue."
1969.412,0,20708,donald_p_cooney,,10.274,13.368,"Thank you, Your Honor."
1969.412,1,33660,johnnie_m_walters,,1264.03,1271.018,Mr. Chief Justice and may it please the Court.
1969.412,2,20708,donald_p_cooney,,2760.524,2784.824,The Government persists on making an analogy with the expenses of the appraisal the litigation in the Iowa State Court with brokerage fees and cites Winmill case.
1969.412,2,15073,warren_e_burger,scotus_justice,3104.768,3107.031,Thank you Mr. Cooney.
