file_name,section,speaker_id,speaker_name,speaker_role,start,stop,text
1971.71-5445,0,15073,warren_e_burger,scotus_justice,0.0,29.779,"-- next in number 71-5445, Shadwick against City of Tampa."
1971.71-5445,0,21410,daniel_a_rezneck,,30.605,33.819,"Mr. Chief Justice, may it please the Court."
1971.71-5445,0,15045,harry_a_blackmun,scotus_justice,55.592,62.71,"Mr. Rezneck, let me know at the start, has Mr. Shadwick ever been tried and convicted?"
1971.71-5445,0,21410,daniel_a_rezneck,,62.71,64.571,No sir.
1971.71-5445,0,15045,harry_a_blackmun,scotus_justice,64.571,67.411,"Well, do we have a final judgment here then?"
1971.71-5445,0,21410,daniel_a_rezneck,,67.411,69.646,I believe that you do.
1971.71-5445,0,15045,harry_a_blackmun,scotus_justice,84.901,86.661,"Well, it is a final judgment under federal statute --"
1971.71-5445,0,21410,daniel_a_rezneck,,86.661,89.106,"Well, I believe that it is."
1971.71-5445,0,15141,william_h_rehnquist,scotus_justice,165.686,169.811,"Was that passed upon specifically in Camara, Mr. Rezneck?"
1971.71-5445,0,21410,daniel_a_rezneck,,169.811,170.708,That particular issue?
1971.71-5445,0,15141,william_h_rehnquist,scotus_justice,170.708,170.944,Yes.
1971.71-5445,0,21410,daniel_a_rezneck,,170.944,190.908,"I do not believe that it was raised and that issue was litigated as to whether it was a final judgment or not, but since that I suppose would be deemed a jurisdictional matter for this Court, I think the fact that this Court went on to decide the case, does decide the jurisdictional issue, at least by implication."
1971.71-5445,0,15140,william_j_brennan_jr,scotus_justice,291.978,299.194,"Tell me Mr. Rezneck, are these clerks permitted some times as substitute for the judge as an a acting judge?"
1971.71-5445,0,21410,daniel_a_rezneck,,299.194,300.884,"No, I don't believe so."
1971.71-5445,0,15140,william_j_brennan_jr,scotus_justice,305.321,306.26,Only in the judge?
1971.71-5445,0,21410,daniel_a_rezneck,,306.26,307.003,Yes.
1971.71-5445,0,15140,william_j_brennan_jr,scotus_justice,307.003,322.749,"Because I know in my own state, local police magistrates, clerks could by statute, exercise judicial powers I believe of the police judges in certain instances when the police judge himself was absent, that's not so in --"
1971.71-5445,0,21410,daniel_a_rezneck,,322.749,329.471,"No as I understand the Florida law, the only judicial function which is confided to the clerk is the issue on certain arrest warrant."
1971.71-5445,0,15073,warren_e_burger,scotus_justice,338.981,342.973,"That's by virtue of the limitation that the Florida legislature imposed, is it not?"
1971.71-5445,0,21410,daniel_a_rezneck,,342.973,343.805,"Yes, that’s correct."
1971.71-5445,0,15073,warren_e_burger,scotus_justice,343.805,347.978,"In other words, they gave a limited quasi judicial power to the clerk?"
1971.71-5445,0,21410,daniel_a_rezneck,,347.978,349.872,"Yes, that is precisely, yeah, right."
1971.71-5445,0,15073,warren_e_burger,scotus_justice,349.872,355.383,How is that very much different from what's done in the federal system?
1971.71-5445,0,21410,daniel_a_rezneck,,355.383,371.716,"Well, I think it is very much different because the arrest warrant powers lodged in only -- first of all it must be lodged in a judicial officer in the federal system and that means either a federal judge or a United States magistrate, those are the only officers who would constitute the judicial officers for purpose."
1971.71-5445,0,15073,warren_e_burger,scotus_justice,371.716,375.182,"How about the commissioner, when we had the commissioners?"
1971.71-5445,0,21410,daniel_a_rezneck,,375.182,377.429,"Well, the commissioners were judicial officers at that time."
1971.71-5445,0,15073,warren_e_burger,scotus_justice,378.603,384.533,Was there a time when the United States commissioners were not required to be lawyers?
1971.71-5445,0,21410,daniel_a_rezneck,,384.533,388.883,They were not required to be lawyers until the United States Magistrates Act was passed in 1968.
1971.71-5445,0,15073,warren_e_burger,scotus_justice,388.883,403.998,"So, until 1968, would you say that the posture of a United States commissioner was very different from that of the clerk exercising these functions in this case?"
1971.71-5445,0,21410,daniel_a_rezneck,,403.998,407.604,"Yes, I would say that it was because he was clearly a judicial officer."
1971.71-5445,0,15073,warren_e_burger,scotus_justice,421.62,425.895,"But to whom is the clerk of court responsible, Mr. Rezneck?"
1971.71-5445,0,21410,daniel_a_rezneck,,425.895,430.306,"Well, I think that it is not at all clear from the Florida statutory structure."
1971.71-5445,0,15073,warren_e_burger,scotus_justice,479.266,487.518,You don't think this clerk is responsible solely to judicial authority when he is performing quasi judicial duties?
1971.71-5445,0,21410,daniel_a_rezneck,,487.518,496.779,"Well, what I meant was that, in terms of his jobs, the appointed power, his responsibilities also run to the clerk who appointed him."
1971.71-5445,0,15104,thurgood_marshall,scotus_justice,533.304,536.857,"Well, is there anything that says he is not neutral?"
1971.71-5445,0,21410,daniel_a_rezneck,,536.857,538.671,Is anything that says he is not neutral?
1971.71-5445,0,15104,thurgood_marshall,scotus_justice,540.581,543.003,Is there anything to say that he is not detached?
1971.71-5445,0,21410,daniel_a_rezneck,,544.997,562.009,"No, we are not alleging that he is connected with the Police Department, but we do not think that this case ought to turn on an inquiry into whether a particular clerk or deputy clerk is impartial or neutral or detached or capable as an individual of having those qualities."
1971.71-5445,0,15104,thurgood_marshall,scotus_justice,580.112,587.888,"Yeah, but the Florida statute has any limitation on the ability of a magistrate?"
1971.71-5445,0,21410,daniel_a_rezneck,,587.888,590.356,"Well, the magistrate is purely a judicial officer."
1971.71-5445,0,15104,thurgood_marshall,scotus_justice,590.356,593.588,"Yeah, but they don't say what he has to be?"
1971.71-5445,0,21410,daniel_a_rezneck,,593.588,594.021,Well --
1971.71-5445,0,15104,thurgood_marshall,scotus_justice,594.021,596.947,"It doesn't say he has to be detached, does it?"
1971.71-5445,0,21410,daniel_a_rezneck,,596.947,598.772,"No, but I think that the assumption would be taxed on the inference --"
1971.71-5445,0,15104,thurgood_marshall,scotus_justice,598.772,602.074,What does the Florida statute say about magistrates?
1971.71-5445,0,21410,daniel_a_rezneck,,602.074,605.126,"It doesn't deal with the point of detachment in those words, but I --"
1971.71-5445,0,15104,thurgood_marshall,scotus_justice,605.126,606.946,"(Voice Overlap) any state, I ever heard."
1971.71-5445,0,21410,daniel_a_rezneck,,606.946,614.156,"No I think the inference of detachment and neutrality arises from the fact, that he is clearly a judicial officer."
1971.71-5445,0,15104,thurgood_marshall,scotus_justice,622.6,624.563,Well how long the clerk has?
1971.71-5445,0,21410,daniel_a_rezneck,,624.563,625.192,Pardon me?
1971.71-5445,0,15104,thurgood_marshall,scotus_justice,625.192,625.946,How long does the clerk --
1971.71-5445,0,21410,daniel_a_rezneck,,625.946,629.017,The clerk is under – is a civil service employee.
1971.71-5445,0,15104,thurgood_marshall,scotus_justice,641.358,648.652,"Well, I still don't see the tie-in between him acting as a magistrate and acting as a clerk?"
1971.71-5445,0,21410,daniel_a_rezneck,,648.652,654.806,"But his primary duties are, clerical duties and they are the usual duties that one would associate with a clerical job."
1971.71-5445,0,15104,thurgood_marshall,scotus_justice,657.201,663.454,"Suppose the law says that, deputy clerk of any country may also act as magistrate?"
1971.71-5445,0,21410,daniel_a_rezneck,,663.454,678.117,"In effect that's what Florida has done here, that's what the Florida Supreme Court giving him the title of magistrate, without giving him any of the status of the judge, without changing his essential status from that of a clerical officer --"
1971.71-5445,0,15104,thurgood_marshall,scotus_justice,678.117,681.566,You keep saying the status of a judge.
1971.71-5445,0,21410,daniel_a_rezneck,,683.447,686.629,"They do not have the name of judges, they do not have the title of judges, but --"
1971.71-5445,0,15104,thurgood_marshall,scotus_justice,686.629,688.713,And they don't have the authority of judges?
1971.71-5445,0,21410,daniel_a_rezneck,,688.713,691.627,"Well, I think that they exercise judicial authority."
1971.71-5445,0,15104,thurgood_marshall,scotus_justice,696.398,697.954,Is that true in Florida?
1971.71-5445,0,21410,daniel_a_rezneck,,697.954,702.681,"Yes, the magistrates, such as the municipal court judges have a four-year term."
1971.71-5445,0,15104,thurgood_marshall,scotus_justice,704.544,708.055,But no qualification is required?
1971.71-5445,0,21410,daniel_a_rezneck,,708.055,711.024,"In a Tampa, they have to be members of bar."
1971.71-5445,0,15104,thurgood_marshall,scotus_justice,711.024,711.854,Magistrates?
1971.71-5445,0,21410,daniel_a_rezneck,,711.854,713.873,"Yes, municipal court judges."
1971.71-5445,0,15104,thurgood_marshall,scotus_justice,713.873,715.05,Sitting at bench.
1971.71-5445,0,15119,lewis_f_powell_jr,scotus_justice,715.05,722.093,"Does Florida law require the court magistrates with authority to the issue warrants, must be lawyers?"
1971.71-5445,0,21410,daniel_a_rezneck,,722.093,739.604,"No, under a new constitution which is going to go and which has been approved in Florida, and that will become effective several years from now, all judges with the exception of county judges and counties of small population below a specified limit will have to be members of the bar."
1971.71-5445,0,15119,lewis_f_powell_jr,scotus_justice,739.604,745.583,Who issues warrants in felony cases in Florida or does it vary from jurisdiction to jurisdiction?
1971.71-5445,0,21410,daniel_a_rezneck,,745.583,767.977,"Under the Florida Rules of Criminal Procedures as I understand them, either a felony or a misdemeanor warrant, may be executed, may be issued by one who is defined as a committing magistrate under the rules and committing magistrates include all the judges and magistrates of the courts authority down to including the municipal court judges and the justices of the peace."
1971.71-5445,0,15071,byron_r_white,scotus_justice,829.889,842.313,Mr. Rezneck for Fourth Amendment purposes if a police officer had left over the facts here and thought that there was probable cause to arrest and went out and arrested without a warrant at all.
1971.71-5445,0,21410,daniel_a_rezneck,,847.925,850.835,"Well, I think that would involve the question what --"
1971.71-5445,0,15071,byron_r_white,scotus_justice,850.835,854.406,Let's suppose -- assume for the moment that there was clearly probable cause.
1971.71-5445,0,21410,daniel_a_rezneck,,854.406,857.016,"Yes, He could not do under Florida law."
1971.71-5445,0,15071,byron_r_white,scotus_justice,857.016,858.099,How about the Fourth Amendment?
1971.71-5445,0,21410,daniel_a_rezneck,,858.099,870.573,"Yes, well I think, that would require the decision by this Court which I don't leave has been made ever as to what the probable cause requirements of the Fourth Amendment are with respect to municipal ordinances."
1971.71-5445,0,15071,byron_r_white,scotus_justice,881.336,895.035,"Well, that was the common law, what about the general proposition of the police being able to arrest without a warrant, without a probable cause?"
1971.71-5445,0,21410,daniel_a_rezneck,,895.035,906.09,"I think that there is a legislative authority in some situations certainly, and I know it has been exercised here in the District of Columbia to give the police the authority to arrest on probable cause for certain misdemeanors."
1971.71-5445,0,15071,byron_r_white,scotus_justice,906.09,908.073,And then what about the states?
1971.71-5445,0,21410,daniel_a_rezneck,,908.073,912.702,"I assume that there are similar statutes in the state, and I think that will allow --"
1971.71-5445,0,15071,byron_r_white,scotus_justice,912.702,914.613,Would you say to that's unconstitutional?
1971.71-5445,0,21410,daniel_a_rezneck,,914.613,925.867,"No, I don't think so, I think that there would be a power in the legislature to define a reason to resemble search procedure to that extent, but I would point out we're not dealing with that here because Florida has the authority to do that."
1971.71-5445,0,15071,byron_r_white,scotus_justice,925.867,933.232,"Now, it's purported to say that a clerk can determine probable cause and authorize an arrest?"
1971.71-5445,0,21410,daniel_a_rezneck,,933.232,938.283,"Yes, but it requires a warrant, in other words, this is an arrest warrant which is required under the state law."
1971.71-5445,0,15071,byron_r_white,scotus_justice,938.283,951.205,"But you would say, Florida could authorize the police authority -- the legislature could authorize police themselves to determine probable cause and make an arrest?"
1971.71-5445,0,21410,daniel_a_rezneck,,951.205,963.824,"For this kind of offense, I'm not sure that I would want to see that because I don't think that we're dealing with this kind of offense that you have the sort of necessity that might justify that practice."
1971.71-5445,0,15071,byron_r_white,scotus_justice,963.824,966.77,"For a more serious misdemeanor, for a felony it would --"
1971.71-5445,0,21410,daniel_a_rezneck,,966.77,976.261,"Well for a felony, I think it's clear under the common law and under the Fourth Amendment which incorporate the common-law rule that a police officer can arrest on probable cause without a warrant."
1971.71-5445,0,15071,byron_r_white,scotus_justice,976.261,980.908,"But he may not do for, do so for a less serious municipal offense?"
1971.71-5445,0,21410,daniel_a_rezneck,,980.908,983.427,"Well, certainly a common-law he could not."
1971.71-5445,0,15071,byron_r_white,scotus_justice,1004.491,1015.932,"But the Florida court here has said that under Florida law that the clerk is sufficiently independent to perform his function as a matter of Florida law, I gather?"
1971.71-5445,0,21410,daniel_a_rezneck,,1015.932,1017.027,Well I think that --
1971.71-5445,0,15071,byron_r_white,scotus_justice,1017.027,1018.208,In your opinion anyway --
1971.71-5445,0,21410,daniel_a_rezneck,,1018.208,1021.635,-- that is a conclusion drawn by the Florida Supreme Court.
1971.71-5445,0,15071,byron_r_white,scotus_justice,1034.207,1046.128,There is nothing in the statute that indicates that he isn't neither or that the Florida Supreme court is wrong and as a matter of judicial judgment investing at this Court with some independence?
1971.71-5445,0,21410,daniel_a_rezneck,,1046.128,1057.777,"Well, I think that you have your supervening federal question it seems to me under the Fourth Amendment as to who is a neutral and detached warrant for Fourth Amendment purposes and that's a federal question."
1971.71-5445,0,15073,warren_e_burger,scotus_justice,1085.814,1093.658,"Well, tell me again then, what is the source of his authority to the issuing the warrant, from what does it derive?"
1971.71-5445,0,21410,daniel_a_rezneck,,1093.658,1110.541,"From the statutes of Florida, one statute of general applicability which gives clerks of the municipal court the authority to issue warrants in municipal ordinances cases and then from two specific statutes applicable in Tampa which are part of the Tampa City Charter."
1971.71-5445,0,15073,warren_e_burger,scotus_justice,1110.541,1116.67,"Isn't kind of legislative decision that these are proper officers, as Mr. Justice White suggested?"
1971.71-5445,0,21410,daniel_a_rezneck,,1116.67,1119.84,"Alright, absolutely we are dealing with a legislative act here."
1971.71-5445,0,15043,potter_stewart,scotus_justice,1188.971,1203.146,"You say Mr. Rezeck you're not, of course you're not relying on the title and the label of clerk, but you're rather relying on the nature of this man's job and duties and position."
1971.71-5445,0,21410,daniel_a_rezneck,,1203.146,1204.719,Yes.
1971.71-5445,0,15043,potter_stewart,scotus_justice,1204.719,1207.286,"Where does that appear in the record, I looked for it and I --"
1971.71-5445,0,21410,daniel_a_rezneck,,1207.286,1207.556,Well --
1971.71-5445,0,15043,potter_stewart,scotus_justice,1207.556,1228.208,"I gather that what you say is correct that this is the only -- that his authority to issue arrest warrants for violations of municipal ordinances is the only power, the only duty he has in his job, is to perform any task that have traditionally been considered judicial tasks."
1971.71-5445,0,21410,daniel_a_rezneck,,1233.032,1234.496,It's not in the record before you.
1971.71-5445,0,15043,potter_stewart,scotus_justice,1247.599,1253.693,What is he -- does he file papers and keep track of them or send in the courtroom and act as bailiff or --
1971.71-5445,0,21410,daniel_a_rezneck,,1253.693,1254.583,Some of them do that.
1971.71-5445,0,15043,potter_stewart,scotus_justice,1254.583,1255.66,What does he do?
1971.71-5445,0,21410,daniel_a_rezneck,,1255.66,1268.853,"He receives fines, for example, and gives receipts for fines in traffic cases, he prepares the dockets and the records, he issues the commitment, once a judge has ordered as opposed to sentence on seomone the deputy clerk makes out the commitment --"
1971.71-5445,0,15043,potter_stewart,scotus_justice,1268.853,1273.601,"Equivalent of a clerk’s office in any court, in this court or any court?"
1971.71-5445,0,21410,daniel_a_rezneck,,1273.601,1279.83,Yes and more specifically I would say in any police court or any municipal court in the country that you’ll find --
1971.71-5445,0,15043,potter_stewart,scotus_justice,1279.83,1283.687,"Track of fines paid, and disbursements and --"
1971.71-5445,0,21410,daniel_a_rezneck,,1283.687,1285.94,(Inaudible) if the case is continued --
1971.71-5445,0,15043,potter_stewart,scotus_justice,1285.94,1288.358,(Voice Overlap) payroll for the court?
1971.71-5445,0,21410,daniel_a_rezneck,,1288.358,1288.917,that I don't know.
1971.71-5445,0,15045,harry_a_blackmun,scotus_justice,1293.537,1296.478,Does he issue subpoenas?
1971.71-5445,0,21410,daniel_a_rezneck,,1296.478,1300.989,"Yes, he’s, I believe, the power to issue to subpoenas."
1971.71-5445,0,15141,william_h_rehnquist,scotus_justice,1300.989,1327.942,"Mr. Rezneck, if Florida by legislation could authorize a policeman to arrest, if there were in fact probable cause in this situation without a warrant and if in fact there is a probable cause in this case, do you have really a Fourth Amendment point, simply because the policeman has taken a warrant issued by a clerk, that made a finding of probable cause?"
1971.71-5445,0,21410,daniel_a_rezneck,,1327.942,1340.705,"Well, I think that you do because I think that's Florida has utilized the arrest warrant procedure here and it has made a determination that it's not proper for a policeman to arrest simply on a probable cause for offenses not committed in their presence."
1971.71-5445,0,15141,william_h_rehnquist,scotus_justice,1341.253,1342.502,That’s a State Law point?
1971.71-5445,0,21410,daniel_a_rezneck,,1342.502,1342.932,Yes.
1971.71-5445,0,15073,warren_e_burger,scotus_justice,1410.353,1420.772,"Mr. Rezneck, how would you categorize the power to issue a warrant, a subpoena rather as distinguished from a warrant?"
1971.71-5445,0,21410,daniel_a_rezneck,,1420.772,1434.724,"I think that that would be wholly ministerial power that would not be classified as a judicial power, because you do not have the elements of discretion and judgment that enter into the warrant decision."
1971.71-5445,0,15073,warren_e_burger,scotus_justice,1443.871,1455.341,"But then when we’ve considered the traditional language of a subpoena, it usually has the arcade form of briefing."
1971.71-5445,0,21410,daniel_a_rezneck,,1479.089,1480.056,No I don't dismiss it.
1971.71-5445,0,15140,william_j_brennan_jr,scotus_justice,1582.899,1593.567,"Mr. Rezneck, if this is the part of statute, I'm looking at your brief at page 3, and that third line after -- and where it took and may issue a warrant --"
1971.71-5445,0,21410,daniel_a_rezneck,,1593.567,1593.869,Yes sir.
1971.71-5445,0,15140,william_j_brennan_jr,scotus_justice,1593.869,1600.617,"-- that were -- if that had been there and may on a finding of probable cause issue a warrant, what would your position be?"
1971.71-5445,0,21410,daniel_a_rezneck,,1600.617,1602.129,As far as the clerk is concerned?
1971.71-5445,0,15140,william_j_brennan_jr,scotus_justice,1602.129,1602.633,Yes.
1971.71-5445,0,21410,daniel_a_rezneck,,1605.794,1615.626,Our position would be exactly the same because the Florida courts have read in a requirement and I think this case does it that the clerk must find probable cause.
1971.71-5445,0,15140,william_j_brennan_jr,scotus_justice,1634.736,1655.523,"And I take it, your position be the same if the statute said only that the clerk may exercise the powers of the local magistrate insofar as he may administer an oath, take an affidavit so forth and issue of warrant, what would you think of that?"
1971.71-5445,0,21410,daniel_a_rezneck,,1655.523,1658.242,"I think he could administer the oaths, I think --"
1971.71-5445,0,15140,william_j_brennan_jr,scotus_justice,1658.242,1667.261,"No, but if the statute said that the clerk may exercise the powers of the local magistrate and he suspects?"
1971.71-5445,0,21410,daniel_a_rezneck,,1667.261,1669.963,"Then I don't think it will be any different, I think it will be the same case."
1971.71-5445,0,15140,william_j_brennan_jr,scotus_justice,1669.963,1671.095,It'd still be here?
1971.71-5445,0,21410,daniel_a_rezneck,,1671.095,1684.346,"Yes, that they would be confining to the clerk a judicial determination, the probable cause without giving in any of the status or qualifications of an independent judicial officer, that they could not do that."
1971.71-5445,0,15140,william_j_brennan_jr,scotus_justice,1684.346,1694.181,"You mean, they have at least to go to so far as to say, the clerk in the absence of the magistrate may perform the functions of the magistrate?"
1971.71-5445,0,21410,daniel_a_rezneck,,1694.181,1701.463,"Well, if the functions of the magistrate is extended to issuing arrest warrants or search warrants, I would say the clerk could not do that, could not be given that power and --"
1971.71-5445,0,15140,william_j_brennan_jr,scotus_justice,1701.463,1704.876,He couldn't he be designated an acting magistrate in absence of the --
1971.71-5445,0,21410,daniel_a_rezneck,,1704.876,1715.963,"Not without more -- not if he remained simply a clerk and was not given any additional status, any additional protections in office, that would simply be changed --"
1971.71-5445,0,15140,william_j_brennan_jr,scotus_justice,1715.963,1719.552,"(Voice Overlap) earlier, that’s right then that whole system in New Jersey."
1971.71-5445,0,21410,daniel_a_rezneck,,1719.552,1720.003,"Well, New Jersey is one of the --"
1971.71-5445,0,15140,william_j_brennan_jr,scotus_justice,1720.003,1721.567,(Voice Overlap)
1971.71-5445,0,21410,daniel_a_rezneck,,1721.567,1728.414,"New Jersey is one of the few states, I might say that does authorize its clerical personnel to issue arrest warrants."
1971.71-5445,0,15140,william_j_brennan_jr,scotus_justice,1732.422,1738.832,"New Jersey still goes as far as it used to, doesn’t it, to permit the clerk to actually to function as the magistrate in the absence --"
1971.71-5445,0,21410,daniel_a_rezneck,,1738.832,1746.999,"Yes, I believe they do, but of course the New Jersey statute with respect to the warrant procedures those quite far in number of respects."
1971.71-5445,0,15073,warren_e_burger,scotus_justice,1805.303,1812.964,"I think you have consumed it all, but we'll see what the situation is Mr. Rezneck."
1971.71-5445,1,24961,gerald_h_bee,,1814.065,1820.727,"Mr. Chief Justice, may it please the Court."
1971.71-5445,1,15043,potter_stewart,scotus_justice,1856.918,1858.217,But the offense --
1971.71-5445,1,24961,gerald_h_bee,,1858.217,1872.707,"The offense was under the ordinance called generally careless driving while drinking which is a phrase I use, but more specifically careless driving while his ability to drive is impaired by the use of alcohol or a drug."
1971.71-5445,1,15043,potter_stewart,scotus_justice,1898.7,1904.564,In Tampa do you have to get a -- as a policeman do you have to get a warrant to issue a parking ticket?
1971.71-5445,1,24961,gerald_h_bee,,1904.564,1907.793,"No sir, that is one of distinguishing features."
1971.71-5445,1,15104,thurgood_marshall,scotus_justice,2021.42,2023.269,What is there in Tampa?
1971.71-5445,1,24961,gerald_h_bee,,2028.048,2041.531,"Then what he does, is he picks him back up and they call the paddywagon, Your Honor, and they take him down and they put him in drunk tank for approximately four hours if he is unable to manipulate himself what-so-ever."
1971.71-5445,1,15104,thurgood_marshall,scotus_justice,2041.531,2044.881,"Well I know, that's not at issue here at all, is it?"
1971.71-5445,1,24961,gerald_h_bee,,2044.881,2045.518,No Sir.
1971.71-5445,1,15104,thurgood_marshall,scotus_justice,2045.518,2049.062,Where do you get to decide on he would go on and keep on driving?
1971.71-5445,1,24961,gerald_h_bee,,2049.062,2060.329,"Well, because appellant has argued and in his brief says, that we should give this man summons rather than arrest him on the street, because by arresting him on the street, what your are doing, the appellant says --"
1971.71-5445,1,15104,thurgood_marshall,scotus_justice,2060.329,2068.556,"I thought appellant’s position was that you couldn't get that warrant, unless you got it from a judicial officer."
1971.71-5445,1,24961,gerald_h_bee,,2068.556,2071.452,"Yes sir, that is his issue."
1971.71-5445,1,15104,thurgood_marshall,scotus_justice,2085.402,2089.224,Then why don't you give the summons when he gets out of tank?
