file_name,section,speaker_id,speaker_name,speaker_role,start,stop,text
1972.72-5323,1,40553,richard_b_stone,,2669.148,2701.358,"Well, I have no further answer to that, Mr. Justice White except for the fact I think a reading of this record and attention to both petitioners charged to himself, requested to charge himself and to the evidence presented would reveal no conceivable question about that and I recognize the difficulty of assuming a directed verdict type of assumption in the criminal context, but I think that the presence of great bodily harm is as conclusively present and undisputed in the context that this case as it could possibly be."
1972.72-5323,1,15043,potter_stewart,scotus_justice,2701.358,2706.639,And I thought that your footnote 2 on page 4 dealt with this question?
1972.72-5323,1,40553,richard_b_stone,,2706.639,2726.594,"Well, it deals with it by a citation, Mr. Justice Stewart of the Nordelo case which implies that when in a criminal context generally, the federal government incorporates a state definition of a crime that it really only incorporates the substantive definition and not necessarily the labels."
1972.72-5323,1,15043,potter_stewart,scotus_justice,2726.594,2727.028,Right.
1972.72-5323,1,40553,richard_b_stone,,2727.028,2733.265,I have some question as to how far we can take that in this case to the extent that there really is an underlying substantive definitional problem.
1972.72-5323,1,15043,potter_stewart,scotus_justice,2746.903,2748.753,You cite Nordelo and (Inaudible)?
1972.72-5323,1,40553,richard_b_stone,,2748.753,2748.908,That’s right.
1972.72-5323,1,15043,potter_stewart,scotus_justice,2748.908,2764.565,"And this question would involve the construing the meaning of the last full paragraph of 18 U.S.C. 1153, but I thought this issue isn’t here since you point out there’s no question about the fact of great bodily harm?"
1972.72-5323,1,40553,richard_b_stone,,2764.565,2777.589,"I think that is right, but I have some, at least slight reluctance to answer to I believe to Mr. Justice White’s suggestion that the element, there’s no question about it, but then it wasn’t submitted to the jury and I recognize that it is difficult to."
1972.72-5323,1,15071,byron_r_white,scotus_justice,2777.589,2788.48,And the judge explained to the jury that he wasn’t charged with beating him to death or even cause him serious?
1972.72-5323,1,40553,richard_b_stone,,2788.48,2795.351,I don’t think he charges that he wasn't -- he doesn’t specifically say that he is not charged with causing serious injuries as he isn’t charged with intent to kill.
1972.72-5323,1,15071,byron_r_white,scotus_justice,2795.351,2802.114,Your contention there is no intention and no contest by the government that the beating in question is ultimate death of the victim.
1972.72-5323,1,40553,richard_b_stone,,2819.801,2839.252,"Well, I would submit with all deference that I have no further response to that question except that I think that the difficulty which is raised here might be a difficulty in another, but it is not a difficulty in this case and ought not to deter this Court from reaching the merits of the underlying issue that’s presented."
1972.72-5323,1,15104,thurgood_marshall,scotus_justice,3053.121,3059.581,All of this tiptoeing had nothing to do with Indians at all?
1972.72-5323,1,40553,richard_b_stone,,3059.581,3061.828,"Mr. Justice Marshall, I’m sorry but I don’t understand that?"
1972.72-5323,1,15104,thurgood_marshall,scotus_justice,3061.828,3064.687,I said they tiptoed in this assimilative statute --
1972.72-5323,1,40553,richard_b_stone,,3064.687,3067.992,"No, no not the assimilative statute, in the Major Crimes Act."
1972.72-5323,1,15104,thurgood_marshall,scotus_justice,3073.941,3081.61,"Well then I ask the question, were the Indians considered on the assimilated crime statute?"
1972.72-5323,1,40553,richard_b_stone,,3081.61,3083.438,I’m sorry I don’t understand the question?
1972.72-5323,1,15104,thurgood_marshall,scotus_justice,3083.438,3091.282,"Well, was this type of case considered on when you have the assimilated crimes statute which allows the states to move, right?"
1972.72-5323,1,40553,richard_b_stone,,3101.132,3115.898,"Well, I assume that what those statutes were enacted with regard to the question of what jurisdiction should be left in what places and to the extent that they involved Indians, they involved consideration of what crime should be left to the Indian courts."
1972.72-5323,1,15104,thurgood_marshall,scotus_justice,3129.622,3131.147,"That’s what I was talking about, the major --"
1972.72-5323,1,40553,richard_b_stone,,3131.147,3131.649,That’s right.
1972.72-5323,1,15140,william_j_brennan_jr,scotus_justice,3243.597,3244.326,Is this notion of --
1972.72-5323,1,40553,richard_b_stone,,3244.326,3247.74,-- Restitution rather than on retribution and --
1972.72-5323,1,15140,william_j_brennan_jr,scotus_justice,3247.74,3259.566,"Is this an argument Mr. Stone really that you can’t ever get an equal protection, due process violation in such a --"
1972.72-5323,1,40553,richard_b_stone,,3259.566,3260.065,No.
1972.72-5323,1,15140,william_j_brennan_jr,scotus_justice,3265.684,3266.943,How far do you go then?
1972.72-5323,1,40553,richard_b_stone,,3266.943,3292.206,"Well in this case, I go -- I think we go not very far at all because I think the discrepancy between which we deal with here, which is that a lesser included offense charge is available to an Indian -- to a non-Indian defendant in this case, but not to an Indian defendant is a very minor price to pay for upholding the very major rationale that Congress has consistently reinforced of preserving tribal sovereignty for number of reasons."
1972.72-5323,1,15140,william_j_brennan_jr,scotus_justice,3416.013,3421.55,"Now, that raises all kinds of body problems and Barkus problems, it never goes, does it?"
1972.72-5323,1,40553,richard_b_stone,,3421.55,3426.644,"Oh, as to whether he can be tried in this -- I think it doesn’t Mr. Justice Brennan."
1972.72-5323,1,15140,william_j_brennan_jr,scotus_justice,3433.476,3434.569,Maybe it’s a separate sovereignty?
1972.72-5323,1,40553,richard_b_stone,,3434.569,3436.305,"Separate sovereignty and we would argue that they are, but let me --"
1972.72-5323,1,15140,william_j_brennan_jr,scotus_justice,3436.305,3439.07,"The Indians at least to that extent sovereign, are they?"
1972.72-5323,1,40553,richard_b_stone,,3439.07,3441.162,"That’s right and well, and --"
1972.72-5323,1,15140,william_j_brennan_jr,scotus_justice,3441.162,3445.463,"It is -- I forgot, don’t we have that issue in some case?"
1972.72-5323,1,40553,richard_b_stone,,3445.463,3446.071,Excuse me?
1972.72-5323,1,15140,william_j_brennan_jr,scotus_justice,3446.071,3447.584,Don’t we have that issue in some case as them?
1972.72-5323,1,40553,richard_b_stone,,3447.584,3450.308,It’s been presented on certiorari and certiorari has been denied.
1972.72-5323,1,15140,william_j_brennan_jr,scotus_justice,3450.308,3451.016,Is that it?
1972.72-5323,1,40553,richard_b_stone,,3451.016,3454.529,"And in the case that it was presented, it was not necessarily an issue."
1972.72-5323,1,15140,william_j_brennan_jr,scotus_justice,3463.701,3467.361,"I mean that these are CFR, these aren’t sovereign Indians either, are they?"
1972.72-5323,1,40553,richard_b_stone,,3467.361,3467.857,That --
1972.72-5323,1,15140,william_j_brennan_jr,scotus_justice,3467.857,3469.915,Doesn't that compensate the body?
1972.72-5323,1,40553,richard_b_stone,,3469.915,3471.426,I don’t think so Mr. Justice Brennan.
1972.72-5323,1,15104,thurgood_marshall,scotus_justice,3486.604,3499.926,"How do you get around the individual Constitutional right asserted by individual in this Court by answering it before the greatest good for the greatest number, we could get it."
1972.72-5323,1,40553,richard_b_stone,,3499.926,3508.441,I answer it as I would in any context Mr. Justice Marshall that the discrimination is only unconstitutional insofar as it is invidious rationally.
1972.72-5323,1,15104,thurgood_marshall,scotus_justice,3511.53,3523.651,"Is it based on anything other than the fact that this man, the petition on this case, is it based on anything other than the fact that he is an Indian, spelled Indian?"
1972.72-5323,1,40553,richard_b_stone,,3523.651,3524.936,Absolutely not Mr. Justice Marshall --
1972.72-5323,1,15104,thurgood_marshall,scotus_justice,3524.936,3525.255,Is there anything else?
1972.72-5323,1,40553,richard_b_stone,,3525.255,3528.786,-- but neither is the entire federal regulatory scheme governing Indians.
1972.72-5323,1,15104,thurgood_marshall,scotus_justice,3528.786,3531.268,But we’re only talking about this one case?
1972.72-5323,1,40553,richard_b_stone,,3531.268,3533.313,"I don’t think you can do that Mr. Justice Marshall, with all respect."
1972.72-5323,1,15104,thurgood_marshall,scotus_justice,3533.313,3535.488,We can’t talk about the one case?
1972.72-5323,1,40553,richard_b_stone,,3535.488,3544.086,"I don’t think you can isolate one case and say, here, it is speculative that he may have suffered some sort of harm as a result to this -- of this classification."
1972.72-5323,1,15140,william_j_brennan_jr,scotus_justice,3622.075,3628.899,"Well, I suppose though that one believed the same transaction under the same offense test might reach different conclusion?"
1972.72-5323,1,40553,richard_b_stone,,3628.899,3630.151,"Conceivably Mr. Justice, that would be a lot --"
1972.72-5323,1,15140,william_j_brennan_jr,scotus_justice,3630.151,3633.055,Though I believe I the same transaction test you can know?
1972.72-5323,1,40553,richard_b_stone,,3633.055,3638.01,That would be -- in that case I am must rely on the argument of separate sovereignties.
1972.72-5323,1,15073,warren_e_burger,scotus_justice,3703.499,3713.531,"Mr. Meierhenry, if you need a little more time than your remaining two minutes, we will extend your time here."
1972.72-5323,2,36320,mark_v_meierhenry,,3713.531,3724.525,"Your Honor, it’s unfortunate that the petitioner’s taken the case this far and the United States government has still not gotten all of its forces together and decided between what’s going on in Washington and what’s going on in South Dakota."
1972.72-5323,2,15107,william_o_douglas,scotus_justice,3816.053,3817.974,"Well, what do you think they want to raise it?"
1972.72-5323,2,36320,mark_v_meierhenry,,3817.974,3821.395,"Your Honor, this is the first trial I ever had and I didn’t see it."
1972.72-5323,2,15071,byron_r_white,scotus_justice,3821.395,3830.724,"Because that this isn’t -- it is may not -- you may have been tried for a crime that you had no authority to charge, right?"
1972.72-5323,2,36320,mark_v_meierhenry,,3830.724,3831.974,That could be Your Honor.
1972.72-5323,2,15071,byron_r_white,scotus_justice,3863.827,3867.227,"What was that, what would then the penalty on the lesser included offense?"
1972.72-5323,2,36320,mark_v_meierhenry,,3867.227,3868.404,"Well, there’s a number of them."
1972.72-5323,2,15071,byron_r_white,scotus_justice,3874.458,3874.95,That’s the six months.
1972.72-5323,2,36320,mark_v_meierhenry,,3874.95,3875.839,-- six months.
1972.72-5323,2,15071,byron_r_white,scotus_justice,3879.076,3904.287,"What if the instruction you asked was to be instructed on a crime that really wasn’t the only crime that should have been tried under the Major Crimes Act, you’re making this -- you really are making the same argument on the lesser included offense as you would have been if you said dismiss the indictment."
1972.72-5323,2,36320,mark_v_meierhenry,,3906.076,3918.472,"Yes, Your Honor, I would also point out that I have argued that, that the cases that the government have cited since then by District Courts in our district, have used those."
1972.72-5323,2,15045,harry_a_blackmun,scotus_justice,3956.134,3958.968,"Mr. Meierhenry, who was the trial judge here, Chief Judge Nickel?"
1972.72-5323,2,36320,mark_v_meierhenry,,3958.968,3962.665,"Yes, Chief Judge Nickel from Sioux Falls, South Dakota, Your Honor."
1972.72-5323,2,15073,warren_e_burger,scotus_justice,4046.403,4054.877,"Mr. Meierhenry, you were not appointed by the Court in the conventional way here, but representing your legal services in South Dakota you volunteered."
1972.72-5323,2,36320,mark_v_meierhenry,,4054.877,4055.311,Yes.
1972.72-5323,2,15073,warren_e_burger,scotus_justice,4055.311,4061.555,"And on behalf of the Court, I want to thank you for your assistance to the Court and of course the assistance to your client."
1972.72-5323,2,36320,mark_v_meierhenry,,4061.555,4066.139,"Well, Your Honor, I also thank you for letting me appear since I don’t qualify as a member of the Supreme Court Bar."
1972.72-5323,2,15073,warren_e_burger,scotus_justice,4066.139,4070.451,"Well, when the three years are up, you can commence the appropriate proceeding."
