file_name,section,speaker_id,speaker_name,speaker_role,start,stop,text
1972.72-694,1,29612,jean_m_coon,,3819.054,3820.905,Okay.
1972.72-694,1,15071,byron_r_white,scotus_justice,3852.491,3858.011,Was the choice personally made in fact people are getting the --
1972.72-694,1,29612,jean_m_coon,,3858.011,3864.087,"Only if his income is less than $5000.00, then he would have to make the choice."
1972.72-694,1,15071,byron_r_white,scotus_justice,3868.114,3876.578,"Well, the person but the -- I suppose a person could have too little income to get any benefit out of the creditors, is that true?"
1972.72-694,1,29612,jean_m_coon,,3876.578,3877.775,That's true.
1972.72-694,1,15071,byron_r_white,scotus_justice,3877.775,3880.066,Which of that he would take a provision?
1972.72-694,1,29612,jean_m_coon,,3880.066,3882.547,That I assume that would be true.
1972.72-694,1,15073,warren_e_burger,scotus_justice,3882.547,3886.632,Would that possibly be true if he had too much income?
1972.72-694,1,29612,jean_m_coon,,3886.632,3887.83,Well --
1972.72-694,1,15073,warren_e_burger,scotus_justice,3887.83,3895.084,"Does it function at any point the way the medical deduction does in the federal, you had an analogy to that and I am not sure I followed it."
1972.72-694,1,29612,jean_m_coon,,3895.084,3902.904,"Well it's over -- if your income is over $24,000.00 a year, you cannot take --"
1972.72-694,1,15073,warren_e_burger,scotus_justice,3902.904,3903.644,None at all?
1972.72-694,1,29612,jean_m_coon,,3903.644,3910.128,"You cannot take the tax relief and if your income is over $5000.00, you cannot take the tuition reimbursement."
1972.72-694,1,15043,potter_stewart,scotus_justice,3910.128,3913.81,"You are eligible for the tuition relief only if your income is below $5000.00, is that correct?"
1972.72-694,1,29612,jean_m_coon,,3913.81,3914.752,Yes.
1972.72-694,1,15140,william_j_brennan_jr,scotus_justice,3914.752,3921.704,"Or I take it chances are if your income is under $5000.00, you would have no tax to pay anyway?"
1972.72-694,1,29612,jean_m_coon,,3921.704,3922.471,I would assume that that would be --
1972.72-694,1,15140,william_j_brennan_jr,scotus_justice,3922.471,3930.519,And I expect that is why the provision for -- the reimbursement to the extent it is --
1972.72-694,1,29612,jean_m_coon,,3930.519,3930.776,I would think so because there would be no.
1972.72-694,1,15140,william_j_brennan_jr,scotus_justice,3930.776,3933.55,-- of people under $5000.00.
1972.72-694,1,15071,byron_r_white,scotus_justice,3936.159,3943.72,"But your deduction -- your deduction or exemption, whatever you call it or credit, whatever you call it, does not go progressively down up to 24, does it?"
1972.72-694,1,15043,potter_stewart,scotus_justice,3943.72,3943.995,Yes.
1972.72-694,1,29612,jean_m_coon,,3943.995,3944.919,"Yes it does, goes progressively down."
1972.72-694,1,15071,byron_r_white,scotus_justice,3944.919,3946.963,Progressively down and then ends at 24?
1972.72-694,1,29612,jean_m_coon,,3946.963,3951.257,Yes.
1972.72-694,1,15141,william_h_rehnquist,scotus_justice,4231.813,4235.599,"Well that really doesn't answer your problem here though, does it?"
1972.72-694,1,29612,jean_m_coon,,4249.458,4251.53,"Yes, Your Honor, that's a correct statement."
1972.72-694,2,37810,porter_r_chandler,,4940.504,4943.564,"Mr. Chief Justice, may it please the Court."
1972.72-694,2,15140,william_j_brennan_jr,scotus_justice,5042.788,5044.76,I gather it cannot be a profit making school?
1972.72-694,2,37810,porter_r_chandler,,5044.76,5045.611,Can't be a what?
1972.72-694,2,15140,william_j_brennan_jr,scotus_justice,5045.611,5046.592,Profit making school?
1972.72-694,2,37810,porter_r_chandler,,5046.592,5054.917,"Can’t be a profit making, you are quite right, Your Honor, a non-profit school that comes with every requirements of the compulsory Education Law."
1972.72-694,2,15043,potter_stewart,scotus_justice,5163.871,5168.859,"That would be, as a matter of this fact, that would be largely the Puerto Rican community, would it?"
1972.72-694,2,37810,porter_r_chandler,,5168.859,5169.657,Largely Puerto Rican.
1972.72-694,2,15104,thurgood_marshall,scotus_justice,5403.723,5409.129,He of course recognized that he knew about that when he paid the money to the school?
1972.72-694,2,37810,porter_r_chandler,,5409.129,5410.568,He knew that the money was coming.
1972.72-694,2,15104,thurgood_marshall,scotus_justice,5410.568,5411.862,Yeah.
1972.72-694,2,37810,porter_r_chandler,,5413.363,5414.707,"Yes, that's right."
1972.72-694,2,15104,thurgood_marshall,scotus_justice,5414.707,5418.333,(Voice Overlap) argument but I think you ought to --
1972.72-694,2,37810,porter_r_chandler,,5418.333,5431.425,"Just as the parent, the parent who paid the bus company in Everson, he knew he was going to get it back but when he got it back, it was his money I think, Your Honor."
1972.72-694,2,15073,warren_e_burger,scotus_justice,5710.264,5716.182,Thank you Mr. Chandler.
1972.72-694,3,30804,john_f_haggerty,,5717.763,5722.449,Mr. Chief Justice and may it please the Court.
1972.72-694,3,15073,warren_e_burger,scotus_justice,5833.082,5843.264,"Of course, the people under $5,000 are not paying -- in New York City to the people under $5,000 five children pay any taxes to the State of New York?"
1972.72-694,3,30804,john_f_haggerty,,5843.264,5848.35,No they don’t but what I’m attempting to do is put into the total perspective of the educational aspect.
1972.72-694,3,15073,warren_e_burger,scotus_justice,5848.35,5849.755,They’re paying sales taxes.
1972.72-694,3,30804,john_f_haggerty,,5849.755,5857.89,"They are paying sales taxes, and they're paying if they own real properties, some type of real property tax."
1972.72-694,3,15043,potter_stewart,scotus_justice,6184.377,6188.365,"This comes to about 280 schools out of a total of around 2,000?"
1972.72-694,3,30804,john_f_haggerty,,6188.365,6194.843,"2,000 non public schools in the state and about 280 of the schools are benefited by Section 1."
1972.72-694,3,15043,potter_stewart,scotus_justice,6194.843,6196.589,Almost under 15%.
1972.72-694,3,30804,john_f_haggerty,,6196.589,6200.402,"Under 15, between -- about 12%."
1972.72-694,3,15140,william_j_brennan_jr,scotus_justice,6237.784,6248.346,"Well, I take it Mr. Haggerty if the heating system broke down under the statute, the entire heating system which also heats the chapel could be replaced, could it not?"
1972.72-694,3,30804,john_f_haggerty,,6248.346,6255.198,"The heating system could be replaced to the extent that it would fall within the definition of a secular, non-ideological (Voice Overlap)"
1972.72-694,3,15140,william_j_brennan_jr,scotus_justice,6255.198,6263.773,"Well I know, but you have a central heating system in the school and it collapses, and that has to be replaced and it heats every room including the chapel."
1972.72-694,3,30804,john_f_haggerty,,6263.773,6264.323,Yes.
1972.72-694,3,15140,william_j_brennan_jr,scotus_justice,6264.323,6267.041,"And under this statute, it could be replaced, could it not?"
1972.72-694,3,30804,john_f_haggerty,,6267.041,6273.938,It could be replaced but we have built into the statute what we consider a statistical requirement of neutrality and that is that --
1972.72-694,3,15140,william_j_brennan_jr,scotus_justice,6273.938,6277.558,"I know but, that was my question, it could be, it could be replaced, could it not?"
1972.72-694,3,30804,john_f_haggerty,,6277.558,6304.101,"It could be replaced, but our preposition in formulating the legislation was that we would never get to a position to where we would pay the total amount of the repair or replacement of the heating system because in no event can the cost reimbursed by the state be more than 50% of the comparable cost in the public sector and that we try to build in as a statistical degree of neutrality here."
1972.72-694,3,15140,william_j_brennan_jr,scotus_justice,6304.101,6313.258,"Well, my only point was, you may not be able to paint the chapel under this, but you can repair the heating system that heats the beside chapel, can't you?"
1972.72-694,3,30804,john_f_haggerty,,6313.258,6319.355,"That's correct, but our purpose was not that you could provide for the total cost of repairing the heating system."
1972.72-694,3,15073,warren_e_burger,scotus_justice,6319.355,6329.89,"But I suppose implicit in your answer is that in very few schools would the chapel exceed 50% of the total heated space, is that a reasonable assumption?"
1972.72-694,3,30804,john_f_haggerty,,6329.89,6335.36,That's correct.
1972.72-694,3,15104,thurgood_marshall,scotus_justice,6355.476,6360.074,(Inaudible)
1972.72-694,3,30804,john_f_haggerty,,6360.074,6363.468,"Hopefully, we won't have to do that."
1972.72-694,3,15073,warren_e_burger,scotus_justice,6527.967,6531.085,Thank you Mr. Haggerty.
1972.72-694,4,34959,leo_pfeffer,,6569.378,6575.529,I think it may even give a rise to a question on Establishment Clause as well.
1972.72-694,4,15073,warren_e_burger,scotus_justice,6575.529,6577.059,With Free Exercise --
1972.72-694,4,34959,leo_pfeffer,,6577.059,6597.966,Or even more than Free Exercise -- Free Exercise and Establishment because Establishment Clauses as it is defined by this Court in a number of cases equally forbids aid to religion and aid to anti-religion.
1972.72-694,4,15073,warren_e_burger,scotus_justice,6599.622,6605.136,"In my hypothetical, I wasn't assuming that they had a sign on the building that this is an anti-religious school."
1972.72-694,4,34959,leo_pfeffer,,6607.679,6607.812,Oh!
1972.72-694,4,15073,warren_e_burger,scotus_justice,6612.599,6615.858,Patronized by people who do not want their children (Voice Overlap)
1972.72-694,4,34959,leo_pfeffer,,6615.858,6616.02,Oh!
1972.72-694,4,15073,warren_e_burger,scotus_justice,6629.428,6631.613,Does that give you any equal protection problem in this respect?
1972.72-694,4,34959,leo_pfeffer,,6631.613,6664.384,"Well, I don't see, how it's – as a matter of fact this Court has all decided on the Nebraska case, the Nebraska case, that was the argument of the plaintiffs in the Nebraska case, that there was a violation of Equal protection because Nebraska, the case which I cited this morning, respect to a suit brought by parents of children attending private schools parochial schools, who claimed there was a violation of Free Exercise because the private schools were excluded/ The District Court unanimously rejected that this Court affirmed without any dissent."
1972.72-694,4,15141,william_h_rehnquist,scotus_justice,6830.026,6833.893,Well Mr. Pfeffer you say this is a tax credit.
1972.72-694,4,34959,leo_pfeffer,,6833.893,6834.05,Yes.
1972.72-694,4,15141,william_h_rehnquist,scotus_justice,6834.05,6840.213,Now how do you define a tax credit as opposed to a deduction or an exemption when you are using that term?
1972.72-694,4,34959,leo_pfeffer,,6840.213,6842.33,I do it in several ways.
1972.72-694,4,15141,william_h_rehnquist,scotus_justice,6886.511,6898.905,Then your definition of tax credit is a broader one than the one which would simply say a tax credit is an amount you subtract from the otherwise computed tax (Voice Overlap)
1972.72-694,4,34959,leo_pfeffer,,6898.905,6902.692,I would say that the First Amendment --
1972.72-694,4,15141,william_h_rehnquist,scotus_justice,6902.692,6904.459,"Well, will you answer my question?"
1972.72-694,4,34959,leo_pfeffer,,6904.459,6906.513,Yes.
1972.72-694,4,15141,william_h_rehnquist,scotus_justice,6914.566,6917.923,But then it is a broader definition than the one I just mentioned to you?
1972.72-694,4,34959,leo_pfeffer,,6917.923,6923.611,"It is a broader definition, yes indeed and indeed Mrs. Coon did conceded that."
1972.72-694,4,15104,thurgood_marshall,scotus_justice,6925.546,6942.58,(Inaudible)
1972.72-694,4,34959,leo_pfeffer,,6942.58,6946.698,I would deem that unconstitutional.
