file_name,section,speaker_id,speaker_name,speaker_role,start,stop,text
1974.73-5768,1,40447,robert_e_shepherd_jr,,2756.94,2761.626,Schneckloth is cited but it is not cited for that purpose.
1974.73-5768,1,15043,potter_stewart,scotus_justice,2761.626,2762.506,Brought a composition.
1974.73-5768,1,40447,robert_e_shepherd_jr,,2762.506,2764.044,Right.
1974.73-5768,1,15043,potter_stewart,scotus_justice,2764.044,2765.435,And you haven’t brief to that?
1974.73-5768,1,40447,robert_e_shepherd_jr,,2765.435,2766.399,"No, that’s correct."
1974.73-5768,1,15073,warren_e_burger,scotus_justice,2784.453,2786.777,Thank you Mr. Shepherd.
1974.73-5768,2,21087,daniel_c_kaufman,,2788.395,2790.676,"Yes I do, Mr. Chief Justice."
1974.73-5768,2,15141,william_h_rehnquist,scotus_justice,2847.314,2858.914,"Do you agree with Mr. Shepherd, Mr. Kaufman that those practices of the Supreme Court of Virginia is not to pass on an issue such as that if it wasn’t raised any differently than you raised it in the Circuit Court?"
1974.73-5768,2,21087,daniel_c_kaufman,,2858.914,2875.285,"Mr. Justice Rehnquist, I'm not that familiar with the practice of the Virginia Supreme Court to be aware of the rational for their decision but as Mr. Shepherd pointed out it was a decision and it has the effect of the decision on the merits."
1974.73-5768,2,15141,william_h_rehnquist,scotus_justice,2875.285,2885.016,Certainly not on the merits of a claim that prior decisions of the Court would hold couldn’t properly be raised in the absence of a suitable objection?
1974.73-5768,2,21087,daniel_c_kaufman,,2885.016,2897.033,I would tend to agree that that would certainly be an open question had the Commonwealth in opposing the petition called the Court’s attention to some defect in the objection but they did not.
1974.73-5768,2,15073,warren_e_burger,scotus_justice,2987.809,2988.977,Thank you Mr. Kaufman.
