file_name,section,speaker_id,speaker_name,speaker_role,start,stop,text
1977.76-1500,0,15073,warren_e_burger,scotus_justice,0.0,43.575,"We will hear arguments next in Number 1500, Massachusetts against the United States."
1977.76-1500,0,43157,terence_p_omalley,,47.752,50.589,Mr. Chief Justice and May it please the court.
1977.76-1500,1,16863,allan_a_ryan_jr,,1433.406,1436.853,"Mr. Chief Justice Burger, May it please the court."
1977.76-1500,1,15141,william_h_rehnquist,scotus_justice,1511.693,1525.44,"You say the helicopter uses the services made possible by Title 1 every time the helicopter lifts off the pad, do you disagree with your opponent's response to Mr. Justice Steven's question?"
1977.76-1500,1,16863,allan_a_ryan_jr,,1525.44,1527.641,"I do although, I think that --"
1977.76-1500,1,15060,john_paul_stevens,scotus_justice,1545.249,1552.586,"I am saying lawfully there is no legal limit on the take off from uncontrolled airport, you don't have to talk to anyone?"
1977.76-1500,1,16863,allan_a_ryan_jr,,1552.586,1554.652,Not in the taking off process I don't believe Mr. Justice.
1977.76-1500,1,15060,john_paul_stevens,scotus_justice,1554.652,1556.037,Neither in landing nor in flying.
