file_name,section,speaker_id,speaker_name,speaker_role,start,stop,text
1979.78-1870,1,15043,potter_stewart,scotus_justice,3487.146,3490.008,"Well, it could disrupt the whole plant, depending on the nature of his job."
1979.78-1870,1,45410,wade_h_mccree_jr,,3490.008,3490.752,It could.
1979.78-1870,1,15043,potter_stewart,scotus_justice,3492.611,3497.891,"I mean, if it were a matter of opening the door so the employees could come in, and he's afraid the ceiling would fall on him."
1979.78-1870,1,45410,wade_h_mccree_jr,,3497.891,3504.076,"And we think, of course, the two cases are distinguished -- I see my time is expired."
1979.78-1870,1,15073,warren_e_burger,scotus_justice,3505.851,3506.531,Thank you gentlemen.
