file_name,section,speaker_id,speaker_name,speaker_role,start,stop,text
1979.78-1918,2,36924,maryann_walsh,,3680.635,3687.053,That possibility is there anytime you have administrative action the possibility of it being non-pliable and no burden is there --
1979.78-1918,2,15060,john_paul_stevens,scotus_justice,3687.053,3692.444,"In this case, nor did the Court of Appeals find there was any question about finality."
1979.78-1918,2,15071,byron_r_white,scotus_justice,3692.444,3693.651,I would like to know what --
1979.78-1918,2,36924,maryann_walsh,,3693.651,3693.701,No -- right --
1979.78-1918,2,15071,byron_r_white,scotus_justice,3693.701,3701.77,"what this case you know of to holding finality in an order like this, the cases you cite aren't very close."
1979.78-1918,2,36924,maryann_walsh,,3701.77,3703.822,But on the basis of where our records --
1979.78-1918,2,15071,byron_r_white,scotus_justice,3703.822,3707.121,What kind of order as being a final order.
1979.78-1918,2,36924,maryann_walsh,,3707.121,3710.826,Do you mean as to the application of the regulations or this particular --
1979.78-1918,2,15071,byron_r_white,scotus_justice,3710.826,3713.735,"The letter of June 8, 1977."
1979.78-1918,2,36924,maryann_walsh,,3717.404,3731.195,It would seem to me that Camp v. Pitts where the record was based on a request for a determination by the Comptroller the determination was made on the exchange of correspondence would be the most similar.
1979.78-1918,2,15071,byron_r_white,scotus_justice,3731.195,3732.288,Camp v. Pitts.
1979.78-1918,2,36924,maryann_walsh,,3732.288,3732.662,Yes.
1979.78-1918,2,15043,potter_stewart,scotus_justice,3732.662,3737.129,"Well, this has been litigated --"
1979.78-1918,2,36924,maryann_walsh,,3737.129,3739.877,It is --
1979.78-1918,2,15043,potter_stewart,scotus_justice,3739.877,3743.254,"Since everybody agrees with it, you --"
1979.78-1918,2,36924,maryann_walsh,,3743.254,3745.758,"We are concerned with jurisdiction, which we believe is --"
1979.78-1918,2,15043,potter_stewart,scotus_justice,3745.758,3750.878,"Since it is jurisdiction, of course we have an independent duty to satisfy ourselves."
1979.78-1918,2,36924,maryann_walsh,,3750.878,3752.38,"Yes, Your Honor."
1979.78-1918,2,15073,warren_e_burger,scotus_justice,3754.954,3755.681,"Thank you, Ms. Walsh."
