file_name,section,speaker_id,speaker_name,speaker_role,start,stop,text
1981.80-1074,1,22659,e_richard_larson,,2642.361,2655.252,"--Because of our two different claims on standing, we believe that we are entitled to survive a motion to dismiss as the court of appeals held below on either theory of standing."
1981.80-1074,1,15071,byron_r_white,scotus_justice,2808.752,2824.312,"The LEAA determines there has been a non compliance, and you say thereupon there was triggered the duty to institute proceedings to terminate?"
1981.80-1074,1,22659,e_richard_larson,,2824.312,2825.078,"--Yes, Your Honor."
1981.80-1074,1,15071,byron_r_white,scotus_justice,2825.078,2830.666,"And you asked them to do that, and they say no, or they don't act, period."
1981.80-1074,1,22659,e_richard_larson,,2830.666,2834.868,"Well, after we filed the motion for preliminary injunction with regard to Philadelphia, they did so."
1981.80-1074,1,15071,byron_r_white,scotus_justice,2834.868,2845.207,"Yes, but I am just wondering, is there judicial review of this action?"
1981.80-1074,1,22659,e_richard_larson,,2849.059,2845.207,"No, there is not."
1981.80-1074,1,15071,byron_r_white,scotus_justice,2849.894,2857.314,"I know there is no particular provision for it, but wouldn't there be judicial review of it in the district court on an arbitrary and capricious standard?"
1981.80-1074,1,22659,e_richard_larson,,2857.314,2859.433,"No, not for an individual claimant."
1981.80-1074,1,15073,warren_e_burger,scotus_justice,3074.39,3075.69,Very well.
1981.80-1074,2,33830,kenneth_s_geller,,3078.642,3081.878,"Just a few things, Mr Chief Justice."
1981.80-1074,2,15071,byron_r_white,scotus_justice,3099.106,3100.541,In the district court?
1981.80-1074,2,33830,kenneth_s_geller,,3100.541,3102.041,They brought it in the district court.
1981.80-1074,2,15071,byron_r_white,scotus_justice,3109.211,3113.715,How do you get into court in such a case?
1981.80-1074,2,33830,kenneth_s_geller,,3113.715,3116.517,The Administrative Procedure Act was the cause of action.
1981.80-1074,2,15071,byron_r_white,scotus_justice,3116.517,3118.519,"But it doesn't give jurisdiction, does it?"
1981.80-1074,2,33830,kenneth_s_geller,,3118.519,3121.821,"No, jurisdiction would be under 28 USC 1331."
1981.80-1074,2,15073,warren_e_burger,scotus_justice,3247.969,3248.788,"Thank you, gentlemen."
