file_name,section,speaker_id,speaker_name,speaker_role,start,stop,text
1982.81-485,2,15092,sandra_day_oconnor,scotus_justice,3031.389,3031.639,"Yes, right."
1982.81-485,2,39761,rex_e_lee,,3031.639,3035.044,"--that is uniform, well accepted."
1982.81-485,2,15071,byron_r_white,scotus_justice,3035.044,3037.543,At the urging of the Service.
1982.81-485,2,39761,rex_e_lee,,3037.543,3038.715,"Oh, that's right."
1982.81-485,2,15071,byron_r_white,scotus_justice,3043.728,3045.65,This is an administrative interpretation.
1982.81-485,2,39761,rex_e_lee,,3045.65,3047.461,This is an administrative interpretation.
1982.81-485,2,15071,byron_r_white,scotus_justice,3047.461,3048.866,Validated by the Court.
1982.81-485,2,39761,rex_e_lee,,3048.866,3050.256,That is correct.
1982.81-485,2,15092,sandra_day_oconnor,scotus_justice,3126.225,3142.141,"Mr. Lee, it seems that you're arguing for a rather broad rule here and it concerns me a little bit, because normally somebody, for example, who takes property from a decedent gets a step up to fair market value."
1982.81-485,2,39761,rex_e_lee,,3164.194,3170.004,"I do not understand our position to be that this has anything to do with a stepped-up basis on estate taxes, estate tax cases."
1982.81-485,2,15092,sandra_day_oconnor,scotus_justice,3183.093,3192.512,"But your theory, if broadly followed, would lead to some surprising consequences for decedents' estates or donors of property."
1982.81-485,2,39761,rex_e_lee,,3192.512,3199.414,"--If it were applied to donors' property or decedents' estates, which so far as I know the Commissioner has never urged."
1982.81-485,2,15092,sandra_day_oconnor,scotus_justice,3199.414,3203.741,"Well, it's the foot in the door, I suppose."
1982.81-485,2,39761,rex_e_lee,,3206.084,3207.522,But let me tell you about--
1982.81-485,2,15045,harry_a_blackmun,scotus_justice,3207.522,3213.332,"General Lee, before you sit down... I notice the white light has gone on... somewhere would you comment on Nash?"
1982.81-485,2,39761,rex_e_lee,,3213.332,3213.957,--Yes.
1982.81-485,2,15060,john_paul_stevens,scotus_justice,3279.413,3289.567,"Before you leave Nash, isn't it true that at the time they set up the reserve for bad debts they assumed the corporation would continue in business for such time as would be necessary to see who paid their bills and who didn't?"
1982.81-485,2,39761,rex_e_lee,,3289.567,3297.718,"Yes, but I think the assumption, Justice Stevens, is not the assumption that the corporation would continue; the assumption is about the collectability of the debts."
1982.81-485,2,15060,john_paul_stevens,scotus_justice,3299.359,3304.138,"Well, but if you say that, the assumption here is about using the feed to feed the cattle, and presumably that's what they did with the feed."
1982.81-485,2,39761,rex_e_lee,,3304.138,3312.307,--I simply take a different view as to what the relevant assumption is.
1982.81-485,2,15071,byron_r_white,scotus_justice,3341.279,3342.341,What is the recovery?
1982.81-485,2,39761,rex_e_lee,,3342.341,3347.698,"The recovery is a recovery to the shareholders, who in turn own the bank."
1982.81-485,2,15140,william_j_brennan_jr,scotus_justice,3347.698,3356.242,But in Bliss I gather under your submission the recovery is not limited to the extent that the shareholders get a basis?
1982.81-485,2,39761,rex_e_lee,,3356.242,3357.414,"That is correct, that is correct."
1982.81-485,2,15140,william_j_brennan_jr,scotus_justice,3357.867,3358.586,You go beyond that.
1982.81-485,2,39761,rex_e_lee,,3358.586,3363.271,"That is correct, and that was precisely the rationale in Tennesee-Carolina."
1982.81-485,2,15140,william_j_brennan_jr,scotus_justice,3363.271,3369.706,"If it was so limited, Mr. Solicitor, would not that rather eliminate the double taxation problem?"
1982.81-485,2,39761,rex_e_lee,,3369.706,3374.579,"Well, that is not our preferred view of the case."
1982.81-485,2,15060,john_paul_stevens,scotus_justice,3374.579,3386.621,"Mr. Solicitor General, the recovery, you say, to the shareholders, who in turn own the bank, but your rule would be exactly the same if they had all sold their stock and you had an entirely different group of owners, because it would then go to former shareholders."
1982.81-485,2,39761,rex_e_lee,,3386.621,3387.121,That is correct.
1982.81-485,2,15060,john_paul_stevens,scotus_justice,3388.339,3390.995,There really isn't necessarily any recovery.
1982.81-485,2,39761,rex_e_lee,,3390.995,3394.274,"--Well, but what I'm saying is that you can find a recovery."
1982.81-485,2,15141,william_h_rehnquist,scotus_justice,3394.274,3396.726,If you try hard enough.
1982.81-485,2,39761,rex_e_lee,,3396.726,3398.085,If you try hard enough.
1982.81-485,2,15073,warren_e_burger,scotus_justice,3436.725,3441.957,"Mr. Stephens, let me put this question to you."
1982.81-485,3,28196,harvey_b_stephens,,3482.988,3498.06,"That $800,000 is taxable to the jewelry company in the year of recovery because, as Your Honor correctly points out and we believe is relevant, there was a recovery, an economic recovery by the company."
1982.81-485,3,15073,warren_e_burger,scotus_justice,3507.306,3509.071,Now let me change it a little bit.
1982.81-485,3,28196,harvey_b_stephens,,3523.191,3529.423,"Then that would be added to the income, because again, it would be a subsequent recovery."
1982.81-485,3,15071,byron_r_white,scotus_justice,3538.732,3547.259,Could the Service insist on amending the 82 return in the Chief Justice's example?
1982.81-485,3,28196,harvey_b_stephens,,3547.259,3555.053,The premise upon which the 82... wait a minute.
1982.81-485,3,15071,byron_r_white,scotus_justice,3557.41,3562.55,"No, the loss is in 82 and the recovery is the next year."
1982.81-485,3,28196,harvey_b_stephens,,3562.55,3564.08,Okay.
1982.81-485,3,15071,byron_r_white,scotus_justice,3569.297,3570.063,All right.
1982.81-485,3,28196,harvey_b_stephens,,3573.28,3574.218,No--
1982.81-485,3,15071,byron_r_white,scotus_justice,3574.218,3578.074,May the Service go back and recover it in the previous year or not?
1982.81-485,3,28196,harvey_b_stephens,,3578.074,3587.273,"--I would say that they could not, because the recovery occurred in 83, and remember, they were stolen."
1982.81-485,3,15071,byron_r_white,scotus_justice,3591.928,3592.944,There was a loss in that year.
1982.81-485,3,28196,harvey_b_stephens,,3592.944,3593.958,--And there was a loss.
1982.81-485,3,15071,byron_r_white,scotus_justice,3622.682,3626.851,"So you don't... you say the Service could not reopen the 82 return in the Chief Justice's example,--"
1982.81-485,3,28196,harvey_b_stephens,,3626.851,3630.24,"I believe under the procedures it could, but this is not the proper--"
1982.81-485,3,15071,byron_r_white,scotus_justice,3630.24,3640.939,"--But they would lose their case if they attempted to make anl assessment for 82 based on the recovery of the $800,000 in 83."
1982.81-485,3,28196,harvey_b_stephens,,3640.939,3656.042,"--Well, obviously, from an accounting point of view they would not lose the case, Your Honor, because if they show $1,800,000 deduction and an $800,000 recovery, they only have a million dollar loss."
1982.81-485,3,15073,warren_e_burger,scotus_justice,3656.042,3658.838,Let me tell you my hypothetical one step beyond.
1982.81-485,3,28196,harvey_b_stephens,,3682.938,3686.203,"Well, in that situation,--"
1982.81-485,3,15073,warren_e_burger,scotus_justice,3686.203,3691.903,"In other words, how is that different from the feed, except that you can't eat the diamonds."
1982.81-485,3,28196,harvey_b_stephens,,3691.903,3697.698,--You're saying you're distributing the diamonds.
1982.81-485,3,15073,warren_e_burger,scotus_justice,3706.084,3706.912,"No, I mean physically."
1982.81-485,3,28196,harvey_b_stephens,,3708.381,3709.083,Physically distributed the diamonds.
1982.81-485,3,15073,warren_e_burger,scotus_justice,3829.987,3832.721,"Thank you, gentlemen, the case is submitted."
