file_name,section,speaker_id,speaker_name,speaker_role,start,stop,text
1983.86_orig,1,15071,byron_r_white,scotus_justice,2506.852,2514.608,"Because when there's an avulsion, if you say, if the law is the line is fixed, then the river's running someplace else."
1983.86_orig,1,21078,david_c_kimmel,,2514.608,2515.691,"Yes, sir, that's correct."
1983.86_orig,1,15092,sandra_day_oconnor,scotus_justice,2528.516,2538.037,"Well, is there enough evidence that would permit the Master without taking any more to connect the live thalweg with the dead?"
1983.86_orig,1,21078,david_c_kimmel,,2538.037,2540.223,"No, Your Honor, there is not."
1983.86_orig,1,15092,sandra_day_oconnor,scotus_justice,2541.039,2552.131,There is only enough evidence to permit the drawing of the thalweg as of given dates in time within a range of the live thalweg?
1983.86_orig,1,21078,david_c_kimmel,,2552.131,2552.831,"Yes, Your Honor, that's correct."
1983.86_orig,1,15071,byron_r_white,scotus_justice,2560.987,2573.73,"The states must have had some experience with this in the past, on avulsions and accretions, and where the dead thalweg ends and the live thalweg begins."
1983.86_orig,1,21078,david_c_kimmel,,2578.098,2582.668,"It's not... Your Honor, it is not a new problem, especially for Louisiana."
1983.86_orig,1,15141,william_h_rehnquist,scotus_justice,2585.87,2589.072,Mr. Kimmel go ahead and finish your answer.
1983.86_orig,1,21078,david_c_kimmel,,2589.072,2594.726,--But it is not a new problem and the state is familiar with the dead thalweg issues.
1983.86_orig,1,15141,william_h_rehnquist,scotus_justice,2608.118,2617.323,"Well, Mr. Kimmel, does the concept of a discontinuous boundary, which apparently makes sense to my brother Justice White, make any sense to you?"
1983.86_orig,1,21078,david_c_kimmel,,2617.323,2626.864,"The only way it makes sense, Your Honor, is that in order... to connect to the 1964 thalweg is just not necessary."
1983.86_orig,1,15073,warren_e_burger,scotus_justice,2687.82,2691.89,"Do you have anything further, Mr. Palmer?"
1983.86_orig,2,32337,j_i_palmer_jr,,2691.89,2698.627,"Yes, Your Honor, several points that the Court very perceptively raised just a moment ago."
1983.86_orig,2,15071,byron_r_white,scotus_justice,2738.436,2747.624,But the connection between the live and the dead I would think in many occasions couldn't possibly be completely in the river.
1983.86_orig,2,32337,j_i_palmer_jr,,2747.624,2759.598,"Your Honor, the upper terminus of a dead thalweg is fixed at a point in time, generally, according to the rules of this Court, when there is no flow in that dead channel."
1983.86_orig,2,15071,byron_r_white,scotus_justice,2762.032,2762.634,Right.
1983.86_orig,2,32337,j_i_palmer_jr,,2762.634,2770.137,"Now, there is an accepted engineering technique for connecting that upper terminus to the migrating live terminus."
1983.86_orig,2,15071,byron_r_white,scotus_justice,2776.374,2776.974,Right.
1983.86_orig,2,32337,j_i_palmer_jr,,2776.974,2778.226,That was done here in this case.
1983.86_orig,2,15071,byron_r_white,scotus_justice,2780.178,2781.078,That's by your witness?
1983.86_orig,2,32337,j_i_palmer_jr,,2781.078,2782.778,--It was discussed by our witness.
1983.86_orig,2,15141,william_h_rehnquist,scotus_justice,2793.203,2806.061,"Unless you've got your dead thalweg in a concrete-lined canal, the point at which the live thalweg goes into the dead thalweg is going to migrate, too, is it not?"
1983.86_orig,2,32337,j_i_palmer_jr,,2806.061,2809.513,The point of connection between the live and the dead is going to be fixed.
1983.86_orig,2,15071,byron_r_white,scotus_justice,2816.583,2817.3,Yes.
1983.86_orig,2,32337,j_i_palmer_jr,,2817.3,2818.369,That's the way it's done.
1983.86_orig,2,15071,byron_r_white,scotus_justice,2818.369,2825.106,And so part of that perpendicular line is going to be... may very well be going over dry land.
1983.86_orig,2,32337,j_i_palmer_jr,,2825.106,2829.641,"It could, but that would be highly unlikely, Your Honor."
1983.86_orig,2,15060,john_paul_stevens,scotus_justice,2830.891,2832.241,May I ask you one question?
1983.86_orig,2,32337,j_i_palmer_jr,,2832.241,2833.008,"--Yes, Your Honor."
1983.86_orig,2,15060,john_paul_stevens,scotus_justice,2833.008,2835.544,"Your client, of course, was the Defendant in the case."
1983.86_orig,2,32337,j_i_palmer_jr,,2835.544,2836.894,I beg your pardon?
1983.86_orig,2,15060,john_paul_stevens,scotus_justice,2836.894,2840.179,"Your client, the State of Mississippi, was the Defendant in the case."
1983.86_orig,2,32337,j_i_palmer_jr,,2840.179,2840.696,"Yes, sir."
1983.86_orig,2,15060,john_paul_stevens,scotus_justice,2840.696,2845.733,"Did you file any kind of a counterclaim or prayer for any kind of relief, affirmative relief?"
1983.86_orig,2,32337,j_i_palmer_jr,,2845.733,2846.416,"We did not, Your Honor."
1983.86_orig,2,15060,john_paul_stevens,scotus_justice,2851.487,2855.889,Did your affirmative defenses pray for a declaration of the boundary?
1983.86_orig,2,32337,j_i_palmer_jr,,2855.889,2856.624,"Yes, sir."
1983.86_orig,2,15071,byron_r_white,scotus_justice,2921.15,2922.366,"Well, let me ask you."
1983.86_orig,2,32337,j_i_palmer_jr,,2947.801,2954.787,"That's correct, because by definition the terminus of the southern end would be the live thalweg."
1983.86_orig,2,15071,byron_r_white,scotus_justice,2954.787,2955.238,Exactly.
1983.86_orig,2,32337,j_i_palmer_jr,,2956.823,2957.573,"Yes, sir."
1983.86_orig,2,15071,byron_r_white,scotus_justice,2957.573,2968.547,And so you have... the boundary line would be traversing a section of the stream that wouldn't be in the live thalweg.
1983.86_orig,2,32337,j_i_palmer_jr,,2968.547,2975.285,"That's correct, and that's why, as was testified to at trial, the accepted technique is to draw the perpendicular line through the live thalweg."
1983.86_orig,2,15071,byron_r_white,scotus_justice,2975.285,2976.151,Perpendicular?
1983.86_orig,2,32337,j_i_palmer_jr,,2976.151,2977.987,Because on equitable principles--
1983.86_orig,2,15071,byron_r_white,scotus_justice,2977.987,2981.872,You mean just perpendicular to the banks there or east and west?
1983.86_orig,2,32337,j_i_palmer_jr,,2981.872,2983.474,--Perpendicular to the live thalweg.
1983.86_orig,2,15071,byron_r_white,scotus_justice,2983.474,2984.241,I see.
1983.86_orig,2,32337,j_i_palmer_jr,,2984.241,2985.774,As Mr. Smith testified--
1983.86_orig,2,15071,byron_r_white,scotus_justice,2985.774,2991.811,"So if the live thalweg happens to be running, at that point be running east and west, you draw it north and south?"
1983.86_orig,2,32337,j_i_palmer_jr,,2991.811,2996.548,"--It depends on where the upper end of the dead thalweg is, but you could, yes, sir."
1983.86_orig,2,15071,byron_r_white,scotus_justice,2996.548,2997.064,Okay.
1983.86_orig,2,32337,j_i_palmer_jr,,2997.064,3002.602,The point is that if you didn't draw it perpendicularly you would be unfairly favoring one state or the other.
1983.86_orig,2,15071,byron_r_white,scotus_justice,3002.602,3003.135,Yes.
1983.86_orig,2,32337,j_i_palmer_jr,,3003.135,3007.339,"The standard of review in this case, as the Court well knows, is de novo."
1983.86_orig,2,15073,warren_e_burger,scotus_justice,3007.339,3011.224,"Thank you, gentlemen."
