file_name,section,speaker_id,speaker_name,speaker_role,start,stop,text
1984.84-592,1,15071,byron_r_white,scotus_justice,2722.407,2725.369,And are there regulations issued with respect to this?
1984.84-592,1,15892,andrew_m_eschen,,2725.369,2727.8,"There are no formal regulations, Your Honor."
1984.84-592,1,15071,byron_r_white,scotus_justice,2735.765,2741.909,"Well, you'd never gather your... I'll say again, you would never gather your interpretation from what you can read in the--"
1984.84-592,1,15892,andrew_m_eschen,,2741.909,2743.502,"--I'm not disagreeing with you, Your Honor."
1984.84-592,1,15071,byron_r_white,scotus_justice,2749.025,2755.857,"--You didn't file a response to the... you didn't file a motion to dismiss to the jurisdictional state, did you?"
1984.84-592,1,15892,andrew_m_eschen,,2755.857,2760.111,"--That raises another complicated question, and that is--"
1984.84-592,1,15071,byron_r_white,scotus_justice,2760.111,2761.133,You waived it.
1984.84-592,1,15892,andrew_m_eschen,,2761.133,2768.797,"--We waived it because this case, Williams, was based upon the decision of the Vermont Supreme Court in Leverson."
1984.84-592,1,15071,byron_r_white,scotus_justice,2918.303,2932.475,"Anybody who is... any Vermont resident who is entitled to the credit, whatever that condition might be, doesn't pay for the use of the Vermont roads."
1984.84-592,1,15892,andrew_m_eschen,,2932.475,2934.385,"--Well, Your Honor, he does."
1984.84-592,1,15071,byron_r_white,scotus_justice,2934.385,2940.51,"Well, you mean because he's paid it to the other state and the state is a reciprocal state?"
1984.84-592,1,15892,andrew_m_eschen,,2940.51,2941.779,"That's correct, Your Honor."
1984.84-592,1,15071,byron_r_white,scotus_justice,2941.779,2943.652,"Well, it doesn't help him much."
1984.84-592,1,15892,andrew_m_eschen,,2949.516,2954.208,"Well, that's right, Your Honor, but there's a reason why Mr. Williams should not get the credit."
1984.84-592,1,15071,byron_r_white,scotus_justice,2967.266,2978.684,"Well, you're saying because of reciprocity, the Vermont resident who gets the credit is really paying for the use of the roads, of the Vermont roads, because he paid some money to New York."
1984.84-592,1,15892,andrew_m_eschen,,2978.684,2985.349,"--Because, for the same reasoning, the New Yorker who buys a car in Vermont and goes back to New York."
1984.84-592,1,15060,john_paul_stevens,scotus_justice,2987.77,2990.222,"So why doesn't that apply to him, too?"
1984.84-592,1,15892,andrew_m_eschen,,2990.222,2991.504,"Well, because, Your Honor--"
1984.84-592,1,15071,byron_r_white,scotus_justice,2991.504,2992.343,I don't follow that.
1984.84-592,1,15892,andrew_m_eschen,,2992.343,2999.217,"--Well, Your Honor, the Appellant purchased his car, presumably, while he was a resident of that state."
1984.84-592,1,15060,john_paul_stevens,scotus_justice,3006.073,3017.28,"Your other hypothetical, we have this woman who goes to New York and lives for a year and works for an advertising agency, wants to work there for a year in New York, but she doesn't have to pay the tax, if I understand your--"
1984.84-592,1,15892,andrew_m_eschen,,3017.28,3020.072,--She would if she registered the vehicle in New York.
1984.84-592,1,15060,john_paul_stevens,scotus_justice,3036.982,3040.665,"--This is based on... anyway, that's what you say the law is, although--"
1984.84-592,1,15892,andrew_m_eschen,,3040.665,3042.155,"That's correct, Your Honor."
1984.84-592,1,15060,john_paul_stevens,scotus_justice,3045.808,3051.601,"--Well, how are we supposed to resolve this question of what the law... should we certify a question to the Vermont Supreme Court and say did you really mean what you said?"
1984.84-592,1,15892,andrew_m_eschen,,3054.873,3058.055,"--Well, Your Honor, I--"
1984.84-592,1,15060,john_paul_stevens,scotus_justice,3058.055,3065.452,"I never have seen one like this before where the opinion is perfectly clear, and then the Attorney General of the state comes up and says the Supreme Court of the state didn't know what it was talking about."
1984.84-592,1,15892,andrew_m_eschen,,3065.452,3073.947,"--Well, Your Honor, the facts of the case were presented to the Vermont Supreme Court and the Vermont Supreme Court concluded that there was no discrimination."
1984.84-592,1,15060,john_paul_stevens,scotus_justice,3086.653,3087.785,To say the least.
1984.84-592,1,15892,andrew_m_eschen,,3087.785,3098.592,"But I submit that the decision has been made by the court, and that under Vermont law the Commissioner's interpretation has been accepted."
1984.84-592,1,15073,warren_e_burger,scotus_justice,3271.125,3274.078,"Do you have anything further, Mr. Williams?"
1984.84-592,2,37341,norman_charles_williams,,3274.078,3277.751,"--If the Court has no questions, I have nothing further."
1984.84-592,2,15073,warren_e_burger,scotus_justice,3277.751,3278.442,Very well.
