file_name,section,speaker_id,speaker_name,speaker_role,start,stop,text
1985.84-732,1,15071,byron_r_white,scotus_justice,3093.078,3101.67,"Prosecutors, you say, have sort of a derivative immunity; they're part of the judicial process?"
1985.84-732,1,26174,g_flint_taylor_jr,,3101.67,3103.95,That's the major--
1985.84-732,1,15071,byron_r_white,scotus_justice,3103.95,3113.398,"And you don't ask them how detached the prosecutor is, do you?"
1985.84-732,1,26174,g_flint_taylor_jr,,3113.398,3113.805,"--No, you don't."
1985.84-732,1,15071,byron_r_white,scotus_justice,3113.805,3119.349,And you don't ask... in Butz was there also a charging party involved there?
1985.84-732,1,26174,g_flint_taylor_jr,,3119.349,3120.318,"Yes, there was."
1985.84-732,1,15071,byron_r_white,scotus_justice,3120.318,3121.302,Absolute immunity?
1985.84-732,1,26174,g_flint_taylor_jr,,3121.302,3122.644,"Yes, there was."
1985.84-732,1,15071,byron_r_white,scotus_justice,3122.644,3123.441,Employed by the agency?
1985.84-732,1,26174,g_flint_taylor_jr,,3123.441,3125.284,"Yes, because it was linked--"
1985.84-732,1,15071,byron_r_white,scotus_justice,3125.284,3126.659,"Not very independent, or not?"
1985.84-732,1,26174,g_flint_taylor_jr,,3126.659,3128.877,--He wasn't a judge.
1985.84-732,1,15071,byron_r_white,scotus_justice,3132.844,3137.67,"So, there are other things, other than immunity; other things other than independence?"
1985.84-732,1,26174,g_flint_taylor_jr,,3137.67,3144.606,"Yes, the procedural safeguards, the availability of review... oh, another important one is the use of precedent in the decision."
1985.84-732,1,15092,sandra_day_oconnor,scotus_justice,3162.52,3174.843,"Does the historical immunity and practice enter into the calculation, if at common law the prosecutor was absolutely immune?"
1985.84-732,1,26174,g_flint_taylor_jr,,3178.357,3179.919,It's definitely an important factor.
1985.84-732,1,15092,sandra_day_oconnor,scotus_justice,3191.227,3197.444,Have you found any historical immunity in the context of this case in the prison--
1985.84-732,1,26174,g_flint_taylor_jr,,3197.444,3198.864,None.
1985.84-732,1,15071,byron_r_white,scotus_justice,3218.481,3224.979,--Would you say that guards who testify at one of these hearings are... just have qualified immunity?
1985.84-732,1,26174,g_flint_taylor_jr,,3224.979,3225.479,"Yes, I--"
1985.84-732,1,15071,byron_r_white,scotus_justice,3225.479,3228.649,And they wouldn't enjoy witnesses' immunity?
1985.84-732,1,26174,g_flint_taylor_jr,,3228.649,3229.024,--No.
1985.84-732,1,15141,william_h_rehnquist,scotus_justice,3331.763,3343.65,"I understood the Government's point to be not so much the flood of litigation, but the impact on the decision making process in the prison, that the close calls would go for the inmate because of fear of suit."
1985.84-732,1,26174,g_flint_taylor_jr,,3343.65,3359.486,"--Yes, I think that's an untenable position, Your Honor, in the sense that if you're starting out with someone who's independent, who's in the middle, if you've got three forces, you've got a prosecutor, you've got a defendant, you've got a judge and you can see that in all the kinds of situations that get the immunity."
1985.84-732,1,15071,byron_r_white,scotus_justice,3380.916,3388.615,"Your answer is, yes, that would be the result and it's the result that should take place, namely that more cases would be decided for the prisoner?"
1985.84-732,1,26174,g_flint_taylor_jr,,3388.615,3390.302,"--Well, I--"
1985.84-732,1,15071,byron_r_white,scotus_justice,3390.302,3392.614,That's the result and that's exactly what you intend?
1985.84-732,1,26174,g_flint_taylor_jr,,3392.614,3397.159,--The result that I intend is that it be deterrence from unconstitutional conduct.
1985.84-732,1,15071,byron_r_white,scotus_justice,3397.159,3399.986,That just puts it another way.
1985.84-732,1,26174,g_flint_taylor_jr,,3399.986,3411.856,"Yes, and I think that what I'm saying is that in this circumstance, yes, when you look at the other side, the flip side of the coin of deterrence, I suppose is the Government's argument of harassment."
1985.84-732,1,15071,byron_r_white,scotus_justice,3460.93,3467.334,What was the grounds in the administrative appeal for setting aside this--
1985.84-732,1,26174,g_flint_taylor_jr,,3467.334,3470.613,"--Well, that was a debate in the--"
1985.84-732,1,15071,byron_r_white,scotus_justice,3470.613,3472.082,--Or did they write something?
1985.84-732,1,26174,g_flint_taylor_jr,,3472.754,3478.08,"--Well, at the trial Warden Benson testified."
1985.84-732,1,15071,byron_r_white,scotus_justice,3478.08,3478.658,--The administrative--
1985.84-732,1,26174,g_flint_taylor_jr,,3478.658,3481.484,The administrative paper itself.
1985.84-732,1,15071,byron_r_white,scotus_justice,3481.484,3481.922,--Yes.
1985.84-732,1,26174,g_flint_taylor_jr,,3483.093,3486.857,"The reason, I think, that they gave was that due process was violated."
1985.84-732,1,15071,byron_r_white,scotus_justice,3486.857,3488.308,"In what respect, did they say?"
1985.84-732,1,26174,g_flint_taylor_jr,,3488.308,3494.291,I can't swear to whether they said because they brought those new charges in the middle of the hearing.
1985.84-732,1,15071,byron_r_white,scotus_justice,3494.291,3496.416,How did he testify at the--
1985.84-732,1,26174,g_flint_taylor_jr,,3496.416,3506.864,"At trial, what I was trying to establish through the regulations was that he... that they expunged because he was innocent, because the regulations said that's the only way you can do it."
1985.84-732,1,15071,byron_r_white,scotus_justice,3521.765,3525.17,"--So, what did you claim in that trial, what the due process violation was?"
1985.84-732,1,26174,g_flint_taylor_jr,,3525.17,3539.554,"The due process violations that we claimed were the fact that during the hearing itself they brought two new charges which did not conform to the evidence, did not give him any notice of them, and proceeded to try him on it and convict him of it right there on the spot."
1985.84-732,1,15071,byron_r_white,scotus_justice,3539.554,3540.695,And is that what the jury found?
1985.84-732,1,26174,g_flint_taylor_jr,,3540.695,3541.085,Yes.
1985.84-732,1,15071,byron_r_white,scotus_justice,3553.783,3556.656,They just said due process?
1985.84-732,1,26174,g_flint_taylor_jr,,3556.656,3563.826,"--They said due process, period, but they were instructed on the Wolff standards that were clearly established as of the time of this trial."
1985.84-732,1,15071,byron_r_white,scotus_justice,3577.132,3582.926,But there has never been a determination that what he was charged with he didn't do?
1985.84-732,1,26174,g_flint_taylor_jr,,3582.926,3586.644,"No, that would be the Carey versus Piphus question."
1985.84-732,1,15071,byron_r_white,scotus_justice,3591.673,3593.595,"I wouldn't think they would have, yes."
1985.84-732,1,26174,g_flint_taylor_jr,,3593.595,3604.903,"And it was... the evidence was so clear, Your Honor, that in fact what he was doing, and if you read the record of the proceeding, that's all they're concerned about is his First Amendment rights."
1985.84-732,1,15071,byron_r_white,scotus_justice,3604.903,3617.648,Do you claim... do you think that the jury should have been authorized to give this amount of damages without a finding that the defendant or the prisoner didn't do what he was charged with?
1985.84-732,1,26174,g_flint_taylor_jr,,3617.648,3621.677,"Well, that's a good question, because the Government raised that on an NOV."
1985.84-732,1,15071,byron_r_white,scotus_justice,3621.677,3622.474,Then what happened?
1985.84-732,1,26174,g_flint_taylor_jr,,3622.474,3631.923,The judge looked at the evidence and said that the evidence of damage was such that it supported the verdict whichever way you looked at it.
1985.84-732,1,15071,byron_r_white,scotus_justice,3631.923,3633.703,And the Government didn't appeal it?
1985.84-732,1,26174,g_flint_taylor_jr,,3633.703,3636.295,"No, it didn't take it to the circuit or, of course, to this Court."
1985.84-732,1,15073,warren_e_burger,scotus_justice,3636.999,3638.546,Very well.
