file_name,section,speaker_id,speaker_name,speaker_role,start,stop,text
1986.85-2068,2,34255,lloyd_n_cutler,,2681.1,2683.647,"--Well, there's no question that--"
1986.85-2068,2,15071,byron_r_white,scotus_justice,2683.647,2683.912,Isn't that right?
1986.85-2068,2,34255,lloyd_n_cutler,,2683.912,2684.49,--That is right.
1986.85-2068,2,15071,byron_r_white,scotus_justice,2693.519,2695.222,Protected her from being fired?
1986.85-2068,2,34255,lloyd_n_cutler,,2695.222,2700.735,"--That gets us to the Pickering/Connick balancing test, I think."
1986.85-2068,2,15104,thurgood_marshall,scotus_justice,2700.735,2707.279,"We don't have to go that far, that she intended to kill the President?"
1986.85-2068,2,34255,lloyd_n_cutler,,2707.279,2717.542,"I don't believe you have to... I think it is clear this was political hyperbole, and you are obliged, I think, to examine it yourself."
1986.85-2068,2,15141,william_h_rehnquist,scotus_justice,2805.555,2807.445,Do you think Watts is still good law?
1986.85-2068,2,34255,lloyd_n_cutler,,2807.445,2810.866,"I would hope Watts is still good law, Justice."
1986.85-2068,2,15049,antonin_scalia,scotus_justice,2873.107,2874.997,"Well, it wasn't really private."
1986.85-2068,2,34255,lloyd_n_cutler,,2878.668,2881.838,It happened to get overheard by one person; that's quite right.
1986.85-2068,2,15049,antonin_scalia,scotus_justice,2881.838,2886.103,"--By Captain LeVrier, who was offended by it, and it might have offended other co-workers."
1986.85-2068,2,34255,lloyd_n_cutler,,2888.008,2899.177,"That's what I... I believe I'll show in a moment, Justice Scalia, she was not fired on the ground that it offended anyone else, or that it affected discipline or morale in the office."
1986.85-2068,2,15049,antonin_scalia,scotus_justice,3014.028,3027.241,"--Well, if you rely on that, then you are conceding that she reaffirmed in the discussion with Rankin, not only that she had said it, but that she meant it, because that's what that testimony refers to?"
1986.85-2068,2,34255,lloyd_n_cutler,,3028.927,3039.033,"What the District Court found is by word or deed... The District Court never found, as I think Justice O'Connor pointed out earlier, that she said, ""Yes, I meant it""."
1986.85-2068,2,15049,antonin_scalia,scotus_justice,3039.033,3039.33,No.
1986.85-2068,2,34255,lloyd_n_cutler,,3042.111,3042.58,That's his testimony.
1986.85-2068,2,15049,antonin_scalia,scotus_justice,3042.58,3043.142,--That's his testimony.
1986.85-2068,2,34255,lloyd_n_cutler,,3043.142,3043.626,That's right.
1986.85-2068,2,15049,antonin_scalia,scotus_justice,3043.626,3046.282,"If you rely on it, you have to accept it for the good and the bad."
1986.85-2068,2,34255,lloyd_n_cutler,,3046.282,3050.234,"I rely on it to... Well, the District Court made its findings."
1986.85-2068,2,15092,sandra_day_oconnor,scotus_justice,3107.479,3112.29,"Mr. Cutler, this was a probationary employee."
1986.85-2068,2,34255,lloyd_n_cutler,,3158.584,3175.391,"Well, to begin with, Perry against Sindermann holds even for employees lacking tenure... I believe that's a teacher's case... that there is an economic expectation even for probationary employees."
1986.85-2068,2,15092,sandra_day_oconnor,scotus_justice,3205.363,3220.201,"My question is whether speech on a matter of public concern can evidence character traits of the employee that would justify the employer from saying,"
1986.85-2068,2,34255,lloyd_n_cutler,,3226.572,3250.016,"--I would say, Justice O'Connor, that it is a very dangerous power to grant just on the distinction between the probationary employee and the employee or this person, let us say, a month later after her probationary status was over."
1986.85-2068,2,15092,sandra_day_oconnor,scotus_justice,3324.16,3343.246,"Can they be fired because they exhibit character traits and an inability to reason adequately to serve in the job of public employment, even though that judgment is made in part by speech that could be protected?"
1986.85-2068,2,34255,lloyd_n_cutler,,3343.246,3354.383,"If it is made on the basis of their suitability to hold the particular job that they are doing, I would say yes."
1986.85-2068,2,15049,antonin_scalia,scotus_justice,3376.342,3381.652,"What about a secretary in the clerk's office out here who, you know, says that?"
1986.85-2068,2,34255,lloyd_n_cutler,,3383.902,3392.149,"--Well, I would think you would at least deliberate, Justice Scalia, and learn the full text of the conversation and have something, for example, in the area--"
1986.85-2068,2,15049,antonin_scalia,scotus_justice,3392.149,3393.774,"If it comes up in the same kind of a conversation, do you think that--"
1986.85-2068,2,34255,lloyd_n_cutler,,3393.774,3405.675,"--It may very well be that this Court is a place of confidential... it certainly is a confidential place which takes you out of this line of cases, and you might be free to do it there."
1986.85-2068,2,15071,byron_r_white,scotus_justice,3410.877,3412.501,"--Well, Mr. Cutler--"
1986.85-2068,2,34255,lloyd_n_cutler,,3412.501,3414.187,Suppose the janitor in the court had said it.
1986.85-2068,2,15071,byron_r_white,scotus_justice,3414.187,3428.136,"--This lady was on probation, but if she were hired permanently, wouldn't sooner or later she perform the other duties of a deputy constable, like serving process and--"
1986.85-2068,2,34255,lloyd_n_cutler,,3428.136,3429.04,I doubt it very much.
1986.85-2068,2,15049,antonin_scalia,scotus_justice,3583.247,3587.34,"--Most of those cases involve criminal sanctions, however, rather than--"
1986.85-2068,2,34255,lloyd_n_cutler,,3587.34,3587.73,Some.
1986.85-2068,2,15049,antonin_scalia,scotus_justice,3587.73,3590.964,--what kind of employees a public employer must retain.
1986.85-2068,2,34255,lloyd_n_cutler,,3590.964,3601.445,"Some, like American Communications Workers against Dowd, just involve simply loss of a union position and nothing more."
1986.85-2068,2,15141,william_h_rehnquist,scotus_justice,3604.6,3606.272,That was upheld in Dowd.
1986.85-2068,2,34255,lloyd_n_cutler,,3606.272,3608.631,--It was upheld over Justice Jackson's dissent.
1986.85-2068,2,15141,william_h_rehnquist,scotus_justice,3630.56,3632.45,"Your time has expired, Mr. Cutler."
