file_name,section,speaker_id,speaker_name,speaker_role,start,stop,text
1986.86-381,0,15141,william_h_rehnquist,scotus_justice,0.0,12.491,"Mr. Jibson, you may proceed whenever--"
1986.86-381,0,31170,j_robert_jibson,,12.491,16.926,"Mr. Chief Justice, and may it please the Court:"
1986.86-381,1,21397,dennis_p_riordan,,1682.713,1686.515,Mr. Chief Justice and may it please the Court:
1986.86-381,2,31170,j_robert_jibson,,3505.543,3507.426,I'd just like to make a couple of points.
1986.86-381,2,15141,william_h_rehnquist,scotus_justice,3611.879,3612.795,"Thank you, Mr. Jibson."
