file_name,section,speaker_id,speaker_name,speaker_role,start,stop,text
1987.86-787,1,15060,john_paul_stevens,scotus_justice,2808.477,2812.961,"--Yes, they are because the defendant here carries the key to the prison--"
1987.86-787,1,40430,richard_lynn_schwartzberg,,2812.961,2816.162,And so does every other criminal defendant in California.
1987.86-787,1,15060,john_paul_stevens,scotus_justice,2830.813,2832.499,"--Yes, but it could also say,"
1987.86-787,1,40430,richard_lynn_schwartzberg,,2835.388,2837.498,And so can they under the civil contempt statute.
1987.86-787,1,15060,john_paul_stevens,scotus_justice,2850.163,2855.833,"But if he does that, then I think everyone would agree that is the equivalent of a criminal procedure."
1987.86-787,1,40430,richard_lynn_schwartzberg,,2855.833,2862.55,But we don't define whether a matter is criminal after we find out what the sentencing is when the state has already said that it is criminal.
1987.86-787,1,15071,byron_r_white,scotus_justice,2864.876,2880.074,"Could I ask you, Mr. Schwartzberg, if we disagree with you and say that California's notion about whether this law is criminal or civil doesn't bind us and we decide that we will treat it as civil, do you lose?"
1987.86-787,1,40430,richard_lynn_schwartzberg,,2880.074,2881.199,Yes.
1987.86-787,1,15071,byron_r_white,scotus_justice,2881.199,2882.166,Why?
1987.86-787,1,40430,richard_lynn_schwartzberg,,2882.166,2899.816,"I lose because I would concede that under Rylander and Usury that the inferences, the burden shifting that this statute accomplishes do not offend the Fifth Amendment in civil matters."
1987.86-787,1,15071,byron_r_white,scotus_justice,2903.392,2904.346,Yes.
1987.86-787,1,40430,richard_lynn_schwartzberg,,2904.549,2908.157,Let me go a little bit further here and indicate to the Court this.
1987.86-787,1,15071,byron_r_white,scotus_justice,2973.131,2984.813,"Well, yes, but the Court of Appeal didn't give short shrift to the notion that this is the kind of a proceeding in which shifting the burden of persuasion is unconstitutional."
1987.86-787,1,40430,richard_lynn_schwartzberg,,2984.813,2998.387,"--No, because they knew from the outset that they were dealing with a crime in California, and once they had that as a predicate, then the only other question that they had to resolve was whether the wording of 1209.5 offended the Fifth Amendment, and they didn't have any trouble reaching that conclusion either."
1987.86-787,1,15071,byron_r_white,scotus_justice,3006.086,3018.472,You seem to be arguing that we just aren't entitled at all to ask whether or not this is close enough to a crime to trigger these protections.
1987.86-787,1,40430,richard_lynn_schwartzberg,,3018.472,3023.314,"I would be fearful to use the word entitled, but I would hope to argue to the Court--"
1987.86-787,1,15071,byron_r_white,scotus_justice,3023.314,3023.923,Don't be fearful.
1987.86-787,1,40430,richard_lynn_schwartzberg,,3023.923,3030.311,"--I would hope to argue to the Court that, yes, the answer is is that this case is very similar in some respects to Runi."
1987.86-787,1,15060,john_paul_stevens,scotus_justice,3101.579,3107.545,So the example would have to be they made it a felony but they way the only remedy for committing this felony is an injunction or a cease and desist order.
1987.86-787,1,40430,richard_lynn_schwartzberg,,3110.216,3111.652,I don't know.
1987.86-787,1,15060,john_paul_stevens,scotus_justice,3134.972,3138.626,But I think you have agreed that California could solve this problem.
1987.86-787,1,40430,richard_lynn_schwartzberg,,3146.249,3148.265,"Justice Stevens, they did, and they got one vote."
1987.86-787,1,15060,john_paul_stevens,scotus_justice,3166.024,3178.034,"If that is true and they want to keep this burden of proof, they can, no matter what we decide, they can say as a matter of California law we are still going to require that the burden of proof on this issue be placed on the other party."
1987.86-787,1,40430,richard_lynn_schwartzberg,,3178.034,3182.095,"I don't think they can do that as long as the Fifth Amendment exists, but I think what they can't do--"
1987.86-787,1,15060,john_paul_stevens,scotus_justice,3182.095,3184.907,"No, no, no, I mean they could take your position, which you say they have now."
1987.86-787,1,40430,richard_lynn_schwartzberg,,3184.907,3185.673,--They don't need to.
1987.86-787,1,15060,john_paul_stevens,scotus_justice,3190.483,3199.557,"What I am suggesting is, if you should lose this case in this Court on the federal theory, they could still, as you say as a matter of California policy this is the result they want, they could easily--"
1987.86-787,1,40430,richard_lynn_schwartzberg,,3199.557,3200.682,"--No question, Your Honor."
1987.86-787,1,15071,byron_r_white,scotus_justice,3202.979,3204.962,--You have your own Fifth Amendment.
1987.86-787,1,40430,richard_lynn_schwartzberg,,3204.962,3210.709,"--Well, we do, but I think that our courts are going to be less inclined to utilize it in the near future."
1987.86-787,1,15071,byron_r_white,scotus_justice,3210.709,3213.068,You can't apply it differently?
1987.86-787,1,40430,richard_lynn_schwartzberg,,3213.068,3214.287,"No, I don't think that."
1987.86-787,1,15049,antonin_scalia,scotus_justice,3221.517,3225.453,"Mr. Schwartzberg, what about this as a way of out of your semantical box."
1987.86-787,1,40430,richard_lynn_schwartzberg,,3253.209,3254.551,And I would suggest that does not happen in this case.
1987.86-787,1,15049,antonin_scalia,scotus_justice,3254.551,3255.035,That is right.
1987.86-787,1,40430,richard_lynn_schwartzberg,,3255.035,3256.831,Absolutely.
1987.86-787,1,15049,antonin_scalia,scotus_justice,3256.831,3259.799,"What is here is, you are going to jail for not having paid previously."
1987.86-787,1,40430,richard_lynn_schwartzberg,,3259.799,3260.081,Correct.
1987.86-787,1,15049,antonin_scalia,scotus_justice,3260.081,3266.421,"And that, if you call that coercive, then every criminal penalty is coercive."
1987.86-787,1,40430,richard_lynn_schwartzberg,,3273.809,3274.481,There is no question.
1987.86-787,1,15049,antonin_scalia,scotus_justice,3275.417,3276.886,That couldn't be what we mean by coercive.
1987.86-787,1,40430,richard_lynn_schwartzberg,,3276.886,3296.972,"--The only concern I have is that I think that petitioner is going to argue to this Court two minutes is that merely facing that jail sentence is going to scare these people into paying their money, and that is what makes it coercive, but the same argument is true that that is supposed to stop crime, because if we know we might go to jail if we are caught, somehow crime won't occur and we know that that is baloney so it is not--"
1987.86-787,1,15049,antonin_scalia,scotus_justice,3296.972,3298.222,Why don't you make that argument to us?
1987.86-787,1,40430,richard_lynn_schwartzberg,,3299.439,3307.326,"--Well, I haven't made it because of the difficulty in grappling with how the California courts go back and forth between the definition of what is a civil versus criminal contempt."
1987.86-787,1,15049,antonin_scalia,scotus_justice,3308.247,3310.559,Do most of these proceedings arise in the fashion that this one is--
1987.86-787,1,40430,richard_lynn_schwartzberg,,3310.559,3311.418,Yes.
1987.86-787,1,15049,antonin_scalia,scotus_justice,3311.418,3315.229,"--that is, the defendant has said you haven't made payments in the past and therefore go to jail?"
1987.86-787,1,40430,richard_lynn_schwartzberg,,3321.524,3336.986,"I would venture to say that most judges attempt the rod before they put them in jail, and the answer is, yes, most defendants are placed on probation just as I would venture to say that most criminal defendants in the traditional criminal sense are placed on probation for first and second, maybe sometimes--"
1987.86-787,1,15071,byron_r_white,scotus_justice,3336.986,3344.921,"But if a judge says, you haven't paid, therefore you got jail, and he goes to jail, if he then comes up with his past payments, he gets out."
1987.86-787,1,40430,richard_lynn_schwartzberg,,3344.921,3346.389,"--No, not in California."
1987.86-787,1,15071,byron_r_white,scotus_justice,3346.764,3347.248,That is it.
1987.86-787,1,40430,richard_lynn_schwartzberg,,3347.248,3347.748,You just do your time.
1987.86-787,1,15071,byron_r_white,scotus_justice,3347.748,3348.279,That's the difference.
1987.86-787,1,40430,richard_lynn_schwartzberg,,3348.279,3348.92,You do your time.
1987.86-787,1,15141,william_h_rehnquist,scotus_justice,3386.638,3387.669,"Thank you, Mr. Schwartzberg."
1987.86-787,2,35577,michael_r_capizzi,,3389.653,3406.818,"Mr. Chief Justice, if it may please the Court, if there was such a defendant in jail and he did have the money, we would be so willing and happy to take that money for the children it is undoubtedly--"
1987.86-787,2,15071,byron_r_white,scotus_justice,3406.818,3409.129,"Yes, but how about the judge?"
1987.86-787,2,35577,michael_r_capizzi,,3409.129,3409.754,--I think the judge would--
1987.86-787,2,15071,byron_r_white,scotus_justice,3409.754,3416.251,"If he puts him in jail for not having paid for a term, he may not let him out just because he comes up with the money."
1987.86-787,2,35577,michael_r_capizzi,,3416.251,3428.247,"--Where it is the coercive element that is trying to be utilized, and the entire thrust of these proceedings is to coerce payment, to get the payment for that child, and it is only as a last resort that the jail--"
1987.86-787,2,15092,sandra_day_oconnor,scotus_justice,3428.247,3438.742,"Well, Mr. Capizzi, is it true as your opponent says, that in California the jail is imposed only as punishment, not as future coercion?"
1987.86-787,2,35577,michael_r_capizzi,,3438.742,3440.663,"--No, that is absolutely incorrect, and--"
1987.86-787,2,15092,sandra_day_oconnor,scotus_justice,3440.663,3443.661,So he is wrong as a matter of California law?
1987.86-787,2,35577,michael_r_capizzi,,3443.661,3448.129,"--He is wrong, and I think the judgment of the Court in this case indicated that he is wrong."
1987.86-787,2,15049,antonin_scalia,scotus_justice,3460.295,3469.48,"The sentence itself, before its suspension, which is what we are arguing about, the sentence itself was a sentence or having failed to make past payments."
1987.86-787,2,35577,michael_r_capizzi,,3487.239,3487.94,Absolutely.
1987.86-787,2,15049,antonin_scalia,scotus_justice,3491.627,3493.143,I am talking about the original sentence.
1987.86-787,2,35577,michael_r_capizzi,,3495.844,3511.353,"--But the sentence was suspended because Mr. Feiock didn't have the wherewithal to pay the $1,650 at the time he was given a payment schedule and told to reduce the arrearage at the rate of $50 per month."
1987.86-787,2,15141,william_h_rehnquist,scotus_justice,3590.992,3592.726,"Your time has expired, Mr. Capizzi."
