file_name,section,speaker_id,speaker_name,speaker_role,start,stop,text
1987.86-836,1,34398,leslie_d_edwards,,2532.461,2544.999,"That they reached up and got someone who was not part of the editorial function who was not skilled in journalism or experienced, and did it for a reason other than journalistic standards or editorial discretion."
1987.86-836,1,15060,john_paul_stevens,scotus_justice,2544.999,2558.589,"Well, say he decided journalistic standards, this article does not show the degree of maturity that we think that it ought to show to have the school name on it and all of the rest, there is some misspelling in it and some bad grammar, a mixture of reasons, that is not enough?"
1987.86-836,1,34398,leslie_d_edwards,,2558.589,2560.5,"The advisor, that he could do that?"
1987.86-836,1,15060,john_paul_stevens,scotus_justice,2560.5,2563.973,"If the advisor can do it, I do not understand why the principal cannot."
1987.86-836,1,34398,leslie_d_edwards,,2563.973,2573.858,Because the advisor is part of what has been delegated by the school to be the training and practicing of student expression.
1987.86-836,1,15060,john_paul_stevens,scotus_justice,2573.858,2577.1,It seems to me what you are saying is if you are going to have censors that they have to be good censors.
1987.86-836,1,34398,leslie_d_edwards,,2577.1,2582.863,"No, I think that they have to be journalistically involved, so the motivation of the school is good journalism and not a viewpoint."
1987.86-836,1,15049,antonin_scalia,scotus_justice,2582.863,2591.279,It is a constitutional line whether you are violating the Constitution depends on whether you have a good journalist involved or not in the censorship?
1987.86-836,1,34398,leslie_d_edwards,,2591.279,2597.193,The constitutional line comes with whether student expression is protected or not.
1987.86-836,1,15071,byron_r_white,scotus_justice,2616.967,2633.898,"Well, I would think that you would say that the principal not being acquainted with journalism could not order this piece deleted even it had inflammatory matters in it."
1987.86-836,1,34398,leslie_d_edwards,,2633.898,2636.489,I think that is because of Tinker.
1987.86-836,1,15071,byron_r_white,scotus_justice,2642.002,2648.958,"Here is this principal who is not the advisor, and he is telling them to take it out."
1987.86-836,1,34398,leslie_d_edwards,,2648.958,2651.269,I think that he could do that.
1987.86-836,1,15071,byron_r_white,scotus_justice,2655.442,2668.409,"But he could not say well, I think this article ought to be taken out because it involves some parents who really ought to have a chance to say their piece before anything is published like that, he could not say that?"
1987.86-836,1,34398,leslie_d_edwards,,2668.409,2669.05,No.
1987.86-836,1,15049,antonin_scalia,scotus_justice,2669.05,2684.931,"Does not any newspaper have somebody who makes a judgment as to whether what is published in the newspaper will offend the community, I assume that any newspaper does not try to publish stuff that is offensive?"
1987.86-836,1,34398,leslie_d_edwards,,2684.931,2685.921,Sure.
1987.86-836,1,15049,antonin_scalia,scotus_justice,2685.921,2688.415,Now who does that when you have a school newspaper.
1987.86-836,1,34398,leslie_d_edwards,,2713.168,2721.163,"When the government is the publisher, I do not think that we can equate it to one person with the same rights as the private press."
1987.86-836,1,15049,antonin_scalia,scotus_justice,2728.449,2736.885,"Once again, you leave us with a terrible choice, either no newspapers at all or newspapers that have to be offensive as no private newspapers need be."
1987.86-836,1,34398,leslie_d_edwards,,2736.885,2740.628,"Well, why would a student newspaper need to be either."
1987.86-836,1,15049,antonin_scalia,scotus_justice,2741.409,2742.348,Because nobody can stop them.
1987.86-836,1,34398,leslie_d_edwards,,2750.503,2756.887,--I think that private newspapers print offensive things all of the time to some portions of the population.
1987.86-836,1,15049,antonin_scalia,scotus_justice,2756.887,2759.228,"They do not try to, I do not think."
1987.86-836,1,34398,leslie_d_edwards,,2759.228,2763.843,"Well, you have this advisor, this instructor supposing monitoring it a little."
1987.86-836,1,15049,antonin_scalia,scotus_justice,2788.767,2789.959,You let him do it?
1987.86-836,1,34398,leslie_d_edwards,,2789.959,2792.32,"Yes, I think he could."
1987.86-836,1,15049,antonin_scalia,scotus_justice,2792.32,2794.961,He could exclude it because I think this will offend the community?
1987.86-836,1,34398,leslie_d_edwards,,2794.961,2800.555,"As long as it is not only because of a viewpoint discrimination, yes."
1987.86-836,1,15049,antonin_scalia,scotus_justice,2800.555,2801.987,"Well, but it is."
1987.86-836,1,34398,leslie_d_edwards,,2804.278,2809.431,It seems to me that offending the community would not have--
1987.86-836,1,15049,antonin_scalia,scotus_justice,2809.431,2813.324,The students want to print something Hitler was right.
1987.86-836,1,34398,leslie_d_edwards,,2831.756,2836.048,"--Well, I think that the advisor can exercise editorial control."
1987.86-836,1,15049,antonin_scalia,scotus_justice,2836.048,2839.751,But the principal?
1987.86-836,1,34398,leslie_d_edwards,,2839.751,2841.294,Not viewpoint.
1987.86-836,1,15071,byron_r_white,scotus_justice,2854.391,2856.384,"Well, so can the principal then?"
1987.86-836,1,34398,leslie_d_edwards,,2856.384,2863.286,"Yes, if it is inflammatory, libel, obscenity, and disrupting school, and invading rights of privacy of others."
1987.86-836,1,15141,william_h_rehnquist,scotus_justice,2863.286,2884.551,I am puzzled by the fact that the First Amendment implication seems to turn on how far up in the educational hierarchy that the decision is made.
1987.86-836,1,34398,leslie_d_edwards,,2894.708,2906.566,"Well, I think that in attempting to analogize to the private press which has a reporter, editor, publisher and an owner, that we have gotten a little bit away from the First Amendment application."
1987.86-836,1,15141,william_h_rehnquist,scotus_justice,2922.766,2928.99,I must say that I did not get that impression of your case from the answers that you have given to the questions.
1987.86-836,1,34398,leslie_d_edwards,,2935.826,2943.44,"Well, I do not think that it is as important as where the decision is made and the manner."
1987.86-836,1,15060,john_paul_stevens,scotus_justice,3021.151,3040.112,"Given your different examples, is it of any significance in this case that the school had no objection to the distribution of xerox copies of the material that was excluded from the newspaper itself, they just did not want to associate the school officially with the material?"
1987.86-836,1,34398,leslie_d_edwards,,3040.112,3041.714,That did not happen.
1987.86-836,1,15060,john_paul_stevens,scotus_justice,3041.714,3043.324,"Oh, did it not, I misunderstood."
1987.86-836,1,34398,leslie_d_edwards,,3043.324,3047.858,"It is in finding of fact No. 21 from the District Court, it is in a footnote of the Eighth Circuit."
1987.86-836,1,15071,byron_r_white,scotus_justice,3057.844,3059.506,Maybe it was in oral argument.
1987.86-836,1,34398,leslie_d_edwards,,3059.506,3061.727,I probably said it.
1987.86-836,1,15071,byron_r_white,scotus_justice,3061.727,3064.288,"Oh, you were there?"
1987.86-836,1,34398,leslie_d_edwards,,3064.288,3065.72,No.
1987.86-836,1,15060,john_paul_stevens,scotus_justice,3071.975,3074.576,"Well, I certainly do not question your representation."
1987.86-836,1,34398,leslie_d_edwards,,3081.181,3084.283,"I do not think that it makes a difference, but that is just my--"
1987.86-836,1,15049,antonin_scalia,scotus_justice,3084.283,3100.074,"Ms. Edwards, if I recall your response, you said that it would be okay if the school said this is a house organ, we are not going to allow everything to be published, we are going to have the last word, that would be okay."
1987.86-836,1,34398,leslie_d_edwards,,3120.658,3121.299,--Yes.
1987.86-836,1,15049,antonin_scalia,scotus_justice,3121.299,3131.513,"Why should that be, I mean it is sort of a violation of the First Amendment that depends on breach of contract or estoppel or what."
1987.86-836,1,34398,leslie_d_edwards,,3147.395,3149.706,"Well, I might qualify my answer a little."
1987.86-836,1,15049,antonin_scalia,scotus_justice,3158.211,3169.637,"This was done too informally, so this First Amendment violation consists exclusively of the fact that the principal did not publish a regulation or something to change whatever course there was, that is the First Amendment violation?"
1987.86-836,1,34398,leslie_d_edwards,,3169.637,3171.43,--No.
1987.86-836,1,15049,antonin_scalia,scotus_justice,3171.43,3176.213,"It is a pretty frail protection, if that is all that we are talking about."
1987.86-836,1,34398,leslie_d_edwards,,3176.213,3181.256,"Well, I do not think whether they write a regulation or not depends upon whether the First Amendment applies."
1987.86-836,1,15049,antonin_scalia,scotus_justice,3189.182,3189.872,"Well, the principal limited it."
1987.86-836,1,34398,leslie_d_edwards,,3189.872,3192.125,He did not limit the program.
1987.86-836,1,15049,antonin_scalia,scotus_justice,3195.608,3196.286,"I see, I see."
1987.86-836,1,34398,leslie_d_edwards,,3196.286,3199.258,Now I think that he can limit the whole thing.
1987.86-836,1,15049,antonin_scalia,scotus_justice,3201.78,3204.781,It is the ad hoc nature of it that you are objecting to here?
1987.86-836,1,34398,leslie_d_edwards,,3204.781,3210.414,"Well, there is some distinction between practice and policy I think, so I did not know if you were asking about that."
1987.86-836,1,15060,john_paul_stevens,scotus_justice,3216.268,3229.718,I wonder if you are saying that your students had a First Amendment right to have a teacher as good as Mr. Stergos.
1987.86-836,1,34398,leslie_d_edwards,,3229.718,3235.542,I suspect that things would have been different had we not had this change.
1987.86-836,1,15141,william_h_rehnquist,scotus_justice,3237.766,3241.446,"Thank you, Ms. Edwards."
1987.86-836,2,38869,robert_p_baine_jr,,3243.229,3247.951,"Thank you, Mr. Chief Justice."
1987.86-836,2,15071,byron_r_white,scotus_justice,3313.674,3316.085,"But the court said that it was something more, too."
1987.86-836,2,38869,robert_p_baine_jr,,3316.085,3318.937,You are correct there.
1987.86-836,2,15049,antonin_scalia,scotus_justice,3342.452,3357.873,"Is there not also some other inconsistency, is there not a footnote in the Court of Appeals opinion that says that there was no active involvement brought by the instructor in the production, and a flat finding by the District Court that there was active involvement by the instructor?"
1987.86-836,2,38869,robert_p_baine_jr,,3357.873,3361.135,"If you read the 21 findings of fact, there is a lot of activity."
1987.86-836,2,15049,antonin_scalia,scotus_justice,3361.135,3363.306,Where did the Court of Appeals get that from?
1987.86-836,2,38869,robert_p_baine_jr,,3363.306,3365.818,"I do not know, I really do not know."
1987.86-836,2,15141,william_h_rehnquist,scotus_justice,3384.349,3386.582,"Thank you, Mr. Baine."
