file_name,section,speaker_id,speaker_name,speaker_role,start,stop,text
1987.86-787,0,15141,william_h_rehnquist,scotus_justice,0.0,8.31,"We will hear arguments next in Cecil Hicks, District Attorney for Orange County, California, acting on behalf of Alta Sue Feiock versus Phillip William Feiock."
1987.86-787,0,35577,michael_r_capizzi,,66.661,67.567,Thank you.
1987.86-787,0,15141,william_h_rehnquist,scotus_justice,227.612,229.643,What is the present population of Orange County?
1987.86-787,0,35577,michael_r_capizzi,,230.689,231.283,Something in excess of two million.
1987.86-787,0,15141,william_h_rehnquist,scotus_justice,231.283,231.736,Two million.
1987.86-787,0,35577,michael_r_capizzi,,231.736,232.095,Yes.
1987.86-787,0,15092,sandra_day_oconnor,scotus_justice,276.781,287.105,"Well, Mr. Capizzi, the California Court of Appeals held that the California statutes make this contempt proceeding criminal in nature."
1987.86-787,0,35577,michael_r_capizzi,,287.105,289.479,"Yes, Justice O'Connor."
1987.86-787,0,15092,sandra_day_oconnor,scotus_justice,289.479,297.943,"Now, I guess California is entitled to determine that for itself as a matter of state law, isn't it?"
1987.86-787,0,35577,michael_r_capizzi,,297.943,306.878,"Well, it can place whatever label it chooses on a case, and this case the court below did term the case criminal."
1987.86-787,0,15092,sandra_day_oconnor,scotus_justice,308.628,316.796,"So is it a matter, is it a question of federal law for purposes of answering whether the federal constitution is violated?"
1987.86-787,0,35577,michael_r_capizzi,,316.796,327.323,--I think that unquestionably it is and be that as it may I would submit that the court below was wrong in terming this case criminal even under California law.
1987.86-787,0,15092,sandra_day_oconnor,scotus_justice,327.323,335.272,"Well, but you don't really want us to get in there, do you, and say that the California Court of Appeals was wrong as a matter of California law?"
1987.86-787,0,35577,michael_r_capizzi,,340.708,348.173,"Well, I think the Court has always looked to the highest court... this Court has looked to the highest court of the state in determining what the state law is."
1987.86-787,0,15092,sandra_day_oconnor,scotus_justice,348.173,356.326,"Well, why would we want to do that if it is a question of federal law for purposes of the federal constitutional question?"
1987.86-787,0,35577,michael_r_capizzi,,371.273,386.939,"No, we merely meant to set the record straight, and point out that the California Supreme Court has held repeatedly that there are still two types of contempt in California, civil and criminal, but that is absolutely correct."
1987.86-787,0,15049,antonin_scalia,scotus_justice,450.695,458.175,"But it is up to California to decide what it is coming with a... I mean, that is a purposive test, and it is California's purpose."
1987.86-787,0,35577,michael_r_capizzi,,461.408,464.314,"--California has not said that it is criminal, Justice Scalia."
1987.86-787,0,15049,antonin_scalia,scotus_justice,464.314,466.579,You are arguing that it doesn't matter what California said.
1987.86-787,0,35577,michael_r_capizzi,,483.009,483.931,That's correct.
1987.86-787,0,15049,antonin_scalia,scotus_justice,483.931,489.007,It has applied certain protections that are normally applicable in a criminal context.
1987.86-787,0,35577,michael_r_capizzi,,490.912,492.568,"Yes, Justice Blackmun, that is correct."
1987.86-787,0,15049,antonin_scalia,scotus_justice,510.67,511.405,That is a different issue.
1987.86-787,0,35577,michael_r_capizzi,,530.256,562.196,"If California should suggest, Justice Scalia, that in a civil case where there are punitive damages those are penal in nature, as they have said in contempt proceedings, the potential of a jail sentence is penal, and because punitive damages are potentially penal, we are going to extend the procedural safeguards of a criminal case, not because they are constitutionally required, but because as a state we are going to extend those rights in the civil case."
1987.86-787,0,15141,william_h_rehnquist,scotus_justice,622.672,642.491,"Mr. Capizzi, I am looking at page A6 of the petition for writ of certiorari where you have the opinion of the Court of Appeal, and I am looking at the second full paragraph on the page, the second sentence, where its says,"
1987.86-787,0,35577,michael_r_capizzi,,661.172,663.03,No.
1987.86-787,0,15141,william_h_rehnquist,scotus_justice,670.012,677.229,Have there been other cases from the Supreme Court of California that have said this kind of proceeding is a criminal rather than a civil proceeding?
1987.86-787,0,35577,michael_r_capizzi,,677.229,677.635,No.
1987.86-787,0,15141,william_h_rehnquist,scotus_justice,683.164,685.381,"Roder wasn't a contempt case, was it?"
1987.86-787,0,35577,michael_r_capizzi,,685.381,685.646,"No, it was not a contempt."
1987.86-787,0,15060,john_paul_stevens,scotus_justice,693.752,699.845,"What significance do you give to the sentence on page A8, contempt is quasi-criminal and requires proof beyond a reasonable doubt?"
1987.86-787,0,35577,michael_r_capizzi,,699.845,707.528,That is what the California courts have required for in excess of 100 years.
1987.86-787,0,15060,john_paul_stevens,scotus_justice,707.528,710.169,In civil contempt proceedings as well as criminal?
1987.86-787,0,35577,michael_r_capizzi,,710.169,756.242,"In civil as well as criminal, and that is why civil contempt proceedings because they have the potential for a jail sentence if the coercive order is violated, they have been given in civil contempt proceedings many of the procedural safeguards that would otherwise be available to a criminal defendant, and as a result, over the 100 years or so, the civil contempt proceedings have been referred to as quasi-criminal and criminal in nature, but that doesn't make them criminal substantively, and as this Court has said in Shilitani versus United States, that we are going to look at the substance, not the procedure by which the order for contempt came about."
1987.86-787,0,15049,antonin_scalia,scotus_justice,803.473,808.94,What was the procedure that was involved there that we said was not necessary?
1987.86-787,0,35577,michael_r_capizzi,,808.94,811.971,In Shillitani?
1987.86-787,0,15049,antonin_scalia,scotus_justice,811.971,812.5,Yes.
1987.86-787,0,35577,michael_r_capizzi,,812.5,813.688,It was the jury trial--
1987.86-787,0,15049,antonin_scalia,scotus_justice,813.688,837.288,"Now, you are urging here that what is not necessary is not only... not only the burden of persuasion... not only the burden of initiation of the evidence, production being placed on the plaintiff, but also the burden of persuasion."
1987.86-787,0,35577,michael_r_capizzi,,867.433,870.948,"--No, we are not, Justice Scalia."
1987.86-787,0,15071,byron_r_white,scotus_justice,888.58,897.295,The Court of Appeals certainly ruled clearly enough that the burden of proving the ability to pay is on the prosecution.
1987.86-787,0,35577,michael_r_capizzi,,897.295,904.526,"The Court expressed that, and again--"
1987.86-787,0,15071,byron_r_white,scotus_justice,904.526,906.478,As a matter of California law.
1987.86-787,0,35577,michael_r_capizzi,,906.478,909.712,"--But it misstated California law, Justice White."
1987.86-787,0,15071,byron_r_white,scotus_justice,909.712,919.395,"Well, I don't know how you can convince us of that, but I thought that... I didn't read your brief and disagree especially with that."
1987.86-787,0,35577,michael_r_capizzi,,927.079,931.297,The statute points out that if there is an order--
1987.86-787,0,15071,byron_r_white,scotus_justice,931.297,931.625,Right.
1987.86-787,0,35577,michael_r_capizzi,,931.625,933.358,--there is knowledge of the order--
1987.86-787,0,15071,byron_r_white,scotus_justice,933.358,933.811,Yes.
1987.86-787,0,35577,michael_r_capizzi,,933.811,946.338,"--and there is a violation, it hasn't been paid, that that is prima facie evidence of contempt, and even if we are to--"
1987.86-787,0,15071,byron_r_white,scotus_justice,946.338,956.896,You are just saying that the statute says that the prosecution's burden is satisfied when you prove the things that you just mentioned.
1987.86-787,0,35577,michael_r_capizzi,,956.896,968.471,"--That is correct, and that is consistent with an early California Supreme Court case, In re McCarty, which likewise said those are the three elements of contempt."
1987.86-787,0,15071,byron_r_white,scotus_justice,981.246,990.555,Did your brief argue that this statute shifted the burden of persuasion on ability?
1987.86-787,0,35577,michael_r_capizzi,,993.459,996.583,The court below--
1987.86-787,0,15071,byron_r_white,scotus_justice,996.583,998.427,What about your brief?
1987.86-787,0,35577,michael_r_capizzi,,998.427,1009.251,--Our brief expresses that it shifts to the respondent the burden of production.
1987.86-787,0,15071,byron_r_white,scotus_justice,1009.251,1017.201,But the burden of proving ability rests on the... remains on the prosecution.
1987.86-787,0,35577,michael_r_capizzi,,1017.201,1020.48,"No, the... again--"
1987.86-787,0,15071,byron_r_white,scotus_justice,1020.48,1021.292,"Well, you can't do it both ways."
1987.86-787,0,35577,michael_r_capizzi,,1021.292,1030.226,--the California Supreme Court has repeatedly said that inability to pay is an affirmative defense.
1987.86-787,0,15071,byron_r_white,scotus_justice,1030.226,1031.224,Yes.
1987.86-787,0,35577,michael_r_capizzi,,1031.224,1040.707,And as an affirmative defense the respondent has the burden of producing evidence.
1987.86-787,0,15071,byron_r_white,scotus_justice,1040.707,1042.067,"Well, we have got--"
1987.86-787,0,35577,michael_r_capizzi,,1062.901,1063.104,No.
1987.86-787,0,15049,antonin_scalia,scotus_justice,1063.104,1064.572,It seems to me that could take--
1987.86-787,0,35577,michael_r_capizzi,,1064.572,1064.822,No.
1987.86-787,0,15049,antonin_scalia,scotus_justice,1064.822,1065.478,--You don't say that.
1987.86-787,0,35577,michael_r_capizzi,,1065.478,1066.353,"Justice Scalia, what we--"
1987.86-787,0,15092,sandra_day_oconnor,scotus_justice,1066.353,1068.056,"But that is what the Court of Appeals said, isn't it?"
1987.86-787,0,35577,michael_r_capizzi,,1068.056,1068.837,--The Court of Appeals said--
1987.86-787,0,15092,sandra_day_oconnor,scotus_justice,1068.837,1075.24,The Court of Appeals said that California law puts the burden of persuasion on the respondent.
1987.86-787,0,35577,michael_r_capizzi,,1080.269,1082.174,"--That's correct, Justice O'Connor."
1987.86-787,0,15092,sandra_day_oconnor,scotus_justice,1082.174,1085.174,"Again, you don't want us to decide that, do you?"
1987.86-787,0,35577,michael_r_capizzi,,1085.174,1086.643,I don't think it is necessary.
1987.86-787,0,15092,sandra_day_oconnor,scotus_justice,1111.414,1117.13,"Well, Rylander involved a situation where only the burden of production shifted."
1987.86-787,0,35577,michael_r_capizzi,,1117.13,1119.989,"--That's correct, Justice O'Connor."
1987.86-787,0,15045,harry_a_blackmun,scotus_justice,1119.989,1132.282,"Well, do you lose this case if the burden of persuasion is also involved and placed on the defendant?"
1987.86-787,0,35577,michael_r_capizzi,,1132.282,1134.032,"No, I don't believe we do."
1987.86-787,0,15045,harry_a_blackmun,scotus_justice,1134.032,1134.827,"I don't think you do, either."
1987.86-787,0,35577,michael_r_capizzi,,1134.827,1147.01,"It is a civil case, and regardless of whether it is the burden of persuasion or the burden of production, there is a rational connection between the proven fact and the presumed fact."
1987.86-787,0,15049,antonin_scalia,scotus_justice,1272.693,1291.139,"Mr. Capizzi, whether California decides to or not, and whether you argue it here or not, I had the impression... I don't know which of the briefs I got it from, that most states do place the burden on the defendant, not just for production but of persuasion."
1987.86-787,0,35577,michael_r_capizzi,,1291.389,1291.92,That's correct.
1987.86-787,0,15049,antonin_scalia,scotus_justice,1291.92,1292.701,--That is correct.
1987.86-787,0,35577,michael_r_capizzi,,1292.701,1296.2,It is a burden of producing... or burden of proof in most states.
1987.86-787,0,15060,john_paul_stevens,scotus_justice,1475.376,1478.094,Let me ask you one final question.
1987.86-787,0,35577,michael_r_capizzi,,1485.966,1487.122,--Yes.
1987.86-787,0,15060,john_paul_stevens,scotus_justice,1487.122,1492.572,And concluded that there was ability to pay with respect to at least a portion of the disputed period.
1987.86-787,0,35577,michael_r_capizzi,,1526.903,1532.807,"He did, Justice Stevens, make a finding that there was ability to pay."
1987.86-787,0,15060,john_paul_stevens,scotus_justice,1568.979,1569.26,Right.
1987.86-787,0,35577,michael_r_capizzi,,1569.26,1574.477,And then made the findings that he had the ability to pay and entered the coercive order.
1987.86-787,0,15060,john_paul_stevens,scotus_justice,1574.477,1584.677,What I am really asking is whether in the actual decision of this case did the allocation of the burden of proof actually have any impact on the outcome.
1987.86-787,0,35577,michael_r_capizzi,,1584.677,1588.393,"Not the ultimate result, no."
1987.86-787,0,15141,william_h_rehnquist,scotus_justice,1611.649,1612.29,"Thank you, Mr. Capizzi."
1987.86-787,1,40430,richard_lynn_schwartzberg,,1614.618,1635.14,"Mr. Chief Justice and the associate Justices of the Supreme Court, and may it please the Court, the issue, contrary to a number of the amicus briefs that were filed in this case, I would suggest, is rather narrow, and I would suggest it has almost no national importance."
1987.86-787,1,15092,sandra_day_oconnor,scotus_justice,1789.28,1804.197,"Mr. Schwartzberg, it seems to me that what the California Court of Appeals did ultimately was to say that the California statute as applied here was invalid as a matter of federal constitutional law."
1987.86-787,1,40430,richard_lynn_schwartzberg,,1804.197,1805.603,"I would concede that, yes."
1987.86-787,1,15092,sandra_day_oconnor,scotus_justice,1805.603,1822.173,So is it not also a question of federal law whether this statute is indeed civil in nature or criminal for purposes of answering the federal constitutional question?
1987.86-787,1,40430,richard_lynn_schwartzberg,,1822.173,1824.08,"No, Justice O'Connor, no more than--"
1987.86-787,1,15092,sandra_day_oconnor,scotus_justice,1824.08,1824.376,No?
1987.86-787,1,40430,richard_lynn_schwartzberg,,1840.902,1843.244,"--Well, I think the answer to that is this."
1987.86-787,1,15092,sandra_day_oconnor,scotus_justice,1865.577,1888.71,"Well, Mr. Schwartzberg, what about a case like Shillitani v. The United States which at least indicates that we are free to examine the purpose of the contempt proceeding and characterize it as civil in this instance because it was for the purpose of coercing the payment of the money."
1987.86-787,1,40430,richard_lynn_schwartzberg,,1888.71,1895.317,"I don't know how to reconcile that with California, and I think California would have trouble reconciling it with Shillitani."
1987.86-787,1,15092,sandra_day_oconnor,scotus_justice,1914.511,1918.697,"Well, I think that is perfectly all right if California wants to do that."
1987.86-787,1,40430,richard_lynn_schwartzberg,,1936.113,1939.08,I think the difficulty with that is that we are putting the cart before the horse.
1987.86-787,1,15049,antonin_scalia,scotus_justice,1972.285,1983.124,"I assume that to some extent, the answer to Justice O'Connor's question must depend upon what the Federal test for criminality is."
1987.86-787,1,40430,richard_lynn_schwartzberg,,2008.411,2010.146,"--Not only that, but I would go one step further."
1987.86-787,1,15060,john_paul_stevens,scotus_justice,2066.262,2069.697,May I pursue Justice O'Connor's inquiry with a hypothetical?
1987.86-787,1,40430,richard_lynn_schwartzberg,,2107.448,2119.615,"Well, I am having a little bit of trouble with the analogy because I am not entirely certain as to whether the courts are determining that the civil cause of action is itself a crime."
1987.86-787,1,15060,john_paul_stevens,scotus_justice,2119.615,2123.646,"Yes, the statute says: Negligent operation of the vehicle is a crime."
1987.86-787,1,40430,richard_lynn_schwartzberg,,2141.404,2145.886,I would be less than frank if I told the Court I really can answer that question.
1987.86-787,1,15060,john_paul_stevens,scotus_justice,2153.165,2153.321,No.
1987.86-787,1,40430,richard_lynn_schwartzberg,,2161.068,2171.079,I hope that this does not devolve into a semantics debate because I don't think that when we say we are calling it a crime that that is all we are doing and that it is not a crime in fact.
1987.86-787,1,15060,john_paul_stevens,scotus_justice,2171.079,2186.276,"But do you say, though, that the California rules applicable to this kind of proceeding should be judged by the same standards that apply to similar rules that produce similar consequences in other states except they don't call it a crime."
1987.86-787,1,40430,richard_lynn_schwartzberg,,2186.276,2187.776,I don't think that they have anything to do with each other.
1987.86-787,1,15060,john_paul_stevens,scotus_justice,2188.823,2191.353,"So, our case pertains only to California?"
1987.86-787,1,40430,richard_lynn_schwartzberg,,2191.353,2191.665,Yes.
1987.86-787,1,15141,william_h_rehnquist,scotus_justice,2198.429,2211.562,"Well, what if California that has a statute that says, for negligently driving while drunk, you can have your license revoked, your motor vehicle operator's permit revoked, and the California courts say,"
1987.86-787,1,40430,richard_lynn_schwartzberg,,2234.429,2279.019,"Well, I think the answer to that is that if the California court's interpretation is unambiguous that notwithstanding the fact that this may only involve an administrative penalty, whether it is loss of license, loss of privilege, loss of money or jail, I think that if the California court says that in California, that act is a crime, then I think this court, not bound to accept that determination, in effect, I think this Court must apply those Federal constitutional guarantees which apply to a criminal act within the context of this Court's decisions."
1987.86-787,1,15141,william_h_rehnquist,scotus_justice,2318.458,2321.3,"But how does one ""know"" that it is a crime?"
1987.86-787,1,40430,richard_lynn_schwartzberg,,2321.3,2326.454,"--Because the courts have, since 1893, defined it as a crime and have treated it as a crime."
1987.86-787,1,15141,william_h_rehnquist,scotus_justice,2326.454,2327.454,And that's all it takes?
1987.86-787,1,40430,richard_lynn_schwartzberg,,2331.061,2336.044,"Well, I am not suggesting--"
1987.86-787,1,15049,antonin_scalia,scotus_justice,2336.044,2343.245,"Could you tell me, Mr. Schwartzberg, could you tell me, because it makes a difference to my answer to the question we are discussing why California has said it is a crime?"
1987.86-787,1,40430,richard_lynn_schwartzberg,,2347.211,2347.477,--Yes.
1987.86-787,1,15049,antonin_scalia,scotus_justice,2347.477,2349.803,As opposed to a coercion?
1987.86-787,1,40430,richard_lynn_schwartzberg,,2352.038,2358.504,"I don't think there is any doubt that the cases have always defined this as a crime because, as the courts say, the ultimate result is punishment."
1987.86-787,1,15092,sandra_day_oconnor,scotus_justice,2384.915,2394.723,"Well, Mr. Schwartzberg, isn't the California procedure California's response to the uniform reciprocal support law requirements?"
1987.86-787,1,40430,richard_lynn_schwartzberg,,2394.723,2397.503,"--Well, California's response as to what, Justice O'Connor?"
1987.86-787,1,15092,sandra_day_oconnor,scotus_justice,2397.503,2407.547,"Well, there is a uniform act as you know designed to enable parents with custody of a child to obtain child support."
1987.86-787,1,40430,richard_lynn_schwartzberg,,2407.547,2407.781,Yes.
1987.86-787,1,15092,sandra_day_oconnor,scotus_justice,2407.781,2417.823,"And each state, including California, has responded to that by having provisions such as this for contempt proceedings, for non-payment of child support."
1987.86-787,1,40430,richard_lynn_schwartzberg,,2417.823,2418.651,Yes.
1987.86-787,1,15092,sandra_day_oconnor,scotus_justice,2418.651,2423.711,And isn't this California's participation in that scheme?
1987.86-787,1,40430,richard_lynn_schwartzberg,,2423.711,2432.177,"Well, the 1209.5 may be, Justice O'Connor, but the original 1209 statute which presents a contempt remedy is not--"
1987.86-787,1,15092,sandra_day_oconnor,scotus_justice,2432.177,2434.817,"Well, 1209.5 is what we are dealing with."
1987.86-787,1,40430,richard_lynn_schwartzberg,,2434.817,2435.052,--Yes.
1987.86-787,1,15092,sandra_day_oconnor,scotus_justice,2435.052,2450.684,"And there is an indication, is there not, in that uniform act that these proceedings are civil in nature for purposes of the uniform act and are designed to coerce the parent who is not making the payments to make the payments."
1987.86-787,1,40430,richard_lynn_schwartzberg,,2454.526,2458.901,"There is no question about that, but that act does not supercede 1209."
1987.86-787,1,15092,sandra_day_oconnor,scotus_justice,2461.462,2473.098,Would it be more accurate to say they have dealt with contempt proceedings as a matter of California law as quasi-criminal?
1987.86-787,1,40430,richard_lynn_schwartzberg,,2476.425,2487.671,"I would say that the courts when they get to the issue of what species this is, whether it is criminal or civil, have used a number of different labels to govern it."
1987.86-787,1,15092,sandra_day_oconnor,scotus_justice,2515.486,2533.01,"Well, don't you suppose, Mr. Schwartzberg, that because one of the consequences of this coercive proceeding may be imposition of a jail term that a state as a matter of state law might want to build in extra protections, such as a higher standard of proof."
1987.86-787,1,40430,richard_lynn_schwartzberg,,2533.01,2544.568,"But, Justice O'Connor, I would agree with you if I could find in the cases... and I have read them over and over, again... any reference either to California's own constitutional provisions which govern the Fifth Amendment which govern the right to counsel."
1987.86-787,1,15049,antonin_scalia,scotus_justice,2576.54,2577.477,Before you get there.
1987.86-787,1,40430,richard_lynn_schwartzberg,,2577.477,2578.383,--All right.
1987.86-787,1,15049,antonin_scalia,scotus_justice,2578.383,2588.69,"Do the California courts make any difference between an order in a case like this which says, the defendant's fault in the court and the court says,"
1987.86-787,1,40430,richard_lynn_schwartzberg,,2612.369,2615.273,There is absolutely no distinction in the procedural--
1987.86-787,1,15049,antonin_scalia,scotus_justice,2615.273,2617.351,Both of them are called coercive.
1987.86-787,1,40430,richard_lynn_schwartzberg,,2617.351,2619.382,--Criminal.
1987.86-787,1,15049,antonin_scalia,scotus_justice,2619.382,2620.163,Criminal.
1987.86-787,1,40430,richard_lynn_schwartzberg,,2620.163,2638.641,"Yes, in fact, when the Court looks at City of Culver City v. Superior Court, essentially, the petitioners in Culver City stand before the court asking them to tell them what kind of contempt this is because they are obviously looking at other jurisdictions and recognizing that depending on what kind of a contempt it is, they get different rights."
1987.86-787,1,15060,john_paul_stevens,scotus_justice,2669.581,2681.825,"Yes, but in this very case, if this man came up with the money that is in arreared and paid it in the court or paid it for his children's support, would he not immediately get out of jail?"
1987.86-787,1,40430,richard_lynn_schwartzberg,,2681.825,2685.059,"Well, first of all, he is not in jail and never was."
1987.86-787,1,15060,john_paul_stevens,scotus_justice,2696.413,2701.506,"And what I am saying is if he makes the past payments, he won't go to jail, if he complies with the order."
1987.86-787,1,40430,richard_lynn_schwartzberg,,2701.506,2707.863,"It is clear that essentially through the minority of his children's lives, if he never misses a payment he will not go to jail."
1987.86-787,1,15060,john_paul_stevens,scotus_justice,2707.863,2712.751,"So, it is clear that this order in other jurisdictions would be treated as a coercive and a civil contempt."
1987.86-787,1,40430,richard_lynn_schwartzberg,,2712.751,2713.438,Correct.
1987.86-787,1,15060,john_paul_stevens,scotus_justice,2723.027,2729.9,"See, you are suggesting, I think, in my hypothetical example about a negligence case, if a state not only called it a crime, but also said,"
1987.86-787,1,40430,richard_lynn_schwartzberg,,2742.801,2744.926,"No, not based upon what you just said."
1987.86-787,1,15060,john_paul_stevens,scotus_justice,2749.845,2757.202,"Well, it comes from California or my hypothetical state's mistaken belief it was compelled to do so by the Federal Constitution."
1987.86-787,1,40430,richard_lynn_schwartzberg,,2757.202,2761.186,"Well, if you assume it is erroneous then, obviously, I lose."
1987.86-787,1,15060,john_paul_stevens,scotus_justice,2763.278,2766.197,They say it was based on the Federal Constitution and that's why they do it.
1987.86-787,1,40430,richard_lynn_schwartzberg,,2774.491,2777.068,"Well, I wouldn't put it that way."
1987.86-787,1,15060,john_paul_stevens,scotus_justice,2777.068,2778.381,--What else do you have in this case?
1987.86-787,1,40430,richard_lynn_schwartzberg,,2782.707,2783.004,Sure.
1987.86-787,1,15060,john_paul_stevens,scotus_justice,2784.129,2787.659,It is a crime because they call it a crime.
1987.86-787,1,40430,richard_lynn_schwartzberg,,2787.659,2788.72,But that is always the predicate.
1987.86-787,1,15060,john_paul_stevens,scotus_justice,2791.953,2792.469,No.
1987.86-787,1,40430,richard_lynn_schwartzberg,,2798.732,2801.184,"Well, then maybe we ought to make it clear."
