file_name,section,speaker_id,speaker_name,speaker_role,start,stop,text
1987.86-772,1,15104,thurgood_marshall,scotus_justice,3113.243,3118.71,"Secondly, how much of this was given to the mayor, presented to the mayor?"
1987.86-772,1,19744,charles_r_oldham,,3118.71,3120.301,"Pardon, Your Honor?"
1987.86-772,1,15104,thurgood_marshall,scotus_justice,3120.301,3123.707,How much of this was told to the mayor?
1987.86-772,1,19744,charles_r_oldham,,3123.707,3129.127,That is difficult to say because--
1987.86-772,1,15104,thurgood_marshall,scotus_justice,3129.127,3132.297,"Well, so far as the record shows--"
1987.86-772,1,19744,charles_r_oldham,,3132.297,3134.047,"--in terms of direct words to Mr. Praprotnik, nobody said,"
1987.86-772,1,15104,thurgood_marshall,scotus_justice,3137.249,3139.857,"--Well, how do you get the mayor involved in this?"
1987.86-772,1,19744,charles_r_oldham,,3139.857,3148.48,"Because the mayor made the decision to transfer Mr. Praprotnik and made decisions to transfer the function, which, incidentally, were never transferred."
1987.86-772,1,15104,thurgood_marshall,scotus_justice,3167.425,3169.345,Did the mayor ever see the Respondent?
1987.86-772,1,19744,charles_r_oldham,,3169.345,3170.048,--Pardon?
1987.86-772,1,15104,thurgood_marshall,scotus_justice,3170.048,3173.765,Did the mayor ever lay his eyes on the Respondent?
1987.86-772,1,19744,charles_r_oldham,,3173.765,3175.577,"I think so, yes."
1987.86-772,1,15104,thurgood_marshall,scotus_justice,3175.577,3176.748,When?
1987.86-772,1,19744,charles_r_oldham,,3178.326,3180.653,The record reflects that--
1987.86-772,1,15104,thurgood_marshall,scotus_justice,3180.653,3183.886,The records reflect that he didn't even know anything about this man; doesn't it?
1987.86-772,1,19744,charles_r_oldham,,3183.886,3184.293,"--Oh, no."
1987.86-772,1,15104,thurgood_marshall,scotus_justice,3186.995,3188.915,"Well, that's what I asked you."
1987.86-772,1,19744,charles_r_oldham,,3197.88,3202.504,The record reflects that the mayor made the decision to transfer him.
1987.86-772,1,15104,thurgood_marshall,scotus_justice,3258.638,3262.62,Somebody told somebody that the mayor was unhappy.
1987.86-772,1,19744,charles_r_oldham,,3262.62,3264.167,Yes.
1987.86-772,1,15104,thurgood_marshall,scotus_justice,3264.167,3265.993,And that charges the mayor with firing him?
1987.86-772,1,19744,charles_r_oldham,,3265.993,3269.789,Mr. Hamsher--
1987.86-772,1,15104,thurgood_marshall,scotus_justice,3269.789,3276.38,Somebody told somebody that the mayor was unhappy.
1987.86-772,1,19744,charles_r_oldham,,3278.957,3281.769,--An agent of the mayor told Mr. Praprotnik... his supervisor told Mr. Praprotnik--
1987.86-772,1,15104,thurgood_marshall,scotus_justice,3281.769,3284.533,Is there anything in the record to show that the mayor was unhappy?
1987.86-772,1,19744,charles_r_oldham,,3284.533,3287.688,--Other than statements of his agents?
1987.86-772,1,15104,thurgood_marshall,scotus_justice,3287.688,3296.122,"Is there anything other than hearsay in the record to show that the mayor was, quote, unhappy, end quote?"
1987.86-772,1,19744,charles_r_oldham,,3296.122,3304.915,"Your Honor, I don't think that a statement of an employee or agent of the mayor is hearsay."
1987.86-772,1,15141,william_h_rehnquist,scotus_justice,3339.433,3342.025,"Thank you, Mr. Oldham."
1987.86-772,2,33585,james_j_wilson,,3344.306,3351.834,We have now in Respondent's argument interjected the mayor of the City of St. Louis into this dispute.
1987.86-772,2,15060,john_paul_stevens,scotus_justice,3426.616,3431.832,"But, Mr. Wilson, as I understand it, you are relying on your motion for a directed verdict at the close of his case."
1987.86-772,2,33585,james_j_wilson,,3431.832,3432.441,"Yes, that's correct."
1987.86-772,2,15060,john_paul_stevens,scotus_justice,3432.441,3438.939,"Which, it seems to me, allows your opponent to rely on evidence in the record, even though it might not have been referred to in the instructions?"
1987.86-772,2,33585,james_j_wilson,,3438.939,3440.625,"Yes, that is correct."
1987.86-772,2,15060,john_paul_stevens,scotus_justice,3445.982,3452.59,"No, but at the directed verdict stage, you are not really debating the theory of the case of whether there is any evidence that would sustain liability under 1983."
1987.86-772,2,33585,james_j_wilson,,3452.59,3472.472,"I think, Justice Stevens, I think we get to the point of attempting to identify the policy maker and I think for that purpose we wanted to make sure that it was clear that the mayor, who may be, along with the Civil Service Commission, to be a policy maker, was not in any way involved in this particular retaliatory transfer."
1987.86-772,2,15141,william_h_rehnquist,scotus_justice,3505.256,3507.053,"Your time is expired, Mr. Wilson."
