file_name,section,speaker_id,speaker_name,speaker_role,start,stop,text
1992.91-740,0,15141,william_h_rehnquist,scotus_justice,0.0,9.297,"We'll hear argument first this morning in Number 91-740, Walter L. Nixon v. the United States."
1992.91-740,0,21564,david_overlock_stewart,,10.348,18.975,"Mr. Chief Justice, and may it please the Court:"
1992.91-740,0,15071,byron_r_white,scotus_justice,65.095,72.27,--I suppose when you call it a trial before 12 Senators.
1992.91-740,0,21564,david_overlock_stewart,,72.27,84.206,"--Well, Your Honor, we do think that the proceeding that anyone comfortable with judicial proceedings would identify as the trial did in fact occur before the committee, and indeed, if you look at Rule 11--"
1992.91-740,0,15071,byron_r_white,scotus_justice,84.206,86.52,"Well, that's what the case is all about, I suppose."
1992.91-740,0,21564,david_overlock_stewart,,86.52,86.81,--It is indeed.
1992.91-740,0,15071,byron_r_white,scotus_justice,86.81,87.24,"Yes, all right."
1992.91-740,0,21564,david_overlock_stewart,,87.24,100.701,The Impeachment Trial Clause ensures that the Senate will approach the cases and exercise its ultimate power to remove executive and judicial officers with great care and deliberation.
1992.91-740,0,15141,william_h_rehnquist,scotus_justice,100.701,104.815,"Well, Mr. Stewart, you refer to it as the Impeachment Trial Clause."
1992.91-740,0,21564,david_overlock_stewart,,111.939,131.392,"Well, Your Honor, that certainly has been the position of respondents, that that is the only... that word sole is the only relevant word in the passage, and that word cuts off all review by the courts, but I think that that reading of that word hangs such a tremendous amount on that word that it's really not defensible."
1992.91-740,0,15141,william_h_rehnquist,scotus_justice,131.392,136.835,"Well, I... you know, certainly that would be a fairly partial way to refer to it."
1992.91-740,0,21564,david_overlock_stewart,,143.533,151.339,"I'm not trying to be partial here, Your Honor, I am simply trying to demonstrate... to describe it... it does seem to describe an impeachment trial."
1992.91-740,0,15049,antonin_scalia,scotus_justice,151.339,152.599,You can be partial.
1992.91-740,0,21564,david_overlock_stewart,,155.343,155.503,Fair enough.
1992.91-740,0,15049,antonin_scalia,scotus_justice,155.503,156.254,It's all right.
1992.91-740,0,21564,david_overlock_stewart,,157.015,169.925,But there are several elements that the trial and other elements of the Constitution require a limited... that limit the power of the Senate in conducting these impeachments.
1992.91-740,0,15141,william_h_rehnquist,scotus_justice,202.755,215.944,"Well, Mr. Stewart, do you think the high crimes and misdemeanors language is such that the interpretation by this Court could supersede that of the Senate?"
1992.91-740,0,21564,david_overlock_stewart,,233.065,238.13,"Yes, Your Honor, I think that could be reviewable, and that the Court has to face up to that."
1992.91-740,0,15141,william_h_rehnquist,scotus_justice,266.4,275.796,"What would the language have meant, in your view, if the word sole were not there, if it simply said the Senate shall have the power to try all impeachments?"
1992.91-740,0,21564,david_overlock_stewart,,275.796,283.433,"--Well, of course, that's the way the clause was written as it was initially approved, and it was only in the Committee of Style that the word sole was adopted."
1992.91-740,0,15092,sandra_day_oconnor,scotus_justice,305.619,320.968,"Well, would it be reviewable, in your view, if a quorum was not present at all times, and could a Senator vote ultimately who had not heard all of the evidence, in your view?"
1992.91-740,0,21564,david_overlock_stewart,,324.611,328.304,"Your Honor, those are two different questions, I think, and let me try to answer them separately."
1992.91-740,0,15049,antonin_scalia,scotus_justice,376.868,381.371,But you think it is a trial if people who haven't been present at the proceedings come in and vote.
1992.91-740,0,21564,david_overlock_stewart,,382.552,384.964,"It is a Senate trial as provided in the Constitution, yes."
1992.91-740,0,15049,antonin_scalia,scotus_justice,387.147,389.067,I don't know how you're drawing the line between the one and the other.
1992.91-740,0,21564,david_overlock_stewart,,389.067,391.129,--If you look at--
1992.91-740,0,15049,antonin_scalia,scotus_justice,391.129,397.873,"I thought a trial means you present evidence before someone who then decides, the person to whom the evidence has been presented."
1992.91-740,0,21564,david_overlock_stewart,,400.225,411.113,"--I have no problem with the proposition that the Framers intended all Senators to be present, but what they provided in the text of the Constitution is that the Senate can conduct its business with a quorum present."
1992.91-740,0,15049,antonin_scalia,scotus_justice,419.048,422.7,"You say a quorum present during the trial, right?"
1992.91-740,0,21564,david_overlock_stewart,,422.7,423.389,"Yes, sir."
1992.91-740,0,15049,antonin_scalia,scotus_justice,423.389,426.812,"But it can be a different... your point is, it can be a different quorum."
1992.91-740,0,21564,david_overlock_stewart,,426.812,428.054,"Yes, sir."
1992.91-740,0,15049,antonin_scalia,scotus_justice,428.054,433.717,"One portion of the Senate can hear the evidence, and another portion vote, and that's a trial."
1992.91-740,0,21564,david_overlock_stewart,,433.717,437.45,Surely undesirable from a point of citizenship--
1992.91-740,0,15049,antonin_scalia,scotus_justice,437.45,437.59,I know it's undesirable.
1992.91-740,0,21564,david_overlock_stewart,,437.85,437.96,--But yes.
1992.91-740,0,15092,sandra_day_oconnor,scotus_justice,438.571,447.727,"What about this Court, if we exercise original jurisdiction and appoint a master, and we don't all sit there and hear the evidence."
1992.91-740,0,21564,david_overlock_stewart,,452.211,459.694,Those proceedings do not resemble an impeachment proceeding to the extent that they involve stripping an individual of rights.
1992.91-740,0,15092,sandra_day_oconnor,scotus_justice,463.217,471.844,"Oh, well, I think they could involve a great many rights... water rights, or one thing and another... that are terribly important."
1992.91-740,0,21564,david_overlock_stewart,,471.844,478.508,--But there is no provision in the Constitution that provides that the trial must be before this Court in those cases.
1992.91-740,0,15113,anthony_m_kennedy,scotus_justice,494.25,504.637,What would you do if the Senate did not allow the accused official to face and confront the witnesses against him?
1992.91-740,0,21564,david_overlock_stewart,,504.637,510.361,"Your Honor, I'm not sure I completely understand the question."
1992.91-740,0,15113,anthony_m_kennedy,scotus_justice,510.822,514.313,"Well, the Senate says you can't cross-examine any of the witnesses against you."
1992.91-740,0,21564,david_overlock_stewart,,514.313,517.369,"--Your Honor, I think that would not--"
1992.91-740,0,15113,anthony_m_kennedy,scotus_justice,517.369,519.558,And you can't be in the room when they're testifying.
1992.91-740,0,21564,david_overlock_stewart,,519.558,547.446,"--To answer the first question, you can't cross-examine the witnesses, we state that the irreducible requirement of the trial is the opportunity to present your case, present your witnesses, and confront the witnesses against you, so there would be a right of cross-examination, and you could pose that hypothetical where there is no right of cross-examination, and I would say that is not a trial, but if the issue were one of the scope of cross-examination, that would be one confined to the discretion of the Senate."
1992.91-740,0,15113,anthony_m_kennedy,scotus_justice,547.446,550.669,What is the standard?
1992.91-740,0,21564,david_overlock_stewart,,561.588,567.782,"There has to be a specific requirement in the Constitution, and I draw this from Baker and Carr and also from Powell v. McCormack."
1992.91-740,0,15141,william_h_rehnquist,scotus_justice,584.104,608.781,"Mr. Stewart, in both the trial of Samuel Chase and the trial of Andrew Johnson there was a great deal of motion being made and demands made for continuance on the part of the defendants, and the Senate insisted in both cases that they be brought to trial much more rapidly than would be conceivable in an ordinary criminal case."
1992.91-740,0,21564,david_overlock_stewart,,620.651,630.015,"No, sir, and in those instances as I recall the case was extended for a substantial period of time and there certainly was an opportunity to prepare, but no, I do not think that would be reviewable."
1992.91-740,0,15141,william_h_rehnquist,scotus_justice,630.015,639.692,"Well, would you say that if you're going to be divested of the office of associate justice or of President that 10 days was sufficient to prepare?"
1992.91-740,0,21564,david_overlock_stewart,,639.692,658.286,"No, I would not, an interestingly, I think the Framers imposing the Trial Clause were very wise to impose the Trial Clause, because when you're dealing with the chief justice or a justice of the Supreme Court or the President, there is a political attention to this which I think will slow down the process in most instances."
1992.91-740,0,15141,william_h_rehnquist,scotus_justice,669.515,678.791,So you would read the Trial Clause differently if you're dealing with a lower court judge than if you're dealing with some highly visible official?
1992.91-740,0,21564,david_overlock_stewart,,678.791,680.544,"I don't mean to say that, Your Honor, no."
1992.91-740,0,15042,david_h_souter,scotus_justice,685.856,691.991,You rest your argument on the assumption that the meaning of the word trial is clear.
1992.91-740,0,21564,david_overlock_stewart,,697.777,724.883,"Your Honor, I think to rule in our favor the Court has to conclude that the word try does have meaning and the meaning is as we say that there is an irreducible requirement of an opportunity to present your case and confront your case, and that meaning I don't think is so elusive when you compare the impeachment clause to other clauses of the Constitution creating powers for the Senate... for example, the power to be the judge of elections."
1992.91-740,0,15042,david_h_souter,scotus_justice,768.152,789.296,"All right, but if we should disagree with you about the clarity of meaning, do I understand you correctly to concede that the case should... and we conclude that the word is ambiguous, do I understand you correctly to concede that the case should be decided just as it would be as if we were dealing with an issue which the Constitution did not expressly address in any way?"
1992.91-740,0,21564,david_overlock_stewart,,800.584,803.016,"Your Honor, I think we would lose."
1992.91-740,0,15042,david_h_souter,scotus_justice,808.562,809.831,But that's the least of your concerns.
1992.91-740,0,21564,david_overlock_stewart,,809.831,809.981,"Yes, sir."
1992.91-740,0,15042,david_h_souter,scotus_justice,809.981,810.522,Okay.
1992.91-740,0,21564,david_overlock_stewart,,820.409,829.475,"Yes, it is, and I'd be happy to address it, because it seems to me that justiciability, as I was saying earlier, hangs so much on the word sole."
1992.91-740,0,15113,anthony_m_kennedy,scotus_justice,898.843,911.021,Could the accused official waive the right that you claim is his?
1992.91-740,0,21564,david_overlock_stewart,,930.685,931.196,Absolutely.
1992.91-740,0,15113,anthony_m_kennedy,scotus_justice,935.49,942.806,But if you were a Senator I take it you would stand up on the floor of the Senate and say I must point out that this is an unconstitutional proceeding.
1992.91-740,0,21564,david_overlock_stewart,,942.806,950.11,"--If I were a Senator and I objected to that because I wanted to hear the testimony, then I would have the right to go listen to the testimony."
1992.91-740,0,15113,anthony_m_kennedy,scotus_justice,950.11,954.891,"Well, I think you'd have the obligation to tell your colleagues that they are proceeding in an unconstitutional manner, wouldn't you?"
1992.91-740,0,21564,david_overlock_stewart,,954.891,969.601,"You would have the... you could do so, but no, I don't think that that is proceeding in an unconstitutional manner, because the right inheres in the individual, and if the individual chooses to waive that right, he certainly has the power to do so."
1992.91-740,0,15071,byron_r_white,scotus_justice,995.63,1005.334,So you really are suggesting we treat this case as though there hadn't been any trial at all in terms of judiciability.
1992.91-740,0,21564,david_overlock_stewart,,1005.334,1006.456,"Yes, Your Honor."
1992.91-740,0,15049,antonin_scalia,scotus_justice,1046.874,1062.554,"Well, when the Constitution gives this Court original jurisdiction in certain matters... those, for example, in which a State is a party, don't you think that meant that the trial would be before us?"
1992.91-740,0,21564,david_overlock_stewart,,1067.397,1074.613,"Your Honor, I'm not sure that I... I think that's certainly a tenable view, but it is not the use of the word try."
1992.91-740,0,15049,antonin_scalia,scotus_justice,1076.606,1085.651,"No, it doesn't use the word try, but doesn't original jurisdiction contemplate that the trial would be before the Supreme Court, and yet we do exactly what you say can't be done in the Senate trial."
1992.91-740,0,21564,david_overlock_stewart,,1088.095,1100.483,"--I think it may well have been an intent, but it is not expressed, and moreover there is no right to assert except in the case of an individual, that the States cannot assert a Seventh Amendment right to a jury trial."
1992.91-740,0,15141,william_h_rehnquist,scotus_justice,1100.483,1101.905,How about an ambassador?
1992.91-740,0,21564,david_overlock_stewart,,1101.905,1103.806,I don't believe so.
1992.91-740,0,15141,william_h_rehnquist,scotus_justice,1103.806,1107.188,"An ambassador is not an individual, then, in your view."
1992.91-740,0,21564,david_overlock_stewart,,1107.188,1114.875,"Your Honor, I would have to review the Seventh Amendment again, but I don't think that is the intent behind that provision."
1992.91-740,0,15049,antonin_scalia,scotus_justice,1213.75,1215.022,"Well, that doesn't necessarily follow."
1992.91-740,0,21564,david_overlock_stewart,,1229.544,1261.003,"Your Honor, I think that comes back to the question of is it the Senate's sole power to decide what is the content, or is it this Court's power to say what the law is, to construe the law, and I think an impeachment, just as in questions of the viability of a commission to be a magistrate of the District of Columbia, this Court must exercise jurisdiction, must review the question in the absence of anything that denies jurisdiction or in the absence of any indication that there are no judiciable standards to apply."
1992.91-740,0,15049,antonin_scalia,scotus_justice,1261.003,1265.698,"Well, you are running a slippery slope kind of an argument... if trial doesn't mean anything, where does it end?"
1992.91-740,0,21564,david_overlock_stewart,,1283.033,1293.569,"No, Your Honor, I don't think so, because we have attempted to provide the line we think needs to be applied here, which is the trial is the opportunity to present witnesses and to confront witnesses."
1992.91-740,0,15049,antonin_scalia,scotus_justice,1293.949,1294.069,And what if--
1992.91-740,0,21564,david_overlock_stewart,,1294.069,1294.48,--Excuse me.
1992.91-740,0,15049,antonin_scalia,scotus_justice,1294.48,1297.072,--What if there's a mistake made so that one element is not there?
1992.91-740,0,21564,david_overlock_stewart,,1301.346,1303.356,I don't understand.
1992.91-740,0,15049,antonin_scalia,scotus_justice,1304.578,1304.858,You know harmless error.
1992.91-740,0,21564,david_overlock_stewart,,1304.858,1305.829,--The admission of hearsay--
1992.91-740,0,15049,antonin_scalia,scotus_justice,1305.829,1308.201,"Well, whatever."
1992.91-740,0,21564,david_overlock_stewart,,1325.474,1328.095,"--Your Honor, I think there has--"
1992.91-740,0,15049,antonin_scalia,scotus_justice,1328.095,1332.347,"Now, if you say there's a harmless error rule, I'm going to say, well then we have to evaluate the weight of the evidence, don't we?"
1992.91-740,0,21564,david_overlock_stewart,,1333.078,1334.359,--I wasn't going to say that.
1992.91-740,0,15049,antonin_scalia,scotus_justice,1335.45,1337.103,So there's no harmless error rule at all.
1992.91-740,0,21564,david_overlock_stewart,,1337.103,1338.154,I appreciate being helped.
1992.91-740,0,15049,antonin_scalia,scotus_justice,1338.154,1339.366,"The slightest mistake, and the whole thing goes out."
1992.91-740,0,21564,david_overlock_stewart,,1339.366,1346.93,"Well, that's like if there was a two-thirds requirement and they're only one vote short of two-thirds, does this Court say well gee, they were awful close?"
1992.91-740,0,15141,william_h_rehnquist,scotus_justice,1350.633,1358.799,"What about applying the confrontation clause to the admission of hearsay... you know, various exceptions to the hearsay rule?"
1992.91-740,0,21564,david_overlock_stewart,,1364.204,1376.612,"No, Your Honor, I do not think that admissibility questions like that, whether... one of the impeachment trials in 1986 involved papers that were... the argument was that they were improperly seized."
1992.91-740,0,15141,william_h_rehnquist,scotus_justice,1376.612,1380.885,But failure to allow cross-examination is raisable in your view.
1992.91-740,0,21564,david_overlock_stewart,,1380.885,1383.097,"I think that is the irreducible requirement, yes, sir."
1992.91-740,0,15141,william_h_rehnquist,scotus_justice,1383.097,1387.27,What about an undue shortening of cross-examination?
1992.91-740,0,21564,david_overlock_stewart,,1387.27,1392.374,"Your Honor, that is the point at which you would have to have a court look at the question."
1992.91-740,0,15049,antonin_scalia,scotus_justice,1423.645,1436.793,"The two-thirds majority, you would have witnesses in the chamber who would... I mean, is it only what... you said before, if it appears in the record that there is not a... why does it have to appear in the record?"
1992.91-740,0,21564,david_overlock_stewart,,1447.752,1453.845,"Well, no, I think there would be certainly be an obligation on defense counsel to call to the attention of the court... the Senate--"
1992.91-740,0,15049,antonin_scalia,scotus_justice,1453.845,1454.036,Right.
1992.91-740,0,21564,david_overlock_stewart,,1454.036,1456.567,--As a court that there is the absence of a quorum.
1992.91-740,0,15049,antonin_scalia,scotus_justice,1456.567,1457.538,"Yes, but the Senate ignores it."
1992.91-740,0,21564,david_overlock_stewart,,1458.028,1461.452,"If the Senate is so reckless as to ignore it, and it is stated--"
1992.91-740,0,15049,antonin_scalia,scotus_justice,1461.452,1463.495,--Then you'd come to us with your affidavits and say there was not a quorum.
1992.91-740,0,21564,david_overlock_stewart,,1463.495,1464.984,"--We state it on the record, yes, sir."
1992.91-740,0,15049,antonin_scalia,scotus_justice,1464.984,1471.469,And we're going to judge whether there was a quorum in the Senate on the basis of affidavits provided by your witnesses.
1992.91-740,0,21564,david_overlock_stewart,,1471.469,1476.354,One of the virtues of the video age we're in is that the Senate proceedings are now televised.
1992.91-740,0,15113,anthony_m_kennedy,scotus_justice,1485.871,1489.214,"Well, actually, you don't come to us, you come to the district court--"
1992.91-740,0,21564,david_overlock_stewart,,1489.214,1489.384,"Yes, sir."
1992.91-740,0,15113,anthony_m_kennedy,scotus_justice,1489.384,1501.551,"--And then to the court of appeals, and then to this Court, and in the case, say, of an impeachment of the President, that could go on easily 21/2 years, I should think, probably 3--"
1992.91-740,0,21564,david_overlock_stewart,,1501.551,1502.993,"Your Honor, that's--"
1992.91-740,0,15113,anthony_m_kennedy,scotus_justice,1502.993,1519.383,--And I think you ought to address the argument that the Solicitor General makes that this would put this Nation at grave risk in the event of an impeachment of the President that was winding its way through the courts on judicial review.
1992.91-740,0,21564,david_overlock_stewart,,1519.383,1522.015,"--Your Honor, you pose a very difficult question."
1992.91-740,0,15113,anthony_m_kennedy,scotus_justice,1547.284,1549.317,But it's not just the delay.
1992.91-740,0,21564,david_overlock_stewart,,1564.578,1578.279,"--Your Honor, I think the most pernicious effect on the Constitution and on the history of this country would be if this Court would simply... and the courts in general simply avert their eyes from an unconstitutional impeachment and surely an unconstitutional impeachment--"
1992.91-740,0,15049,antonin_scalia,scotus_justice,1578.279,1600.882,"Mr. Stewart, don't you think that Framers who had enough foresight to provide for original jurisdiction by this Court in cases involving ambassadors, in cases involving the States, would also have had enough foresight to provide for original jurisdiction by this Court if they thought that the courts were being able to review at least impeachments of the President?"
1992.91-740,0,21564,david_overlock_stewart,,1614.425,1615.997,"--Your Honor, I don't think so."
1992.91-740,0,15141,william_h_rehnquist,scotus_justice,1638.853,1640.674,"Very well, Mr. Stewart."
1992.91-740,1,33983,kenneth_w_starr,,1642.967,1646.688,"Mr. Chief Justice, and may it please the Court:"
1992.91-740,1,15113,anthony_m_kennedy,scotus_justice,1701.265,1703.597,Are the committee hearings part of the trial?
1992.91-740,1,33983,kenneth_w_starr,,1703.597,1704.228,Yes.
1992.91-740,1,15113,anthony_m_kennedy,scotus_justice,1704.228,1712.061,Then I take it if the President were impeached and a committee was sitting the chief justice would preside over the committee.
1992.91-740,1,33983,kenneth_w_starr,,1712.061,1715.565,"It is very possible that that would be the case, but I think--"
1992.91-740,1,15113,anthony_m_kennedy,scotus_justice,1715.565,1717.638,"Well, he would have to if it's part of the trial, wouldn't he?"
1992.91-740,1,33983,kenneth_w_starr,,1717.638,1721.457,"--I think that is quite arguably the case, Justice Kennedy."
1992.91-740,1,15049,antonin_scalia,scotus_justice,1796.128,1822.223,"But General Starr, when that rule was adopted in 1904 according to your opponent here it was contemplated that it would be voluntary on the part of the person being impeached, and indeed, maybe many of them would prefer to be tried by 12 Senators who were there than by 100 who weren't, so one can see why that would have some attraction."
1992.91-740,1,33983,kenneth_w_starr,,1822.223,1830.6,"Justice Scalia, it's fair to say that the Senate was not of one mind with respect to the constitutionality of Rule XI."
1992.91-740,1,15049,antonin_scalia,scotus_justice,2090.152,2097.999,"Well, we could issue a stay pending appeal, General Starr, I guess, right... a stay or removal pending appeal, or something like that?"
1992.91-740,1,33983,kenneth_w_starr,,2097.999,2104.314,"You have the raw power to do that, but I don't think that it would be a constitutional act."
1992.91-740,1,15049,antonin_scalia,scotus_justice,2104.314,2106.234,"Who would we direct that to, the Senate?"
1992.91-740,1,33983,kenneth_w_starr,,2106.234,2109.436,It seems to me--
1992.91-740,1,15049,antonin_scalia,scotus_justice,2109.436,2110.668,I assume the removal is automatic.
1992.91-740,1,33983,kenneth_w_starr,,2114.491,2118.335,"--I think that is right, because the judgment is what removes."
1992.91-740,1,15049,antonin_scalia,scotus_justice,2146.572,2154.829,I notice in the recent district court there has been a district court judgment reversing an impeachment of another judge--
1992.91-740,1,33983,kenneth_w_starr,,2154.829,2155.848,--Precisely.
1992.91-740,1,15049,antonin_scalia,scotus_justice,2155.848,2158.78,--And the end of the judgment was that the case is remanded to the Senate.
1992.91-740,1,33983,kenneth_w_starr,,2158.78,2160.472,That is correct.
1992.91-740,1,15060,john_paul_stevens,scotus_justice,2216.791,2232.552,"May I ask, General Starr, do you think the Senate or the House could have impeached a judge and merely recited the fact that he had been convicted of a crime and that was the ground of impeachment and then the evidence of that be sufficient before the Senate to remove him?"
1992.91-740,1,33983,kenneth_w_starr,,2232.552,2234.063,"Yes, I do--"
1992.91-740,1,15060,john_paul_stevens,scotus_justice,2234.063,2237.925,So you think all of this was process and may not have even been necessary.
1992.91-740,1,33983,kenneth_w_starr,,2237.925,2261.052,"--I think it was not necessary, but I think, Justice Stevens, that clearly a majority of the Senators did feel... and I know Mr. Stewart's position is that there is a constitutional right to a separate proceeding that must involve a sense of what the evidence was in the case, and that's the sober judgment of the Senators."
1992.91-740,1,15071,byron_r_white,scotus_justice,2281.715,2288.161,--you say the Senate would have the power just to impeach based on a criminal conviction.
1992.91-740,1,33983,kenneth_w_starr,,2288.161,2288.949,To convict.
1992.91-740,1,15049,antonin_scalia,scotus_justice,2367.313,2367.954,"That may well be, General Starr."
1992.91-740,1,33983,kenneth_w_starr,,2374.148,2374.889,That's correct.
1992.91-740,1,15049,antonin_scalia,scotus_justice,2374.889,2377.811,They could have impeached him for poisoning a neighbor's cat--
1992.91-740,1,33983,kenneth_w_starr,,2377.811,2379.073,That is correct.
1992.91-740,1,15049,antonin_scalia,scotus_justice,2379.073,2381.965,--And called that a high crime and misdemeanor and you'd say that's good enough for you--
1992.91-740,1,33983,kenneth_w_starr,,2381.965,2383.223,That's correct.
1992.91-740,1,15049,antonin_scalia,scotus_justice,2383.223,2385.026,--And there could have not been a quorum present.
