file_name,section,speaker_id,speaker_name,speaker_role,start,stop,text
1992.91-740,1,33983,kenneth_w_starr,,2387.848,2394.142,We'd have to accept... I think this Court's decisions in Ballin and Field v. Clark say we accept the records of the Senate.
1992.91-740,1,15049,antonin_scalia,scotus_justice,2395.795,2398.396,--Suppose it's clear on the records of the Senate that there was not a quorum present?
1992.91-740,1,33983,kenneth_w_starr,,2398.396,2401.067,--I think that the judgment still stands.
1992.91-740,1,15092,sandra_day_oconnor,scotus_justice,2403.461,2404.46,What if--
1992.91-740,1,33983,kenneth_w_starr,,2404.46,2406.302,--Possible arena of Powell v. McCormack.
1992.91-740,1,15092,sandra_day_oconnor,scotus_justice,2406.302,2413.858,--What if the record shows that there was not a vote of two-thirds of the Senate to convict?
1992.91-740,1,33983,kenneth_w_starr,,2413.858,2424.857,"We think that as long as the records themselves are being accepted, that it does seem to us that we are in the arena of Powell v. McCormack at that stage."
1992.91-740,1,15092,sandra_day_oconnor,scotus_justice,2451.184,2453.905,So in your view that might be justiciable.
1992.91-740,1,33983,kenneth_w_starr,,2453.905,2454.166,Yes.
1992.91-740,1,15092,sandra_day_oconnor,scotus_justice,2454.166,2467.456,"Is the claim before us today... should we treat it as nonjusticiable, or just committed by the text to the discretion of the Senate?"
1992.91-740,1,33983,kenneth_w_starr,,2467.456,2491.951,"The former because of the latter, that the text itself, when we also contemplate the structure of the Constitution and the purpose of impeachment in our system of separated powers, that it does satisfy, it seems to us, at a minimum two of the criteria laid down by this Court in Baker v. Carr, a textual commitment to the Senate."
1992.91-740,1,15113,anthony_m_kennedy,scotus_justice,2508.454,2518.15,So you do want us to rule that the question of the meaning of trial is textually committed to the Senate.
1992.91-740,1,33983,kenneth_w_starr,,2518.15,2518.431,--Yes.
1992.91-740,1,15113,anthony_m_kennedy,scotus_justice,2518.431,2519.652,You do want us to rule--
1992.91-740,1,33983,kenneth_w_starr,,2519.652,2528.589,"Yes, we do, but even if... and this Court has struggled, as have we and others, with the political question doctrine."
1992.91-740,1,15113,anthony_m_kennedy,scotus_justice,2555.067,2564.071,"--That leaves open the two-thirds vote, the quorum and all those other issues, for future litigation, then."
1992.91-740,1,33983,kenneth_w_starr,,2564.071,2565.293,It does indeed.
1992.91-740,1,15071,byron_r_white,scotus_justice,2666.012,2679.964,"I suppose that at least what the Senate... the procedure the Senate might adopt, I suppose they would have to call it a trial, wouldn't they?"
1992.91-740,1,33983,kenneth_w_starr,,2679.964,2688.608,"--It seems to me... they might have to call it a trial in one sense, but Justice White, here's the reason I'm struggling with that."
1992.91-740,1,15071,byron_r_white,scotus_justice,2693.73,2700.025,"Well, whatever it meant, they have to be able to... they have to fit it within the word try."
1992.91-740,1,33983,kenneth_w_starr,,2700.025,2701.397,--They have to fit it within the word try.
1992.91-740,1,15071,byron_r_white,scotus_justice,2729.857,2746.968,"So if the Senate has a rule... had a rule that anyone who's been convicted, any Federal officer who's been convicted of a felony, and the judgment is final, we just automatically... he is automatically guilty."
1992.91-740,1,33983,kenneth_w_starr,,2761.089,2767.081,"Because you use the word automatic, it concerns me as to whether there, Justice White, is that examination as a judge."
1992.91-740,1,15071,byron_r_white,scotus_justice,2787.566,2791.018,"So if they did that, that in your view would be judicially reviewable."
1992.91-740,1,33983,kenneth_w_starr,,2791.018,2799.835,"It might be in terms of whether there was an examination at all, whether the Senate was examining as a judge, but it might be."
1992.91-740,1,15042,david_h_souter,scotus_justice,2824.852,2833.578,And those procedures that you refer to as having been entrusted to the Senate are in other words those which are not necessarily implied by the word trial itself.
1992.91-740,1,33983,kenneth_w_starr,,2833.578,2846.395,"That's correct, because as we've noted in our brief, Rufus King, one of the delegates who also served on the Committee of Style, referred to the President and members of the legislature being tried by their electors--"
1992.91-740,1,15042,david_h_souter,scotus_justice,2846.395,2846.976,What if we took--
1992.91-740,1,33983,kenneth_w_starr,,2846.976,2847.787,--A judgment... I'm sorry.
1992.91-740,1,15042,david_h_souter,scotus_justice,2847.787,2848.278,--I'm sorry.
1992.91-740,1,33983,kenneth_w_starr,,2887.544,2894.06,"If I concede that... I'm sorry, I'm not sure I follow the language."
1992.91-740,1,15042,david_h_souter,scotus_justice,2894.06,2909.94,"Would you concede that we would have a judiciable... the courts would have a judiciable controversy here if, 1) we concluded as a matter of law the trial implied the reception of evidence directly by the findings of fact?"
1992.91-740,1,33983,kenneth_w_starr,,2909.94,2910.08,No.
1992.91-740,1,15042,david_h_souter,scotus_justice,2910.291,2911.312,You would not concede that.
1992.91-740,1,33983,kenneth_w_starr,,2911.312,2926.824,"I would not concede that, because it seems to me that... and now I'm going to be formalistic, and that is I'm going to rely on the sole... the grant of that sole power to try, it seems to me, carries with it the interpretive power to determine what the procedures are going to be."
1992.91-740,1,15042,david_h_souter,scotus_justice,2926.824,2927.324,But--
1992.91-740,1,33983,kenneth_w_starr,,2927.324,2928.193,But... sorry.
1992.91-740,1,15042,david_h_souter,scotus_justice,2928.193,2934.558,"--Why, then, don't you say the same thing with respect to the interpretive power to determine what is a two-third majority?"
1992.91-740,1,33983,kenneth_w_starr,,2941.424,2945.878,It seems to me that we are in two structurally different domains.
1992.91-740,1,15042,david_h_souter,scotus_justice,2952.342,2952.572,Right.
1992.91-740,1,33983,kenneth_w_starr,,2952.572,2954.004,--And sit in judgment.
1992.91-740,1,15042,david_h_souter,scotus_justice,2954.004,2955.634,"Could I just short-circuit this, maybe make this simpler--"
1992.91-740,1,33983,kenneth_w_starr,,2955.634,2955.804,Yes.
1992.91-740,1,15042,david_h_souter,scotus_justice,2955.804,2956.676,--Than I started out to make it.
1992.91-740,1,33983,kenneth_w_starr,,2965.351,2965.661,Yes.
1992.91-740,1,15042,david_h_souter,scotus_justice,2965.661,2971.866,"Now, do you concede that because that is an issue of fact which is easily resolved?"
1992.91-740,1,33983,kenneth_w_starr,,2971.866,2972.337,No.
1992.91-740,1,15042,david_h_souter,scotus_justice,2972.337,2972.928,Why?
1992.91-740,1,33983,kenneth_w_starr,,2974.24,2974.39,No.
1992.91-740,1,15042,david_h_souter,scotus_justice,3030.859,3033.28,"So it's a difference in emphasis, then."
1992.91-740,1,33983,kenneth_w_starr,,3033.28,3034.222,It's the fact--
1992.91-740,1,15042,david_h_souter,scotus_justice,3034.222,3061.499,"If, for example... if I varied my example and said trial not only means the... not only requires the presence of all the fact-finders but they had said trial, parenthesis, at which of course all Members of the Senate will be present, end paren, you would find there had not been such a commitment to the Senate simply by virtue of the emphasis on that requirement and the need to enforce it somehow beyond the Senate itself."
1992.91-740,1,33983,kenneth_w_starr,,3061.499,3074.739,"--You're using the term emphasis, and without trying to quibble, I'm trying to say, Justice Souter, that I am emphasizing the fact that the text itself specifically defines what the majority is."
1992.91-740,1,15141,william_h_rehnquist,scotus_justice,3144.158,3144.328,General Starr--
1992.91-740,1,33983,kenneth_w_starr,,3144.328,3144.558,"Yes, I'm sorry."
1992.91-740,1,15141,william_h_rehnquist,scotus_justice,3144.558,3156.266,"--Supposing that during an impeachment trial of the Senate the chief justice dies, and the Senate says well, there's by statute created the office of vice chief justice."
1992.91-740,1,33983,kenneth_w_starr,,3165.131,3165.952,This is the impeachment of the President.
1992.91-740,1,15141,william_h_rehnquist,scotus_justice,3165.952,3167.484,The impeachment of the President.
1992.91-740,1,33983,kenneth_w_starr,,3181.275,3193.994,"It seems to me that under our theory I have to admit that if the chief justice, whoever it be, he or she, the acting chief justice is not in the Chair, then that is judicially reviewable."
1992.91-740,1,15049,antonin_scalia,scotus_justice,3193.994,3194.973,You have to admit--
1992.91-740,1,33983,kenneth_w_starr,,3205.271,3209.732,I think it is a most appropriate first question--
1992.91-740,1,15071,byron_r_white,scotus_justice,3209.732,3210.433,"Well, I know, but--"
1992.91-740,1,33983,kenneth_w_starr,,3210.433,3211.424,"--To answer, and yet--"
1992.91-740,1,15071,byron_r_white,scotus_justice,3211.424,3212.355,--Jurisdictional?
1992.91-740,1,33983,kenneth_w_starr,,3212.355,3217.288,"--I don't think it divests you of... I think you have jurisdiction, obviously, to decide that, but the most--"
1992.91-740,1,15071,byron_r_white,scotus_justice,3217.288,3232.94,"So you think it would be proper to say, well we assume judiciability without deciding it, but we think the Senate clearly had the power to do what it did."
1992.91-740,1,33983,kenneth_w_starr,,3232.94,3260.108,"--It seems to me that while you're not drained of jurisdiction to do that, in terms of the appropriateness of the exercise of the judicial power, if in fact the matter has been entrusted to another branch, then it seems to me that it is part of your duty to resolve that question first as opposed to saying that is such a difficult question, but it's actually easy for us when we move to the merits to say this is a perfectly sensible procedure."
1992.91-740,1,15049,antonin_scalia,scotus_justice,3270.844,3280.251,"General Starr, if I understand your theory, you're quite right trial does not have a precise content, but surely it has some content."
1992.91-740,1,33983,kenneth_w_starr,,3293.823,3294.444,Yes.
1992.91-740,1,15049,antonin_scalia,scotus_justice,3294.444,3298.354,"What if you refuse to hear to hear all evidence, you just don't let the defendant put on any evidence at all."
1992.91-740,1,33983,kenneth_w_starr,,3298.765,3299.967,"Yes, it is, under--"
1992.91-740,1,15049,antonin_scalia,scotus_justice,3299.967,3302.568,"What is not a trial, in your view?"
1992.91-740,1,33983,kenneth_w_starr,,3304.25,3317.749,"--I suggest a difficulty with the automatic rule that we're not going to consider anything at all because we have an automatic rule which we're going to apply, because it does seem to me that the term try means that you're coming to judgment, but yes, if you--"
1992.91-740,1,15049,antonin_scalia,scotus_justice,3317.749,3332.337,"I think it's an artificial system you're setting up when you say two-thirds has a meaning and chief justice shall preside has a meaning, oath or affirmation has a meaning, but trial has no meaning whatever."
1992.91-740,1,33983,kenneth_w_starr,,3335.59,3342.384,"--I think it does... I'm sorry, in the abstract, of course it has meaning, but who's going to give content to the meaning in our view is the Senate."
1992.91-740,1,15049,antonin_scalia,scotus_justice,3342.384,3342.565,At the margins.
1992.91-740,1,33983,kenneth_w_starr,,3345.798,3347.948,"But Justice Scalia, my point is this."
1992.91-740,1,15049,antonin_scalia,scotus_justice,3357.094,3362.359,"I may agree with that, but I would say the same about the chief justice presiding, about the two-thirds, and all the rest of it as well."
1992.91-740,1,33983,kenneth_w_starr,,3362.359,3366.303,"--Well, that's fine, if you want to view that as nonjudiciable, that's fine."
1992.91-740,1,15049,antonin_scalia,scotus_justice,3368.816,3372.567,"Well, I just don't see any logical basis for drawing a line between the two."
1992.91-740,1,33983,kenneth_w_starr,,3372.567,3378.832,"--If I may say so with all respect, that may be the difficulty that you're having with Powell v. McCormack as opposed to our submission."
1992.91-740,1,15113,anthony_m_kennedy,scotus_justice,3378.832,3387.177,"If you say... if that's the operative word that you say the Senate must construe, I take it then you don't rely on sole power."
1992.91-740,1,33983,kenneth_w_starr,,3391.161,3392.292,Absolutely.
1992.91-740,1,15071,byron_r_white,scotus_justice,3399.498,3414.017,So the House could impeach saying the judge is a bad guy and the Senate could take a vote without any trial or anything else and say... they unanimously say the judge is a bad guy.
1992.91-740,1,33983,kenneth_w_starr,,3414.017,3420.772,"Justice White, my theory has to... leads me to answer that question yes."
1992.91-740,1,15071,byron_r_white,scotus_justice,3420.772,3421.083,Yes.
1992.91-740,1,33983,kenneth_w_starr,,3421.083,3438.334,"But will you permit me also to say that will not happen, and we saw that, by the way, in 1986, when there was a hue and cry by virtue of the decision of the 11th Circuit in the infamous Allday case, and thoughtful consideration was given by the House of Representatives... I'm sorry."
1992.91-740,1,15141,william_h_rehnquist,scotus_justice,3439.686,3441.256,"Thank you, General Starr."
1992.91-740,2,21564,david_overlock_stewart,,3443.788,3445.55,"Thank you, Your Honor."
1992.91-740,2,15049,antonin_scalia,scotus_justice,3519.198,3531.866,"Mr. Stewart, I suppose after these arguments are over the nine of us could go in the back room and just flip a coin or draw straws as to how the decision should come out and it would be promulgated."
1992.91-740,2,21564,david_overlock_stewart,,3538.362,3539.683,"--That is not reversible, Your Honor."
1992.91-740,2,15049,antonin_scalia,scotus_justice,3539.683,3540.604,It is not reversible.
1992.91-740,2,21564,david_overlock_stewart,,3549.46,3555.435,"And of course, Your Honor, we're not saying that the Senator's reasons for voting are subject to review by this Court."
1992.91-740,2,15049,antonin_scalia,scotus_justice,3564.254,3567.907,"But you're saying they can't draw straws or flip a coin, but we can."
1992.91-740,2,21564,david_overlock_stewart,,3567.907,3570.22,We are not going to the decision.
1992.91-740,2,15049,antonin_scalia,scotus_justice,3590.733,3595.778,"The issue is somebody has to be trusted as the last word, isn't that the simple issue?"
1992.91-740,2,21564,david_overlock_stewart,,3609.92,3611.449,If I may answer the question--
