file_name,section,speaker_id,speaker_name,speaker_role,start,stop,text
1993.93-5418,1,15049,antonin_scalia,scotus_justice,3016.9,3023.739,"We say, in effect, he may well be held in violation of Federal law, but he has had a full and fair opportunity to litigate that, end of matter."
1993.93-5418,1,15408,arend_j_abel,,3023.739,3025.872,"Exactly, Justice Scalia."
1993.93-5418,1,15141,william_h_rehnquist,scotus_justice,3041.617,3043.384,"Thank you, Mr. Abel."
1993.93-5418,2,32967,jerold_s_solovy,,3045.653,3049.605,"Thank you, Mr. Chief Justice Rehnquist, may it please the Court:"
1993.93-5418,2,15141,william_h_rehnquist,scotus_justice,3196.081,3197.466,"Thank you, Mr. Solovy."
