file_name,section,speaker_id,speaker_name,speaker_role,start,stop,text
1994.94-623,1,15113,anthony_m_kennedy,scotus_justice,2589.618,2593.252,"Well, why doesn't that operate to restore COGSA, then?"
1994.94-623,1,43475,thomas_c_walsh,,2593.252,2603.297,"I don't... at the moment I can't think of the answer, Your Honor, although I had it earlier."
1994.94-623,1,15084,ruth_bader_ginsburg,scotus_justice,2603.948,2605.2,Then perhaps we should--
1994.94-623,1,43475,thomas_c_walsh,,2605.2,2606.25,"--The... excuse me, Your Honor."
1994.94-623,1,15084,ruth_bader_ginsburg,scotus_justice,2606.25,2610.253,--concentrate on the question that Justice O'Connor asked.
1994.94-623,1,43475,thomas_c_walsh,,2660.385,2672.474,"Your Honor, that is correct, it does cost something, but in this case it is not as if your entire evidence is in the United States."
1994.94-623,1,15060,john_paul_stevens,scotus_justice,2692.269,2699.534,"Yes, but your case would be... your legal position would be exactly the same if nobody ever was within 400,000 miles of Japan."
1994.94-623,1,43475,thomas_c_walsh,,2705.986,2707.749,"--That is true, Your Honor."
1994.94-623,1,15060,john_paul_stevens,scotus_justice,2707.749,2713.753,Some of whom might not really want to go to Tokyo to testify for 15 minutes in some kind of an arbitration.
1994.94-623,1,43475,thomas_c_walsh,,2713.753,2719.076,"That is true, Your Honor, and they might decide not to go, and there might be a change in the agreement at that point."
1994.94-623,1,15060,john_paul_stevens,scotus_justice,2719.076,2729.403,"So it may well be, as a practical matter, much more difficult to prove the liability if you have to go 10,000 miles to a distant forum than if you do it right where everybody's right at home."
1994.94-623,1,43475,thomas_c_walsh,,2729.403,2736.126,I cannot quickly tell you whether it's further from Morocco to Tokyo than Morocco to New York.
1994.94-623,1,15060,john_paul_stevens,scotus_justice,2736.126,2738.997,"No, I'm just assuming... my hypothetical is everybody lives in--"
1994.94-623,1,43475,thomas_c_walsh,,2738.997,2739.258,No--
1994.94-623,1,15060,john_paul_stevens,scotus_justice,2739.258,2740.85,--in Boston in my case.
1994.94-623,1,43475,thomas_c_walsh,,2740.85,2743.422,"--If everyone lives in Boston, Your Honor, no one will want to travel."
1994.94-623,1,15060,john_paul_stevens,scotus_justice,2743.422,2746.113,"Yes, and they still, under your view they still--"
1994.94-623,1,43475,thomas_c_walsh,,2754.248,2755.69,"That's true, Your Honor."
1994.94-623,1,15060,john_paul_stevens,scotus_justice,2755.69,2759.572,"I know you will argue it's not different because of the international convention, but I don't think that's essential to your position."
1994.94-623,1,43475,thomas_c_walsh,,2759.572,2768.227,"No, and I think it's important to keep in mind, Your Honor, that what we're talking about is arbitration, a totally different vehicle than litigation."
1994.94-623,1,15060,john_paul_stevens,scotus_justice,2799.128,2814.758,"But I'm not sure how you get around Justice Kennedy's concern that the COGSA says, in so many words, if you have different terms in a bill of lading than those the statute requires, that bill of lading is null and void, and you're saying well, we can write a different bill of lading as long as we have an arbitration clause."
1994.94-623,1,43475,thomas_c_walsh,,2815.758,2822.903,"My belief is that there's nothing in COGSA, Your Honor, which says I cannot put an arbitration clause in a bill of lading."
1994.94-623,1,15060,john_paul_stevens,scotus_justice,2841.966,2842.466,--But you'd also say--
1994.94-623,1,43475,thomas_c_walsh,,2842.466,2843.658,--and also say it's greater or lesser.
1994.94-623,1,15060,john_paul_stevens,scotus_justice,2843.658,2846.91,"--that applying a different nation's law does not lessen liability, either."
1994.94-623,1,43475,thomas_c_walsh,,2850.151,2851.081,"Yes, Your Honor."
1994.94-623,1,15042,david_h_souter,scotus_justice,2858.227,2870.595,"But you could lose on that point entirely, and still you would maintain... I assume you would maintain the position that the mere existence of the arbitration clause is not what the statute means by lessening liability."
1994.94-623,1,43475,thomas_c_walsh,,2870.595,2872.435,"That is correct, Your Honor, absolutely."
1994.94-623,1,15049,antonin_scalia,scotus_justice,2872.435,2872.695,Okay.
1994.94-623,1,43475,thomas_c_walsh,,2887.706,2893.62,"the lower court, my recollection is, Your Honor, simply said that issue's not before us."
1994.94-623,1,15060,john_paul_stevens,scotus_justice,2893.62,2906.57,"Yes, but by doing that it said we can assume arguendo that it's different, and we still will require arbitration, and if your position depends on them being the same, then there is not a necessary finding that they are the same."
1994.94-623,1,43475,thomas_c_walsh,,2906.57,2909.441,Our position does not depend on it being the same.
1994.94-623,1,15060,john_paul_stevens,scotus_justice,2909.441,2915.024,"You're... and under the court of appeals rationale, you're entitled to win, even if they're different."
1994.94-623,1,43475,thomas_c_walsh,,2915.024,2915.825,"Yes, Your Honor."
1994.94-623,1,15060,john_paul_stevens,scotus_justice,2915.825,2917.505,"Because they said, we don't have to decide it."
1994.94-623,1,43475,thomas_c_walsh,,2917.505,2917.886,Yes.
1994.94-623,1,15049,antonin_scalia,scotus_justice,2917.886,2933.387,"But you're making the argument here that you're a fortiori entitled to win if they are the same, and in order to sustain that argument, we have to make a finding about whether they're different or the same, which hasn't been made."
1994.94-623,1,43475,thomas_c_walsh,,2933.387,2935.357,"Correct, Your Honor."
1994.94-623,1,15042,david_h_souter,scotus_justice,2935.357,2958.601,"And I guess... am I correct that what the court of appeals was ultimately assuming was that the question of their resemblance would be decided in the first instance by the arbitrator, the district court would retain jurisdiction, and subject to whatever rules for review of arbitration might exist, the issue could ultimately come back to the district court."
1994.94-623,1,43475,thomas_c_walsh,,2958.601,2960.063,"Yes, Your Honor."
1994.94-623,1,15042,david_h_souter,scotus_justice,2960.833,2963.254,"It simply would be resolved by arbitration in the first instance, is that--"
1994.94-623,1,43475,thomas_c_walsh,,2963.254,2963.624,"--Yes, Your Honor."
1994.94-623,1,15042,david_h_souter,scotus_justice,2963.624,2964.195,--what was assumed?
1994.94-623,1,43475,thomas_c_walsh,,2964.195,2969.929,And the district court here with the security posted retains jurisdiction until this matter is finally ended.
1994.94-623,1,15141,william_h_rehnquist,scotus_justice,2994.696,2995.815,Very well.
