file_name,section,speaker_id,speaker_name,speaker_role,start,stop,text
1998.98-369,1,21550,david_m_smith,,2631.669,2643.744,"We have no... we have no such case, but I think it's fair, Justice Thomas, to conclude that an Inspector General can be told to comply with the law when you conduct an investigation."
1998.98-369,1,15100,clarence_thomas,scotus_justice,2649.919,2652.78,"Well, you could be told... the IG can be told anything."
1998.98-369,1,21550,david_m_smith,,2665.5,2674.496,"In our view, the... the Inspector General can be told by the agency head and/or the appointing authority, the President of the United States, to comply with the law, yes."
1998.98-369,1,15100,clarence_thomas,scotus_justice,2674.496,2675.106,Okay.
1998.98-369,1,21550,david_m_smith,,2677.317,2688.814,"The only examples that we would refer to would be the ones I previously mentioned, that in the... in the statute, in the legislative history it's conceded, for example, that the Inspector General must comply with the Privacy Act."
1998.98-369,1,15100,clarence_thomas,scotus_justice,2706.637,2711.719,"But you would have to agree... I mean, you can't to a specific provision in the IG Act for that."
1998.98-369,1,21550,david_m_smith,,2730.923,2742.891,"The IG's position would have to be, in such a case, that the inclusion of a union rep prohibited or precluded me from conducting an investigation because that's the statutory string that we go through to analyze--"
1998.98-369,1,15100,clarence_thomas,scotus_justice,2742.891,2757.459,"No, but if your argument is, if... if this were my chief of staff who was conducting the... the investigation and I said, look, you are to include the union representative, my chief of staff theoretically as the agency representative would have to do that."
1998.98-369,1,21550,david_m_smith,,2781.566,2782.946,--We think the authority--
1998.98-369,1,15100,clarence_thomas,scotus_justice,2782.946,2785.139,And I'd like you to point to me where that authority is.
1998.98-369,1,21550,david_m_smith,,2785.139,2791.761,"--Well, the... the premise of your question is that it is the agency head that is imposing this requirement on the Inspector General."
1998.98-369,1,21550,david_m_smith,,2791.761,2792.101,That's right.
1998.98-369,1,21550,david_m_smith,,2792.101,2793.023,We think that's incorrect.
1998.98-369,1,15100,clarence_thomas,scotus_justice,2799.338,2812.815,"But your argument is that this IG reports to the Administrator, and if the Administrator can't direct the IG to do precisely what you think the IG should be doing, then I don't know how you can say that the IG reports to the Administrator."
1998.98-369,1,21550,david_m_smith,,2812.815,2816.719,"--Well, I don't want to... I don't want to butt heads with you."
1998.98-369,1,15100,clarence_thomas,scotus_justice,2822.322,2823.673,I bet you the agency head does.
1998.98-369,1,21550,david_m_smith,,2824.494,2828.307,"--In conducting their investigations, they have to comply with the law."
1998.98-369,1,15141,william_h_rehnquist,scotus_justice,2830.166,2832.499,"Thank you, Mr. Smith."
1998.98-369,2,41626,stuart_kirsch,,2845.257,2848.288,"Mr. Chief Justice, and may it please the Court:"
1998.98-369,2,15049,antonin_scalia,scotus_justice,2921.556,2923.018,Excuse me.
1998.98-369,2,41626,stuart_kirsch,,2947.265,2955.369,"Typically it is correct, I would say, that an agency will instruct the employee to appear before the IG."
1998.98-369,2,15141,william_h_rehnquist,scotus_justice,2982.568,2984.939,"You say here, Mr. Kirsch."
1998.98-369,2,41626,stuart_kirsch,,2986.709,2987.199,--Yes.
1998.98-369,2,15141,william_h_rehnquist,scotus_justice,2987.199,2990.082,And what did happen in that respect here?
1998.98-369,2,41626,stuart_kirsch,,2990.082,2997.757,In this case we had a referral from the FBI to the OIG.
1998.98-369,2,15139,stephen_g_breyer,scotus_justice,3040.474,3042.554,What is it--
1998.98-369,2,41626,stuart_kirsch,,3082.693,3088.256,Nothing about specifically that he has to tell--
1998.98-369,2,15139,stephen_g_breyer,scotus_justice,3088.256,3089.765,"No, I'm not saying--"
1998.98-369,2,41626,stuart_kirsch,,3089.765,3090.216,--But--
1998.98-369,2,15139,stephen_g_breyer,scotus_justice,3090.216,3095.66,--Does the... does the head of the agency have the authority to do anything whatsoever in respect to the IG--
1998.98-369,2,41626,stuart_kirsch,,3095.66,3096.801,--Yes.
1998.98-369,2,15139,stephen_g_breyer,scotus_justice,3096.801,3100.113,--that an ordinary citizen of the United States wouldn't have?
1998.98-369,2,41626,stuart_kirsch,,3100.113,3101.634,"Yes, and also--"
1998.98-369,2,15139,stephen_g_breyer,scotus_justice,3101.634,3102.305,What?
1998.98-369,2,41626,stuart_kirsch,,3102.305,3113.411,--the OIG has duties and responsibilities vis-a-vis the agency head and access to certain information that others outside an agency would not have.
1998.98-369,2,15139,stephen_g_breyer,scotus_justice,3153.399,3162.014,Those are examples of instances in which the IG might have some authority that he wouldn't have were he not part of the agency.
1998.98-369,2,41626,stuart_kirsch,,3168.699,3184.638,"By... by... he can tell him to not assert the disciplinary authority of our agency here to compel the attendance of our employees, if he so chose to do that."
1998.98-369,2,15113,anthony_m_kennedy,scotus_justice,3200.068,3210.374,"Could the agency head tell the employee directly, now, when the IG calls you, you don't have to go and I won't give you any discipline unless you have the union rep there?"
1998.98-369,2,41626,stuart_kirsch,,3211.816,3212.587,Yes.
1998.98-369,2,15113,anthony_m_kennedy,scotus_justice,3212.587,3217.5,Would that... that would not be an interference with the OIG's authority?
1998.98-369,2,41626,stuart_kirsch,,3219.21,3232.02,"There's nothing in the OIG act that gives the OIG subpoena power over a particular employee within his agency, and there's nothing that could compel the employee to appear there and to fully cooperate other than disciplinary--"
1998.98-369,2,15113,anthony_m_kennedy,scotus_justice,3232.02,3234.0,"--Well, if that's so, then he wasn't entitled to counsel here, was he?"
1998.98-369,2,41626,stuart_kirsch,,3234.0,3235.401,--I'm sorry.
1998.98-369,2,15113,anthony_m_kennedy,scotus_justice,3235.401,3238.183,"If he was not compelled, he wasn't entitled to counsel in this case."
1998.98-369,2,41626,stuart_kirsch,,3238.183,3246.137,"If he was not compelled in this particular case, the... the statute says compelled to appear before any agency... then he would be entitled to counsel."
1998.98-369,2,15141,william_h_rehnquist,scotus_justice,3247.95,3250.051,"But if he was not compelled, then he was not entitled to counsel."
1998.98-369,2,41626,stuart_kirsch,,3250.051,3262.39,"Perhaps he may not have been entitled to counsel unless there was a custodial interrogation, a criminal type investigation, or some way otherwise overbearing the will of the individual--"
1998.98-369,2,15141,william_h_rehnquist,scotus_justice,3262.39,3270.835,"Well, that would... that would mean that the evidence might not be introduced... introducible in a criminal trial, but that doesn't necessarily mean that he has a right to counsel."
1998.98-369,2,41626,stuart_kirsch,,3270.835,3279.63,--If he... the statute... you are both correct... indicates where an... where an employee is compelled to appear before the agency.
1998.98-369,2,15084,ruth_bader_ginsburg,scotus_justice,3280.992,3303.897,"Mr. Kirsch, I... I would... I had assumed... and please correct me if I'm wrong... that if an employee is told show up at that interview or you lose your job and the employee then says, okay, can we meet in my lawyer's office, that that employee is being compelled to show up at the interview even though he says okay."
1998.98-369,2,41626,stuart_kirsch,,3307.049,3322.647,"--That's exactly our position, that absent an affirmative statement that you don't have to be there, the... the appearance is clear to any employee that their job is in jeopardy for refusal to participate or cooperate fully in an investigation."
1998.98-369,2,15141,william_h_rehnquist,scotus_justice,3370.129,3373.311,You say it's excluded under the labor statute.
1998.98-369,2,41626,stuart_kirsch,,3379.615,3391.404,--They're explicitly excluded by definition of being an agency and therefore would not be subject to the provisions of the labor statute in any respects.
1998.98-369,2,15141,william_h_rehnquist,scotus_justice,3391.404,3399.468,So... so that... you say an FBI investigation is by definition not covered by the--
1998.98-369,2,41626,stuart_kirsch,,3399.468,3403.581,"An exclusive FBI investigation, yes, that would be correct."
1998.98-369,2,15141,william_h_rehnquist,scotus_justice,3428.498,3430.139,"--Thank you, Mr. Kirsch."
1998.98-369,3,20869,david_c_frederick,,3432.099,3451.293,"Justice Kennedy, I'd like to return to your question about who the IG reports to because Executive Order 12993, which is not cited in the briefs, provides that the President shall engage a process to investigate wrongdoing by an Inspector General."
1998.98-369,3,15141,william_h_rehnquist,scotus_justice,3571.804,3572.835,"Thank you, Mr. Frederick."
