file_name,section,speaker_id,speaker_name,speaker_role,start,stop,text
2000.99-1687,2,34750,lee_levine,,2500.575,2503.587,I think it's fairest to say that I'm talking about quantity and quality.
2000.99-1687,2,15139,stephen_g_breyer,scotus_justice,2517.946,2519.215,"Well, given that, then why is it worse?"
2000.99-1687,2,34750,lee_levine,,2530.334,2538.1,"I see your point and this may be a fine distinction in response, but I think it's an important one, Justice Breyer, the physical diary is property."
2000.99-1687,2,15113,anthony_m_kennedy,scotus_justice,2562.435,2572.993,"I guess the case points up that chattel analogies are difficult in a modern age of digitized speech, et cetera."
2000.99-1687,2,34750,lee_levine,,2576.165,2577.515,That's right.
2000.99-1687,2,15113,anthony_m_kennedy,scotus_justice,2577.515,2581.499,And what the Government is trying to do is to recognize that in this statute.
2000.99-1687,2,34750,lee_levine,,2581.499,2582.31,That's correct.
2000.99-1687,2,15141,william_h_rehnquist,scotus_justice,2582.31,2584.13,"Thank you, Mr. Levine."
2000.99-1687,3,42731,thomas_c_goldstein,,2586.043,2597.17,Mr. Chief Justice and may it please the Court:
2000.99-1687,3,15141,william_h_rehnquist,scotus_justice,2635.264,2642.811,"Well, what you then presumably have other ideas as to how the Government might get at this problem, less drastic, perhaps?"
2000.99-1687,3,42731,thomas_c_goldstein,,2643.301,2668.857,"Mr. Chief Justice, we believe that the solution adopted by the Third Circuit, the narrow approach it took is the one that is appropriate under intermediate scrutiny and that is it left in place by and large the redisclosure prohibition but recognized that when the final disclosure is on a question of public significance, and is by a person completely uninvolved in the illegal interception, then the speech rights outweigh."
2000.99-1687,3,15139,stephen_g_breyer,scotus_justice,2694.433,2694.964,So is it a fact--
2000.99-1687,3,15049,antonin_scalia,scotus_justice,2694.964,2699.147,--The newspaper's not going to publish it unless it has public interest?
2000.99-1687,3,42731,thomas_c_goldstein,,2718.311,2719.753,It is a matter of public interest.
2000.99-1687,3,15141,william_h_rehnquist,scotus_justice,2723.323,2730.339,"Well, now what's the difference if we... do our cases articulate any difference between public significance and public interest."
2000.99-1687,3,42731,thomas_c_goldstein,,2730.339,2731.06,--The Court has--
2000.99-1687,3,15141,william_h_rehnquist,scotus_justice,2731.06,2732.86,Can you answer the question yes or no?
2000.99-1687,3,42731,thomas_c_goldstein,,2732.86,2737.124,"--No, because it hasn't been presented, Mr. Chief Justice and I would--"
2000.99-1687,3,15141,william_h_rehnquist,scotus_justice,2737.124,2738.464,And you're presenting it now.
2000.99-1687,3,42731,thomas_c_goldstein,,2738.464,2739.906,--Yes.
2000.99-1687,3,15141,william_h_rehnquist,scotus_justice,2841.114,2841.864,"Well, it's no longer--"
2000.99-1687,3,42731,thomas_c_goldstein,,2852.18,2854.473,That argument is not inconsistent with what I have just said.
2000.99-1687,3,15141,william_h_rehnquist,scotus_justice,2855.713,2856.184,I hope you will.
2000.99-1687,3,42731,thomas_c_goldstein,,2856.184,2869.294,"The radio station here played the tape in this area of northeastern Pennsylvania, Mr. Chief Justice, the New York Times comes along and listens and says oh, my goodness, look what happened here."
2000.99-1687,3,15141,william_h_rehnquist,scotus_justice,2878.278,2883.392,Is that expressed in the Government's brief or is this just something that you're adding to the Government's brief?
2000.99-1687,3,42731,thomas_c_goldstein,,2883.392,2890.918,"Well, Mr. Chief Justice, I'm in the difficult position that this argument is made in one sentence in the Government's reply brief and so this is my understanding."
2000.99-1687,3,15141,william_h_rehnquist,scotus_justice,2890.918,2903.234,"Well, so your feeling is that if it's just disclosed in northeastern Pennsylvania, then someone who discloses it perhaps in northwestern Pennsylvania is disclosing it anew?"
2000.99-1687,3,42731,thomas_c_goldstein,,2903.234,2904.386,Exactly.
2000.99-1687,3,15141,william_h_rehnquist,scotus_justice,2905.996,2906.467,It sure does.
2000.99-1687,3,42731,thomas_c_goldstein,,2906.467,2917.516,--And I... I agree with you that it's ridiculous but it is what the statute says and it's completely consonant with what Congress was apparently attempting to do here.
2000.99-1687,3,15049,antonin_scalia,scotus_justice,2926.001,2928.802,You don't have to read statutes unreasonably.
2000.99-1687,3,42731,thomas_c_goldstein,,2938.312,2950.36,The plain text of the statute uses a much broader term than is suggested by the Solicitor General and let me continue with the other four problems with tailoring.
2000.99-1687,3,15141,william_h_rehnquist,scotus_justice,3053.597,3059.382,Well wouldn't a reporter or a news station ordinarily want to check out a story?
2000.99-1687,3,42731,thomas_c_goldstein,,3063.927,3069.169,"--Mr. Chief Justice, if that's the case then I don't think that we have a problem."
2000.99-1687,3,15049,antonin_scalia,scotus_justice,3102.722,3104.512,"Well, I don't understand that."
2000.99-1687,3,15139,stephen_g_breyer,scotus_justice,3104.512,3104.933,That might be quite difficult.
2000.99-1687,3,42731,thomas_c_goldstein,,3151.796,3156.51,Let me begin by stepping back to the variant on that question that you asked my colleague.
2000.99-1687,3,15049,antonin_scalia,scotus_justice,3216.177,3217.689,He knows it was illegally obtained.
2000.99-1687,3,42731,thomas_c_goldstein,,3226.114,3231.418,It was an obviously... it was obviously recorded and very likely recorded by someone who wasn't a party to it.
2000.99-1687,3,15049,antonin_scalia,scotus_justice,3231.418,3231.638,Okay.
2000.99-1687,3,42731,thomas_c_goldstein,,3232.99,3239.085,Because he is not engaged in anything that anyone believes is wrong.
2000.99-1687,3,15042,david_h_souter,scotus_justice,3252.174,3258.047,"But isn't it the case that by the time the publication which is the subject of this action occurred, the threat was over?"
2000.99-1687,3,42731,thomas_c_goldstein,,3262.428,3264.931,"--With respect, that is not correct, particularly as to my client."
2000.99-1687,3,15042,david_h_souter,scotus_justice,3274.416,3278.34,--Why didn't he just notify the people who were the subjects of the threat?
2000.99-1687,3,42731,thomas_c_goldstein,,3278.34,3278.781,He did.
2000.99-1687,3,15042,david_h_souter,scotus_justice,3278.781,3287.366,Once it goes to the radio station you're not talking about an exception for people who are performing the public service of warning victims.
2000.99-1687,3,42731,thomas_c_goldstein,,3287.366,3292.231,I think that there is something to be said of warning the public.
2000.99-1687,3,15042,david_h_souter,scotus_justice,3292.592,3300.795,"Well, the public's porches weren't going to be blown off, the school committee's porches were going to be blown off, and they were notified."
2000.99-1687,3,42731,thomas_c_goldstein,,3307.351,3310.062,"--When he gave it to the radio station, yes, we were."
2000.99-1687,3,15042,david_h_souter,scotus_justice,3310.062,3324.492,"And at the same time, he was making it known, I forget how, but he was making it known to the victims so that the radio station was not necessary to make it known to the victims and the people who learn through the radio station weren't potential victims."
2000.99-1687,3,42731,thomas_c_goldstein,,3325.443,3326.234,That is correct.
2000.99-1687,3,15042,david_h_souter,scotus_justice,3357.035,3363.259,But who knows that someone upon whom he is depending acted illegally.
2000.99-1687,3,42731,thomas_c_goldstein,,3363.259,3365.23,Has reason to know.
2000.99-1687,3,15042,david_h_souter,scotus_justice,3365.23,3368.152,Has reason to know and certainly there is reason to know here.
2000.99-1687,3,42731,thomas_c_goldstein,,3368.152,3369.912,That's correct.
2000.99-1687,3,15042,david_h_souter,scotus_justice,3369.912,3376.417,"All right, and... and Congress certainly did intend to stop that, it seems to me, contrary to what you said."
2000.99-1687,3,42731,thomas_c_goldstein,,3393.029,3397.401,"Justice Souter, if I said this wasn't what Congress was trying to do, I misspoke."
2000.99-1687,3,15042,david_h_souter,scotus_justice,3397.401,3398.713,I thought you did say that.
2000.99-1687,3,42731,thomas_c_goldstein,,3398.713,3401.023,We agreed that that was Congress' goal.
2000.99-1687,3,15084,ruth_bader_ginsburg,scotus_justice,3411.372,3416.324,"Then they should have time to do it under the procedure as it has gone so far, they haven't."
2000.99-1687,3,42731,thomas_c_goldstein,,3416.995,3431.425,"--Justice Ginsburg, they had the opportunity to develop a record in this case and the other two cases that have come before you, that are the Peavey case and the Baynor case have gone through the courts and no one has suggested that they are going to develop any kind of record."
2000.99-1687,3,15084,ruth_bader_ginsburg,scotus_justice,3431.425,3434.436,"--Then, but tell me if I'm wrong."
2000.99-1687,3,42731,thomas_c_goldstein,,3448.865,3454.871,They did not attempt in this case to put forward any record regarding the efficacy of the statute.
2000.99-1687,3,15084,ruth_bader_ginsburg,scotus_justice,3454.871,3467.038,"If they knew they were required to do something beyond the intuitive judgment that people make that of course nobody is going to do this if nobody is going to touch it, if it's going to be treated like a hot potato."
2000.99-1687,3,42731,thomas_c_goldstein,,3467.038,3471.162,"I think maybe you and I, Justice Ginsburg, are speaking about two slightly different things."
2000.99-1687,3,15141,william_h_rehnquist,scotus_justice,3492.025,3492.505,"Thank you, Mr. Goldstein."
2000.99-1687,4,42213,seth_p_waxman,,3497.248,3498.66,"Thank you, Mr. Chief Justice."
2000.99-1687,4,15141,william_h_rehnquist,scotus_justice,3681.255,3682.377,"Thank you, General Waxman."
