file_name,section,speaker_id,speaker_name,speaker_role,start,stop,text
2003.02-857,2,15049,antonin_scalia,scotus_justice,2782.047,2799.841,"I thought your argument, Ms. Goldsmith, was that the contract provides that any extension of credit over the credit limit shall be subject to the regular percentage plus the $15 penalty."
2003.02-857,2,41416,sylvia_antalis_goldsmith,,2813.438,2814.907,I don't--
2003.02-857,2,15049,antonin_scalia,scotus_justice,2814.907,2818.622,"If that's not your argument, then... then I think Justice Souter has to be correct."
2003.02-857,2,41416,sylvia_antalis_goldsmith,,2818.622,2829.684,"--I think at this stage of... of the litigation, since we have not conducted any discovery, we have not seen the actual cardholder agreement to know what it says with regard to over-limit fees."
2003.02-857,2,15084,ruth_bader_ginsburg,scotus_justice,2831.997,2834.226,Didn't... didn't Ms. Pfennig get a copy?
2003.02-857,2,41416,sylvia_antalis_goldsmith,,2837.941,2849.086,"On her bill it will tell her what her contract rate is, but the initial disclosures... I believe she had this card 7-8 years before this happened and it is not in the record."
2003.02-857,2,15084,ruth_bader_ginsburg,scotus_justice,2849.086,2854.455,I thought... I thought the terms have to be disclosed monthly in addition to when the credit card is new.
2003.02-857,2,41416,sylvia_antalis_goldsmith,,2854.455,2864.153,"What has to be... and... and I believe that... that Mr. Waxman explained this, but you have your initial disclosures that come with the card when you originally get it."
2003.02-857,2,15042,david_h_souter,scotus_justice,2896.148,2899.325,"And if that's not in the record, how can you make the argument you're making?"
2003.02-857,2,41416,sylvia_antalis_goldsmith,,2910.161,2925.037,I think the confusion is coming in because ultimately what is or is not labeled in an over-limit fee may not be a fee for exceeding a credit limit as that term has been used in the regulations.
2003.02-857,2,15042,david_h_souter,scotus_justice,2925.037,2927.084,"And the only way we can tell that is to look at the contract, isn't it?"
2003.02-857,2,41416,sylvia_antalis_goldsmith,,2927.084,2928.115,I don't believe so.
2003.02-857,2,15042,david_h_souter,scotus_justice,2928.115,2928.653,No?
2003.02-857,2,41416,sylvia_antalis_goldsmith,,2928.653,2942.316,"I believe that if you look at section 1637(b)(2) that describes how each and every extension of credit needs to be itemized, we're talking about a singular event, an extension of credit."
2003.02-857,2,15141,william_h_rehnquist,scotus_justice,2957.26,2966.055,"Are you talking about just an ordinary credit card transaction where you go in and say, look, I'm buying a pair of gloves and I want to put them on my credit card?"
2003.02-857,2,41416,sylvia_antalis_goldsmith,,2969.77,2970.429,Absolutely.
2003.02-857,2,15141,william_h_rehnquist,scotus_justice,2970.429,2971.461,Okay.
2003.02-857,2,41416,sylvia_antalis_goldsmith,,2974.971,2975.919,I'm not quite sure.
2003.02-857,2,15060,john_paul_stevens,scotus_justice,2976.745,2987.065,"Well, one reason it's complicated, if I understand your position, you're objecting both to the fee and to the later statements imposing an interest charge on the fee, aren't you?"
2003.02-857,2,41416,sylvia_antalis_goldsmith,,2987.065,2989.294,"I think it's triple dipping, yes."
2003.02-857,2,15049,antonin_scalia,scotus_justice,3003.373,3004.692,"If that's in the contract, so what?"
2003.02-857,2,41416,sylvia_antalis_goldsmith,,3016.126,3017.158,--I think--
2003.02-857,2,15049,antonin_scalia,scotus_justice,3017.158,3018.727,And you don't know whether it's in the contract.
2003.02-857,2,41416,sylvia_antalis_goldsmith,,3020.502,3023.064,--But this is not a breach of contract case.
2003.02-857,2,15049,antonin_scalia,scotus_justice,3026.157,3029.79,"Whether it is or not, you shouldn't call it unfair if you don't know."
2003.02-857,2,41416,sylvia_antalis_goldsmith,,3029.79,3032.762,--I don't recall using the word unfair.
2003.02-857,2,15060,john_paul_stevens,scotus_justice,3040.275,3041.473,Could I interrupt with this one question?
2003.02-857,2,41416,sylvia_antalis_goldsmith,,3057.365,3072.886,"--I don't believe so because when it is charged as a flat fee as an other charge, besides the fact that there's interest charged on top of it, the consumer is in a position that they then need to compare cost of credit, one, as a dollar figure, the other as an APR."
2003.02-857,2,15060,john_paul_stevens,scotus_justice,3092.827,3098.687,But why would the consumer understand the cost of credit any better by labeling it a finance charge rather than an other charge?
2003.02-857,2,41416,sylvia_antalis_goldsmith,,3100.423,3103.767,--Because Congress said we want that to be an apples-to-apples comparison.
2003.02-857,2,15139,stephen_g_breyer,scotus_justice,3115.86,3116.77,So how does that work?
2003.02-857,2,41416,sylvia_antalis_goldsmith,,3145.498,3149.585,--The simple answer is I don't know.
2003.02-857,2,15139,stephen_g_breyer,scotus_justice,3158.752,3163.869,"I think that's why Justice Stevens might have thought it's going to confuse the consumer if you win, not help the consumer."
2003.02-857,2,41416,sylvia_antalis_goldsmith,,3202.878,3205.851,--But I don't believe that that's necessarily how it would be done.
2003.02-857,2,15139,stephen_g_breyer,scotus_justice,3240.236,3252.207,"But, of course, the difficulty for you is all you have to say is that the view I was taking somewhat by argument is a reasonable one, and if it's a reasonable one, I guess it's a reasonable interpretation of the statute."
2003.02-857,2,41416,sylvia_antalis_goldsmith,,3267.689,3271.693,--I think that ultimately depends on... on the construction of the regulation.
2003.02-857,2,15084,ruth_bader_ginsburg,scotus_justice,3296.296,3308.845,The one thing that the... the board has said is we don't want these individual to make every extension of credit or what... to do this kind of thing on a case-by-case basis.
2003.02-857,2,41416,sylvia_antalis_goldsmith,,3328.042,3332.501,And I think that gets back to Justice... Justice Kennedy's question of quite some time ago.
2003.02-857,2,15084,ruth_bader_ginsburg,scotus_justice,3396.485,3399.495,Now you're going back to the regulation itself is no good.
2003.02-857,2,41416,sylvia_antalis_goldsmith,,3399.495,3404.947,"To the extent that it controls here, which I'm not sure it does, I think yes."
2003.02-857,2,15084,ruth_bader_ginsburg,scotus_justice,3418.443,3429.217,"Ms. McDowell said that... that in dollars and cents, there's no difference to the customer using... there is a dollars and cents difference, I take it, and would you explain what it is?"
2003.02-857,2,41416,sylvia_antalis_goldsmith,,3429.217,3429.755,Yes.
2003.02-857,2,15141,william_h_rehnquist,scotus_justice,3433.636,3435.494,I think you've answered it.
2003.02-857,2,41416,sylvia_antalis_goldsmith,,3438.383,3438.671,Thank you.
2003.02-857,3,42213,seth_p_waxman,,3438.671,3451.386,The question of whether or not we disclosed this fee properly within the regulation was passed on by the lower court.
2003.02-857,3,15141,william_h_rehnquist,scotus_justice,3607.424,3608.334,"Thank you, Mr. Waxman."
2003.02-857,3,42213,seth_p_waxman,,3608.334,3609.077,"--Thank you, Your Honor."
2003.02-857,3,15141,william_h_rehnquist,scotus_justice,3609.077,3609.942,The case is submitted.
