file_name,section,speaker_id,speaker_name,speaker_role,start,stop,text
2004.03-9659,1,25031,gena_a_bunn,,2691.932,2697.9,"--Your Honor, the... that was not the prosecutor's argument at trial and it's... it is not our position now that--"
2004.03-9659,1,15139,stephen_g_breyer,scotus_justice,2697.9,2698.076,No.
2004.03-9659,1,25031,gena_a_bunn,,2767.513,2783.001,"--Your Honor, as to Juror Billy Jean Fields, he did not express qualms about the death penalty in general, but he did state that it was his belief that no one... no one... no matter their background or what they've done, is beyond rehabilitation."
2004.03-9659,1,15084,ruth_bader_ginsburg,scotus_justice,2853.392,2859.477,"Ms. Bunn, before you finish, there... there are two pieces of this I hope you can give me an answer to."
2004.03-9659,1,25031,gena_a_bunn,,2869.301,2872.208,--I... I don't... I don't have any information.
2004.03-9659,1,15060,john_paul_stevens,scotus_justice,2889.083,2897.92,Is it not a fair inference that each of the cues noted on the cards was something that the prosecutors thought relevant to whether or not to challenge the juror?
2004.03-9659,1,25031,gena_a_bunn,,2909.12,2911.221,--Not necessarily.
2004.03-9659,1,15060,john_paul_stevens,scotus_justice,2913.153,2913.723,"Well, why else would it be noted?"
2004.03-9659,1,25031,gena_a_bunn,,2913.723,2918.945,--There was... just to familiarize an attorney getting ready for voir dire of an extensive number of people--
2004.03-9659,1,15113,anthony_m_kennedy,scotus_justice,2918.945,2919.516,Is... is there any--
2004.03-9659,1,15049,antonin_scalia,scotus_justice,2919.516,2924.263,Maybe the prosecutors didn't want to come up with an all-white jury for fear it would be challenged.
2004.03-9659,1,25031,gena_a_bunn,,2924.263,2925.81,--That's certainly--
2004.03-9659,1,15060,john_paul_stevens,scotus_justice,2925.81,2939.149,"That may be, but is it not... is it not clear that this is one of the factors that was used to decide whether or not to exercise a challenge, just as the beard and the other things that are mentioned in the... in the manual were?"
2004.03-9659,1,25031,gena_a_bunn,,2939.149,2940.669,"--No, Your Honor."
2004.03-9659,1,15113,anthony_m_kennedy,scotus_justice,2952.53,2958.562,"--Well, were the... were the cues on the card similar to the instructions in the manual?"
2004.03-9659,1,25031,gena_a_bunn,,2958.562,2964.526,"There were some that could... that would correlate, but there were others that aren't noted on the juror cards--"
2004.03-9659,1,15113,anthony_m_kennedy,scotus_justice,2964.526,2967.15,Can you quantify the correlation or lack of correlation for me?
2004.03-9659,1,25031,gena_a_bunn,,2967.15,2975.88,"--The... for instance, occupations were... or addresses... perhaps not occupations, but I know addresses were... were noted."
2004.03-9659,1,15084,ruth_bader_ginsburg,scotus_justice,2985.364,2988.841,I had asked you if they were still race and gender-coded.
2004.03-9659,1,25031,gena_a_bunn,,3007.374,3009.166,I do not know.
2004.03-9659,1,15084,ruth_bader_ginsburg,scotus_justice,3010.772,3026.057,"The other question I had, are these two prosecutors the same ones who were involved in other cases where it was determined that they had used tactics that violated Batson?"
2004.03-9659,1,25031,gena_a_bunn,,3035.23,3050.377,"--The record indicates that Prosecutor Macaluso was involved in jury selection in the Chambers case, and that case was tried months... I believe it was late 1985 when Chambers was tried."
2004.03-9659,1,15113,anthony_m_kennedy,scotus_justice,3050.377,3051.204,Wasn't that 2 months?
2004.03-9659,1,25031,gena_a_bunn,,3051.204,3053.481,2 months?
2004.03-9659,1,15049,antonin_scalia,scotus_justice,3060.921,3065.113,Is it... is it unlawful to take sex into account in jury selection?
2004.03-9659,1,25031,gena_a_bunn,,3065.113,3065.988,Yes.
2004.03-9659,1,15042,david_h_souter,scotus_justice,3102.729,3107.316,Is... is that true with respect to weight and mustaches and things like that?
2004.03-9659,1,25031,gena_a_bunn,,3107.316,3110.17,--That... that doesn't--
2004.03-9659,1,15042,david_h_souter,scotus_justice,3110.17,3115.38,"They were... they were making notations of things like that, as I understand it, and they didn't have to worry about Batson there."
2004.03-9659,1,15060,john_paul_stevens,scotus_justice,3118.271,3120.532,And Batson hadn't been decided yet.
2004.03-9659,1,25031,gena_a_bunn,,3120.532,3121.647,"--Yes, that's true."
2004.03-9659,1,15042,david_h_souter,scotus_justice,3146.122,3147.781,"But I... I don't... I mean, I'd just like to go back to my question."
2004.03-9659,1,25031,gena_a_bunn,,3183.088,3193.936,"--Your Honor, the... the notations, though, correlate as well to simply visual cues that a litigant will use just simply to familiarize himself with the manual."
2004.03-9659,1,15042,david_h_souter,scotus_justice,3193.936,3198.171,The manual had said there are certain visual cues that indicate jurors you don't want on the jury.
2004.03-9659,1,25031,gena_a_bunn,,3211.638,3219.846,"Your Honor, there are other explainable reasons, there are other plausible reasons for noting those things."
2004.03-9659,1,15084,ruth_bader_ginsburg,scotus_justice,3233.675,3242.182,What about the Fifth Circuit said that comparing Rand's testimony... that that was in line with Mazza's.
2004.03-9659,1,25031,gena_a_bunn,,3249.104,3256.864,"Justice Ginsburg, they recognized, as Justice Scalia had in his concurring opinion, that that was basically as close as it got."
2004.03-9659,1,15060,john_paul_stevens,scotus_justice,3428.059,3430.624,"Thank you, Ms.... Ms. Bunn."
2004.03-9659,2,42213,seth_p_waxman,,3435.851,3436.934,I have just three points.
2004.03-9659,2,15060,john_paul_stevens,scotus_justice,3574.982,3577.398,The case is submitted.
