file_name,section,speaker_id,speaker_name,speaker_role,start,stop,text
2006.06-5306,1,45595,william_p_marshall,,2594.704,2602.31,"If for some reason the court records are jumbled for some reason or another and nobody can determine when that entry of order is, that's a different case."
2006.06-5306,1,15060,john_paul_stevens,scotus_justice,2602.31,2606.561,"In that case, you then rely on the February 27 date in the order?"
2006.06-5306,1,45595,william_p_marshall,,2614.939,2620.663,"Again, Your Honor, the critical thing with the rule period is the time period from the entry of judgment."
2006.06-5306,1,15060,john_paul_stevens,scotus_justice,2620.663,2626.757,"I know, and I say it's hard to figure out when the order was actually written down in the docket."
2006.06-5306,1,45595,william_p_marshall,,2626.757,2634.241,I think that the question that would be required then was for whoever was filing the notice of appeal to determine when the entry of the docket is.
2006.06-5306,1,15060,john_paul_stevens,scotus_justice,2640.265,2643.027,And not rely on the 2-27 date.
2006.06-5306,1,45595,william_p_marshall,,2643.027,2649.381,I would certainly suggest that a litigant argue on... err on the side of caution if at all.
2006.06-5306,1,15084,ruth_bader_ginsburg,scotus_justice,2649.381,2657.375,Justice Breyer quoted from the Osterneck case.
2006.06-5306,1,45595,william_p_marshall,,2686.665,2687.816,"No, Your Honor."
2006.06-5306,1,15084,ruth_bader_ginsburg,scotus_justice,2694.35,2698.983,--The case that I'm reading from is the concurring opinion in Carlisle against United States.
2006.06-5306,1,45595,william_p_marshall,,2701.076,2706.99,"Thompson is the case, Thompson... this Court has not relied on the unique circumstances doctrine in 40 years."
2006.06-5306,1,15084,ruth_bader_ginsburg,scotus_justice,2729.554,2737.611,"But they would have filed that notice of appeal earlier if the judge had said, your motion for a new trial is untimely."
2006.06-5306,1,45595,william_p_marshall,,2773.024,2781.269,"But, Your Honor, there is nothing that the court did that prevented the litigant here from filing on time."
2006.06-5306,1,15084,ruth_bader_ginsburg,scotus_justice,2788.742,2792.846,There was nothing in Thompson that prevented filing the notice of appeal.
2006.06-5306,1,45595,william_p_marshall,,2792.846,2798.9,"--Except in Thompson, Your Honor, he was told that he had the right to proceed on a motion for new trial."
2006.06-5306,1,15086,john_g_roberts_jr,scotus_justice,2801.842,2802.844,You can finish your answer.
2006.06-5306,1,45595,william_p_marshall,,2802.844,2812.14,"In Thompson, Your Honor, the difference is that... that the litigant was sent down a different road which was inconsistent with his filing a notice of appeal."
2006.06-5306,1,15086,john_g_roberts_jr,scotus_justice,2817.233,2818.943,"Thank you, Mr. Marshall."
2006.06-5306,1,45595,william_p_marshall,,2818.943,2819.865,"Thank you, Your Honor."
2006.06-5306,1,15086,john_g_roberts_jr,scotus_justice,2819.865,2824.727,We'll hear from Mr. Stewart.
2006.06-5306,2,36722,malcolm_l_stewart,,2824.727,2836.775,Thank you Mr. Chief Justice and may it please the Court.
2006.06-5306,2,15084,ruth_bader_ginsburg,scotus_justice,2877.394,2881.175,"Mr. Stewart, do you think this is subject... that question is subject matter jurisdiction?"
2006.06-5306,2,36722,malcolm_l_stewart,,2881.175,2885.319,We would... we would characterize it as a species of appellate jurisdiction.
2006.06-5306,2,15060,john_paul_stevens,scotus_justice,2942.017,2944.486,"Mr. Stewart, that's one those interesting examples."
2006.06-5306,2,36722,malcolm_l_stewart,,2950.491,2951.222,That is an anomaly.
2006.06-5306,2,15042,david_h_souter,scotus_justice,2988.156,2991.279,"Mr. Stewart, should we repudiate the unique circumstances doctrine?"
2006.06-5306,2,36722,malcolm_l_stewart,,2991.279,3007.068,--I don't think you need to... I think you should repudiate any conception that Federal courts have freewheeling authority to excuse noncompliance with statutory time limits for taking appeals.
2006.06-5306,2,15042,david_h_souter,scotus_justice,3007.068,3012.932,"Well, the unique circumstances doctrine is one circumstance in which courts, say yeah, you can excuse it."
2006.06-5306,2,36722,malcolm_l_stewart,,3012.932,3016.625,"Well, I... I think actually both Harris and Thompson are explicable on other grounds."
2006.06-5306,2,15042,david_h_souter,scotus_justice,3021.357,3027.962,"But on the grounds for which they have been taken as authority, is it your view that we should repudiate those grounds?"
2006.06-5306,2,36722,malcolm_l_stewart,,3027.962,3028.412,--Yes.
2006.06-5306,2,15139,stephen_g_breyer,scotus_justice,3044.414,3045.874,Well... in criminal.
2006.06-5306,2,36722,malcolm_l_stewart,,3045.874,3051.238,In criminal cases the time for taking an appeal is not specified by statute.
2006.06-5306,2,15139,stephen_g_breyer,scotus_justice,3069.659,3078.585,"But in... though of course, you'd have to confine it very narrowly, I take that doctrine, if there weren't a statute, you read it into the rule."
2006.06-5306,2,36722,malcolm_l_stewart,,3094.905,3098.999,--Well I think it makes a fundamental difference that there is a statute in place.
2006.06-5306,2,15086,john_g_roberts_jr,scotus_justice,3107.904,3112.837,You're sure habeas cases are classified for this purpose as civil rather than criminal?
2006.06-5306,2,36722,malcolm_l_stewart,,3112.837,3114.629,"Yes, there's no... no dispute about that."
2006.06-5306,2,15086,john_g_roberts_jr,scotus_justice,3137.615,3140.967,"Looking at the rule, it does require these findings."
2006.06-5306,2,36722,malcolm_l_stewart,,3148.329,3156.416,I think the courts of appeals have not required that they be written on the record but have required that there be a basis appearing in the record for those findings.
2006.06-5306,2,15060,john_paul_stevens,scotus_justice,3322.296,3327.381,But it begins with the exception as provided in subparagraph (c).
2006.06-5306,2,36722,malcolm_l_stewart,,3327.381,3328.122,--That's correct.
2006.06-5306,2,15060,john_paul_stevens,scotus_justice,3329.812,3330.132,Yeah.
2006.06-5306,2,36722,malcolm_l_stewart,,3330.132,3343.52,"--but we're saying that the rule specifies that if the various time restrictions are not complied with, the appeal will not bring... I'm sorry, the appeal shall not bring the judgment, order, or decree before the court of appeals."
2006.06-5306,2,15139,stephen_g_breyer,scotus_justice,3349.373,3367.015,"What do you think, if we did go to Thompson and looked at that, this would be a fortiori from Thompson, as described in Osterneck, was a case in which the judge simply said from the bench look, your... your... the new trial motion is timely, though it wasn't; it was out of by two days."
2006.06-5306,2,36722,malcolm_l_stewart,,3377.323,3379.374,"Well, are two things we would say about Thompson."
2006.06-5306,2,15086,john_g_roberts_jr,scotus_justice,3439.353,3440.655,"Thank you, Mr. Stewart."
2006.06-5306,3,38138,paul_mancino_jr,,3443.176,3450.831,"If this were a case where someone just missed the 30-day deadline, I don't think we would be talking."
2006.06-5306,3,15060,john_paul_stevens,scotus_justice,3491.109,3494.091,"Mr. Mancino, does the record tell us how you got notice of that order?"
2006.06-5306,3,38138,paul_mancino_jr,,3494.091,3496.361,"--No, it doesn't."
2006.06-5306,3,15060,john_paul_stevens,scotus_justice,3500.733,3502.666,"You, you got that order in the mail?"
2006.06-5306,3,38138,paul_mancino_jr,,3502.666,3503.835,"--In the mail, correct."
2006.06-5306,3,15113,anthony_m_kennedy,scotus_justice,3517.124,3524.849,"And I asked this once before: Did the document you received show the dates that it was entered on the docket, so you knew when the 14 days was running from?"
2006.06-5306,3,38138,paul_mancino_jr,,3524.849,3532.005,"No, the only information it had was the printed... the printed date by the judge."
2006.06-5306,3,15139,stephen_g_breyer,scotus_justice,3534.556,3537.098,"Yeah, but in the... in this thing, it says entered on February 10."
2006.06-5306,3,38138,paul_mancino_jr,,3537.098,3537.909,"Yeah, that's correct."
2006.06-5306,3,15060,john_paul_stevens,scotus_justice,3539.429,3542.851,But how did you find out it had been entered on February 10?
2006.06-5306,3,38138,paul_mancino_jr,,3546.474,3555.119,"Well, I just went off what the date on the... the handwritten date on the pleading we received from the court."
2006.06-5306,3,15084,ruth_bader_ginsburg,scotus_justice,3567.658,3573.662,"This is, this is all at the top of page 151 of the joint appendix, right?"
2006.06-5306,3,38138,paul_mancino_jr,,3574.914,3578.086,"That is the... well, it is printed on that."
2006.06-5306,3,15084,ruth_bader_ginsburg,scotus_justice,3579.886,3580.176,Yes.
2006.06-5306,3,38138,paul_mancino_jr,,3580.997,3585.73,"--It's a handwritten... handwritten by the judge in, in the case."
2006.06-5306,3,15113,anthony_m_kennedy,scotus_justice,3586.1,3589.022,But it says when it was signed by the judge.
2006.06-5306,3,38138,paul_mancino_jr,,3592.986,3593.967,--No.
2006.06-5306,3,15139,stephen_g_breyer,scotus_justice,3596.338,3602.703,"But it says it in the index, it says... it says docket entries."
2006.06-5306,3,38138,paul_mancino_jr,,3607.796,3608.357,"Yeah, that's correct."
2006.06-5306,3,15139,stephen_g_breyer,scotus_justice,3609.256,3610.418,Received.
2006.06-5306,3,38138,paul_mancino_jr,,3611.409,3620.976,"--But the document we received from the Court just has... you know... the handwritten notation on it, file your appeal by--"
2006.06-5306,3,15068,samuel_a_alito_jr,scotus_justice,3620.976,3624.327,"What would you, what would you have had to have done to find out when it was entered on the docket?"
2006.06-5306,3,38138,paul_mancino_jr,,3628.87,3645.471,"--Well, probably I could not have... at that time, I mean I could do it now, but at that time you'd have to go over to the courthouse, just like we walked on orders of appeal over to the courthouse, had it stamped by the clerk there, and figured that was the end of it and we were on our way to the Sixth Circuit in Cincinnati."
2006.06-5306,3,15086,john_g_roberts_jr,scotus_justice,3647.874,3649.416,"Thank you, Mr. Mancino."
