file_name,section,speaker_id,speaker_name,speaker_role,start,stop,text
2006.06-480,2,38903,robert_w_coykendall,,2701.889,2705.068,"That's the only incentive, the only reason for imposing resale prices--"
2006.06-480,2,15049,antonin_scalia,scotus_justice,2705.068,2710.761,He's only going to be given the thing if he does the kind of additional service that the manufacturer wants.
2006.06-480,2,38903,robert_w_coykendall,,2722.85,2734.748,"--Well, there are more efficient ways than RPM to achieve any benefits of efficiency, such as contracts with the retailers to provide those additional demand creating services."
2006.06-480,2,15086,john_g_roberts_jr,scotus_justice,2743.087,2746.688,Why would you argue that those are more efficient than resale price maintenance?
2006.06-480,2,38903,robert_w_coykendall,,2746.688,2751.531,The resale price maintenance amounts to nothing more than throwing money at the problem.
2006.06-480,2,15086,john_g_roberts_jr,scotus_justice,2770.323,2775.857,"Well, you can add the contractual provisions you were talking about to a contract that has a minimum resale price."
2006.06-480,2,38903,robert_w_coykendall,,2783.824,2788.526,"--If you have a contract requiring those services, you don't need the minimum resale price."
2006.06-480,2,15113,anthony_m_kennedy,scotus_justice,2797.282,2804.866,Does that presume a contract in which the retailer has a separate charge for the service?
2006.06-480,2,38903,robert_w_coykendall,,2804.866,2806.398,It could be.
2006.06-480,2,15113,anthony_m_kennedy,scotus_justice,2807.607,2812.502,"If not, I don't see how that would work under your rule."
2006.06-480,2,38903,robert_w_coykendall,,2812.502,2821.809,"Well, under... the idea is the manufacturer chooses to deal with only those dealers that offer this particular service."
2006.06-480,2,15086,john_g_roberts_jr,scotus_justice,2882.607,2892.074,"Your reference to the will of Congress, they haven't enacted legislation that supports the result you seek."
2006.06-480,2,38903,robert_w_coykendall,,2892.074,2904.283,"Your Honor, as this Court observed in Sylvania, Congress by repealing the Miller-Tydings McGuire Act did indicate its support for the per se rule."
2006.06-480,2,15086,john_g_roberts_jr,scotus_justice,2907.515,2909.446,"Thank you, counsel."
2006.06-480,3,18121,barbara_d_underwood,,2921.553,2924.394,"Mr. Chief Justice, and may it please the Court:"
2006.06-480,3,15086,john_g_roberts_jr,scotus_justice,2967.454,2977.029,"Well, it's also been settled law for 90 years under the Colgate doctrine that manufacturers can achieve the same results, albeit more inefficiently."
2006.06-480,3,18121,barbara_d_underwood,,2983.444,2983.844,No.
2006.06-480,3,15049,antonin_scalia,scotus_justice,3022.399,3023.158,I'm not sure it's often the case.
2006.06-480,3,18121,barbara_d_underwood,,3030.374,3045.654,"--Well, as you have observed, virtually any vertical restriction could be accomplished by having the manufacturer integrate the retailing function and become one entity instead of two entities."
2006.06-480,3,15049,antonin_scalia,scotus_justice,3117.9,3122.174,Were they relying on Dr. Miles or were they relying on us?
2006.06-480,3,18121,barbara_d_underwood,,3125.126,3125.416,They were relying--
2006.06-480,3,15049,antonin_scalia,scotus_justice,3125.416,3139.818,"They left the situation where it was, which is that the antitrust law is as determined by this Court, and we had shown our willingness to update the antitrust law when sound economic doctrine suggests is necessary."
2006.06-480,3,18121,barbara_d_underwood,,3139.818,3140.147,--No.
2006.06-480,3,15086,john_g_roberts_jr,scotus_justice,3158.639,3162.702,"But of course, they could always pass a law saying that if their intent is so clear."
2006.06-480,3,18121,barbara_d_underwood,,3164.092,3188.858,"--That's true, they did not do that here and I'm not suggesting that they did, only that, uniquely among the rules that this Court has established in the antitrust area, this rule has received the repeated attention of Congress; and so the Court's deference to Congress and reluctance to overturn the rule should be at its peek as compared with those other rules."
2006.06-480,3,15086,john_g_roberts_jr,scotus_justice,3283.991,3285.382,But they could.
2006.06-480,3,18121,barbara_d_underwood,,3295.749,3296.769,You could.
2006.06-480,3,15086,john_g_roberts_jr,scotus_justice,3308.488,3315.481,"But then the retailer, but then the retailer might have a real incentive not to do a good job on the service because they really want to market it for price, not for service."
2006.06-480,3,18121,barbara_d_underwood,,3315.481,3333.854,"--That really depends, doesn't it, on what the consumers in the market want, and if it's correct, if the manufacturer... if the claim on behalf of the manufacturer here is correct that what the customers want is service, the retailers are in at least as good a position to identify that fact as not."
2006.06-480,3,15086,john_g_roberts_jr,scotus_justice,3334.635,3340.099,"Well, but there you have the free rider problem, which is you go to the fancy show room, you figure out what you want, and then you buy it at the discount store."
2006.06-480,3,18121,barbara_d_underwood,,3340.099,3340.977,--Yes.
2006.06-480,3,15049,antonin_scalia,scotus_justice,3359.77,3368.305,"But some manufacturers want their product associated with excellent service, high warranty, and all of that."
2006.06-480,3,18121,barbara_d_underwood,,3373.879,3374.39,"Yes, there is."
2006.06-480,3,15060,john_paul_stevens,scotus_justice,3408.832,3419.4,Am I correct on the congressional point that there was a period when Congress would have prohibited the Solicitor General from making the argument he made today?
2006.06-480,3,18121,barbara_d_underwood,,3419.4,3420.65,"Yes, there was such a period."
2006.06-480,3,15060,john_paul_stevens,scotus_justice,3424.734,3429.545,So there was a legislative expression of a position on this particular issue?
2006.06-480,3,18121,barbara_d_underwood,,3429.545,3433.058,--There was a legislative expression of position on this particular issue.
2006.06-480,3,15086,john_g_roberts_jr,scotus_justice,3433.058,3435.051,And that no longer is applicable?
2006.06-480,3,18121,barbara_d_underwood,,3435.051,3442.714,"That is... the Solicitor General is no longer barred from making that argument, as is evidenced today."
2006.06-480,3,15049,antonin_scalia,scotus_justice,3443.185,3444.875,I guess Congress changed its mind then.
2006.06-480,3,18121,barbara_d_underwood,,3444.875,3453.771,"--No, I think Congress found it unnecessary or perhaps questioned the wisdom or constitutionality of barring the Solicitor General from making particular arguments."
2006.06-480,3,15049,antonin_scalia,scotus_justice,3453.771,3455.343,I find it hard to believe that.
2006.06-480,3,18121,barbara_d_underwood,,3455.982,3476.435,"But Congress has consistently... well, and the repeal... the reason the repeal of the Miller-Tydings Act seems particularly relevant is that it is indeed... it was an amendment to this statute that this Court is being asked to interpret, so it sheds some light on the on the meaning of this statute as it stands."
2006.06-480,3,15084,ruth_bader_ginsburg,scotus_justice,3476.435,3482.309,"As Mr. Olson pointed out, under the fair trade laws this was per se legal."
2006.06-480,3,18121,barbara_d_underwood,,3485.083,3487.104,Yes.
2006.06-480,3,15084,ruth_bader_ginsburg,scotus_justice,3515.842,3528.401,"Maybe on the year by year, don't spend any money on, maybe Congress decided that wasn't an appropriate technique, but Congress has used that after, hasn't it, in other cases?"
2006.06-480,3,18121,barbara_d_underwood,,3528.401,3536.286,"It has, but I would question the wisdom of that technique as a method of expressing Congress's views."
2006.06-480,3,15086,john_g_roberts_jr,scotus_justice,3543.34,3545.941,"Thank you, Ms. Underwood."
2006.06-480,4,43165,theodore_b_olson,,3547.972,3579.154,"The Respondent and its amici seem to recognize that what this Court said in State Oil versus Khan, that a vertical restraint imposed by a single manufacturer or wholesaler may stimulate interbrand competition even as it reduces intrabrand competition and, by the way, it enhances intrabrand competition on matters of service and availability and other things in addition to price."
2006.06-480,4,15060,john_paul_stevens,scotus_justice,3607.912,3610.404,But you're just giving them an additional ground for termination.
2006.06-480,4,43165,theodore_b_olson,,3610.404,3611.756,Pardon me?
2006.06-480,4,15060,john_paul_stevens,scotus_justice,3611.756,3615.877,"You're just giving, you're just suggesting we should give them an additional ground for termination."
2006.06-480,4,43165,theodore_b_olson,,3615.877,3616.137,No.
2006.06-480,4,15086,john_g_roberts_jr,scotus_justice,3753.619,3755.161,"Thank you, Mr. Olson."
