file_name,section,speaker_id,speaker_name,speaker_role,start,stop,text
2008.07-869,3,15042,david_h_souter,scotus_justice,2757.815,2779.431,"--Why shouldn't we, on the theory that what is important is not which particular coffer the penny goes into, but the fact that it is public money, i.e., money being raised from taxpayers under a statute passed by the State authorizing taxation; and it is going to -- and its justification for taxation is the performance of public functions."
2008.07-869,3,29833,jeremiah_a_collins,,2793.171,2795.937,"--For the following reason, I think, Justice Souter."
2008.07-869,3,15042,david_h_souter,scotus_justice,2834.498,2861.815,"Yes, but what you're saying is, I -- you're saying in effect that I -- that you reject my -- my hypothetical assumption here, that what we ought to regard as the proper characterization of the money is not ""our"" State money, but public money raised under a system of public taxation; and you're saying you should not go -- you should not characterize the funds that way."
2008.07-869,3,29833,jeremiah_a_collins,,2862.798,2863.281,"--No, I--"
2008.07-869,3,15042,david_h_souter,scotus_justice,2863.281,2866.517,"--because if you do characterize the funds that way, it seems to me you're in trouble."
2008.07-869,3,29833,jeremiah_a_collins,,2866.517,2867.052,--Now--
2008.07-869,3,15042,david_h_souter,scotus_justice,2867.052,2869.252,But why shouldn't I characterize them that way?
2008.07-869,3,29833,jeremiah_a_collins,,2869.252,2894.953,"--The -- even characterizing -- even characterizing it that way, the reason that I think the analysis breaks down as to applying subsidization law, is that the subsidization law doctrine, subsidization doctrine -- Regan and those cases -- as the Court has explained it, it is to protect the prerogatives of the government that is making decisions about how it wants particular programs to be operated."
2008.07-869,3,15042,david_h_souter,scotus_justice,2894.953,2902.54,The State -- the State legislature is making a decision as to how it wants the -- the programs which comprise local government to be operated.
2008.07-869,4,20073,clay_riggs_smith,,2902.54,2913.896,"But the difference, Your Honor, in all of the other cases one could look at Regan and the like, there is a program where the government is involved in its manifold details."
2008.07-869,4,15042,david_h_souter,scotus_justice,2943.998,2953.869,"Well, but the point in the case that you concede that the government may make that choice is that the government is subsidizing it by the activity which the government is refusing to perform."
2008.07-869,5,29833,jeremiah_a_collins,,2969.177,2986.888,"But the difference for First Amendment analysis, I would submit, Your Honor, and the reason why I think the subsidization doctrine has been confined in the areas it's been confined, is when we are talking in this case, for example, about the State, the State determines whether it's going to have a payroll deduction system."
2008.07-869,5,15060,john_paul_stevens,scotus_justice,3032.1,3036.635,"Mr. Collins, may I interrupt you and ask you the converse of the question I asked your opponent?"
2008.07-869,5,29833,jeremiah_a_collins,,3076.962,3104.214,"Your Honor, we conceded that reluctantly under the view that where the question is whether the State -- our claim against the State would say we are -- we are going to require the State to start devoting money that it doesn't want to spend as we -- we have chosen given the force of cases like Regan, not to make that contention, but to accept the ruling that the State's refusal to spend money on its own programs is in a different category."
2008.07-869,5,15060,john_paul_stevens,scotus_justice,3104.214,3113.921,But this is not a case involving a State's decision not to spend the time and energy to do payroll deductions because they do them for everybody else.
2008.07-869,5,29833,jeremiah_a_collins,,3122.86,3126.229,"That's correct, Your Honor."
2008.07-869,5,15060,john_paul_stevens,scotus_justice,3136.085,3136.485,How can it not be clear?
2008.07-869,5,29833,jeremiah_a_collins,,3147.725,3161.466,"--Well, in Davenport, Your Honor, the Court did indicate that a statute that applies to public and private, even though it's a unitary statute, you have to analyze it separately in the two contexts."
2008.07-869,5,15060,john_paul_stevens,scotus_justice,3210.28,3210.997,I see your argument.
2008.07-869,5,15113,anthony_m_kennedy,scotus_justice,3210.997,3217.034,"Suppose the State at the State level says this is a contentious area, we want to stay out of it."
2008.07-869,5,29833,jeremiah_a_collins,,3251.44,3271.953,"Because I think the difference here, Your Honor, as I understand the case law, is that when the State is simply saying we choose not to spend our own money on this activity, it does not have the same burden of explaining why it's made that choice that it has when it reaches out and says, and by the way, we don't want local government or even private government--"
2008.07-869,5,15113,anthony_m_kennedy,scotus_justice,3271.953,3272.853,"Well, of course, that's the interest."
2008.07-869,5,29833,jeremiah_a_collins,,3288.113,3290.749,--And we have no quarrel at all with that notion.
2008.07-869,5,15113,anthony_m_kennedy,scotus_justice,3305.706,3309.158,I -- I -- I'm not sure that's right.
2008.07-869,5,29833,jeremiah_a_collins,,3315.478,3336.724,"If the -- if the State wants to have a uniform law for itself -- for public employer -- employees, its own employees and local government employees because of some unitary interest that the State wants to pursue, there is nothing wrong with the state pursuing that objective."
2008.07-869,5,15113,anthony_m_kennedy,scotus_justice,3398.06,3403.512,"I'll read Russo again, but I didn't think Pocatello, Idaho, was part of the state of major."
2008.07-869,5,29833,jeremiah_a_collins,,3403.512,3418.806,"--I just meant that no -- it's this simple, Justice Kennedy, and the point I'm trying to make is that for someone to get access to political -- to a payroll deduction system of the State government, it needs an affirmative grant from the State."
2008.07-869,5,15113,anthony_m_kennedy,scotus_justice,3453.691,3454.474,Could you help me with this?
2008.07-869,5,29833,jeremiah_a_collins,,3465.915,3474.438,"--It's fine with me, but if you analyze it in any way that says that heightened scrutiny is applicable and there is no exception--"
2008.07-869,5,15113,anthony_m_kennedy,scotus_justice,3474.438,3474.921,Why is that?
2008.07-869,5,29833,jeremiah_a_collins,,3475.557,3483.861,"MR. COLLINS -- the problem with constitutional condition -- if it were a condition on the local governments, then it's not really--"
2008.07-869,5,15139,stephen_g_breyer,scotus_justice,3483.861,3499.405,Are you saying -- is it your view that heightened scrutiny applies whenever a government tells any group that wants to raise money for political purposes in any way they want involving the government that it can't?
2008.07-869,5,29833,jeremiah_a_collins,,3499.405,3501.005,"--No, Your Honor."
2008.07-869,5,15139,stephen_g_breyer,scotus_justice,3501.005,3501.572,No.
2008.07-869,5,29833,jeremiah_a_collins,,3518.967,3528.739,"The -- well, there are exceptions to heightened scrutiny where the government is acting as a proprietor."
2008.07-869,5,15139,stephen_g_breyer,scotus_justice,3530.608,3537.678,But then you are making -- say it always applies except in a few little exceptions.
2008.07-869,5,29833,jeremiah_a_collins,,3557.438,3562.758,"--Well, if the government is allowing other speech it would be heightened scrutiny."
2008.07-869,5,15139,stephen_g_breyer,scotus_justice,3562.758,3574.816,"You cannot -- you have to use heightened scrutiny when the FDA, for example -- you know, the case I wrote in -- the FDA says you cannot advertise on a label for a drug."
2008.07-869,5,29833,jeremiah_a_collins,,3579.903,3588.242,"It -- if it's -- if it's commercial speech, it might fall under a different standard."
2008.07-869,5,15139,stephen_g_breyer,scotus_justice,3601.55,3606.352,And regulation of government employees is the same?
2008.07-869,5,29833,jeremiah_a_collins,,3606.352,3617.06,--It basically would trigger the -- the heightened scrutiny except where the government is involved.
2008.07-869,5,15086,john_g_roberts_jr,scotus_justice,3654.566,3656.099,Why are you -- why are you focusing on heightened scrutiny?
2008.07-869,5,29833,jeremiah_a_collins,,3672.61,3675.396,"If I may answer that question, Mr. Chief Justice?"
2008.07-869,5,15086,john_g_roberts_jr,scotus_justice,3730.196,3731.113,"Thank you, counsel."
2008.07-869,6,20073,clay_riggs_smith,,3739.183,3743.421,Two points that I think are critical.
2008.07-869,6,15086,john_g_roberts_jr,scotus_justice,3802.125,3802.859,"Thank you, counsel."
