file_name,section,speaker_id,speaker_name,speaker_role,start,stop,text
2009.08-1065,2,37772,paul_d_clement,,2415.759,2423.429,"Well, I would ask -- I would ask both of you to go back and read two things, and I would particularly like Justice Scalia to go back and read your separate opinion in Burns."
2009.08-1065,2,15086,john_g_roberts_jr,scotus_justice,2460.102,2470.91,"If you cannot rely on anything that goes on at the trial to establish the due process violation, what do you rely on to establish the violation?"
2009.08-1065,2,37772,paul_d_clement,,2470.91,2472.01,"Well, Mr. Chief Justice--"
2009.08-1065,2,15086,john_g_roberts_jr,scotus_justice,2472.01,2477.314,"I guess the question is where is it complete, or do you say it doesn't have to be a complete violation?"
2009.08-1065,2,37772,paul_d_clement,,2477.314,2485.669,"--Well, I guess what I would do, Mr. Chief Justice, is try to take issue with your premise, which is that we can't advert to the absolute immune act at all."
2009.08-1065,2,15086,john_g_roberts_jr,scotus_justice,2487.519,2494.525,"Well, let's say that you -- let's say that you can't because we read Imbler as conferring absolute immunity on what goes on at the trial."
2009.08-1065,2,37772,paul_d_clement,,2499.977,2519.974,"--Well, I would still say we do, but please let me try to take one more crack at the premise, which is Imbler is not a use immunity case and this Court has rejected the proposition that just because you're absolutely immune for an act there's no evidentiary use of that in going after conduct that was earlier in the causal chain."
2009.08-1065,2,15086,john_g_roberts_jr,scotus_justice,2532.598,2533.566,Against -- against the judge?
2009.08-1065,2,37772,paul_d_clement,,2533.566,2537.352,"--It wasn't against the judge, but I -- but with all due respect, I don't think that matters."
2009.08-1065,2,15086,john_g_roberts_jr,scotus_justice,2538.268,2540.72,"Well, that's the distinction here in this case, isn't it?"
2009.08-1065,2,37772,paul_d_clement,,2540.72,2543.839,"--Well, but -- but it's a distinction without a difference."
2009.08-1065,2,15086,john_g_roberts_jr,scotus_justice,2596.891,2605.597,"In terms of the chilling impact on the prosecutor, what difference does it make whether it's at trial or pretrial for use at trial?"
2009.08-1065,2,37772,paul_d_clement,,2605.597,2619.672,"Well, I think it makes all the difference in the world in the sense that if -- if they know that everything they do at trial is going to be protected, those functions, which is the basis of this Court's functional approach to absolute immunity, are going to be protected."
2009.08-1065,2,15049,antonin_scalia,scotus_justice,2620.256,2621.256,But it won't be protected.
2009.08-1065,2,37772,paul_d_clement,,2652.493,2658.731,"--Well, I think there is going to be an effect on the deterrent effect on the prosecutor pretrial, which is they will be procured."
2009.08-1065,2,15139,stephen_g_breyer,scotus_justice,2683.782,2688.734,"There's a different tendency, which I would say this is a slight fluke, what you're describing."
2009.08-1065,2,37772,paul_d_clement,,2732.762,2733.797,Well--
2009.08-1065,2,15139,stephen_g_breyer,scotus_justice,2733.797,2739.266,"Or is there something -- I mean, I can see Buckley with the, you know, probable cause."
2009.08-1065,2,37772,paul_d_clement,,2757.58,2764.151,"--Well, Justice Breyer, I mean, I would say that there is no reason for this Court to disturb the line it drew in Buckley."
2009.08-1065,2,15139,stephen_g_breyer,scotus_justice,2765.417,2768.286,We have amicus briefs here that give us a lot of reason.
2009.08-1065,2,37772,paul_d_clement,,2781.028,2782.012,--Well--
2009.08-1065,2,15139,stephen_g_breyer,scotus_justice,2782.012,2783.662,"And they say they do it in Chicago, I think."
2009.08-1065,2,37772,paul_d_clement,,2785.064,2794.42,"--Well, I mean, another thing presumably, Justice Breyer, you want to encourage is having the police officers come to the prosecutors and get legal advice about what they're doing."
2009.08-1065,2,15113,anthony_m_kennedy,scotus_justice,2803.692,2817.535,"--Well, could you answer Justice Breyer's question, which I -- I think raises a -- a critical point in terms of Justice Alito's examples of talking to the witness."
2009.08-1065,2,37772,paul_d_clement,,2829.676,2831.128,"--Well, Justice Kennedy, let me respond."
2009.08-1065,2,15113,anthony_m_kennedy,scotus_justice,2839.449,2842.853,"No, but probable cause doesn't work because you have -- you have probable cause once you fabricate the evidence."
2009.08-1065,2,37772,paul_d_clement,,2842.853,2843.619,"Well, I think--"
2009.08-1065,2,15113,anthony_m_kennedy,scotus_justice,2843.619,2844.536,That's circular.
2009.08-1065,2,37772,paul_d_clement,,2844.536,2845.971,"--No, I don't think so."
2009.08-1065,2,15113,anthony_m_kennedy,scotus_justice,2901.022,2914.949,"Suppose the prosecutor isn't sure there's probable cause and he calls -- calls in the accountant, the CFO, and really doesn't begin to believe his story, so he starts probing and finally he gets the CFO to change his story with the plea -- plea bargain."
2009.08-1065,2,37772,paul_d_clement,,2921.353,2927.757,"I think at the point -- if the interview begins and he doesn't think he has probable cause, I think that that--"
2009.08-1065,2,15113,anthony_m_kennedy,scotus_justice,2927.757,2928.273,"Well, he's trying to find out."
2009.08-1065,2,37772,paul_d_clement,,2928.74,2930.223,--Of course he is trying to find out.
2009.08-1065,2,15139,stephen_g_breyer,scotus_justice,2943.266,2961.494,"Well, also, you're making me more worried because I think, if 85 percent of all the defendants -- or 90 percent plead guilty, it might be a highly desirable thing to get prosecutors involved in the truth-discovering process, I mean, so that they don't just see themselves as the job of -- well, we're going to take somebody, put them in jail."
2009.08-1065,2,37772,paul_d_clement,,2966.298,2971.767,"Well -- you know, I'm not sure what the logical place to push it back any further is, and I think -- you know--"
2009.08-1065,2,15139,stephen_g_breyer,scotus_justice,2971.767,2972.619,Where have you got it now?
2009.08-1065,2,37772,paul_d_clement,,2977.939,2978.772,--Yes.
2009.08-1065,2,15139,stephen_g_breyer,scotus_justice,2978.772,2979.722,Someone?
2009.08-1065,2,37772,paul_d_clement,,2982.474,2983.091,That's right.
2009.08-1065,2,15139,stephen_g_breyer,scotus_justice,2983.091,2984.759,Uh-huh.
2009.08-1065,2,37772,paul_d_clement,,2984.759,2992.413,"And let me say this, Justice Breyer, I mean, I know you don't want to talk about Burns, but I'd like to, just for a second, because I think it's a very similar policy concern."
2009.08-1065,2,15086,john_g_roberts_jr,scotus_justice,3007.073,3007.989,"Well, we thought it was -- I'm sorry."
2009.08-1065,2,37772,paul_d_clement,,3009.023,3011.689,--I just wanted to say the incentive would really be perverse.
2009.08-1065,2,15086,john_g_roberts_jr,scotus_justice,3035.054,3040.975,"I was going to suggest in response to your point that -- you know, qualified immunity is really significant."
2009.08-1065,2,37772,paul_d_clement,,3073.379,3088.975,"And, again, the Court addressed exactly this Court in the -- exactly that issue in the Buckley decision and said, sure -- you know, from -- with the benefit of hindsight, you can sort of retrospectively look and make anything in the investigatory stage part of -- and part and parcel of the prosecution."
2009.08-1065,2,15068,samuel_a_alito_jr,scotus_justice,3102.383,3119.094,"In -- in answer to Justice Breyer's question, would -- would it be a -- would it be practical and conceptually correct to draw the line at the stage at which the prosecutor is interviewing witnesses to evaluate credibility?"
2009.08-1065,2,37772,paul_d_clement,,3126.164,3129.45,"Well, if I could add, I mean, I suppose I might be able--"
2009.08-1065,2,15068,samuel_a_alito_jr,scotus_justice,3129.45,3133.402,Not on whether there is probable cause because probable cause is -- is evanescent.
2009.08-1065,2,37772,paul_d_clement,,3144.375,3164.123,"--And let me say this: If I could add a couple of words, I think we could probably live with that line, which is, if the prosecutor is interviewing those witnesses with an eye towards credibility for use at trial, I mean, that's a line that, I think, would be, I think, probably pretty consistent with probable cause, but something that we could live with, but--"
2009.08-1065,2,15068,samuel_a_alito_jr,scotus_justice,3164.123,3179.549,"But with a line toward investigating credibility for use at a trial, which is -- which is, at that point, foreordained, but, if the evaluation is being done for the purpose of determining whether there should be a trial, then, no."
2009.08-1065,2,37772,paul_d_clement,,3180.299,3183.6,"--Well, I mean, I worry that words are being put in my mouth."
2009.08-1065,2,15086,john_g_roberts_jr,scotus_justice,3202.814,3207.652,"Well, your approach, then, encourages prosecutors to be trigger happy."
2009.08-1065,2,37772,paul_d_clement,,3215.822,3221.56,"--Well, shoot first -- you mean go to an impartial magistrate and try to get somebody arrested or--"
2009.08-1065,2,15086,john_g_roberts_jr,scotus_justice,3221.56,3222.994,"No, just begin the formulation."
2009.08-1065,2,37772,paul_d_clement,,3230.898,3231.767,"--Well, I suppose--"
2009.08-1065,2,15086,john_g_roberts_jr,scotus_justice,3231.767,3243.991,"In Justice Alito's hypothetical, you've got a CFO, you can -- you know, you've probably got probable cause to go after him as well, but you want to begin interviewing him, to see if he's going to flip in your case against the CEO."
2009.08-1065,2,37772,paul_d_clement,,3243.991,3250.062,"--Well, if you have probable cause, then I think you're on the other side of the Buckley line, and that's an objective determination, and I think--"
2009.08-1065,2,15086,john_g_roberts_jr,scotus_justice,3250.062,3254.181,"So you've got -- you've got to make that decision early in the process, rather than later."
2009.08-1065,2,37772,paul_d_clement,,3254.181,3257.383,"--Well, I think it's -- I'm not sure it's a decision you have to make."
2009.08-1065,2,15086,john_g_roberts_jr,scotus_justice,3370.953,3372.221,"Thank you, Mr. Clement."
2009.08-1065,3,42101,stephen_sanders,,3375.09,3376.506,"Thank you, Mr. Chief Justice."
2009.08-1065,3,15049,antonin_scalia,scotus_justice,3413.965,3416.417,What -- what does that prove?
2009.08-1065,3,42101,stephen_sanders,,3435.359,3436.645,"--No, Your Honor."
2009.08-1065,3,15049,antonin_scalia,scotus_justice,3445.75,3446.233,--Yes.
2009.08-1065,3,42101,stephen_sanders,,3455.356,3456.808,I'm not sure I understand the question.
2009.08-1065,3,15049,antonin_scalia,scotus_justice,3456.808,3457.524,Okay.
2009.08-1065,3,42101,stephen_sanders,,3457.524,3468.449,"The -- I think it's important to understand the consequences of affirming the courts below, either on the basis of the Zahrey theory or on the freestanding due process theory offered by respondents."
2009.08-1065,3,15084,ruth_bader_ginsburg,scotus_justice,3525.535,3535.908,"I want, before you're finished, to get a clear picture of your view of the dimensions of the claim because you rely heavily on the trial part."
2009.08-1065,3,42101,stephen_sanders,,3555.555,3556.924,--Uh-huh.
2009.08-1065,3,15084,ruth_bader_ginsburg,scotus_justice,3556.924,3561.125,Is anyone in this picture liable?
2009.08-1065,3,42101,stephen_sanders,,3571.914,3574.349,"Your Honor, I believe there would be no due process liability."
2009.08-1065,3,15084,ruth_bader_ginsburg,scotus_justice,3604.737,3614.926,"You said -- I think your position is that due process begins when trial is underway, and before that due process doesn't enter the picture?"
2009.08-1065,3,42101,stephen_sanders,,3614.926,3624.699,"Your Honor, I believe that this Court's decisions make clear that due process applies to the judicial process; that is, the filing of charges and the later conduct of the prosecuting--"
2009.08-1065,3,15060,john_paul_stevens,scotus_justice,3624.699,3626.484,"Yes, but what about the pretrial detention?"
2009.08-1065,3,42101,stephen_sanders,,3628.436,3631.804,"--Your Honor, it would be, but that would be Fourth Amendment territory."
2009.08-1065,3,15060,john_paul_stevens,scotus_justice,3631.804,3633.087,Why would it be Fourth Amendment?
2009.08-1065,3,42101,stephen_sanders,,3637.791,3653.134,"Your Honor, this Court -- seven justices in this Court's decision in Albright agreed that there was no due process cause of action for the wrongful institution of criminal proceedings, that in that case there may be some sort of Fourth Amendment claim."
2009.08-1065,3,15060,john_paul_stevens,scotus_justice,3657.955,3666.728,"But that case talked about the institution of prosecution, not the deprivation of liberty during pretrial detention, which is a different matter."
2009.08-1065,3,42101,stephen_sanders,,3666.728,3687.641,"--Your Honor, I believe the Court's Fourth Amendment jurisprudence would still indicate that that is a concern of the Fourth Amendment, not the Due Process Clause, and that pursuant to Paul v. Davis and Parrot v. Taylor, there may indeed be some sort of State law cause of action for defamation or loss of status, but that there is no support for a Federal due process claim."
2009.08-1065,3,15086,john_g_roberts_jr,scotus_justice,3687.641,3688.491,"Thank you, Counsel."
