file_name,section,speaker_id,speaker_name,speaker_role,start,stop,text
2010.09-1088,1,15086,john_g_roberts_jr,scotus_justice,2901.21,2909.881,"When you say they did nothing, surely that was rhetorical hyperbole, and you took the 6 hours to say this proves what we said, they did nothing; they did next to nothing."
2010.09-1088,1,41598,sean_k_kennedy,,2913.935,2931.278,--I think what we did is we confirmed the allegation that we had made in State court which is just another example of why it was important based on these allegations for Pinholster to get a hearing to develop the record--
2010.09-1088,1,15086,john_g_roberts_jr,scotus_justice,2931.278,2941.05,"That gets back to the point that Justice Scalia was making, is that this is new evidence that the Ninth Circuit considered with respect to the original."
2010.09-1088,1,41598,sean_k_kennedy,,2958.345,2990.733,"--Well, I think you can, because the Ninth Circuit -- I mean, if you look at -- if the Court looks at the allegations in State court, there were -- the allegations regarding counsel's performance was that they did not believe that they were going to a penalty phase; that because they did not look at the prosecutor's open file, they did not know that their theory that they really did not have a penalty phase was wrong; and that they had no strategic reason--"
2010.09-1088,1,15086,john_g_roberts_jr,scotus_justice,2990.733,2997.403,"You are going back to arguing that, you win under the original proceeding and the question on which we granted cert--"
2010.09-1088,1,41598,sean_k_kennedy,,2997.403,2998.386,"--Yes, yes."
2010.09-1088,1,15086,john_g_roberts_jr,scotus_justice,2998.386,2998.953,--should be addressed.
2010.09-1088,1,41598,sean_k_kennedy,,2998.953,2999.338,Yes.
2010.09-1088,1,15086,john_g_roberts_jr,scotus_justice,2999.338,2999.888,Okay.
2010.09-1088,1,15139,stephen_g_breyer,scotus_justice,2999.888,3002.54,--Is -- I just want to be as clear as possible.
2010.09-1088,1,41598,sean_k_kennedy,,3034.643,3035.178,Yes.
2010.09-1088,1,15139,stephen_g_breyer,scotus_justice,3035.178,3035.711,Okay.
2010.09-1088,1,41598,sean_k_kennedy,,3059.258,3061.61,"Well, the--"
2010.09-1088,1,15139,stephen_g_breyer,scotus_justice,3061.61,3064.979,I can ask you is that conceded on both sides?
2010.09-1088,1,41598,sean_k_kennedy,,3064.979,3093.331,"--Well, what the Ninth Circuit majority was saying is that if there was some bar that (e)(2) had to holding a hearing where new evidence could be properly presented, that it wouldn't matter, because based on the record before it in State court, it proved a Strickland violation under Williams, Wiggins and Rompilla; and it was objectively unreasonable."
2010.09-1088,1,15049,antonin_scalia,scotus_justice,3093.331,3100.901,"Yes, but that -- that was on the assumption that the only new evidence would have been the evidence of, how did they put it?"
2010.09-1088,1,41598,sean_k_kennedy,,3110.59,3113.709,"Well, but I'm -- I'm sorry."
2010.09-1088,1,15131,sonia_sotomayor,scotus_justice,3113.709,3116.244,"--Counsel, could I just ask one clarifying question."
2010.09-1088,1,41598,sean_k_kennedy,,3142.894,3152.083,"Yes, because it's the same -- we have an automatic appeals and the habeas is done in front of the Supreme Court."
2010.09-1088,1,15049,antonin_scalia,scotus_justice,3188.089,3189.939,"How do you believe that, you have nothing to support it."
2010.09-1088,1,41598,sean_k_kennedy,,3197.445,3216.906,"Your Honor, the lawyers made this revelation in court at trial in front of the famously aggressive prosecutor and the trial judge who knew these lawyers and had sat through the hearing, and no one had any suggestion that it was puffery or it was false."
2010.09-1088,1,15086,john_g_roberts_jr,scotus_justice,3240.022,3252.245,"How long does it take to read Dr. Stahlberg's report that says I've looked at this, I've examined this, this and this and there is nothing here that is going to support a mental impairment theory?"
2010.09-1088,1,41598,sean_k_kennedy,,3252.245,3260.518,"It's very short, but the report, when they read that quick report on its face they had to know that he wasn't prepared enough to render an opinion."
2010.09-1088,1,15086,john_g_roberts_jr,scotus_justice,3298.143,3305.98,"Counsel, just to get back to (e)(2), what is specifically the factual predicate that could not have been previously discovered in this case?"
2010.09-1088,1,41598,sean_k_kennedy,,3305.98,3326.144,"The factual predicate that could not be discovered was the evolution of the mental health testimonies as it moved from affidavit to live testimony, and the state gave for the first time specific notice of how it was going to attack the presentation in state court."
2010.09-1088,1,15086,john_g_roberts_jr,scotus_justice,3337.935,3339.137,"Thank you, counsel."
2010.09-1088,2,29247,james_w_bilderback_ii,,3341.587,3342.255,Thank you.
2010.09-1088,2,15131,sonia_sotomayor,scotus_justice,3342.255,3357.182,Could you clarify the procedure question I asked earlier: Were the billing records made part of the record that went up to the California reviewing courts?
2010.09-1088,2,29247,james_w_bilderback_ii,,3357.182,3358.799,"Some, but not all of them were."
2010.09-1088,2,15131,sonia_sotomayor,scotus_justice,3358.799,3362.134,Are you claiming the 6-hour one didn't go up?
2010.09-1088,2,29247,james_w_bilderback_ii,,3362.134,3374.025,"Well, of course, part of the problem is that the 6 and a half-hour figure is arrived at by purportedly adding up all of the hours spent in preparation--"
2010.09-1088,2,15131,sonia_sotomayor,scotus_justice,3374.025,3375.743,I'm just asking a simple question.
2010.09-1088,2,29247,james_w_bilderback_ii,,3382.047,3382.497,--Yes.
2010.09-1088,2,15131,sonia_sotomayor,scotus_justice,3382.497,3384.832,--were they before the California reviewing courts?
2010.09-1088,2,29247,james_w_bilderback_ii,,3384.832,3385.399,Yes.
2010.09-1088,2,15049,antonin_scalia,scotus_justice,3427.143,3430.897,Is that where the 6 and a half hours came from?
2010.09-1088,2,29247,james_w_bilderback_ii,,3430.897,3431.38,--No.
2010.09-1088,2,15049,antonin_scalia,scotus_justice,3436.132,3437.884,Which the California court had.
2010.09-1088,2,29247,james_w_bilderback_ii,,3437.884,3438.401,--Yes.
2010.09-1088,2,15049,antonin_scalia,scotus_justice,3440.786,3441.853,"So it's not new evidence, then."
2010.09-1088,2,29247,james_w_bilderback_ii,,3444.455,3454.845,"--Well, the -- again, the allegation that there were only 6 and a half hours spent in preparation, that allegation was never made through the California Supreme Court."
2010.09-1088,2,15131,sonia_sotomayor,scotus_justice,3454.845,3459.13,"But if I'm on the reviewing court, and the lawyer spent no time preparing--"
2010.09-1088,2,29247,james_w_bilderback_ii,,3459.13,3459.963,I beg your pardon.
2010.09-1088,2,15131,sonia_sotomayor,scotus_justice,3459.963,3469.169,"--When I was reviewing judge on the Court of Appeals, someone said he didn't spend any time doing X, Y, and Z, and the first thing I went to was the billing records."
2010.09-1088,2,29247,james_w_bilderback_ii,,3473.407,3473.907,Yes.
2010.09-1088,2,15131,sonia_sotomayor,scotus_justice,3474.473,3482.079,"So I have to assume -- I don't have to assume, but it's not new evidence."
2010.09-1088,2,29247,james_w_bilderback_ii,,3483.363,3493.219,"--The billing records -- again, the billing records upon which the Ninth Circuit arrived at its conclusion that there were only 6 and a half hours was before the State court."
2010.09-1088,2,15049,antonin_scalia,scotus_justice,3505.459,3509.93,"If you are relying on allegations rather than the evidence, the allegation was even worse."
2010.09-1088,2,29247,james_w_bilderback_ii,,3511.996,3512.965,Exactly.
2010.09-1088,2,15049,antonin_scalia,scotus_justice,3513.565,3514.865,But that doesn't help you.
2010.09-1088,2,29247,james_w_bilderback_ii,,3514.865,3520.219,"--No, it doesn't, Your Honor, because that allegation was plainly false, based upon the State court record."
2010.09-1088,2,15139,stephen_g_breyer,scotus_justice,3562.094,3564.112,"Is this right, then?"
2010.09-1088,2,29247,james_w_bilderback_ii,,3580.573,3581.34,Yes.
2010.09-1088,2,15139,stephen_g_breyer,scotus_justice,3581.34,3603.087,"Then to get home, we then have to look at the new evidence, and there it's some combination of: A, there was nothing to have a hearing about, because there is nothing here that lets you have a hearing; or B, there was something to have a hearing about because this was so new that it was a new claim, and you should have gone to the State court first on that one, but there is no room to do it."
2010.09-1088,2,29247,james_w_bilderback_ii,,3614.112,3624.9,The only point with which I would -- I would take issue with the Court's characterization is -- I assume the Court was not speaking hypothetically.
2010.09-1088,2,15139,stephen_g_breyer,scotus_justice,3626.585,3627.302,"Yes, yes."
2010.09-1088,2,29247,james_w_bilderback_ii,,3627.302,3630.871,"In my case, the State court's doors are not closed."
2010.09-1088,2,15139,stephen_g_breyer,scotus_justice,3630.871,3633.489,"Well, why isn't that a part of thing -- you have a new claim here."
2010.09-1088,2,29247,james_w_bilderback_ii,,3634.775,3651.885,"Because the exhaustion difficulty in this case, the exhaustion problem in this case, is a consequence of the errors that the Federal court made in doing the (d)(1) -- in failing to do the (d)(1) determination at all and in taking evidence in clear derogation of (e)(2)."
2010.09-1088,2,15086,john_g_roberts_jr,scotus_justice,3658.974,3659.991,"Thank you, Counsel."
