file_name,section,speaker_id,speaker_name,speaker_role,start,stop,text
2017.16-1435,0,15086,john_g_roberts_jr,scotus_justice,0.0,7.08,"We'll hear argument this morning in Case 16-1435, Minnesota Voters Alliance versus Mansky. Mr. Breemer."
2017.16-1435,0,62961,j_david_breemer,,7.08,21.56,"Mr. Chief Justice, and may it please the Court: Minnesota's statute bans all conventional political expression on apparel to prevent a smaller class of material that can already be regulated under other election statutes."
2017.16-1435,0,15084,ruth_bader_ginsburg,scotus_justice,41.84,42.6,Which -- which are those -- which are the --
2017.16-1435,0,15113,anthony_m_kennedy,scotus_justice,42.6,55.96,"I was just going to ask you -- I was just going to ask you, those examples you gave, in your view, could be prohibited by a properly drawn statute? Moveon.org and so forth you say could be prohibited under a properly drawn statute?"
2017.16-1435,0,62961,j_david_breemer,,55.96,57.52,They can -- they are prohibited.
2017.16-1435,0,15113,anthony_m_kennedy,scotus_justice,58.52,64.72,Could they be prohibited under a statute that was more narrowly drawn?
2017.16-1435,0,62961,j_david_breemer,,64.72,65.88,"No, I do not think they could."
2017.16-1435,0,15094,elena_kagan,scotus_justice,75.44,75.88,Do you think more --
2017.16-1435,0,15084,ruth_bader_ginsburg,scotus_justice,75.88,89.04,"Could you clarify the procedural posture of this case? I gather the first time around you went to the Eighth Circuit and they rejected the facial challenge, but they sent it back on as-applied."
2017.16-1435,0,62961,j_david_breemer,,101.88,103.92,"It's solely a facial challenge, Your Honor."
2017.16-1435,0,15094,elena_kagan,scotus_justice,122.48,139.68,"Do you -- do you think, Mr. Breemer, that a statute could target only electoral speech, in other words, ""Clinton for President,"" ""Trump for President,"" that sort of thing? Could a statute say that that speech cannot be worn in the polling place?"
2017.16-1435,0,62961,j_david_breemer,,139.68,142.68,"Yes, a statute does say that."
2017.16-1435,0,15094,elena_kagan,scotus_justice,144.76,145.36,"No, I know."
2017.16-1435,0,62961,j_david_breemer,,154.52,160.6,"Yes, Your Honor, it's a very close call, but it's not one that this Court has to make in this particular case."
2017.16-1435,0,15094,elena_kagan,scotus_justice,160.6,163.52,"I know, but I'm just asking your view."
2017.16-1435,0,62961,j_david_breemer,,163.52,173.36,"I honestly don't know, Your Honor, whether that -- that line is so close, but the statute here, the first sentence, already prohibits that material, and it's unchallenged, that particular sentence here."
2017.16-1435,0,15113,anthony_m_kennedy,scotus_justice,192.28,195.56,"Well, but it -- but it's important for us if -- we're going to have to write an opinion on this."
2017.16-1435,0,15113,anthony_m_kennedy,scotus_justice,198.36,200.8,What about political buttons?
2017.16-1435,0,62961,j_david_breemer,,200.8,201.12,Anything that --
2017.16-1435,0,15113,anthony_m_kennedy,scotus_justice,201.12,204.4,"""Vote -- Vote for X"" or ""Vote for Y"" and they're both on the ballot."
2017.16-1435,0,62961,j_david_breemer,,204.4,206.28,Correct.
2017.16-1435,0,15113,anthony_m_kennedy,scotus_justice,210.28,212.84,We're asking about a hypothetical case.
2017.16-1435,0,62961,j_david_breemer,,218.88,222.24,"No, I don't think it would be."
2017.16-1435,0,15113,anthony_m_kennedy,scotus_justice,223.88,224.36,All right.
2017.16-1435,0,62961,j_david_breemer,,224.36,232.72,"Because of the passive and non-disruptive nature of the speech, people simply wearing that type of clothing as they go in and out of the polling place --"
2017.16-1435,0,15131,sonia_sotomayor,scotus_justice,232.72,236.08,So you're -- you're telling us to overrule Burson?
2017.16-1435,0,62961,j_david_breemer,,236.08,237.68,"No, Your Honor, I'm not saying that at all."
2017.16-1435,0,15131,sonia_sotomayor,scotus_justice,237.68,242.64,Burson basically said the opposite of what you're saying.
2017.16-1435,0,62961,j_david_breemer,,242.64,243.04,"Well, it's --"
2017.16-1435,0,15131,sonia_sotomayor,scotus_justice,243.04,244.4,Directly and completely.
2017.16-1435,0,62961,j_david_breemer,,244.4,252.16,"Well, as we read Burson, it didn't deal with the passive wearing of a -- any kind of apparel, campaign or more general political apparel."
2017.16-1435,0,15131,sonia_sotomayor,scotus_justice,256.08,264.76,"That's the line you're drawing? Because someone puts something on instead of handing it around, that's the line you want us to draw?"
2017.16-1435,0,62961,j_david_breemer,,264.76,266.12,"Well, that's part of the line."
2017.16-1435,0,62836,neil_gorsuch,scotus_justice,274.2,275.0,Mr. -- Mr. Breemer --
2017.16-1435,0,62961,j_david_breemer,,275.0,275.76,Yes.
2017.16-1435,0,62836,neil_gorsuch,scotus_justice,275.76,294.44,"-- passive versus active sounds a lot like the act/omission distinction, and that has proven to be one of the most slippery concepts in all of law. Is it an act to put on a button or is it an omission to not speak about what's on the button? A T-shirt, you say, is passive."
2017.16-1435,0,62961,j_david_breemer,,307.0,310.6,"Well, what I'm suggesting, Your Honor, is that the line is already policed."
2017.16-1435,0,15086,john_g_roberts_jr,scotus_justice,326.68,334.56,"They -- they talk about other interests, like decorum and dignity, and those aren't addressed by the other statutes."
2017.16-1435,0,62961,j_david_breemer,,334.56,345.84,"No, they're not -- well, they are addressed by Section 2 -- 204C.06, Your Honor, which prohibits disorderly conduct and interference --"
2017.16-1435,0,15086,john_g_roberts_jr,scotus_justice,345.84,351.76,"Well, there's a difference between interference with someone's right to vote or disorderly conduct and -- and decorum."
2017.16-1435,0,62961,j_david_breemer,,356.92,359.12,"Yes, it probably would, Your Honor."
2017.16-1435,0,15086,john_g_roberts_jr,scotus_justice,377.24,424.2,"Well, you -- you say that, but I wonder if the state can make an opposite determination and say, you know, for however many months we've had this, you know, maybe bitter, sharp, political campaign going on, and maybe, just before you cast your vote, you should be able to have a time for some quiet reflection or to do that important civic obligation in peace and quiet without being bombarded by another campaign display. And it -- you know, you say these are -- it's passive but not active, but, you know, a picture can be worth a thousand words, and people's apparel can convey very strong and shocking images that maybe the state can decide that, just before you cast your vote, you should have at least a moment free of all the Sturm und Drang of the campaign."
2017.16-1435,0,62961,j_david_breemer,,424.2,428.8,That -- that's true. And there are legitimate interests in the polling place.
2017.16-1435,0,15084,ruth_bader_ginsburg,scotus_justice,437.0,440.24,"But you've answered -- you've answered that it's already covered, but it's no good."
2017.16-1435,0,15113,anthony_m_kennedy,scotus_justice,440.24,441.56,You've said it's no good.
2017.16-1435,0,62961,j_david_breemer,,441.56,442.84,"Excuse me, I'm sorry."
2017.16-1435,0,15084,ruth_bader_ginsburg,scotus_justice,443.04,448.96,"You said the coverage was no good, that you could not cover."
2017.16-1435,0,62961,j_david_breemer,,448.96,450.48,"If I'm -- yes, Your Honor."
2017.16-1435,0,15113,anthony_m_kennedy,scotus_justice,459.76,461.44,"Well, you're pressured to come --"
2017.16-1435,0,62961,j_david_breemer,,461.44,462.76,But the statute here goes far beyond that.
2017.16-1435,0,15113,anthony_m_kennedy,scotus_justice,462.76,467.08,-- you're pressured to come up with a workable rule to guide us when we write this decision.
2017.16-1435,0,62961,j_david_breemer,,467.08,467.72,"Yes, Your Honor."
2017.16-1435,0,15113,anthony_m_kennedy,scotus_justice,467.72,483.24,"And you're -- you're telling, in response to the Chief Justice, basically, that the state's interest in -- in -- in decorum and solemnity and the dignity of the voting process cannot be protected by rules relating to buttons and apparel."
2017.16-1435,0,62961,j_david_breemer,,483.24,492.6,"I'm saying, Your Honor, that it -- it's not reasonably protected in this instance because it sweeps in so much material that's not reasonably related to those interests -- interests."
2017.16-1435,0,15068,samuel_a_alito_jr,scotus_justice,492.6,526.16,"Well, suppose we think that it would be a different case and that a state could have a law that prohibits the wearing of buttons or any other -- or attire that contains the name of a candidate or refers to a ballot issue or the name of a political party that has candidates running for office in that election. If we thought that that would be consistent with the First Amendment, would that doom your case or would you still have additional arguments?"
2017.16-1435,0,62961,j_david_breemer,,526.16,533.64,"No, that -- Your Honor, that is one place where you can draw the line. And if the line is drawn there, this statute still fails."
2017.16-1435,0,15094,elena_kagan,scotus_justice,536.96,540.12,"And -- and what would be the justification for that line, in your view?"
2017.16-1435,0,62961,j_david_breemer,,540.12,541.44,"Well, the justification for --"
2017.16-1435,0,15094,elena_kagan,scotus_justice,541.44,555.04,"In other words, why would we put one -- all the materials that Justice Alito talked about on one side of the line and all the materials that you think a state cannot restrict on the other side of the line? In your view, what's the difference?"
2017.16-1435,0,62961,j_david_breemer,,555.04,572.32,"I think that you could arguably conclude that that type of apparel is reasonably related to the government's legitimate interest in preventing undue influence in polling places, but shirts that simply say AFL-CIO, Chamber of Congress, NAACP, those are not related to the government's interests in --"
2017.16-1435,0,15131,sonia_sotomayor,scotus_justice,572.32,576.08,How about issues on the ballot?
2017.16-1435,0,62961,j_david_breemer,,576.08,576.76,"Yes, Your Honor, I would -- that would be --"
2017.16-1435,0,15131,sonia_sotomayor,scotus_justice,576.76,577.48,All right.
2017.16-1435,0,62961,j_david_breemer,,595.16,597.64,"No, Your Honor, I don't believe it could, because the connection is so --"
2017.16-1435,0,15131,sonia_sotomayor,scotus_justice,597.64,603.6,I think your adversary says they can because it's a political issue display.
2017.16-1435,0,62961,j_david_breemer,,603.6,604.28,That's correct.
2017.16-1435,0,15131,sonia_sotomayor,scotus_justice,604.96,608.6,And that's where you say they can't?
2017.16-1435,0,62961,j_david_breemer,,608.6,608.84,No.
2017.16-1435,0,15131,sonia_sotomayor,scotus_justice,609.2,612.36,Even though that's on the ballot?
2017.16-1435,0,62961,j_david_breemer,,612.36,617.8,A fiscal issue? I think the connection would be too attenuated because then you could extrapolate forever.
2017.16-1435,0,15131,sonia_sotomayor,scotus_justice,617.8,618.32,To you.
2017.16-1435,0,62961,j_david_breemer,,623.48,634.84,"I think a -- yes, I do think a reasonable observer would not see generalized political apparel as an influencing towards something on the ballot."
2017.16-1435,0,15131,sonia_sotomayor,scotus_justice,643.8,644.4,Can you --
2017.16-1435,0,15084,ruth_bader_ginsburg,scotus_justice,644.4,676.44,"But they have a statute that covered one thing that is in this case, it's not hypothetical, it doesn't have to do with an issue on the ballot, but the ""Please ID Me,"" the ""Please ID Me"" button, which was challenged and then you chose not to pursue that. But what is your position on that? Could a legitimately challenged statute stop you from having the ""Please ID Me"" button?"
2017.16-1435,0,62961,j_david_breemer,,676.44,677.04,"Yes, it could."
2017.16-1435,0,15094,elena_kagan,scotus_justice,726.28,741.44,"It -- it just is a little bit hard, Mr. Breemer, to evaluate an argument of overbreadth unless we have a clear view from you as to how far you think a state could go. So I'm not sure that you've given us that view."
2017.16-1435,0,62961,j_david_breemer,,758.64,759.72,"Yes, Your Honor."
2017.16-1435,0,15113,anthony_m_kennedy,scotus_justice,781.84,800.08,"Well, if -- if the Court is concerned about preserving the dignity and the decorum and the solemnity of the voting process, and the statute is as difficult as you say, isn't that an argument for allowing good faith determination on a case-by-case basis by the polling officials?"
2017.16-1435,0,62961,j_david_breemer,,800.08,804.84,"No, I wouldn't say that, Your Honor, because, in the meantime, free speech would be chilled."
2017.16-1435,0,15094,elena_kagan,scotus_justice,829.68,841.28,"If -- if that were where we drew the line, I mean, what -- what would be encompassed in advocacy material? Would it be only things that named a candidate's name?"
2017.16-1435,0,62961,j_david_breemer,,841.28,848.76,"Your Honor, I think it would be anything that said for or against a candidate or an issue directly on the ballot."
2017.16-1435,0,15094,elena_kagan,scotus_justice,848.76,850.92,"How about if it said ""Resist""?"
2017.16-1435,0,62961,j_david_breemer,,850.92,856.28,"I think that would be constitutionally permitted, and should be, and -- and generalized slogans --"
2017.16-1435,0,15094,elena_kagan,scotus_justice,856.28,859.04,"""Make America Great Again""?"
2017.16-1435,0,62961,j_david_breemer,,859.04,862.36,"That type of slogan, too, I think that should be constitutionally permissible."
2017.16-1435,0,15113,anthony_m_kennedy,scotus_justice,876.88,887.72,"Why should there be speech inside the election booth at all, or inside the -- what you call the election room? Let's -- let's say that it's a small room."
2017.16-1435,0,62961,j_david_breemer,,892.28,897.56,"Your Honor, because the First Amendment doesn't stop at the polling place door, even -- even if it's a non --"
2017.16-1435,0,15113,anthony_m_kennedy,scotus_justice,897.56,899.32,That's one of the questions in the case.
2017.16-1435,0,62961,j_david_breemer,,901.64,904.68,"""Jews for Jesus,"" Your Honor."
2017.16-1435,0,15084,ruth_bader_ginsburg,scotus_justice,904.68,906.52,Was it an airport?
2017.16-1435,0,62961,j_david_breemer,,906.52,907.28,It was an airport.
2017.16-1435,0,15084,ruth_bader_ginsburg,scotus_justice,911.76,930.48,"Justice Kennedy asked the question, could a state say that the polling place is off limits to any kind of advocacy or promotion of any point of view?"
2017.16-1435,0,62961,j_david_breemer,,930.48,935.28,"A state could say that, yes, Your Honor, and Minnesota has said that. I'm sorry if I misunderstood."
2017.16-1435,0,15084,ruth_bader_ginsburg,scotus_justice,976.8,987.96,So what -- what do you put in what the state can do in addition to vote for candidate X or vote against proposition Y?
2017.16-1435,0,62961,j_david_breemer,,987.96,993.44,"As a bright-line rule, Your Honor, I don't -- I don't see any other feasible bright line."
2017.16-1435,0,15131,sonia_sotomayor,scotus_justice,1004.04,1011.48,"You took the position that ""Me Too"" -- ""Please ID Me"" wasn't intimidating."
2017.16-1435,0,62961,j_david_breemer,,1011.48,1012.28,"No, Your Honor, I don't think I --"
2017.16-1435,0,15131,sonia_sotomayor,scotus_justice,1012.28,1018.72,"Or that it was free speech that should not be stifled, correct? Are you changing your mind on that now?"
2017.16-1435,0,62961,j_david_breemer,,1018.72,1019.04,No.
2017.16-1435,0,15131,sonia_sotomayor,scotus_justice,1027.16,1029.32,So there's always line-drawing.
2017.16-1435,0,62961,j_david_breemer,,1058.16,1065.64,"I think the -- the -- the reason is that the First Amendment continues, as I mentioned before, continues to apply in polling places."
2017.16-1435,0,15131,sonia_sotomayor,scotus_justice,1067.28,1068.0,It does.
2017.16-1435,0,62961,j_david_breemer,,1073.24,1073.56,Correct.
2017.16-1435,0,15131,sonia_sotomayor,scotus_justice,1074.12,1075.6,So it's not all that's being --
2017.16-1435,0,62961,j_david_breemer,,1075.6,1078.32,There -- there's an --
2017.16-1435,0,15131,sonia_sotomayor,scotus_justice,1078.32,1092.32,"I mean, I suspect that on a military base we would say it would be okay for the Army to say on military grounds we're not going to permit political speech."
2017.16-1435,0,62961,j_david_breemer,,1092.32,1105.68,"Well, I'm not quite sure about that, Your Honor, because, in Greer, in the Greer decision, the Court said that conventional political speech would not be banned. This Court has never upheld a prohibition on political speech as broad as this."
2017.16-1435,0,15068,samuel_a_alito_jr,scotus_justice,1106.4,1112.52,Have we ever said that it would be permissible to ban all political speech on military ground?
2017.16-1435,0,62961,j_david_breemer,,1112.52,1113.2,"No, Your Honor."
2017.16-1435,0,15131,sonia_sotomayor,scotus_justice,1139.2,1145.16,Because there was not a state interest that would permit it?
2017.16-1435,0,62961,j_david_breemer,,1145.16,1146.2,"Well, that's -- that's correct."
2017.16-1435,0,15131,sonia_sotomayor,scotus_justice,1146.96,1158.68,"It wasn't a state interest, but here there is a state interest that was recognized in Burson as being quite important and very legitimate?"
2017.16-1435,0,62961,j_david_breemer,,1158.68,1161.52,"It's true, they are important interests, and -- and we don't deny that."
2017.16-1435,0,15113,anthony_m_kennedy,scotus_justice,1166.4,1167.28,You're -- you're --
2017.16-1435,0,62961,j_david_breemer,,1167.28,1194.56,"-- of political expression that doesn't have a reasonable connection to those particular interests, like simply wearing a shirt that identifies an organization that has political views or a hat or any other sort of apparel that simply identifies the wearer's personal beliefs. A lot of this material is not worn as advocacy or to influence but simply as self-expression on the day of election when people want to express their own political views when everyone is talking about them and -- and wear them in."
2017.16-1435,0,15086,john_g_roberts_jr,scotus_justice,1217.0,1252.72,"What about the -- the concern about coordination? You know, whatever the group is, you know, a big employer, the union, teachers, whatever, say we're all going to show up and we're all going to have, you know, these -- these buttons on or whatever, and maybe you're a member of the group and you don't agree with the position and you'll feel some pressure to transform your speech from what you really would like to say or you wouldn't like to say anything about it, yet you're going to be identified; because you don't have our button, you're not doing what you should be doing to support the group."
2017.16-1435,0,62961,j_david_breemer,,1252.72,1253.4,"Yes, Your Honor."
2017.16-1435,0,15086,john_g_roberts_jr,scotus_justice,1264.12,1267.8,"Well, but nobody would say that it's interference or disorderly conduct."
2017.16-1435,0,62961,j_david_breemer,,1273.96,1283.52,"And in that case, Your Honor, then it would be -- could be dealt with on an as-applied basis as the circumstances come up, if it crosses the line between --"
2017.16-1435,0,15084,ruth_bader_ginsburg,scotus_justice,1283.52,1284.0,As-applied under what?
2017.16-1435,0,62961,j_david_breemer,,1284.0,1285.44,-- speech and conduct.
2017.16-1435,0,15084,ruth_bader_ginsburg,scotus_justice,1285.44,1288.32,Under what? You have to have a statute to apply.
2017.16-1435,0,62961,j_david_breemer,,1288.32,1288.96,Yes.
2017.16-1435,0,15068,samuel_a_alito_jr,scotus_justice,1332.24,1336.08,How many other states have laws that go as far as Minnesota's?
2017.16-1435,0,62961,j_david_breemer,,1336.08,1341.36,"Your Honor, we believe -- nine is our estimate."
2017.16-1435,0,15068,samuel_a_alito_jr,scotus_justice,1350.52,1361.84,And what has been the experience of these other cases -- these other states? Have they had brawls in the -- in the polling place? Have they had disturbances in the polling place?
2017.16-1435,0,62961,j_david_breemer,,1361.84,1369.64,"No, Your Honor, there's no evidence of -- of disruption either in Minnesota or these other states caused by simply wearing --"
2017.16-1435,0,15068,samuel_a_alito_jr,scotus_justice,1369.64,1373.92,"Well, the states that don't have laws that go as far as Minnesota's, what -- what has been the record there?"
2017.16-1435,0,62961,j_david_breemer,,1373.92,1376.88,"As far as I know, Your Honor -- it's not in this record."
2017.16-1435,0,15068,samuel_a_alito_jr,scotus_justice,1402.52,1412.36,And does the record show how many officials would be making these determinations at a general election in Minnesota and how they're selected?
2017.16-1435,0,62961,j_david_breemer,,1412.36,1414.0,"The polling officials, Your Honor?"
2017.16-1435,0,15068,samuel_a_alito_jr,scotus_justice,1414.0,1415.36,"Yeah, the polling officials."
2017.16-1435,0,62961,j_david_breemer,,1415.36,1418.16,"They're selected from the parties, various parties."
2017.16-1435,0,15068,samuel_a_alito_jr,scotus_justice,1428.36,1429.84,So they're selected by the parties.
2017.16-1435,0,62961,j_david_breemer,,1443.08,1448.32,"What happens at that point, Your Honor, is, yes, that's -- that's a final decision in -- in this respect."
2017.16-1435,0,15084,ruth_bader_ginsburg,scotus_justice,1453.96,1462.72,"But if the other -- the other election judge says I disagree, then what happens?"
2017.16-1435,0,62961,j_david_breemer,,1462.72,1474.64,"Then I -- I think they would call the head judge, Your Honor, and there would be a decision -- head election judge and there would be a decision being made. And in the meantime, there would be a disruption going on in the polling place because apparel is being policed."
2017.16-1435,0,15068,samuel_a_alito_jr,scotus_justice,1474.64,1475.0,And who --
2017.16-1435,0,62961,j_david_breemer,,1475.0,1475.68,"And, again --"
2017.16-1435,0,15068,samuel_a_alito_jr,scotus_justice,1475.68,1476.24,I'm sorry.
2017.16-1435,0,62961,j_david_breemer,,1480.44,1483.2,"I'm sorry, Your Honor, I don't -- I don't know the answer to that question."
2017.16-1435,0,15068,samuel_a_alito_jr,scotus_justice,1484.2,1485.72,"Well, I'll ask -- I guess I'll ask the state."
2017.16-1435,0,62961,j_david_breemer,,1499.76,1500.96,I don't know.
2017.16-1435,0,15086,john_g_roberts_jr,scotus_justice,1537.4,1551.4,"Thank you, counsel. Mr. Rogan."
2017.16-1435,1,62962,daniel_rogan,,1551.4,1559.6,"Mr. Chief Justice, and may it please the Court: Minnesota's restriction on speech in the polling place does not violate the First Amendment."
2017.16-1435,1,15086,john_g_roberts_jr,scotus_justice,1595.28,1599.92,It does reach quite a bit beyond what I think a reasonable observer would think is necessary.
2017.16-1435,1,62962,daniel_rogan,,1608.68,1618.16,"Your Honor, the -- the -- the test that Minnesota has is what a reasonable observer would understand is advocating electoral choices."
2017.16-1435,1,15086,john_g_roberts_jr,scotus_justice,1622.4,1623.24,"Well, you can see it."
2017.16-1435,1,62962,daniel_rogan,,1626.96,1647.52,"Certainly, yes, Your Honor, I do -- I do think that that causes the -- the problems and is constitutionally proscribable, and it's for the reasons that -- that you discussed, which is the intimidation that it -- that can occur is not just based on the plain meaning of what is -- what the apparel says, that it's somehow intimidating on its own."
2017.16-1435,1,15086,john_g_roberts_jr,scotus_justice,1677.16,1678.96,"Well, I don't know if I discuss the issues."
2017.16-1435,1,62962,daniel_rogan,,1713.32,1757.64,"Certainly, Your Honor, and -- and I think -- I think Burson recognized that order and decorum can be called into question by simply wearing campaign material. All that Minnesota's law does is extend that line to political material. And it's for the exact same reasons. It's that when you have a campaign that's gone on for months, and we end up at the Election Day in the polling place where we've asked people to come forward to exercise their right to vote, that is a place where we want to ensure that there's order and decorum so that there is the solemnity that goes with voting. And having people identify themselves with a pin that is a campaign or a political message on it reasonably could lead to disruption."
2017.16-1435,1,15084,ruth_bader_ginsburg,scotus_justice,1758.6,1785.44,"How would -- how would -- well, how far does -- does this go? The -- the clear case is a pin that says ""Vote For Candidate X."" But we're told by the Petitioner that you can't wear a pin saying ""Me Too,"" you can't wear a pin saying ""ACLU Defends Free Speech""?"
2017.16-1435,1,62962,daniel_rogan,,1785.44,1803.64,"Your Honor, the -- the line that we have drawn is campaign material plus political material, with the definition of political material being reasonably related -- a reasonable person would understand that the message that's being delivered is one regarding electoral choices in the polling place. And so --"
2017.16-1435,1,15084,ruth_bader_ginsburg,scotus_justice,1803.64,1809.12,"So where -- where does that limitation come in, electoral choices in the polling place?"
2017.16-1435,1,62962,daniel_rogan,,1809.12,1825.32,"Your Honor, it comes from the definition of political, which is in an Election Day -- Election Day electioneering statute, and from the definition of political purpose, which is in the statute which describes -- that uses the word ""political"" to mean influencing voting in an election."
2017.16-1435,1,15068,samuel_a_alito_jr,scotus_justice,1825.32,1832.4,"The problem is that so many things have political connotations, and the connotations are in the eye of the beholder."
2017.16-1435,1,62962,daniel_rogan,,1902.12,1908.08,"So, Your Honor, the -- I think the -- the answer is that it has two components to it."
2017.16-1435,1,15068,samuel_a_alito_jr,scotus_justice,1931.52,1931.8,Yeah.
