file_name,section,speaker_id,speaker_name,speaker_role,start,stop,text
2018.17-1307,1,33978,kannon_k_shanmugam,,2649.36,2650.08,"Well, I think that --"
2018.17-1307,1,15131,sonia_sotomayor,scotus_justice,2650.08,2664.88,"-- more damage, I think, can be done in a non-judicial foreclosure because there is no judge there to protect or review what's occurring."
2018.17-1307,1,33978,kannon_k_shanmugam,,2666.6,2667.4,"Well, I --"
2018.17-1307,1,15131,sonia_sotomayor,scotus_justice,2667.4,2676.0,You seem to argue that because Congress knew that non-judicial foreclosures were set forth in very particular ways.
2018.17-1307,1,33978,kannon_k_shanmugam,,2678.52,2705.96,"I think, Justice Sotomayor, that what I would say about that is that it wasn't so much that Congress was seeking to cover judicial foreclosures as that it was seeking to cover situations in which you're seeking payment. And a judicial foreclosure, as you will be well aware, is more like a typical lawsuit where a party is effectively bringing an in personam action, as is ordinarily the case or at least often the case, against the debtor and, in the context of that, seeking payment."
2018.17-1307,1,15131,sonia_sotomayor,scotus_justice,2707.2,2710.6,"Well, that -- that's the problem with non-judicial foreclosure."
2018.17-1307,1,33978,kannon_k_shanmugam,,2718.88,2721.6,And I certainly am not here to dispute that reality.
2018.17-1307,1,15131,sonia_sotomayor,scotus_justice,2732.36,2734.52,So do foreclosure actions.
2018.17-1307,1,33978,kannon_k_shanmugam,,2734.52,2754.32,"Well, that is -- that is correct, but I -- I do think that non-judicial foreclosures -- and -- and Colorado's scheme is distinct in some ways but characteristic in others -- do require notice to be provided to debtors. They do often provide at least some judicial mechanism for, for instance, a determination of whether or not a party is in default or a review after a sale."
2018.17-1307,1,15131,sonia_sotomayor,scotus_justice,2756.72,2760.68,It doesn't help you review after sales if you've lost your home.
2018.17-1307,1,33978,kannon_k_shanmugam,,2760.68,2767.56,"Well, but there is the ability actually to unwind the sale where there is -- there is fraud or misrepresentations or other misconduct."
2018.17-1307,1,15086,john_g_roberts_jr,scotus_justice,2833.76,2834.16,Thank you.
2018.17-1307,1,33978,kannon_k_shanmugam,,2834.16,2834.92,And so --
2018.17-1307,1,15086,john_g_roberts_jr,scotus_justice,2834.92,2835.8,"Thank you, counsel."
2018.17-1307,1,33978,kannon_k_shanmugam,,2835.8,2847.44,-- we would ask that the judgment be affirmed.
2018.17-1307,1,15086,john_g_roberts_jr,scotus_justice,2847.44,2848.76,Mr. Bond.
2018.17-1307,2,62924,jonathan_c_bond,,2848.76,2884.28,"Mr. Chief Justice, and may it please the Court: In the FDCPA, Congress made a considered compromise judgment between security interest enforcers as debt collectors for a single subsection of the Act, and not for the remainder, including the provisions at issue here. Petitioner's contrary position would nullify that congressional judgment by extending all of the Act's provisions to all security interest enforcers, and his answer to that is this increasingly narrowed category that seems reverse-engineered to pick up only a subset of repossession agents, which he says saves the provision from superfluity."
2018.17-1307,2,17766,brett_m_kavanaugh,scotus_justice,2936.32,2936.84,Not really.
2018.17-1307,2,62924,jonathan_c_bond,,2939.36,2948.4,"So the language undoubtedly could be clearer, but what's -- I think what comes from the text is that Congress referred to enforcement of security interests as a distinct concept."
2018.17-1307,2,15094,elena_kagan,scotus_justice,2948.4,2958.2,"But just so I understand the nature of your argument, I mean, you could be saying, look, foreclosure proceedings don't fall within the general purpose definition."
2018.17-1307,2,62924,jonathan_c_bond,,2970.48,2975.28,So I think the argument that we're making is that Congress chose to treat these two things separately.
2018.17-1307,2,15094,elena_kagan,scotus_justice,2975.28,2977.0,"No, but you're not answering my question."
2018.17-1307,2,62924,jonathan_c_bond,,2986.6,2991.24,I think that's a -- it's a very difficult question because you wouldn't have text that speaks directly to it.
2018.17-1307,2,15086,john_g_roberts_jr,scotus_justice,3010.4,3019.84,"It -- it -- it didn't use that language, though, and it -- it seems significant language on the first step of Justice Kagan's question. It said indirectly."
2018.17-1307,2,62924,jonathan_c_bond,,3032.08,3045.2,So I think fore -- indirect debt collection would encompass things like publishing notice that's not directed to the debtor but intended to shame the debtor into paying or trying to garnish his wages informally by going to the employer. There are other things in that category.
2018.17-1307,2,15131,sonia_sotomayor,scotus_justice,3083.6,3090.08,"I'm sorry, he -- he doesn't, because he says the creditor doesn't care -- the repo man doesn't care about the debt."
2018.17-1307,2,62924,jonathan_c_bond,,3106.84,3108.76,I think it --
2018.17-1307,2,15131,sonia_sotomayor,scotus_justice,3108.76,3110.6,And so I'm not sure how you're right.
2018.17-1307,2,62924,jonathan_c_bond,,3130.88,3132.6,So we agree on the last point.
2018.17-1307,2,15139,stephen_g_breyer,scotus_justice,3192.44,3208.8,"Can I ask you one question on what you mean? Imagine we have a person just like this one, he's trying to enforce a securities interest and he doesn't ask for any deficiency payment. All right."
2018.17-1307,2,62924,jonathan_c_bond,,3250.4,3252.16,So I think --
2018.17-1307,2,15139,stephen_g_breyer,scotus_justice,3252.16,3256.68,So he -- there -- there is a state law for -- I guess here requiring you to go to newspapers.
2018.17-1307,2,62924,jonathan_c_bond,,3270.64,3276.4,"So, in that circumstance, if you're going beyond the procedures set forth in state law to enforce a security interest --"
2018.17-1307,2,15139,stephen_g_breyer,scotus_justice,3276.4,3276.64,Yes.
2018.17-1307,2,62924,jonathan_c_bond,,3276.64,3279.12,-- then you're not within this part 2 definition.
2018.17-1307,2,15139,stephen_g_breyer,scotus_justice,3280.08,3316.12,"Well, that's the part that puzzles me, because -- exactly what I thought you would say, and can I -- can you explain it a little, because, if you're outside of the main thing, part 1, and only covered by f(6), because you did certain things, I want the house, and I'm not saying anything about deficiency, just what happened here, if you're outside it for the instance where you get a conflict with state law, why wouldn't you be outside it for the instance where you don't get a conflict with state law?"
2018.17-1307,2,62924,jonathan_c_bond,,3316.12,3318.84,So it's not about what state law requires for its own sake.
2018.17-1307,2,15139,stephen_g_breyer,scotus_justice,3330.84,3342.24,"No, in other words, you're saying if the state were exactly the same, but it just didn't say anything about newspapers, then his client would win?"
2018.17-1307,2,62924,jonathan_c_bond,,3342.24,3344.36,So I think that does present a trickier question where --
2018.17-1307,2,15139,stephen_g_breyer,scotus_justice,3344.36,3344.64,Why?
2018.17-1307,2,62924,jonathan_c_bond,,3344.64,3345.52,-- where the state law doesn't --
2018.17-1307,2,15139,stephen_g_breyer,scotus_justice,3345.52,3346.28,"If they're out, they're out."
2018.17-1307,2,62924,jonathan_c_bond,,3349.96,3375.88,"Because, if the state law prescribes the procedure that you're going through, it's relatively easy for courts to determine that what you are doing is enforcing a security interest. If you're doing something that state law doesn't require, then you have the more difficult question of, under the general definition, the first part 1 definition, does this conduct constitute debt collection? So, if you engage in repossession or any other enforcement of a security interest, but you also send a demand letter, that demand letter is --"
2018.17-1307,2,15094,elena_kagan,scotus_justice,3375.88,3377.16,What -- what -- what --
2018.17-1307,2,62836,neil_gorsuch,scotus_justice,3377.16,3379.96,Can I see if I under -- I'm sorry.
2018.17-1307,2,15094,elena_kagan,scotus_justice,3379.96,3380.56,Go ahead.
2018.17-1307,2,62836,neil_gorsuch,scotus_justice,3380.56,3382.64,I just want to make sure I understand the answer.
2018.17-1307,2,62924,jonathan_c_bond,,3403.8,3405.68,So there are two separate things here.
2018.17-1307,2,62836,neil_gorsuch,scotus_justice,3409.48,3409.96,Right.
2018.17-1307,2,62924,jonathan_c_bond,,3413.84,3414.0,Yes.
2018.17-1307,2,62836,neil_gorsuch,scotus_justice,3415.12,3423.52,Is your answer that we determine that by reference to state law and what is mandated in order to collect on a security interest or to enforce a security interest?
2018.17-1307,2,62924,jonathan_c_bond,,3423.52,3433.96,"We -- we determine whether what you're doing is security interest enforcement by looking at state law, that's right, to determine whether your steps, the actions you've taken, are the things that are set forth in state law."
2018.17-1307,2,62836,neil_gorsuch,scotus_justice,3433.96,3434.2,All right.
2018.17-1307,2,15094,elena_kagan,scotus_justice,3436.4,3446.08,"No, so if state law, if a state's non-judicial foreclosure process also allows the creditor to get a deficiency judgment, what in your view follows from that?"
2018.17-1307,2,62924,jonathan_c_bond,,3446.08,3447.92,So I think you look to what the creditor does.
2018.17-1307,2,15086,john_g_roberts_jr,scotus_justice,3462.24,3464.88,"Thank you, counsel. Three minutes, Mr. Geyser."
2018.17-1307,3,62794,daniel_l_geyser,,3464.88,3471.56,"Thank you, Mr. Chief Justice. I'd like to start with 1692i because we heard very little about it from the other side."
2018.17-1307,3,15131,sonia_sotomayor,scotus_justice,3629.92,3644.92,"I'm assuming that to the extent judicial foreclosures have been viewed as debt collection, that whatever conflicts have worked out there have also been -- that have happened there have also been worked out?"
2018.17-1307,3,62794,daniel_l_geyser,,3644.92,3649.32,"Oh, absolutely, which is why that it's -- it's very easy to accommodate these interests."
2018.17-1307,3,15086,john_g_roberts_jr,scotus_justice,3662.48,3663.44,"Thank you, counsel."
2018.17-1307,3,62794,daniel_l_geyser,,3663.44,3663.72,Thank you.
2018.17-1307,3,15086,john_g_roberts_jr,scotus_justice,3663.72,0.0,The case is submitted.
